Destination URL,Destination Title,Destination Score,Total Reviews (Destination),Destination Image,Reviewer Name,Reviewer Location,Review Title,Review Score,Reviewer Category,Review Text,Written Date,% %,  %
https://www.tripadvisor.com/Attraction_Review-g12336487-d3568858-Reviews-Avukana_Buddha_Statue-Kekirawa_North_Central_Province.html,Avukana Buddha Statue,4.3,129,https://dynamic-media-cdn.tripadvisor.com/media/photo-o/22/82/02/11/avukana-buddha-status.jpg?w=700&h=400&s=1,Lucky J,"Digana, Sri Lanka",Visit to Aukana Buddha statue,5,Couples,"Visiting for the second or third time. A great experience indeed. Marveling at the talent, energy and resilience of the artist called Bharana, who was an engineer occupied with building Kalawewa reservoir, and as a hobby ended up turning out this great creation in 7 years, which now stands for over 1500 years.","September 17, 2025",0.0,0.0
https://www.tripadvisor.com/Attraction_Review-g12336487-d3568858-Reviews-Avukana_Buddha_Statue-Kekirawa_North_Central_Province.html,Avukana Buddha Statue,4.3,129,https://dynamic-media-cdn.tripadvisor.com/media/photo-o/22/82/02/11/avukana-buddha-status.jpg?w=700&h=400&s=1,Rémi,"Lyon, France",Stunning,5,Missing,"Our guide explained the amazing story of this engineer who built the dam and who in his spare time played the hammer and chisel. One of the oldest and most beautiful in the country according to some. This Buddha is huge, imposing, beautiful. It opens to meditation. This place is quiet, it distils serenity: take a detour!","July 21, 2025",0.0,0.0
https://www.tripadvisor.com/Attraction_Review-g12336487-d3568858-Reviews-Avukana_Buddha_Statue-Kekirawa_North_Central_Province.html,Avukana Buddha Statue,4.3,129,https://dynamic-media-cdn.tripadvisor.com/media/photo-o/22/82/02/11/avukana-buddha-status.jpg?w=700&h=400&s=1,x_Sakura,"Barcelona, Spain",No more.,3,Solo,"It is an impressive Buddha statue carved from the stone.It is not how the photos currently show, but they have put up a kind of rain tent...so it does not look so impressive to me. You have to pay 1,500 rupees.","April 14, 2025",0.0,0.0
https://www.tripadvisor.com/Attraction_Review-g12336487-d3568858-Reviews-Avukana_Buddha_Statue-Kekirawa_North_Central_Province.html,Avukana Buddha Statue,4.3,129,https://dynamic-media-cdn.tripadvisor.com/media/photo-o/22/82/02/11/avukana-buddha-status.jpg?w=700&h=400&s=1,Scenic Lanka Personal Tour Drivers,"Colombo, Sri Lanka",Awukana Buddha Statue: A Journey Through Sri Lanka's Ancient Art and Spiritual Heritage,5,Business,"Welcome to one of Sri Lanka’s most remarkable historical landmarks, the Awukana Buddha Statue! As your guide, I’m excited to share the incredible story behind this ancient masterpiece, which has stood the test of time for over 1,500 years. Standing at an impressive 42 feet, this awe-inspiring statue was carved out of a single granite rock during the reign of King Dhatusena in the 5th century. The craftsmanship here is extraordinary—notice how the robes seem to flow naturally over the Buddha's body, even though it’s all carved from stone. This statue represents the “Asisa Mudra,” a gesture of blessing, and you’ll feel a sense of calm and spirituality just by looking at the serene expression on the Buddha’s face. As we stand here in the peaceful surroundings near the Kala Wewa reservoir, it’s easy to imagine how this site was not only a place of worship but also a hub of culture and art in ancient Sri Lanka. The skill and precision of the stone carving are a testament to the expertise of the craftsmen of that time. This was not just a religious monument but a statement of artistic achievement. What makes the Awukana statue even more fascinating is that it has been well-preserved over the centuries, despite being exposed to the elements. You’ll be amazed at how much detail still remains, especially in the folds of the robes and the delicate facial features. For any visitor to Sri Lanka, this is a must-see destination—not just for its religious significance but also for its historical and artistic value. Whether you're a history buff, a spiritual traveler, or simply someone who appreciates magnificent art, the Awukana Buddha Statue offers a unique glimpse into Sri Lanka’s rich cultural past. I hope you enjoy your visit and leave with a deeper understanding of Sri Lanka’s ancient heritage!","September 23, 2024",0.0,0.0
https://www.tripadvisor.com/Attraction_Review-g12336487-d3568858-Reviews-Avukana_Buddha_Statue-Kekirawa_North_Central_Province.html,Avukana Buddha Statue,4.3,129,https://dynamic-media-cdn.tripadvisor.com/media/photo-o/22/82/02/11/avukana-buddha-status.jpg?w=700&h=400&s=1,Exigentus,Spain,"Little known, impressive and in a very nice area.",4,Missing,"Stunning Buddha sculpture standing, original and typical of Sri Lanka, on an immense stone, still united to the mother rock. Environment of very traditional villages with interesting customs such as drying wheat on the road. Visit in August at 11:00 with no one...","August 27, 2024",0.0,0.0
https://www.tripadvisor.com/Attraction_Review-g12336487-d3568858-Reviews-Avukana_Buddha_Statue-Kekirawa_North_Central_Province.html,Avukana Buddha Statue,4.3,129,https://dynamic-media-cdn.tripadvisor.com/media/photo-o/22/82/02/11/avukana-buddha-status.jpg?w=700&h=400&s=1,Traveltales,"Rajagiriya, Sri Lanka",A testament to craftmanship,5,Couples,"Avukana Buddha statue is generally considered the pinnacle of Anuradhapura era Buddha Statues. Believed to have been constructed in the 5th century AD during the timea of King Datusena, standing at over 14 meters, it will amaze you with its life like features, intricate detailing and the sheer scale. You can reach Avukana from Thambuttegama, Galewela as well as from Kekirawa side or even via Kurunegala- hiripitiya-Madagalla. A lot of roads around the area were being newly carpeted at the time we visited. Even the access road to the avukana statue was in good condition and you can go down the same road up to kalawewa. Once you go down the access roads, the Google maps will say you have reached the location when there is nothing in sight! Drive a couple of hundred meters forwards and you will come to a place that looks like park a with small shops etc. There is ample parking and some small shops selling snacks and drinks. From the main road, there is only a small climb up to the statue. The place is maintained quite well by the army.","July 28, 2024",0.0,0.0
https://www.tripadvisor.com/Attraction_Review-g12336487-d3568858-Reviews-Avukana_Buddha_Statue-Kekirawa_North_Central_Province.html,Avukana Buddha Statue,4.3,129,https://dynamic-media-cdn.tripadvisor.com/media/photo-o/22/82/02/11/avukana-buddha-status.jpg?w=700&h=400&s=1,Sjim Romme,"Amsterdam, The Netherlands",Visit in the morning hours as it's peaceful and calm,4,Friends,We went to this place in the early morning. All carved on a stone. There's a great story to this place. Surrounding was calm and peaceful. We mediated around 2 hours at this place.,"May 10, 2024",0.0,0.0
https://www.tripadvisor.com/Attraction_Review-g12336487-d3568858-Reviews-Avukana_Buddha_Statue-Kekirawa_North_Central_Province.html,Avukana Buddha Statue,4.3,129,https://dynamic-media-cdn.tripadvisor.com/media/photo-o/22/82/02/11/avukana-buddha-status.jpg?w=700&h=400&s=1,Brunella B,"Bologna, Italy",Large statue carved into the rock,3,Friends,"It was the first stop on our tour of Sri Lanka. We were still dazed from the plane trip, we were catapulted into this oasis of quiet, few tourists, several faithful. We adapted to the rules in force in Buddhist temples, barefoot, knee-length trousers, shoulders covered. Don't take photos with people with their backs to the Buddha, it's not allowed. High entry price, compared to the complex which is not very large.","January 22, 2024",0.0,0.0
https://www.tripadvisor.com/Attraction_Review-g12336487-d3568858-Reviews-Avukana_Buddha_Statue-Kekirawa_North_Central_Province.html,Avukana Buddha Statue,4.3,129,https://dynamic-media-cdn.tripadvisor.com/media/photo-o/22/82/02/11/avukana-buddha-status.jpg?w=700&h=400&s=1,anibal p,"San Esteban De Gormaz, Spain",very good......,4,Couples,"Beautiful Buddha and a must-see, they say it is carved from a single stone, honestly, amazingly beautiful. The bad thing was that the sun caught us in the face...","October 17, 2023",0.0,0.0
https://www.tripadvisor.com/Attraction_Review-g12336487-d3568858-Reviews-Avukana_Buddha_Statue-Kekirawa_North_Central_Province.html,Avukana Buddha Statue,4.3,129,https://dynamic-media-cdn.tripadvisor.com/media/photo-o/22/82/02/11/avukana-buddha-status.jpg?w=700&h=400&s=1,Jip d,10 contributions,Not worth a visit.,2,Couples,Not worth a visit. You have to pay about 1500 rupies for each person. The statue is covered by a roof. In a few minutes you have seen everything.,"September 5, 2023",0.0,0.0
https://www.tripadvisor.com/Attraction_Review-g12336487-d3568858-Reviews-Avukana_Buddha_Statue-Kekirawa_North_Central_Province.html,Avukana Buddha Statue,4.3,129,https://dynamic-media-cdn.tripadvisor.com/media/photo-o/22/82/02/11/avukana-buddha-status.jpg?w=700&h=400&s=1,Dasun,"Matale, Sri Lanka",,5,Missing,It can be considered as a masterpiece of idol artists in our country.A place where the mind rests...,"August 16, 2022",0.0,0.0
https://www.tripadvisor.com/Attraction_Review-g12336487-d3568858-Reviews-Avukana_Buddha_Statue-Kekirawa_North_Central_Province.html,Avukana Buddha Statue,4.3,129,https://dynamic-media-cdn.tripadvisor.com/media/photo-o/22/82/02/11/avukana-buddha-status.jpg?w=700&h=400&s=1,Pavel from 2HungryWanderers.com,74 contributions,,2,Missing,"The statue itself is well preserved and nice. Now it is under a roof, which makes it look less impressive than in older photos. The entrance fee of 1000 LKR is extremely high and totally undeserved for a couple of minutes of looking at a single statue. Makes the whole experience something better to avoid. Also, the roads in the area are in very bad condition, as a minimum there are 20-30 minutes bumpy ride if you decide to visit the site.","August 20, 2020",0.0,0.0
https://www.tripadvisor.com/Attraction_Review-g12336487-d3568858-Reviews-Avukana_Buddha_Statue-Kekirawa_North_Central_Province.html,Avukana Buddha Statue,4.3,129,https://dynamic-media-cdn.tripadvisor.com/media/photo-o/22/82/02/11/avukana-buddha-status.jpg?w=700&h=400&s=1,The Travel Couple - Chathu & Ishanka,"Kalutara, Sri Lanka",,5,Couples,This is a magnificent example of our ancient craftsmanship. This is an amazing example of a well preserved standing Buddha statue. It’s a calm and peaceful place. Since this is a religious place behave well dress accordingly and pay your respects.,"July 16, 2020",0.0,0.0
https://www.tripadvisor.com/Attraction_Review-g12336487-d3568858-Reviews-Avukana_Buddha_Statue-Kekirawa_North_Central_Province.html,Avukana Buddha Statue,4.3,129,https://dynamic-media-cdn.tripadvisor.com/media/photo-o/22/82/02/11/avukana-buddha-status.jpg?w=700&h=400&s=1,AchiniJ3,18 contributions,,5,Missing,"I visited with our parents and my 8 years old son. It's recommended to go in the early morning since these days are very hot in the day time. We worshipped very peacefully because it's not very crowded. There's a information desk and the Policeman there was very helpful. Make sure to visit Raswehera Temple,  same kind of Buddha statue there.Also a  Good educational tour for my son.","March 21, 2020",0.0,0.0
https://www.tripadvisor.com/Attraction_Review-g12336487-d3568858-Reviews-Avukana_Buddha_Statue-Kekirawa_North_Central_Province.html,Avukana Buddha Statue,4.3,129,https://dynamic-media-cdn.tripadvisor.com/media/photo-o/22/82/02/11/avukana-buddha-status.jpg?w=700&h=400&s=1,Luap123,"Lichfield, United Kingdom",,3,Couples,I’m sure there was good reason to put a cover over this but it spoils the beauty and photography of the statue.,"March 4, 2020",0.0,0.0
https://www.tripadvisor.com/Attraction_Review-g12336487-d3568858-Reviews-Avukana_Buddha_Statue-Kekirawa_North_Central_Province.html,Avukana Buddha Statue,4.3,129,https://dynamic-media-cdn.tripadvisor.com/media/photo-o/22/82/02/11/avukana-buddha-status.jpg?w=700&h=400&s=1,Terry M,"Hamilton, Canada",,5,Missing,"Likely dating from about the 8th c A.D., this 43' statue is striking. The Buddha is in the blessing position re his hands. The statue looks human but has transcendental, divine elements. The statue has a roof overhead for protective purposes but it does detract from the beauty of the artistic work. The lotus plinth or base was carved from a different piece of rock. We were there during a torrential downpour. On returning, there was an area to wash your feet and a little cloth on your shoes to dry your feet; classy.","January 22, 2020",0.0,0.0
https://www.tripadvisor.com/Attraction_Review-g12336487-d3568858-Reviews-Avukana_Buddha_Statue-Kekirawa_North_Central_Province.html,Avukana Buddha Statue,4.3,129,https://dynamic-media-cdn.tripadvisor.com/media/photo-o/22/82/02/11/avukana-buddha-status.jpg?w=700&h=400&s=1,1LifeStand,"Colombo, Sri Lanka",,2,Friends,We stopped here on the way from Anuradhapura to Sigiriya. Foreigners have to pay Rs. 1000 while locals walk in free. I asked the Buddhist priest if the Central Cultural Fund decides on the fees for which he gave a vague answer... When I repeated the question (upto here politely) he became quite angry and we exchanged some heated words! Thereafter he calmed down and spoke to us by the Buddha Statue. It is absurd to charge Rs. 1000 for a 5min visit to the statue.... And clearly the money was collected by the priest to improve the condition of his dwelling. Charges at Buduruwagala was Rs. 364. Which we thought was reasonable.,"December 26, 2019",0.0,0.0
https://www.tripadvisor.com/Attraction_Review-g12336487-d3568858-Reviews-Avukana_Buddha_Statue-Kekirawa_North_Central_Province.html,Avukana Buddha Statue,4.3,129,https://dynamic-media-cdn.tripadvisor.com/media/photo-o/22/82/02/11/avukana-buddha-status.jpg?w=700&h=400&s=1,Mohan Amarasuriya,"Colombo, Sri Lanka",,5,Friends,Worth visiting. According to the history it's done in mid 5th century AD. During King Dhatusena (Father of king Kashyapa who made Sigiriya Rock Fortress). Entrance fee for a foreigner is Rs1000 each.,"December 3, 2019",0.0,0.0
https://www.tripadvisor.com/Attraction_Review-g12336487-d3568858-Reviews-Avukana_Buddha_Statue-Kekirawa_North_Central_Province.html,Avukana Buddha Statue,4.3,129,https://dynamic-media-cdn.tripadvisor.com/media/photo-o/22/82/02/11/avukana-buddha-status.jpg?w=700&h=400&s=1,Lanka Nature Trails - LNT,"Colombo, Sri Lanka",,5,Friends,"Near the village of Aukana in Anuradhapura district, stands the tallest Buddha statue in Sri Lanka. (12 m in height) Carved out from a granite cliff by just a narrow piece of rock in the fifth century during the reign of king Dhathusena. The statue still in extremely good condition. The features and details are very sharp and clear. When you go to visit Avukana statue from from Habarana or Kakirawa or Dambulla on your way, you will pass Kalawewa tank. The atmosphere of Kalawewa tank will add more peace to your mind to visit or worship the statue. When you go to visit this statue bring some flowers to offer if respect Buddhism. Enjoy your tour! Thanks!","August 28, 2019",0.0,0.0
https://www.tripadvisor.com/Attraction_Review-g12336487-d3568858-Reviews-Avukana_Buddha_Statue-Kekirawa_North_Central_Province.html,Avukana Buddha Statue,4.3,129,https://dynamic-media-cdn.tripadvisor.com/media/photo-o/22/82/02/11/avukana-buddha-status.jpg?w=700&h=400&s=1,Ceylon Beach Travels,"Dehiwala-Mount Lavinia, Sri Lanka",,5,Missing,Pilgrims visit the statue from all parts of the country and the Avukana statue has now become a popular tourist attraction in Sri Lanka.,"March 19, 2019",0.0,0.0
https://www.tripadvisor.com/Attraction_Review-g12336487-d3568858-Reviews-Avukana_Buddha_Statue-Kekirawa_North_Central_Province.html,Avukana Buddha Statue,4.3,129,https://dynamic-media-cdn.tripadvisor.com/media/photo-o/22/82/02/11/avukana-buddha-status.jpg?w=700&h=400&s=1,wijayanandagk,"Pinwatta, Sri Lanka",,5,Missing,Had a full day pilgrimage tour to Anuradhapura sacred city. You should not miss to visit Avukana Buddha statue.It was a great construction.,"February 6, 2019",0.0,0.0
https://www.tripadvisor.com/Attraction_Review-g12336487-d3568858-Reviews-Avukana_Buddha_Statue-Kekirawa_North_Central_Province.html,Avukana Buddha Statue,4.3,129,https://dynamic-media-cdn.tripadvisor.com/media/photo-o/22/82/02/11/avukana-buddha-status.jpg?w=700&h=400&s=1,Nilmini D,"Colombo, Sri Lanka",,5,Missing,Great job done by the craftsman. The Statue was made out of a huge granite rock and it is so beautiful. Now they have made a roof in order to protect the statue from the wind and rain. Recommend to any tourist who is interested in the history of Sri Lanka and Buddhism.,"January 17, 2019",0.0,0.0
https://www.tripadvisor.com/Attraction_Review-g12336487-d3568858-Reviews-Avukana_Buddha_Statue-Kekirawa_North_Central_Province.html,Avukana Buddha Statue,4.3,129,https://dynamic-media-cdn.tripadvisor.com/media/photo-o/22/82/02/11/avukana-buddha-status.jpg?w=700&h=400&s=1,moviegeekjn,"Phoenix, Arizona",,4,Friends,"This large standing Buddha statue, carved from the granite cliff over 1500 years ago is well worth the brief stop as you make your way to other historic destinations.  This is the largest statue of its type in Sri Lanka, and it's a true work of art.","December 29, 2018",0.0,0.0
https://www.tripadvisor.com/Attraction_Review-g12336487-d3568858-Reviews-Avukana_Buddha_Statue-Kekirawa_North_Central_Province.html,Avukana Buddha Statue,4.3,129,https://dynamic-media-cdn.tripadvisor.com/media/photo-o/22/82/02/11/avukana-buddha-status.jpg?w=700&h=400&s=1,worldnomad_01,"Los Angeles, California",,4,Missing,"The 12 meters statue of a standing Buddha was masterfully carved out of granite stone sometime in the 5th century. Apparently it is one of the best examples of a standing statue in Sri Lanka, thus quite popular, although at the time of our visit there was no one else there. Very much worth a short stop...","December 4, 2018",0.0,0.0
https://www.tripadvisor.com/Attraction_Review-g12336487-d3568858-Reviews-Avukana_Buddha_Statue-Kekirawa_North_Central_Province.html,Avukana Buddha Statue,4.3,129,https://dynamic-media-cdn.tripadvisor.com/media/photo-o/22/82/02/11/avukana-buddha-status.jpg?w=700&h=400&s=1,Samanpadmalal,"Anuradhapura, Sri Lanka",,4,Missing,Situated in north central province close to kekirawa Passing the huge tank in Kalawewa you can reach the place. Here you can see a stormy statue of Lord Buddha. its very big and the work is so neat and wonderful The important thing is that he did it with out any sophisticated machines or equipment s This is a must in your list of attraction,"September 19, 2018",0.0,0.0
https://www.tripadvisor.com/Attraction_Review-g12336487-d3568858-Reviews-Avukana_Buddha_Statue-Kekirawa_North_Central_Province.html,Avukana Buddha Statue,4.3,129,https://dynamic-media-cdn.tripadvisor.com/media/photo-o/22/82/02/11/avukana-buddha-status.jpg?w=700&h=400&s=1,lyndasmith1000,"Colombo, Sri Lanka",,5,Solo,"The Avukana Buddha statue is almost 12 m high and is carved out from a granite cliff. it is almost free-standing , being joined to the cliff by just a narrow piece of rock. It is commonly believed that this statue was constructed in the fifth century CE , during the reign of King Dathusena. In extremely good condition with its features and details still very sharp and clear. I would like to pay my thanks for the authorities which maintain that place. And I'm very much thankful to my driver Mr Mihiraj to show me that place without any request from my side. We had a nice quick lunch near the statue in the bank of nice lake (A tank according to him) named Kala wewa with it's nice breeze. I think he understood who am I. I enjoyed this visit a lot. Thanks nice Sri Lanka and nice man Mihiraj.","September 6, 2018",0.0,0.0
https://www.tripadvisor.com/Attraction_Review-g12336487-d3568858-Reviews-Avukana_Buddha_Statue-Kekirawa_North_Central_Province.html,Avukana Buddha Statue,4.3,129,https://dynamic-media-cdn.tripadvisor.com/media/photo-o/22/82/02/11/avukana-buddha-status.jpg?w=700&h=400&s=1,Thilini C,"Colombo, Sri Lanka",,5,Missing,I had visited Aukana.it was a nice place to visit as Buddhist.on the way to Aukana nature is should have to take a fresh breath.,"July 9, 2018",0.0,0.0
https://www.tripadvisor.com/Attraction_Review-g12336487-d3568858-Reviews-Avukana_Buddha_Statue-Kekirawa_North_Central_Province.html,Avukana Buddha Statue,4.3,129,https://dynamic-media-cdn.tripadvisor.com/media/photo-o/22/82/02/11/avukana-buddha-status.jpg?w=700&h=400&s=1,Honisoiquimalypense,"Derby, United Kingdom",,5,Solo,"If you are up in the Cultural Quarter - this is a ""must do"" location to visit. The statue is considered to be one of best examples of standing buddhas in Sri Lanka and it is really impressive. It stands over 40 ft tall and is carved out of a granite cliff in the 5th century. The statue is attached in places to the cliff and is really well carved ( especially the detail of the robe). A modern ""roof"" has been build over the statue and it does take away from it a bit - but it does keep it safe from erosion. Elsewhere on the site is a small stupa with a buddha statue (hidden behind a vertical pole and also a really pretty hand dug pond/reservoir.","March 19, 2018",0.0,0.0
https://www.tripadvisor.com/Attraction_Review-g12336487-d3568858-Reviews-Avukana_Buddha_Statue-Kekirawa_North_Central_Province.html,Avukana Buddha Statue,4.3,129,https://dynamic-media-cdn.tripadvisor.com/media/photo-o/22/82/02/11/avukana-buddha-status.jpg?w=700&h=400&s=1,Marco M,"Gropada, Italy",,4,Missing,"Interesting place, but the Reswehera Buddha at Sesseruwa is better in my opinion. This statue is also now spoiled by the metallic roof (necessary to preserve the statue), a massive structure. Worth to visit if you are passing by.","February 28, 2018",0.0,0.0
https://www.tripadvisor.com/Attraction_Review-g12336487-d3568858-Reviews-Avukana_Buddha_Statue-Kekirawa_North_Central_Province.html,Avukana Buddha Statue,4.3,129,https://dynamic-media-cdn.tripadvisor.com/media/photo-o/22/82/02/11/avukana-buddha-status.jpg?w=700&h=400&s=1,Salani_Tharaka,"Colombo, Sri Lanka",,5,Missing,Avukana is the tallest Buddha statue in Sri Lanka carved out of one single rock during 459 - 477 AD . It shows the pose of Asisa Mudra of Lord Buddha.,"February 6, 2018",0.0,0.0
https://www.tripadvisor.com/Attraction_Review-g12336487-d3568858-Reviews-Avukana_Buddha_Statue-Kekirawa_North_Central_Province.html,Avukana Buddha Statue,4.3,129,https://dynamic-media-cdn.tripadvisor.com/media/photo-o/22/82/02/11/avukana-buddha-status.jpg?w=700&h=400&s=1,mohommadthafik51,"Doha, Qatar",,5,Missing,"Me and my family visited this place according to our guid's suggestions, after visited we understood this is a very important place to visit. I can recommend aukana.","January 24, 2018",0.0,0.0
https://www.tripadvisor.com/Attraction_Review-g12336487-d3568858-Reviews-Avukana_Buddha_Statue-Kekirawa_North_Central_Province.html,Avukana Buddha Statue,4.3,129,https://dynamic-media-cdn.tripadvisor.com/media/photo-o/22/82/02/11/avukana-buddha-status.jpg?w=700&h=400&s=1,Yohan P,"Negombo, Sri Lanka",,3,Friends,It's about 45 minutes drive from dambulla. A large standing position granite statue of Buddha. If you are in dambulla or anuradhapura and have a couple of hours to spare may be check it out. The tourist ticket price is 1000lkr,"January 6, 2018",0.0,0.0
https://www.tripadvisor.com/Attraction_Review-g12336487-d3568858-Reviews-Avukana_Buddha_Statue-Kekirawa_North_Central_Province.html,Avukana Buddha Statue,4.3,129,https://dynamic-media-cdn.tripadvisor.com/media/photo-o/22/82/02/11/avukana-buddha-status.jpg?w=700&h=400&s=1,Sivakumar V,"Bengaluru, India",,5,Missing,"In the north central province of Srilanka , we come across this  colossus Buddha statue in the Awakana village on the Dambulla- Anuradhapur highway. The 40feet (nearly) Buddha statue in the standing posture in the blessing posture is carved on a huge granite boulder , around 5th Century AD. There is a proposal to construct a huge 3-tier building to inculcate the ideals of Buddhism. The workmanship on the carving , including the finely folded robes is awesome. The place , though does not attract much tourists , is really a must on a tour of Srilanka.","November 27, 2017",0.0,0.0
https://www.tripadvisor.com/Attraction_Review-g12336487-d3568858-Reviews-Avukana_Buddha_Statue-Kekirawa_North_Central_Province.html,Avukana Buddha Statue,4.3,129,https://dynamic-media-cdn.tripadvisor.com/media/photo-o/22/82/02/11/avukana-buddha-status.jpg?w=700&h=400&s=1,RamblerAtHeart,"Halifax, United Kingdom",,5,Missing,"This ancient stone statue is nearly 50 feet high.  Incredible. The resident monk, dressed in orange robes was very welcoming & eager to speak of having met Queen Elizabeth11 & The Duke Of Edinburgh in 1981 when they visited the site.  Donations are welcomed to support ht school run nearby.","September 22, 2017",0.0,0.0
https://www.tripadvisor.com/Attraction_Review-g12336487-d3568858-Reviews-Avukana_Buddha_Statue-Kekirawa_North_Central_Province.html,Avukana Buddha Statue,4.3,129,https://dynamic-media-cdn.tripadvisor.com/media/photo-o/22/82/02/11/avukana-buddha-status.jpg?w=700&h=400&s=1,Deryn H,"Waterlooville, United Kingdom",,4,Friends,"This statue is a massive standing Buddha hewn out of solid rock in the 5th or 11th century, according to who you believe.  It was a very impressive piece of history for such an ancient sculpture. Of course we had to take our shoes off to go and visit it and boy were the stones hot as it was just past the middle of the day at 36 degrees C.I would recommend wearing socks rather than bare feet.","July 12, 2017",0.0,0.0
