Destination URL,Destination Title,Destination Score,Total Reviews (Destination),Destination Image,Reviewer Name,Reviewer Location,Review Title,Review Score,Reviewer Category,Review Text,Written Date,  %,% %
https://www.tripadvisor.com/Attraction_Review-g293962-d27508705-Reviews-Colombo_Lotus_Tower-Colombo_Western_Province.html,Colombo Lotus Tower,3.6,64,https://dynamic-media-cdn.tripadvisor.com/media/photo-o/2d/bd/ad/0c/the-colombo-lotus-tower.jpg?w=700&h=-1&s=1,Mark T,4 contributions,Think Twice,2,Missing,"Food below average Costs above average Atmosphere not very good Entrance reminds of a building site  could do with some cheering up Puddings and deserts need improving. I personally cannot recommend this place. If you want Atmosphere,  happening scene and tasty food. Try the Kingsbury. Go for th the Evening Buffet. Tell them a happy guest recommend them Room 301","January 7, 2026",0.0,0.0
https://www.tripadvisor.com/Attraction_Review-g293962-d27508705-Reviews-Colombo_Lotus_Tower-Colombo_Western_Province.html,Colombo Lotus Tower,3.6,64,https://dynamic-media-cdn.tripadvisor.com/media/photo-o/2d/bd/ad/0c/the-colombo-lotus-tower.jpg?w=700&h=-1&s=1,TAMAN1951,"Liberty Lake, Washington",Nice,3,Couples,Nice viewing spot from the tallest self-supported structure in South Asia. A fee to enter but no good if raining or even drizzling. Unique appearance from the outside as well.,"December 19, 2025",0.0,0.0
https://www.tripadvisor.com/Attraction_Review-g293962-d27508705-Reviews-Colombo_Lotus_Tower-Colombo_Western_Province.html,Colombo Lotus Tower,3.6,64,https://dynamic-media-cdn.tripadvisor.com/media/photo-o/2d/bd/ad/0c/the-colombo-lotus-tower.jpg?w=700&h=-1&s=1,KumaraKK,"Colombo, Sri Lanka",Amazing Views from Colombo Lotus Tower,5,Missing,Visited Colombo Lotus Tower with my family and had an incredible experience! The 360° panoramic view from the tallest point in Colombo is absolutely stunning. The best time to visit is between 5:00 PM and 6:00 PM so you can enjoy the breathtaking sunset. A must-see landmark when in Colombo.. Ticket fee Adults Local (Rs. 500) / Foreign (USD 20),"December 17, 2025",0.0,0.0
https://www.tripadvisor.com/Attraction_Review-g293962-d27508705-Reviews-Colombo_Lotus_Tower-Colombo_Western_Province.html,Colombo Lotus Tower,3.6,64,https://dynamic-media-cdn.tripadvisor.com/media/photo-o/2d/bd/ad/0c/the-colombo-lotus-tower.jpg?w=700&h=-1&s=1,Aspen K,13 contributions,Nice South/Southeast Asian Buffet with a View,5,Missing,"This Review is solely for the Blue Orbit Citrus Restaurant. Make Reservations directly with the Restaurant,  the Buffet is roughly 20-30 dollars per adult, where I found some third party apps charging close to 60 USD per adult! Making a reservation was a little hard to understand,  but a text and a call and a little faith that they saved your reservation and you are in there,  they give a window, and not a specific time which took me a second to pick up on. When you arrive, dont be intimidated if there is a wrap around line outside, that line is for the observation deck. Just inform an attendant that you made a reservation and they will walk you directly to the elevator (making you feel a little bad for skipping the line, but also like a badass VIP) The windows closest to the windows are for couples only and do not rotate, but there is a rotating platform for the rest of the tables that my kids enjoyed. The view is amazing, we went at night so the lights were pretty, but I bet seeing it in the day is also great. The food was good, a mix of Sri Lankan, Indian and Chinese all in one Buffet.","November 30, 2025",0.0,0.0
https://www.tripadvisor.com/Attraction_Review-g293962-d27508705-Reviews-Colombo_Lotus_Tower-Colombo_Western_Province.html,Colombo Lotus Tower,3.6,64,https://dynamic-media-cdn.tripadvisor.com/media/photo-o/2d/bd/ad/0c/the-colombo-lotus-tower.jpg?w=700&h=-1&s=1,K W,14 contributions,Observation deck is closed for rain or drizzle,1,Solo,"Observation deck is closed when it’s raining, even for drizzle. I gave it the low rating because there is no warning or disclaimer by the site or timely status update when the observation deck is closed due to rain. There could even be a sign posted at the entrance when the deck is closed.","November 27, 2025",0.0,0.0
https://www.tripadvisor.com/Attraction_Review-g293962-d27508705-Reviews-Colombo_Lotus_Tower-Colombo_Western_Province.html,Colombo Lotus Tower,3.6,64,https://dynamic-media-cdn.tripadvisor.com/media/photo-o/2d/bd/ad/0c/the-colombo-lotus-tower.jpg?w=700&h=-1&s=1,Angel,"London, United Kingdom","Nice views, disappointing experience but has more potential",3,Couples,"It was nice to see the Lotus Tower closely. Despite only been built a few years ago, the inside is already looking dated and old. The bathrooms are not in great condition and there are a few empty shops on the ground floor. The lift was not particularly modern looking either. However, it was nice seeing the views from the top and identify some of the landmarks. Although many of the signs do not actually line up with the landmark and is actually far to the left or right making it difficult to find them. Great to have this for locals as the only viewing tower in the country. However, there was nothing else of interest there. They still charged full price despite the Pixel Bloom under renovation for a couple of days (this was not explained until walking around aimlessly trying to find it). Okay experience but have seen plenty of other observation decks done a lot better and made more interesting. Hopefully improvements will be made to make this a focal attraction in Colombo in the future.","November 18, 2025",0.0,0.0
https://www.tripadvisor.com/Attraction_Review-g293962-d27508705-Reviews-Colombo_Lotus_Tower-Colombo_Western_Province.html,Colombo Lotus Tower,3.6,64,https://dynamic-media-cdn.tripadvisor.com/media/photo-o/2d/bd/ad/0c/the-colombo-lotus-tower.jpg?w=700&h=-1&s=1,ingrid d,68 contributions,360 view and amazing food,5,Couples,"We first visit the deck, personel was unfriendly and grumpy. But the views were great. The extra animation were very boring and childish. Later we visit the restaurant, friendly personal and great food.","November 7, 2025",0.0,0.0
https://www.tripadvisor.com/Attraction_Review-g293962-d27508705-Reviews-Colombo_Lotus_Tower-Colombo_Western_Province.html,Colombo Lotus Tower,3.6,64,https://dynamic-media-cdn.tripadvisor.com/media/photo-o/2d/bd/ad/0c/the-colombo-lotus-tower.jpg?w=700&h=-1&s=1,Nitharsan M,1 contribution,Rip Off Place,1,Missing,This is one of the Rip off place charging for people who has a passport please try to avoid even some of the workers not respectfull so i avoid this place with family,"September 25, 2025",0.0,0.0
https://www.tripadvisor.com/Attraction_Review-g293962-d27508705-Reviews-Colombo_Lotus_Tower-Colombo_Western_Province.html,Colombo Lotus Tower,3.6,64,https://dynamic-media-cdn.tripadvisor.com/media/photo-o/2d/bd/ad/0c/the-colombo-lotus-tower.jpg?w=700&h=-1&s=1,Viv Vivekananda,"2,073 contributions",Iconic Lotus Tower with great observation deck,3,Missing,"Aptly named Lotus Tower stands at a height of 351.5 meters (1,153 feet). It is an iconic tower in the city visible from afar. Completed in 2019, it serves various purposes, including communication and observation, as well as leisure facilities. An entry fee charged for going up to the observation gallery. In between you can find restaurants, supermarket and food court. Not very crowded, suggest visit early morning . Nice views of city from gallery. You can take a break at one of the food outlets","August 4, 2025",0.0,0.0
https://www.tripadvisor.com/Attraction_Review-g293962-d27508705-Reviews-Colombo_Lotus_Tower-Colombo_Western_Province.html,Colombo Lotus Tower,3.6,64,https://dynamic-media-cdn.tripadvisor.com/media/photo-o/2d/bd/ad/0c/the-colombo-lotus-tower.jpg?w=700&h=-1&s=1,"Damian ""Senior Restaurant Tester""",290 contributions,Restaurant with view over Colombo,5,Missing,"The Lotus Tower in the Sri Lankan capital of Colombo is a 350-meter-tall television tower. The tower is the tallest structure in Sri Lanka, one of the tallest structures in Asia, and also one of the tallest television towers in the world. The structure has become a prominent landmark and tourist attraction in Colombo. The Lotus Tower of Colombo, Sri Lanka's capital, is a 350-meter-high television tower. The tower is the tallest structure in Sri Lanka, one of the tallest in Asia and also one of the tallest television towers in the world. The structure became a prominent landmark and landmark of Colombo.","August 1, 2025",0.0,0.0
https://www.tripadvisor.com/Attraction_Review-g293962-d27508705-Reviews-Colombo_Lotus_Tower-Colombo_Western_Province.html,Colombo Lotus Tower,3.6,64,https://dynamic-media-cdn.tripadvisor.com/media/photo-o/2d/bd/ad/0c/the-colombo-lotus-tower.jpg?w=700&h=-1&s=1,nimjas01,"Rancho Cucamonga, California",,1,Couples,I am a American resident born and bred in Sri Lanka who left at the age of 27. We were visiting SL and wanted to experience the new attraction which was not open during my last visit in 2019. The price was displayed as 500 SLRupees to enter. When approached to purchase tickets counter wanted to charge us $20 equal to 6000 rupees which is ridiculously high even for a foreigner visiting because I did not have a Sri Lanka ID card. We left without buying the tickets. Be reasonable for ex Sri Lankan who are interested in seeing new additions in the motherland.,"June 30, 2025",0.0,0.0
https://www.tripadvisor.com/Attraction_Review-g293962-d27508705-Reviews-Colombo_Lotus_Tower-Colombo_Western_Province.html,Colombo Lotus Tower,3.6,64,https://dynamic-media-cdn.tripadvisor.com/media/photo-o/2d/bd/ad/0c/the-colombo-lotus-tower.jpg?w=700&h=-1&s=1,Oushika M,1 contribution,,3,Missing,"find the exit. We requested the exit from the guest relations hostess.(Muslim lady in blue suit.) She directed me to my destination. The first time, I didn't hear the way. When I asked a second time, her body language was quite harsh. The facial expressions were pretty awful.","June 29, 2025",0.0,0.0
https://www.tripadvisor.com/Attraction_Review-g293962-d27508705-Reviews-Colombo_Lotus_Tower-Colombo_Western_Province.html,Colombo Lotus Tower,3.6,64,https://dynamic-media-cdn.tripadvisor.com/media/photo-o/2d/bd/ad/0c/the-colombo-lotus-tower.jpg?w=700&h=-1&s=1,Avi Sharma,India,,3,Missing,"The first thing we did after landing in Colombo was visit the Tower, a major attraction in the city. The view from the top is fantastic, and the crowd management is well organised. The Pixel Show is enjoyable for small kids. Although the tickets are pretty expensive, they're worth visiting at least once. However, the washrooms on the ground level need some upkeep. Overall, I would recommend visiting! 👌","June 23, 2025",0.0,0.0
https://www.tripadvisor.com/Attraction_Review-g293962-d27508705-Reviews-Colombo_Lotus_Tower-Colombo_Western_Province.html,Colombo Lotus Tower,3.6,64,https://dynamic-media-cdn.tripadvisor.com/media/photo-o/2d/bd/ad/0c/the-colombo-lotus-tower.jpg?w=700&h=-1&s=1,amyadamy,"Lansing, Michigan",,4,Missing,"This was one of the first things we did when we landed in Colombo, and it was such a great way to begin seeing the city. The views from the top are really beautiful, and on a clear day, you can really see quite far. The Pixel experience was closed the day we were there, but a great stop if you want to see Colombo from the sky!","June 12, 2025",0.0,0.0
https://www.tripadvisor.com/Attraction_Review-g293962-d27508705-Reviews-Colombo_Lotus_Tower-Colombo_Western_Province.html,Colombo Lotus Tower,3.6,64,https://dynamic-media-cdn.tripadvisor.com/media/photo-o/2d/bd/ad/0c/the-colombo-lotus-tower.jpg?w=700&h=-1&s=1,Sabrina Gabriel Honest Views,Seychelles,,4,Couples,"The Lotus Tower is a stunning architectural marvel that offers breathtaking city views from its observation deck. Its iconic lotus-inspired design is a treat to the eyes, day and night. The Pixel Bloom experience adds a magical touch, blending art and technology with interactive, vibrant digital displays that captivate visitors of all ages. With excellent facilities and friendly staff, it’s a must-visit for anyone seeking a mix of beauty, creativity, and innovation. Perfect for both locals and tourists!","June 12, 2025",0.0,0.0
https://www.tripadvisor.com/Attraction_Review-g293962-d27508705-Reviews-Colombo_Lotus_Tower-Colombo_Western_Province.html,Colombo Lotus Tower,3.6,64,https://dynamic-media-cdn.tripadvisor.com/media/photo-o/2d/bd/ad/0c/the-colombo-lotus-tower.jpg?w=700&h=-1&s=1,Margaret D Costa,"Dhaka City, Bangladesh",,4,Missing,"It was a windy evening when we had visited. Because of cloudiness the sunset was not as expected. However, great view of Colombo from the observation deck.","June 11, 2025",0.0,0.0
https://www.tripadvisor.com/Attraction_Review-g293962-d27508705-Reviews-Colombo_Lotus_Tower-Colombo_Western_Province.html,Colombo Lotus Tower,3.6,64,https://dynamic-media-cdn.tripadvisor.com/media/photo-o/2d/bd/ad/0c/the-colombo-lotus-tower.jpg?w=700&h=-1&s=1,PRAKASH,"Salem, India",,5,Friends,"Colombo Lotus Tower The Colombo Lotus Tower, standing proudly in the heart of Colombo, is South Asia’s tallest self-supported structure and Sri Lanka’s tallest skyscraper, reaching an impressive height of 356 meters (1168 feet). Designed to resemble a lotus blossom, a symbol of purity and renewal, this iconic structure reflects the blend of tradition and modernity in Sri Lanka. With construction initiated in 2012, the tower was meticulously crafted over a decade and opened to the public on 15th September 2022, marking a new chapter in Sri Lanka’s architectural and technological advancement. Situated along the banks of Beira Lake, the Colombo Lotus Tower is a landmark visible from far beyond the city limits, drawing thousands of visitors each month who come to experience its panoramic observation deck, cutting-edge technology, and entertainment facilities. The tower offers a 360-degree view of Colombo, the Indian Ocean, and the lush landscapes that extend inland, making it a prime spot for sightseeing, photography, and cultural immersion.","May 26, 2025",0.0,0.0
https://www.tripadvisor.com/Attraction_Review-g293962-d27508705-Reviews-Colombo_Lotus_Tower-Colombo_Western_Province.html,Colombo Lotus Tower,3.6,64,https://dynamic-media-cdn.tripadvisor.com/media/photo-o/2d/bd/ad/0c/the-colombo-lotus-tower.jpg?w=700&h=-1&s=1,Tango Tour,"Tangalle, Sri Lanka",,4,Missing,"Beautiful view top of lotus tower, but ticket price higher than we thought. Only lift up & down, No any function at top at that day.","May 22, 2025",0.0,0.0
https://www.tripadvisor.com/Attraction_Review-g293962-d27508705-Reviews-Colombo_Lotus_Tower-Colombo_Western_Province.html,Colombo Lotus Tower,3.6,64,https://dynamic-media-cdn.tripadvisor.com/media/photo-o/2d/bd/ad/0c/the-colombo-lotus-tower.jpg?w=700&h=-1&s=1,Simon S,1 contribution,,5,Business,Perfect accomodation! The room service was exceptional! People like Sakila work really hard for the guests to have a dreamy experience!,"May 20, 2025",0.0,0.0
https://www.tripadvisor.com/Attraction_Review-g293962-d27508705-Reviews-Colombo_Lotus_Tower-Colombo_Western_Province.html,Colombo Lotus Tower,3.6,64,https://dynamic-media-cdn.tripadvisor.com/media/photo-o/2d/bd/ad/0c/the-colombo-lotus-tower.jpg?w=700&h=-1&s=1,Reetika R,11 contributions,,5,Missing,"The view is amazing, best tune to go is in the evening to see sunset...school visits happen, so you got to be lucky to go when it's not crowded. Very well managed inside.","May 14, 2025",0.0,0.0
https://www.tripadvisor.com/Attraction_Review-g293962-d27508705-Reviews-Colombo_Lotus_Tower-Colombo_Western_Province.html,Colombo Lotus Tower,3.6,64,https://dynamic-media-cdn.tripadvisor.com/media/photo-o/2d/bd/ad/0c/the-colombo-lotus-tower.jpg?w=700&h=-1&s=1,Busker999,"Tonbridge, United Kingdom",,4,Couples,"Appreciate foreign tourists extra cost but that's ok for us, not so for those with low wages or low income countries. Observation Deck has a good view over the city. Place cards on important sites but would be helpful if showed on a wider map to help spotting. Did the digital experience after which was fun and nice quick history too from Portuguese invasion onwards then more about colombo before doing interactive part. Worth it even though yiu can do something similar in most capitals and big cities nowadays","May 7, 2025",0.0,0.0
https://www.tripadvisor.com/Attraction_Review-g293962-d27508705-Reviews-Colombo_Lotus_Tower-Colombo_Western_Province.html,Colombo Lotus Tower,3.6,64,https://dynamic-media-cdn.tripadvisor.com/media/photo-o/2d/bd/ad/0c/the-colombo-lotus-tower.jpg?w=700&h=-1&s=1,vi c,"Fareham, United Kingdom",,5,Solo,I thoroughly enjoyed my visit here. I went early and was in the first lift up ~ there were very few people around at that time. Despite it being a little hazy the views were still great and the haze only affected things in the distance which wouldn't have been very visible anyway. For me it was certainly worth the 6000 /= to go up there.,"April 27, 2025",0.0,0.0
https://www.tripadvisor.com/Attraction_Review-g293962-d27508705-Reviews-Colombo_Lotus_Tower-Colombo_Western_Province.html,Colombo Lotus Tower,3.6,64,https://dynamic-media-cdn.tripadvisor.com/media/photo-o/2d/bd/ad/0c/the-colombo-lotus-tower.jpg?w=700&h=-1&s=1,Manjula M,1 contribution,,1,Missing,Terrible and ugly experience with tickets counter staffer. Impolite lack of customer service full on attitude. I am local visitor with my wife and daughter even I was provided my National ID still keep asking all of ours passports. Because of I we were well dressed staffer decided by her own mindset that we are foreign visitors. We just turned around and went back with disgusting experience.,"April 19, 2025",0.0,0.0
https://www.tripadvisor.com/Attraction_Review-g293962-d27508705-Reviews-Colombo_Lotus_Tower-Colombo_Western_Province.html,Colombo Lotus Tower,3.6,64,https://dynamic-media-cdn.tripadvisor.com/media/photo-o/2d/bd/ad/0c/the-colombo-lotus-tower.jpg?w=700&h=-1&s=1,sudesh s,14 contributions,,5,Family,"We went with the children of two families and had a great time. The views from the top were breathtaking, offering a 360-degree panorama of the city. Additionally, they have a digital gallery, panoramic restaurants, shops, and a boardwalk on the ground floor. There’s a good selection of food stalls, and the place feels safe for families and friends.","April 7, 2025",0.0,0.0
https://www.tripadvisor.com/Attraction_Review-g293962-d27508705-Reviews-Colombo_Lotus_Tower-Colombo_Western_Province.html,Colombo Lotus Tower,3.6,64,https://dynamic-media-cdn.tripadvisor.com/media/photo-o/2d/bd/ad/0c/the-colombo-lotus-tower.jpg?w=700&h=-1&s=1,PBPG,"Yorkshire, United Kingdom",,5,Couples,"The Lotus Tower, also known as the Colombo Lotus Tower, is 351.5 meters high  It has become a symbolic landmark for the country. Situated on 320 McCallum Rd, Colombo.  You can go up, the tower.  It stands out from the crowd and can be seen from many points in the city.  An amazing structure.  Best seen at night from a distance so you can see the lights changing colour.","April 2, 2025",0.0,0.0
https://www.tripadvisor.com/Attraction_Review-g293962-d27508705-Reviews-Colombo_Lotus_Tower-Colombo_Western_Province.html,Colombo Lotus Tower,3.6,64,https://dynamic-media-cdn.tripadvisor.com/media/photo-o/2d/bd/ad/0c/the-colombo-lotus-tower.jpg?w=700&h=-1&s=1,scotdoc2015,"Birmingham, United Kingdom",,3,Solo,Grand attractive place. Well organised. Neck wrenching tall. Money making enterprise. Very expensive tickets. Was charged full rate despite 50% of service not being available (closed due to works). Good views from top with helpful diagrams. Take your time at top. Looks better at night from a distance. Lots of eateries at base on exiting.,"March 17, 2025",0.0,0.0
https://www.tripadvisor.com/Attraction_Review-g293962-d27508705-Reviews-Colombo_Lotus_Tower-Colombo_Western_Province.html,Colombo Lotus Tower,3.6,64,https://dynamic-media-cdn.tripadvisor.com/media/photo-o/2d/bd/ad/0c/the-colombo-lotus-tower.jpg?w=700&h=-1&s=1,travelkat,"Scotland, United Kingdom",,1,Couples,"I’ll start with the lift/elevator journey back down…my husband’s exact words: “Was that it??” Before entering, we took fab ground level photos of the tower, as well as the ‘Columbo phone box’ outside - that was the best bit (which can be done for free). Enter (as a tourist) and expect, as others have said, to pay 20USD. This might not seem much when you compare it to the CN Tower in Toronto or the Burj Khalifa in Dubai - some might say ‘it’s all relative’ (on this occasion it’s not…) So…you are ushered past the ticket counter for locals, which is outside, enter the building and buy your 20USD tourist ticket. Go to the lift/elevator, and travel in an enclosed box for 29 floors. Exit. Walk around the tower viewing platform, taking views in/ taking photos as you like and after those 5-10mins have passed, return to the enclosed box to descend 29 floors as you think to yourself “Was that it??” (… and your partner says it out loud…)","February 21, 2025",0.0,0.0
https://www.tripadvisor.com/Attraction_Review-g293962-d27508705-Reviews-Colombo_Lotus_Tower-Colombo_Western_Province.html,Colombo Lotus Tower,3.6,64,https://dynamic-media-cdn.tripadvisor.com/media/photo-o/2d/bd/ad/0c/the-colombo-lotus-tower.jpg?w=700&h=-1&s=1,huzzmundo,"Leicester, United Kingdom",,2,Couples,"Visited the Colombo Lotus Tower on a day visit in Colombo. So surprised they charge £16 per per person if your foreign and £1.35 if your a local! Can you imagine if we did that in the UK?! Even though you so much more you don’t get any benefit, still the same queue, no priority or anything. The pixel show is a scam, it’s a simple array of lights whilst waiting for the elevator. Views were nice, definitely wouldn’t go if it was cloudy. Wouldn’t bother wasting time here. Nice to take pictures of the tower from around the city.","February 14, 2025",0.0,0.0
https://www.tripadvisor.com/Attraction_Review-g293962-d27508705-Reviews-Colombo_Lotus_Tower-Colombo_Western_Province.html,Colombo Lotus Tower,3.6,64,https://dynamic-media-cdn.tripadvisor.com/media/photo-o/2d/bd/ad/0c/the-colombo-lotus-tower.jpg?w=700&h=-1&s=1,Peter v,12 contributions,,5,Missing,Beautiful view from the 29th floor over Colombo. Afterwards you can attend a presentation about the origins of SriLanka. This shows our VOC time.,"February 12, 2025",0.0,0.0
https://www.tripadvisor.com/Attraction_Review-g293962-d27508705-Reviews-Colombo_Lotus_Tower-Colombo_Western_Province.html,Colombo Lotus Tower,3.6,64,https://dynamic-media-cdn.tripadvisor.com/media/photo-o/2d/bd/ad/0c/the-colombo-lotus-tower.jpg?w=700&h=-1&s=1,Lizzy M,"Nicosia, Cyprus",,4,Friends,"We visited with friends, it’s quite an amazing view from up there of the whole city…. And good food too.   The floor rotates but not scary 😝","February 7, 2025",0.0,0.0
https://www.tripadvisor.com/Attraction_Review-g293962-d27508705-Reviews-Colombo_Lotus_Tower-Colombo_Western_Province.html,Colombo Lotus Tower,3.6,64,https://dynamic-media-cdn.tripadvisor.com/media/photo-o/2d/bd/ad/0c/the-colombo-lotus-tower.jpg?w=700&h=-1&s=1,Shyam Mishra,"Kolkata (Calcutta), India",,4,Missing,Prices are high that is 20 USD per tourist otherwise a top view of Colombo is seen so not so value for money as per my opinion,"February 1, 2025",0.0,0.0
https://www.tripadvisor.com/Attraction_Review-g293962-d27508705-Reviews-Colombo_Lotus_Tower-Colombo_Western_Province.html,Colombo Lotus Tower,3.6,64,https://dynamic-media-cdn.tripadvisor.com/media/photo-o/2d/bd/ad/0c/the-colombo-lotus-tower.jpg?w=700&h=-1&s=1,Janice J,"Mumbai, India",,3,Couples,"Tourist trap!!!!!!! It was way too expensive and there was nothing that was unique or interesting or remotely fun about this. If you really want to see Colombo from top, you could rather go to Sky lounge- Kingsbury or any other rooftop restaurants because this was $20 for international tourist and was just just seeing the city from top. 4/10","January 28, 2025",0.0,0.0
https://www.tripadvisor.com/Attraction_Review-g293962-d27508705-Reviews-Colombo_Lotus_Tower-Colombo_Western_Province.html,Colombo Lotus Tower,3.6,64,https://dynamic-media-cdn.tripadvisor.com/media/photo-o/2d/bd/ad/0c/the-colombo-lotus-tower.jpg?w=700&h=-1&s=1,JackPC32,"Exeter, United Kingdom",,5,Couples,"The Lotus Tower stands as the tallest single-supported structure in Southeast Asia and is a true architectural marvel in Colombo. While there’s an entrance fee of $20, the experience of ascending to the top is absolutely worth it. On a clear, sunny day, you’re treated to a breathtaking 360-degree panoramic view of Colombo, including a stunning bird’s-eye view of the main railway station and the city’s sprawling landscape. The tower is not only an iconic landmark but also a testament to modern engineering and design. Whether you’re a local or a visitor, the Lotus Tower is a must-visit destination for its unparalleled views and unique experience. Don’t miss the chance to see Colombo from this incredible vantage point!","January 27, 2025",0.0,0.0
