Destination URL,Destination Title,Destination Score,Total Reviews (Destination),Destination Image,Reviewer Name,Reviewer Location,Review Title,Review Score,Reviewer Category,Review Text,Written Date,% %,  %
https://www.tripadvisor.com/Attraction_Review-g616035-d15275195-Reviews-Honey_Bee_Garden-Ella_Uva_Province.html,Honey Bee Garden,5.0,500,https://dynamic-media-cdn.tripadvisor.com/media/photo-o/2c/d3/57/13/caption.jpg?w=700&h=400&s=1,Jane K,5 contributions,,5,Family,"We spent a fabulous evening in Ruwini's kitchen cooking up a delicious feast, which we ate with delight.  It was an absolute highlight for us to observe the every day life of a Sri Lankan home kitchen, but getting involved also.  We would really recommend this activity.","December 30, 2018",0.0,0.0
https://www.tripadvisor.com/Attraction_Review-g616035-d15275195-Reviews-Honey_Bee_Garden-Ella_Uva_Province.html,Honey Bee Garden,5.0,500,https://dynamic-media-cdn.tripadvisor.com/media/photo-o/2c/d3/57/13/caption.jpg?w=700&h=400&s=1,nathanm92,"Liverpool, UK",,5,Friends,"Having never done a cooking class before I was unsure what to expect, but Ruwini was great. She was a fantastic teacher and so hospitable. The food was amazing (especially the aubergine) and Ruwini even emailed the recipes to us to try at home. A truly authentic Sri Lankan cooking experience and one of the best things we did on our trip.","December 26, 2018",0.0,0.0
https://www.tripadvisor.com/Attraction_Review-g616035-d15275195-Reviews-Honey_Bee_Garden-Ella_Uva_Province.html,Honey Bee Garden,5.0,500,https://dynamic-media-cdn.tripadvisor.com/media/photo-o/2c/d3/57/13/caption.jpg?w=700&h=400&s=1,Bradley W,9 contributions,,5,Couples,"We had a great time with Ruwini as she taught 9 of us how to prepare a variety of traditional Sri Lankan dishes, including coconut roti, sambal and 5 different curry dishes. This was all done in her kitchen, through a combination of demonstration and participation. We then ate the food we had cooked together, confirming it was as tasty as it looked! 😀","December 24, 2018",0.0,0.0
https://www.tripadvisor.com/Attraction_Review-g616035-d15275195-Reviews-Honey_Bee_Garden-Ella_Uva_Province.html,Honey Bee Garden,5.0,500,https://dynamic-media-cdn.tripadvisor.com/media/photo-o/2c/d3/57/13/caption.jpg?w=700&h=400&s=1,Witninja,Uganda,,5,Couples,Ruwini went out of her way to give us the best experience. She even included coconut rotti and jackfruit curry on our request. She knows her way around her kitchen. You will have a incredible truly Sri Lankan experiece. A wonderful time!,"December 20, 2018",0.0,0.0
https://www.tripadvisor.com/Attraction_Review-g616035-d15275195-Reviews-Honey_Bee_Garden-Ella_Uva_Province.html,Honey Bee Garden,5.0,500,https://dynamic-media-cdn.tripadvisor.com/media/photo-o/2c/d3/57/13/caption.jpg?w=700&h=400&s=1,Nicole G,13 contributions,,5,Couples,"The cookery class at Honey Bee Gardens was SO BRILLIANT. It was one of the highlights of our trip. The class was small so everyone was able to get stuck into helping, we learned how to make half a dozen or more (I lost count!) dishes and Ruwini was very helpful telling us how to modify if we couldn’t get the same ingredients at home. It’s a beautiful setting and the food was out of this world!!","December 13, 2018",0.0,0.0
https://www.tripadvisor.com/Attraction_Review-g616035-d15275195-Reviews-Honey_Bee_Garden-Ella_Uva_Province.html,Honey Bee Garden,5.0,500,https://dynamic-media-cdn.tripadvisor.com/media/photo-o/2c/d3/57/13/caption.jpg?w=700&h=400&s=1,Sam B,1 contribution,,5,Couples,"What an awesome experience! Ruwini was such a great teacher and helped us to cook coconut rotis, sambol, rice as well as 5 different curries! Some of the best food we have eaten in Sri Lanka and skills that we can take with us back home to impress our family and friends. Absolutely a must do whilst in Ella, couldn’t recommend enough!","December 11, 2018",0.0,0.0
https://www.tripadvisor.com/Attraction_Review-g616035-d15275195-Reviews-Honey_Bee_Garden-Ella_Uva_Province.html,Honey Bee Garden,5.0,500,https://dynamic-media-cdn.tripadvisor.com/media/photo-o/2c/d3/57/13/caption.jpg?w=700&h=400&s=1,fylde_wanderer,"Kew, UK",,5,Couples,"I highly recommend a Sri Lankan cooking lesson at the Honey Bee Garden! Ruwini was a superb host and a great tutor. Our lesson was 5 guests, which was a perfect class size for the kitchen. All 5 of us got to take turns preparing and cooking. We used fresh ingredients to make 7 or 8 different authentic dishes. At the end of the evening, I think these made the very best meal that we’ve had in Sri Lanka so far - utterly brilliant!","December 10, 2018",0.0,0.0
https://www.tripadvisor.com/Attraction_Review-g616035-d15275195-Reviews-Honey_Bee_Garden-Ella_Uva_Province.html,Honey Bee Garden,5.0,500,https://dynamic-media-cdn.tripadvisor.com/media/photo-o/2c/d3/57/13/caption.jpg?w=700&h=400&s=1,NessieMac,"London, UK",,5,Couples,"My husband and I were recommended the cookery lesson at Honey Bee Garden by our hotel instead of the one we had read about in the guide book. We were so glad we took their advice. A group of 5 people the session was a perfect size and Ruwini was the perfect host- introducing us to the spices and flavours of Sri Lankan cuisine. We prepared and cooked everything from scratch over 2 hours and then sat down to enjoy the meal as a group. In total I think we made 7 dishes plus rice: Coconut roti, Dahl curry, aubergine curry, bean curry, poppadoms, mango chutney, pumpkin curry. All cooked in Ruwini’s kitchen as a local would do on their own homes.","December 7, 2018",0.0,0.0
https://www.tripadvisor.com/Attraction_Review-g616035-d15275195-Reviews-Honey_Bee_Garden-Ella_Uva_Province.html,Honey Bee Garden,5.0,500,https://dynamic-media-cdn.tripadvisor.com/media/photo-o/2c/d3/57/13/caption.jpg?w=700&h=400&s=1,Adam D,"London, UK",,5,Couples,Ruwini was a great host for the 4 of us doing the class. We learnt a lot of Sri Lankan cooking techniques and there was soooo much to eat! Great value for money and good fun. We all took turns doing different things and had a laugh doing it.,"December 7, 2018",0.0,0.0
https://www.tripadvisor.com/Attraction_Review-g616035-d15275195-Reviews-Honey_Bee_Garden-Ella_Uva_Province.html,Honey Bee Garden,5.0,500,https://dynamic-media-cdn.tripadvisor.com/media/photo-o/2c/d3/57/13/caption.jpg?w=700&h=400&s=1,Navigator53562323875,1 contribution,,5,Couples,The teacher is the best. Her level of English is quite high and she answered all of our questions with a lovely smile on her face. We definitely recommend this cooking workshop! Gijs,"November 25, 2018",0.0,0.0
https://www.tripadvisor.com/Attraction_Review-g616035-d15275195-Reviews-Honey_Bee_Garden-Ella_Uva_Province.html,Honey Bee Garden,5.0,500,https://dynamic-media-cdn.tripadvisor.com/media/photo-o/2c/d3/57/13/caption.jpg?w=700&h=400&s=1,Liz C,6 contributions,,5,Couples,"This is a must-do in Ella! We got to learn the basis for all good Curry’s and the tips and recipes are definitely something we can use back at home. The food was the best tasting that we’ve had in Sri Lanka! Ruwini was so hospitable and friendly. We made: bean curry, pumpkin curry, dhal, eggplant dish, coconut sambol, roti, papadum. Delicious.","November 23, 2018",0.0,0.0
https://www.tripadvisor.com/Attraction_Review-g616035-d15275195-Reviews-Honey_Bee_Garden-Ella_Uva_Province.html,Honey Bee Garden,5.0,500,https://dynamic-media-cdn.tripadvisor.com/media/photo-o/2c/d3/57/13/caption.jpg?w=700&h=400&s=1,Timo I,"Stockholm, Sweden",,5,Couples,The cookery class at honey Bee garden was a fantastic experience in Sri Lanka. It is a very good way to learn more about The traditional Sri lankan cuisine. The best part is that you get to eat What you make in The end. We Will try The recipes when we get home for sure.,"November 17, 2018",0.0,0.0
https://www.tripadvisor.com/Attraction_Review-g616035-d15275195-Reviews-Honey_Bee_Garden-Ella_Uva_Province.html,Honey Bee Garden,5.0,500,https://dynamic-media-cdn.tripadvisor.com/media/photo-o/2c/d3/57/13/caption.jpg?w=700&h=400&s=1,Helen N,"Sheffield, UK",,5,Couples,"Fantastic cooking class - good pace, clear explanations and very tasty food. Lots of tips for cooking back home about what we can substitute in and what combinations of vegetable and spice work. A very enjoyable evening cooking and eating. The homestay room also looked lovely and the breakfast would be incredible!","November 3, 2018",0.0,0.0
https://www.tripadvisor.com/Attraction_Review-g616035-d15275195-Reviews-Honey_Bee_Garden-Ella_Uva_Province.html,Honey Bee Garden,5.0,500,https://dynamic-media-cdn.tripadvisor.com/media/photo-o/2c/d3/57/13/caption.jpg?w=700&h=400&s=1,Mobile01980676392,1 contribution,,5,Couples,"A very nice class in a family environment! We made different vegetable curries, spice mixes, coconut rotis and coconut sambal.. the best sri lankan food we had so far :) and the host is a very kind and lovely person!","October 31, 2018",0.0,0.0
https://www.tripadvisor.com/Attraction_Review-g616035-d15275195-Reviews-Honey_Bee_Garden-Ella_Uva_Province.html,Honey Bee Garden,5.0,500,https://dynamic-media-cdn.tripadvisor.com/media/photo-o/2c/d3/57/13/caption.jpg?w=700&h=400&s=1,robs2bbart,"Tangalle, Sri Lanka",,5,Couples,"This was one of the highlights of our time in Sri Lanka. The cooking class was incredible. Best food we had during our trip. It was well organised, and the cook was friendly and knowledgeable. We enjoyed the authenticity of the class, and it was a wonderful experience. Cannot recommend enough! Thank you to Honeybee Gardens for providing us with the opportunity to make authentic Sri Lankan food. We can’t wait to try the recipes at home!","October 29, 2018",0.0,0.0
https://www.tripadvisor.com/Attraction_Review-g616035-d15275195-Reviews-Honey_Bee_Garden-Ella_Uva_Province.html,Honey Bee Garden,5.0,500,https://dynamic-media-cdn.tripadvisor.com/media/photo-o/2c/d3/57/13/caption.jpg?w=700&h=400&s=1,achidz,"Riyadh, Saudi Arabia",,5,Missing,Ruwini is such a hospitable person. We had a lovely evening cooking with her - definitely the best food we had during our trip! The aubergine dish was incredible. She has inspired us all to get cooking so we’re heading home with loads of different spices!,"October 18, 2018",0.0,0.0
https://www.tripadvisor.com/Attraction_Review-g616035-d15275195-Reviews-Honey_Bee_Garden-Ella_Uva_Province.html,Honey Bee Garden,5.0,500,https://dynamic-media-cdn.tripadvisor.com/media/photo-o/2c/d3/57/13/caption.jpg?w=700&h=400&s=1,Haeiks9,"Munich, Germany",,5,Missing,Found this place via TripAdvisor. Had a cookery class with 4 participants. The host was very lovely and showed us how to cook traditional Sri Lankan dishes. The had the chance to cook ourselves and prepared several different dishes. The food was awesome! We received the recipes afterwards. Highly recommend!,"October 10, 2018",0.0,0.0
https://www.tripadvisor.com/Attraction_Review-g616035-d15275195-Reviews-Honey_Bee_Garden-Ella_Uva_Province.html,Honey Bee Garden,5.0,500,https://dynamic-media-cdn.tripadvisor.com/media/photo-o/2c/d3/57/13/caption.jpg?w=700&h=400&s=1,Jesper H,"New Delhi, India",,5,Missing,A very nice and lovely experience. We were well taken care of during the entire evening and the food we created tasted better than most restaurants in Sri lanka.,"October 2, 2018",0.0,0.0
https://www.tripadvisor.com/Attraction_Review-g616035-d15275195-Reviews-Honey_Bee_Garden-Ella_Uva_Province.html,Honey Bee Garden,5.0,500,https://dynamic-media-cdn.tripadvisor.com/media/photo-o/2c/d3/57/13/caption.jpg?w=700&h=400&s=1,Laura T,6 contributions,,5,Missing,"We attended this cooking class last night and I have to say that it was a great experience!! The cooking class was more or less 1.5/2 hours and after that we enjoyed the amazing food. Everything was very tasty and we even asked if it was possible to prepare Roti (as I really love it) and even thought it wasn’t in the cooking class menu, Ruwini was very nice and thought us how to make a very nice coconut Roti! I would definitely recommend it! Really good value for money","September 15, 2018",0.0,0.0
https://www.tripadvisor.com/Attraction_Review-g616035-d15275195-Reviews-Honey_Bee_Garden-Ella_Uva_Province.html,Honey Bee Garden,5.0,500,https://dynamic-media-cdn.tripadvisor.com/media/photo-o/2c/d3/57/13/caption.jpg?w=700&h=400&s=1,Ellie W,3 contributions,,5,Missing,"Ruwini was a lovely and charismatic host for our cooking class. She was smiley, very encouraging and friendly throughout. We learnt how to cook pumpkin curry, green bean curry, lentil dahl, aubergine tamarind curry, rice, poppadoms, coconut sambal (sort of like Sri Lanka's answer to guacamole) and a salad. The food was cooked as a group so everyone got a chance to take part but there was no pressure. The class would be suitable for any level of cook. The food was all beautiful and she made sure all of us were involved. She's emailing us the recipes so we hope we can take her tips home with us! She was also interested in our food and how we cook which was nice. Her English was amazing, and she even laughed at our British sarcasm. Overall a fantastic experience - thanks Ruwini!!","September 13, 2018",0.0,0.0
https://www.tripadvisor.com/Attraction_Review-g616035-d15275195-Reviews-Honey_Bee_Garden-Ella_Uva_Province.html,Honey Bee Garden,5.0,500,https://dynamic-media-cdn.tripadvisor.com/media/photo-o/2c/d3/57/13/caption.jpg?w=700&h=400&s=1,lorbag,15 contributions,,5,Missing,Really interesting and impossible to miss this appointment with the Sri Lanka's culinary tradition. Ruwini will guide you through typical ingredients of this fantastico Land. A wonderfull way to bring home a piece of Sri Lanka,"September 10, 2018",0.0,0.0
https://www.tripadvisor.com/Attraction_Review-g616035-d15275195-Reviews-Honey_Bee_Garden-Ella_Uva_Province.html,Honey Bee Garden,5.0,500,https://dynamic-media-cdn.tripadvisor.com/media/photo-o/2c/d3/57/13/caption.jpg?w=700&h=400&s=1,Anna B,Vietnam,,5,Missing,"Thank you so much Ruwini for the fantastic class! This lovely bubbly lady has great English and a great relaxed style. We all participated in cooking a dhaal, bean curry, aubergine modju, potato dish, coconut sambal and a salad. It was all really well explained and absolutely delicious to eat afterwards! Looking forward to trying out the recipes (also sent by email) at home.","September 7, 2018",0.0,0.0
https://www.tripadvisor.com/Attraction_Review-g616035-d15275195-Reviews-Honey_Bee_Garden-Ella_Uva_Province.html,Honey Bee Garden,5.0,500,https://dynamic-media-cdn.tripadvisor.com/media/photo-o/2c/d3/57/13/caption.jpg?w=700&h=400&s=1,mctravels_82,97 contributions,,5,Missing,"The cooking class at Honey Bee Garden was very good and I highly recommend it during your stay in Ella. For 2000 rupee you get to make 7 different dishes which are traditional Sri Lankan dishes. All of the dishes were very delicious and fulfilling (you don't need desert after, trust me). The teacher spoke English well and did a good job of explaining all of the steps and ingredients used in the dishes. I loved the teachers personality, she is very friendly and charismatic. The location of the cooking course is in a nice location in Ella (the gardens around the homestay are fantastic). Overall I was very pleased with the cooking course and was excellent value for money. I would certainly do another course at Honey Bee Garden again if I ever visit Ella.","August 31, 2018",0.0,0.0
https://www.tripadvisor.com/Attraction_Review-g616035-d15275195-Reviews-Honey_Bee_Garden-Ella_Uva_Province.html,Honey Bee Garden,5.0,500,https://dynamic-media-cdn.tripadvisor.com/media/photo-o/2c/d3/57/13/caption.jpg?w=700&h=400&s=1,Laurie F,"Queenstown, New Zealand",,5,Missing,"This is not a restaurant. It's a cooking class followed by a meal from the results of the class. Ruini is lovely. The venue is genuinely in home. The food is wonderful. Best meal in Sri Lanka and we have been to the ""best"" according to the reviews. Thanks Ruini for a great evening.","August 28, 2018",0.0,0.0
https://www.tripadvisor.com/Attraction_Review-g616035-d15275195-Reviews-Honey_Bee_Garden-Ella_Uva_Province.html,Honey Bee Garden,5.0,500,https://dynamic-media-cdn.tripadvisor.com/media/photo-o/2c/d3/57/13/caption.jpg?w=700&h=400&s=1,Travelbug,"Ulverstone, Australia",,5,Missing,"We did the cooking school here starting at 6pm for 2000 rupees lasting approx two hours making some absolutely delicious dishes including a green bean dish, potato dish, dhal, aubergine dish, and cucumber salad. There was only four of us in total so quite a personalised night. We sat down to a huge feast with rice and pappadams and it was some of the nicest food we had had in 3 weeks of travelling.  We were also emailed the recipes at a later time. It is a small family run place and everyone was friendly.","August 25, 2018",0.0,0.0
https://www.tripadvisor.com/Attraction_Review-g616035-d15275195-Reviews-Honey_Bee_Garden-Ella_Uva_Province.html,Honey Bee Garden,5.0,500,https://dynamic-media-cdn.tripadvisor.com/media/photo-o/2c/d3/57/13/caption.jpg?w=700&h=400&s=1,Sarah,"Burnley, UK",,5,Missing,We had a great afternoon and into the evening at this cooking class! We spent 2hrs to 2.5hrs cooking there was plenty of things for us all to do and experience. Then we sat and ate the meal which tasted amazing! The spice level was tailored to the groups liking. It was also the birthday of one of the young girls there and a special cake had been made which tasted delicious! I would highly recommend booking a cooking class here.,"August 22, 2018",0.0,0.0
https://www.tripadvisor.com/Attraction_Review-g616035-d15275195-Reviews-Honey_Bee_Garden-Ella_Uva_Province.html,Honey Bee Garden,5.0,500,https://dynamic-media-cdn.tripadvisor.com/media/photo-o/2c/d3/57/13/caption.jpg?w=700&h=400&s=1,Vicki A,"Bolton, UK",,5,Missing,visited here as a family and had the most enjoyable cooking experience. Fabulous food - learned loads - and am now looking forward to trying the recipes at home. thank you for a great afternoon,"August 17, 2018",0.0,0.0
https://www.tripadvisor.com/Attraction_Review-g616035-d15275195-Reviews-Honey_Bee_Garden-Ella_Uva_Province.html,Honey Bee Garden,5.0,500,https://dynamic-media-cdn.tripadvisor.com/media/photo-o/2c/d3/57/13/caption.jpg?w=700&h=400&s=1,meliacholy,"Singapore, Singapore",,5,Missing,"Being a foodie, I was really excited to be attending a cooking class in Ella. We chose Honey Bee due to the many amazing reviews and we were not disappointed. The entire experience was authentic, fun and we also learned how to prepare real authentic Sri Lankan dishes. When we arrived, we were led into Ruwini’s home kitchen where she had prepared and laid out all the ingredients for our cook. She took the time to explain the ingredients and got us involved with helping to prepare and cook various curries. Since we loved our spices, we told her not to hold back on the chilli and spices! In about an hour and a half, we had prepared a a few curries, veggies, coconut roti and our favourite coconut sambal. We sat down to enjoy the feast afterwards and it was the best meal we had in Sri Lanka. I would highly recommend this experience as a really nice break from all the trekking from Little Adam’s peak and Ella rock!","August 11, 2018",0.0,0.0
https://www.tripadvisor.com/Attraction_Review-g616035-d15275195-Reviews-Honey_Bee_Garden-Ella_Uva_Province.html,Honey Bee Garden,5.0,500,https://dynamic-media-cdn.tripadvisor.com/media/photo-o/2c/d3/57/13/caption.jpg?w=700&h=400&s=1,Lauren F,1 contribution,,5,Missing,"After eating all the incredible food Sri Lanka has to offer, myself and my boyfriend wanted to try and learn how some of these meals were made! We were recommended to see Ruwini at Honey Bee, by another local café in Ella - Café C (also amazing food). I'm so pleased that we did we were greeted by her & her family in her beautiful garden guesthouse. With her warm smile we were instantly at ease. How lucky were we that she prepared a cooking class for just us 2. She got us involved in everything opening and milking a coconut, preparing each dish and explaining all the different herbs, spices and techniques she has grown to love! It was as real as any traveller could want in her well loved kitchen, you felt like you were really living ""a day in the life"". After a few hours we got to eat the feast and it was INSANE. I really enjoyed being in the moment and not having to keep up with writing notes as she offers to sends you all of her notes and reciepes after the class via email (for free), Thank you so much Ruwini after 2 years travelling we are back in England and looking forward to cooking up some of your dishes!! By far one of the most memorable experiences of Sri Lanka & our travels :)","August 10, 2018",0.0,0.0
https://www.tripadvisor.com/Attraction_Review-g616035-d15275195-Reviews-Honey_Bee_Garden-Ella_Uva_Province.html,Honey Bee Garden,5.0,500,https://dynamic-media-cdn.tripadvisor.com/media/photo-o/2c/d3/57/13/caption.jpg?w=700&h=400&s=1,Rocio M,26 contributions,,5,Missing,"We tried to go to this place but it's not a restaurant, they only offer cooking classes where you can later enjoy the meal you prepared.","August 3, 2018",0.0,0.0
https://www.tripadvisor.com/Attraction_Review-g616035-d15275195-Reviews-Honey_Bee_Garden-Ella_Uva_Province.html,Honey Bee Garden,5.0,500,https://dynamic-media-cdn.tripadvisor.com/media/photo-o/2c/d3/57/13/caption.jpg?w=700&h=400&s=1,Camilla O,5 contributions,,5,Missing,"We wanted to do a cookingclass in Ella and was recommend to visit Ruwini. She is very kind and gets every one involved, and allowed us to taste and add chili as we liked (we are not used to spicy food) This was the bedst Sri Lankan food we had in Sri Lanka and eating in the garden was lovely as well. This is the place to go if you want to learn how to cook real Sri Lankan food at home","July 27, 2018",0.0,0.0
https://www.tripadvisor.com/Attraction_Review-g616035-d15275195-Reviews-Honey_Bee_Garden-Ella_Uva_Province.html,Honey Bee Garden,5.0,500,https://dynamic-media-cdn.tripadvisor.com/media/photo-o/2c/d3/57/13/caption.jpg?w=700&h=400&s=1,Catherine,"Singapore, Singapore",,5,Missing,"Thoroughly enjoyed the cooking class last night with Ruwini- she is such a clear and engaging instructor. Hard to believe the banquet that was created in 90 minutes. For 2000 per person, you get to assist with creating the dishes to be shared (rice, around 4-6 curries and salads, pappadams), a copy of the recipes emailed  to you, and a chance to meet fellow travellers. Some of the best curries I’ve also tasted here in Sri Lanka so you are learning from the best!","July 23, 2018",0.0,0.0
https://www.tripadvisor.com/Attraction_Review-g616035-d15275195-Reviews-Honey_Bee_Garden-Ella_Uva_Province.html,Honey Bee Garden,5.0,500,https://dynamic-media-cdn.tripadvisor.com/media/photo-o/2c/d3/57/13/caption.jpg?w=700&h=400&s=1,Herman H,"Harstad, Norway",,5,Missing,"Very good cooking class and excelent host. Ruwini were able to squeez in a cooking class for us right before a huge festival which they were going to make food for. During the cooking class she explained every step very good it was informative, fun and the food was very good (not because of us). We will definitely make this food for our friends when we get back home. This is a must visit when in Ella.","July 11, 2018",0.0,0.0
https://www.tripadvisor.com/Attraction_Review-g616035-d15275195-Reviews-Honey_Bee_Garden-Ella_Uva_Province.html,Honey Bee Garden,5.0,500,https://dynamic-media-cdn.tripadvisor.com/media/photo-o/2c/d3/57/13/caption.jpg?w=700&h=400&s=1,Thies W,"Wiesbaden, Germany",,5,Missing,We attend this evening on a cooking lesson. We learned how to cook the traditional curries and dishes which were served during our Sri Lanka Trip. The explanation and the way how to proceed was remarkable. Absolutely remmonandable!,"July 8, 2018",0.0,0.0
https://www.tripadvisor.com/Attraction_Review-g616035-d15275195-Reviews-Honey_Bee_Garden-Ella_Uva_Province.html,Honey Bee Garden,5.0,500,https://dynamic-media-cdn.tripadvisor.com/media/photo-o/2c/d3/57/13/caption.jpg?w=700&h=400&s=1,sgilj,"Stavanger, Norway",,5,Missing,"If you enjoy SriLankan food, and want an introduction in making rice and different curries: Yes then this is a MUST DO. You are welcomed into an traditional SriLankan kitchen, nothing fancy but good old craftmanship with food. You both watch and participate in making some rice and different curries in SriLankan traditional style. The session is about 1,5 hours, and ends with eating the food. The time at honeybee garden just flew away. Highly enjoyable. She even mails you the recipes afterwards. The place is located just outside Ella downtown, a 200 LNK tuk-tuk ride away. If you stay at The One Ella (recommended highly for accomodation, fantastic location, food and host) - Honey Bee Garden is just one minute walk across the road :-) Thanks a lot !","July 6, 2018",0.0,0.0
https://www.tripadvisor.com/Attraction_Review-g616035-d15275195-Reviews-Honey_Bee_Garden-Ella_Uva_Province.html,Honey Bee Garden,5.0,500,https://dynamic-media-cdn.tripadvisor.com/media/photo-o/2c/d3/57/13/caption.jpg?w=700&h=400&s=1,Martyne A,15 contributions,,5,Missing,"Would recommend a cooking class with Ruwani without hesitation! We cooking a buffet of things and we’re able to get hands on and be part of it. Ruwani made sure we made things where we could easily get the ingredients at home. We got to eat the food we made and it was delicious, will definitely be giving it a crack when I get home!","July 6, 2018",0.0,0.0
