Destination URL,Destination Title,Destination Score,Total Reviews (Destination),Destination Image,Reviewer Name,Reviewer Location,Review Title,Review Score,Reviewer Category,Review Text,Written Date,  %,% %
https://www.tripadvisor.com/Attraction_Review-g304138-d4896053-Reviews-Kandy_City_Center-Kandy_Kandy_District_Central_Province.html,Kandy City Center,4.0,295,https://dynamic-media-cdn.tripadvisor.com/media/photo-o/28/bb/db/a2/caption.jpg?w=200&h=200&s=1&cx=1920&cy=1080&chk=v1_a521032f34575745171a,Charith B,"Colombo, Sri Lanka",,5,Couples,"The shopping complex has many branded showrooms and luxury items such as gifts , wrist watches. And the restaurant is bit crowded and a complex ordering process. But the food is pretty good in all 5 restaurants ( Chinese, Indian, Italian, Dessert & Beverages)","June 28, 2017",0.0,0.0
https://www.tripadvisor.com/Attraction_Review-g304138-d4896053-Reviews-Kandy_City_Center-Kandy_Kandy_District_Central_Province.html,Kandy City Center,4.0,295,https://dynamic-media-cdn.tripadvisor.com/media/photo-o/28/bb/db/a2/caption.jpg?w=200&h=200&s=1&cx=1920&cy=1080&chk=v1_a521032f34575745171a,Star1310,"Brisbane, Australia",,5,Friends,"Kandy City Center is quite modern and clean for window shopping or to find something of interest. Branded items are not as cheap as back home. There is a grocery shop where one can pick snacks etc at a reasonable price. There is a cafe and a food station court where one can enjoy a variety of choices. The concept is quite interesting where one is given card to enter the food area. One choose whatever to have and it's loaded onto the card which gets paid prior to existing. Friday, Saturday and Sunday they have live entertainment as you dine. It is a nice get away from the hustle & bustles of the streets around.","June 7, 2017",0.0,0.0
https://www.tripadvisor.com/Attraction_Review-g304138-d4896053-Reviews-Kandy_City_Center-Kandy_Kandy_District_Central_Province.html,Kandy City Center,4.0,295,https://dynamic-media-cdn.tripadvisor.com/media/photo-o/28/bb/db/a2/caption.jpg?w=200&h=200&s=1&cx=1920&cy=1080&chk=v1_a521032f34575745171a,Shanaka M,"Nugegoda, Sri Lanka",,3,Friends,Super duper place to get away from the rush. All good shops and many banks. It's a full fledge shopping mall with great food Court and a Kiddies play area. Be very careful at this place I lost my camera in few seconds since it's always a busy busy place.,"May 22, 2017",0.0,0.0
https://www.tripadvisor.com/Attraction_Review-g304138-d4896053-Reviews-Kandy_City_Center-Kandy_Kandy_District_Central_Province.html,Kandy City Center,4.0,295,https://dynamic-media-cdn.tripadvisor.com/media/photo-o/28/bb/db/a2/caption.jpg?w=200&h=200&s=1&cx=1920&cy=1080&chk=v1_a521032f34575745171a,Gohulan,"Colombo, Sri Lanka",,5,Missing,"Kandy, Sourrended by Lake, Dalada Maligawa, Peradeniya Park and etc, but there are no any places like KCC to dine and shopping. All food centers in KCC are really good and specially they are making all favorites of food. Also it has lot of shopping centers such as Odel, NoLimit and etc.","May 18, 2017",0.0,0.0
https://www.tripadvisor.com/Attraction_Review-g304138-d4896053-Reviews-Kandy_City_Center-Kandy_Kandy_District_Central_Province.html,Kandy City Center,4.0,295,https://dynamic-media-cdn.tripadvisor.com/media/photo-o/28/bb/db/a2/caption.jpg?w=200&h=200&s=1&cx=1920&cy=1080&chk=v1_a521032f34575745171a,Lahiru Dulshan,"Colombo, Sri Lanka",,5,Friends,"excellent place with great shops with great services. you can find banks, book shops, jewellers, tech shops as well as you can go clothing in this shopping mall. there's a new food court name world spice but its too expensive but they serve various of local foods and foods from the other parts of the world.","May 9, 2017",0.0,0.0
https://www.tripadvisor.com/Attraction_Review-g304138-d4896053-Reviews-Kandy_City_Center-Kandy_Kandy_District_Central_Province.html,Kandy City Center,4.0,295,https://dynamic-media-cdn.tripadvisor.com/media/photo-o/28/bb/db/a2/caption.jpg?w=200&h=200&s=1&cx=1920&cy=1080&chk=v1_a521032f34575745171a,Prasanna,"Panadura, Sri Lanka",,3,Missing,"KCC, small shopping mall in the heart of Kandy is s famous hangout of the young and a popular shopping destination for quality clothing and other items. Clean, good and the best in Kandy and decent in Sri Lankan standard, a foreigner might wonder what this all hype about the place","May 2, 2017",0.0,0.0
https://www.tripadvisor.com/Attraction_Review-g304138-d4896053-Reviews-Kandy_City_Center-Kandy_Kandy_District_Central_Province.html,Kandy City Center,4.0,295,https://dynamic-media-cdn.tripadvisor.com/media/photo-o/28/bb/db/a2/caption.jpg?w=200&h=200&s=1&cx=1920&cy=1080&chk=v1_a521032f34575745171a,cecilratnayake,"Colombo, Sri Lanka",,4,Missing,"when you visit Kandy do not forget to visit KCC. This is one of the biggest attraction in the Main City. there are branded shops. Restaurants, toilet facilities,and enough parking facilities., The best place in the town for a comfortable shopping.","April 27, 2017",0.0,0.0
https://www.tripadvisor.com/Attraction_Review-g304138-d4896053-Reviews-Kandy_City_Center-Kandy_Kandy_District_Central_Province.html,Kandy City Center,4.0,295,https://dynamic-media-cdn.tripadvisor.com/media/photo-o/28/bb/db/a2/caption.jpg?w=200&h=200&s=1&cx=1920&cy=1080&chk=v1_a521032f34575745171a,KamranZahid,"Dhahran, Saudi Arabia",,5,Missing,"Kandy City Center is how I expect a mall to be like. It has a really good variety of shops for clothing, shoes, cosmetics, fashion accessories, electronics, toys, etc. There's an indoor amusement park for children (World Play) on the top floor with lots of entertaining options including an open air mini roller coaster that looks really exciting (unfortunately, we didn't get a chance to try it). There's also an interesting food court offering a variety of cuisines and beverages. We weren't able to check out all areas of the mall but it's definitely well-maintained and has a modern appearance. If you're in Kandy, I highly recommend coming here. It's located in a busy area. Kandy Lake is right outside and there are many shops and restaurants around.","March 8, 2017",0.0,0.0
https://www.tripadvisor.com/Attraction_Review-g304138-d4896053-Reviews-Kandy_City_Center-Kandy_Kandy_District_Central_Province.html,Kandy City Center,4.0,295,https://dynamic-media-cdn.tripadvisor.com/media/photo-o/28/bb/db/a2/caption.jpg?w=200&h=200&s=1&cx=1920&cy=1080&chk=v1_a521032f34575745171a,RSW1965,"Colombo, Sri Lanka",,3,Missing,Kandy has very few such places to chill out. Could have been very crowded if not for the day we selected for the visit. Place is well maintained and staff was very prompt and caring. Worth a visit if you are in Kandy,"February 25, 2017",0.0,0.0
https://www.tripadvisor.com/Attraction_Review-g304138-d4896053-Reviews-Kandy_City_Center-Kandy_Kandy_District_Central_Province.html,Kandy City Center,4.0,295,https://dynamic-media-cdn.tripadvisor.com/media/photo-o/28/bb/db/a2/caption.jpg?w=200&h=200&s=1&cx=1920&cy=1080&chk=v1_a521032f34575745171a,Titus D,Sri Lanka,,5,Solo,"Kandy City Centre (KCC) is located in the heart of the town at No 5, Dalada Veediya near Cargills and Devon Restaurant. The land area it covers is little over one acre. Its front building is old it is but maintained without modernizing as it is involved in the City Kandy Heritage status. The roofs are made in a unique style with high gradient area  in the middle which is the style of it in Kandy athe area since the era of the up country Kingdoms. Photography was not allowed but the Customer Relations Manger Mr Madhawa Jayasinghe and  his assistant Mr. Dharshana Bandara honored my request as the cause is for reviewing. They arrange the Duty OIC to accompany me and I thak him as well. I thank for the kind gesture of the KCC staff. It is a exciting awesome shopping complex which markets not only items/ materials (clothes/shoes/ antiques/ phones/ souvenirs) and services,  but also offers quality, delicious and awesome food of world over plus provide entertainment for kids with a mini Roller Coaster and World Play. As a result children are excited when hearing that they would visit KCC soon.  The people visiting also get fascinating experience with enjoyment and feel happy that they have spent the best time of their life. It is a must visit place for a tourist arriving to Sri Lanka. They generally visit Kandy also, which is considered as the second capital of the country. KCC is clean and bright as the staff does maintenance round the clock. The toilets are clean too and attended to, at all times but have to pay a small sum of Rs 10 meant for the privet organization maintaining it. Staff are helpful and tourists have to inquire from security guards of the location of certain shops as its display not given which is a draw back. The Direct factory Outlet of Melbourne (DFO) displays orientation of each of outlets under different floors. The food Loft is on the top (4th Floor) which was opened in August 2016. It is called as “Dinning Loft”. It has an access road from the vehicle road bordering the lake and to the left of the KCC. Therefore the customers can easily reach the place conveniently. New type of innovation is introduced where an electronic card is given to the customer which is used for ordering food. The payment is made at the departure. The delicious food, sweets, beverages etc from around the world (Italian / Thai / Chinese / Indian) could be consumed in a pleasing surrounding  while enjoying the beauty of the Kandy lake and the mountainous surrounding. The modernized food court gives  a very nice experience for the customers. The variety of food offered is great too. The atmosphere is pleasing.  The food is reasonably priced. Ice-cream parlour provides a range of different tastes of them. KCC Offers good branded goods with choices to select from and the quality of the purchased is genuine. The staff is very friendly and helpful. A playing area and small roller coaster is in operation in the evenings. The fee charge for the roller coaster is on the higher side. I would briefly mention the main  allocations in different levels. They are; Level 1 : Banks , Level 2: Electronic items/ Jewellaery / Tea; Level 3: Fashion clothes, Level 4 :Food Court / World Play , and Level 5: Family Events (Handicrafts / Book Stalls/ Exhibitions) I’m sure you would remember the visit you made to KCC for a long time in your life.","February 23, 2017",0.0,0.0
https://www.tripadvisor.com/Attraction_Review-g304138-d4896053-Reviews-Kandy_City_Center-Kandy_Kandy_District_Central_Province.html,Kandy City Center,4.0,295,https://dynamic-media-cdn.tripadvisor.com/media/photo-o/28/bb/db/a2/caption.jpg?w=200&h=200&s=1&cx=1920&cy=1080&chk=v1_a521032f34575745171a,Ijaz Mohamed,"Matale, Sri Lanka",,5,Missing,Awesome place with full entertainment for kids and nice dining experience for families. Moreover you can do your shopping too.,"February 3, 2017",0.0,0.0
https://www.tripadvisor.com/Attraction_Review-g304138-d4896053-Reviews-Kandy_City_Center-Kandy_Kandy_District_Central_Province.html,Kandy City Center,4.0,295,https://dynamic-media-cdn.tripadvisor.com/media/photo-o/28/bb/db/a2/caption.jpg?w=200&h=200&s=1&cx=1920&cy=1080&chk=v1_a521032f34575745171a,JustinBem95,6 contributions,,5,Couples,"Decent shopping complex with restaurants, supermarkets and most of all it is clean. Staff there is really helpful with directions. Really loved the experience. A must visit place in kandy.","January 22, 2017",0.0,0.0
https://www.tripadvisor.com/Attraction_Review-g304138-d4896053-Reviews-Kandy_City_Center-Kandy_Kandy_District_Central_Province.html,Kandy City Center,4.0,295,https://dynamic-media-cdn.tripadvisor.com/media/photo-o/28/bb/db/a2/caption.jpg?w=200&h=200&s=1&cx=1920&cy=1080&chk=v1_a521032f34575745171a,Amanda,"Christmas Island, Australia",,4,Couples,"We stumbled across this shopping complex which is situated off Dalada Vidya. The complex is clean and bright, has a food court with lots of tables and chairs, restaurant, cinema, supermarket, and a small roller coaster on the roof top! There are name brand shops such as Nike if you are looking for that sort of thing. The toilets are clean (small Rs 10 fee).","January 13, 2017",0.0,0.0
https://www.tripadvisor.com/Attraction_Review-g304138-d4896053-Reviews-Kandy_City_Center-Kandy_Kandy_District_Central_Province.html,Kandy City Center,4.0,295,https://dynamic-media-cdn.tripadvisor.com/media/photo-o/28/bb/db/a2/caption.jpg?w=200&h=200&s=1&cx=1920&cy=1080&chk=v1_a521032f34575745171a,Anitha_snd,1 contribution,,5,Missing,As the name suggests the building is built in the middle of the city. This is a place where you can do some decent. Shopping.,"January 9, 2017",0.0,0.0
https://www.tripadvisor.com/Attraction_Review-g304138-d4896053-Reviews-Kandy_City_Center-Kandy_Kandy_District_Central_Province.html,Kandy City Center,4.0,295,https://dynamic-media-cdn.tripadvisor.com/media/photo-o/28/bb/db/a2/caption.jpg?w=200&h=200&s=1&cx=1920&cy=1080&chk=v1_a521032f34575745171a,AnuDU,22 contributions,,5,Missing,World spice centre newly opened at Kandy city centre... Which brings you variety of food from around the world. The quality food and facilities definitely brings you the joy.,"December 30, 2016",0.0,0.0
https://www.tripadvisor.com/Attraction_Review-g304138-d4896053-Reviews-Kandy_City_Center-Kandy_Kandy_District_Central_Province.html,Kandy City Center,4.0,295,https://dynamic-media-cdn.tripadvisor.com/media/photo-o/28/bb/db/a2/caption.jpg?w=200&h=200&s=1&cx=1920&cy=1080&chk=v1_a521032f34575745171a,IsuruMa,"Colombo, Sri Lanka",,4,Missing,We have been to Kandy many a times but this was the first time we visited the KCC. We actually ended up in here accidentally after an evening walk around the Kandy lake. The ambiance in the mall was magnificent and being frank this is a far better mall than what we have at Colombo. It has more international standards as well. It has an in house roller coaster as well. There was an ice cream parlor which I was not mistaken with the name of 'Gelleto' and it was the best ice cream I have tasked from any parlor in the country. Good place to visit especially at night.,"December 27, 2016",0.0,0.0
https://www.tripadvisor.com/Attraction_Review-g304138-d4896053-Reviews-Kandy_City_Center-Kandy_Kandy_District_Central_Province.html,Kandy City Center,4.0,295,https://dynamic-media-cdn.tripadvisor.com/media/photo-o/28/bb/db/a2/caption.jpg?w=200&h=200&s=1&cx=1920&cy=1080&chk=v1_a521032f34575745171a,Johan V,"Sunshine Coast, Australia",,5,Missing,"Have been looking for a decent restaurant in Kandy and haven't really found anything too impressive so far. By mistake really, we stumbled upon the World Spice Restaurant on the top floor of Kandy City Centre KCC. It's quite a neat concept actually. Upon entering the restaurant you receive an electronic card that you then show when ordering your food and drinks. And when leaving you pay for the whole thing. There's four different cuisines - Indian, Thai, Chinese and Italian as well as sweets and beverages of course. You choose from the menu and then place you order at the respective ""restaurant"". Nice and simple and no cash needed until you leave (or card). This place opened in August 2016 and I must say it's by far he freshest restaurant (or Dining Loft as they call it) we've come across in Kandy. The ambience isn't the best of course since it's more like a food court but the food is tasty, generous and reasonably priced and the selection is outstanding. Definitely worth a visit!","December 18, 2016",0.0,0.0
https://www.tripadvisor.com/Attraction_Review-g304138-d4896053-Reviews-Kandy_City_Center-Kandy_Kandy_District_Central_Province.html,Kandy City Center,4.0,295,https://dynamic-media-cdn.tripadvisor.com/media/photo-o/28/bb/db/a2/caption.jpg?w=200&h=200&s=1&cx=1920&cy=1080&chk=v1_a521032f34575745171a,Tharaka S. Soysa,"Colombo, Sri Lanka",,5,Couples,Best place in Kandy to some shopping and eat. Food court at the top floor has great food. Must try!!!,"December 15, 2016",0.0,0.0
https://www.tripadvisor.com/Attraction_Review-g304138-d4896053-Reviews-Kandy_City_Center-Kandy_Kandy_District_Central_Province.html,Kandy City Center,4.0,295,https://dynamic-media-cdn.tripadvisor.com/media/photo-o/28/bb/db/a2/caption.jpg?w=200&h=200&s=1&cx=1920&cy=1080&chk=v1_a521032f34575745171a,Fathima I,"Leeds, United Kingdom",,4,Missing,On the top floor there is a place to dine which allows you to choose a variety of freshly cooked food for a very reasonable price We had Thai and  Italian good the service was amazing along with the chefs who you get to speak with ... There was music in the background and seem to be a hit with the locals,"December 13, 2016",0.0,0.0
https://www.tripadvisor.com/Attraction_Review-g304138-d4896053-Reviews-Kandy_City_Center-Kandy_Kandy_District_Central_Province.html,Kandy City Center,4.0,295,https://dynamic-media-cdn.tripadvisor.com/media/photo-o/28/bb/db/a2/caption.jpg?w=200&h=200&s=1&cx=1920&cy=1080&chk=v1_a521032f34575745171a,PARIZAD S,"Mumbai, India",,4,Friends,The city centre has everything to offer you. Odel & Aditi are the best stores to shop from at KCC. You get everything under one roof.,"December 10, 2016",0.0,0.0
https://www.tripadvisor.com/Attraction_Review-g304138-d4896053-Reviews-Kandy_City_Center-Kandy_Kandy_District_Central_Province.html,Kandy City Center,4.0,295,https://dynamic-media-cdn.tripadvisor.com/media/photo-o/28/bb/db/a2/caption.jpg?w=200&h=200&s=1&cx=1920&cy=1080&chk=v1_a521032f34575745171a,wabi writer,"Jeju Island, South Korea",,1,Solo,"When I read that this was the best thing that had happened to Kandy I decided to pay it a visit on my next trip Very disappointing Thus is not a mall It's a maze! Feels constricted and tacky with shiny steel and clutter everywhere There is no feeling of a deep inhalation But a series of tint cutouts, like courtyards looking down to nothing interesting but bald heads and overflowing bosoms. The food court upstairs offers basic ""Chinese, Indian, Thai, pastries"" all looking woefully sad. So I walk over to the open terrace where the restaurant offers a fairly decent buffet lunch, a good bargain for 595/- rupees. Or so I think. Beware ITS A TRAP they force you to pay for bottled water by telling you they only have tap water. So I ask "" you don't offer filtered water?"" They say "" tap only Saar"". Disgusting Pushing and peddling bottled water and fuzzy drinks by not serving plain drinking water is a legal offence Someone should hold them responsible for it and sue them! Not the warmth and hospitality one is used to expect in smiley Sri Lanka. This place tarnished the whole holiday.","December 6, 2016",0.0,0.0
https://www.tripadvisor.com/Attraction_Review-g304138-d4896053-Reviews-Kandy_City_Center-Kandy_Kandy_District_Central_Province.html,Kandy City Center,4.0,295,https://dynamic-media-cdn.tripadvisor.com/media/photo-o/28/bb/db/a2/caption.jpg?w=200&h=200&s=1&cx=1920&cy=1080&chk=v1_a521032f34575745171a,Lasith P,94 contributions,,5,Missing,"They offer a fairly wide variety of food to choose from chinese , indian , italian .There also got a italian pizza stall.coner you can see Gelateria Ice Cream stall Great variety, great taste, good quality","November 14, 2016",0.0,0.0
https://www.tripadvisor.com/Attraction_Review-g304138-d4896053-Reviews-Kandy_City_Center-Kandy_Kandy_District_Central_Province.html,Kandy City Center,4.0,295,https://dynamic-media-cdn.tripadvisor.com/media/photo-o/28/bb/db/a2/caption.jpg?w=200&h=200&s=1&cx=1920&cy=1080&chk=v1_a521032f34575745171a,RoshiP15,"Kandy, Sri Lanka",,5,Missing,"If you are a visitor to kandy or residing in kandy this is a very nice mall to visit where most of the good shops, banks, etc are located. They have recently opened a food court which is very reasonably priced with a children's playing area close by. Without walking the streets this is a convenient spot with a well representation of shops and offices that one needs.","October 16, 2016",0.0,0.0
https://www.tripadvisor.com/Attraction_Review-g304138-d4896053-Reviews-Kandy_City_Center-Kandy_Kandy_District_Central_Province.html,Kandy City Center,4.0,295,https://dynamic-media-cdn.tripadvisor.com/media/photo-o/28/bb/db/a2/caption.jpg?w=200&h=200&s=1&cx=1920&cy=1080&chk=v1_a521032f34575745171a,Elena C,Cyprus,,3,Friends,"My friends and I were ripped off in Kandy from the so-called gem and jewelry exhibition centers in Kandy where all tour operators take you as part of city center tours. Tour operators and these types of centers for gem stones, batik and silk rip off unaware tourists by charging 300-400% more than the actual price of goods. This is due to the mafia system which exists with the huge commissions imposed by the people involved..... Do your shopping in Colombo. Reputable jewelry shops in Colombo charge usd 3-5 per carat for Amethyst stones as opposed to usd 9-15 per carat charged by the Kandy mafia!! For same quality stones!! BEWARE also spice and herb gardens rip you off in Kandy as well as tea factories where they take you. Be prepared to pay up to 5 times on top of the price!!","October 12, 2016",0.0,0.0
https://www.tripadvisor.com/Attraction_Review-g304138-d4896053-Reviews-Kandy_City_Center-Kandy_Kandy_District_Central_Province.html,Kandy City Center,4.0,295,https://dynamic-media-cdn.tripadvisor.com/media/photo-o/28/bb/db/a2/caption.jpg?w=200&h=200&s=1&cx=1920&cy=1080&chk=v1_a521032f34575745171a,Athula Rubesinghe,"Colombo, Sri Lanka",,4,Couples,Don't miss this place for your meal. Very well exicuted with good foog. We had indian and the juice bar and it was good. The Italian was god too. The snack bar was a bit expensive but overall it was ok.,"September 28, 2016",0.0,0.0
https://www.tripadvisor.com/Attraction_Review-g304138-d4896053-Reviews-Kandy_City_Center-Kandy_Kandy_District_Central_Province.html,Kandy City Center,4.0,295,https://dynamic-media-cdn.tripadvisor.com/media/photo-o/28/bb/db/a2/caption.jpg?w=200&h=200&s=1&cx=1920&cy=1080&chk=v1_a521032f34575745171a,Chandana Herath,"Norwich, United Kingdom",,4,Missing,"Recently opened self service collection of Thai, Chinese, Italian and Indian food outlets on Set menus. Separate stalls for beverages and state of the art deserts. Very clean, air conditioned area with large space and panoramic view of the Kandy Lake. Delicious food. Reasonably priced. A plate of fried rice £2.5 and a juice £1.5 in average. Hope this ll help to plan your meal in Kandy.","September 27, 2016",0.0,0.0
https://www.tripadvisor.com/Attraction_Review-g304138-d4896053-Reviews-Kandy_City_Center-Kandy_Kandy_District_Central_Province.html,Kandy City Center,4.0,295,https://dynamic-media-cdn.tripadvisor.com/media/photo-o/28/bb/db/a2/caption.jpg?w=200&h=200&s=1&cx=1920&cy=1080&chk=v1_a521032f34575745171a,885Jan885,72 contributions,,5,Missing,"This is the best place in Kandy do some decent shopping. Air conditioned and decent outlets assure you good quality products. Recently they have add a food court in the roof top and that's the best thing for me in the whole complex. Lot of varieties , clean, excellent environment to dine with your family. I strongly recommend this place .","September 23, 2016",0.0,0.0
https://www.tripadvisor.com/Attraction_Review-g304138-d4896053-Reviews-Kandy_City_Center-Kandy_Kandy_District_Central_Province.html,Kandy City Center,4.0,295,https://dynamic-media-cdn.tripadvisor.com/media/photo-o/28/bb/db/a2/caption.jpg?w=200&h=200&s=1&cx=1920&cy=1080&chk=v1_a521032f34575745171a,Yameen H,132 contributions,,5,Missing,It's must visit place for FOOD.top floor of this complex restaurant call SPICE WORLD. very good place to eat food.varieties of food.reasonable prices. Clean.quick service.can recommend any one to go there. For shopping it's not the place.i think out side got more choice and reasonable prices.,"September 22, 2016",0.0,0.0
https://www.tripadvisor.com/Attraction_Review-g304138-d4896053-Reviews-Kandy_City_Center-Kandy_Kandy_District_Central_Province.html,Kandy City Center,4.0,295,https://dynamic-media-cdn.tripadvisor.com/media/photo-o/28/bb/db/a2/caption.jpg?w=200&h=200&s=1&cx=1920&cy=1080&chk=v1_a521032f34575745171a,Nagalingam K,20 contributions,,4,Missing,"It's located next to KFC,I couldn't find entrance easily, people on the street didn't guide   me correctly. Shopping mall , Food court and Children's play place is there . Have to get entrance ticket to enter the Kid's play place and have to get separate ticket for each activity/game.","September 13, 2016",0.0,0.0
https://www.tripadvisor.com/Attraction_Review-g304138-d4896053-Reviews-Kandy_City_Center-Kandy_Kandy_District_Central_Province.html,Kandy City Center,4.0,295,https://dynamic-media-cdn.tripadvisor.com/media/photo-o/28/bb/db/a2/caption.jpg?w=200&h=200&s=1&cx=1920&cy=1080&chk=v1_a521032f34575745171a,lilyj2013,"Downham Market, United Kingdom",,1,Couples,"Hugely busy, takes ages to get anywhere due to the constant traffic jams. Perhaps there are nice parts of Kandy but time did not allow us to find them. Just had enough of it and happy to move on.","September 10, 2016",0.0,0.0
