Destination URL,Destination Title,Destination Score,Total Reviews (Destination),Destination Image,Reviewer Name,Reviewer Location,Review Title,Review Score,Reviewer Category,Review Text,Written Date,  %,% %
https://www.tripadvisor.com/Attraction_Review-g304138-d4896053-Reviews-Kandy_City_Center-Kandy_Kandy_District_Central_Province.html,Kandy City Center,4.0,295,https://dynamic-media-cdn.tripadvisor.com/media/photo-o/28/bb/db/a2/caption.jpg?w=200&h=200&s=1&cx=1920&cy=1080&chk=v1_a521032f34575745171a,Peter Daniliuc,"Adelaide, Australia",,5,Couples,"Kandy is well worth setting aside a day to explore.  Apart from the Temple of the Tooth and Kandy Lake, there's lot to explore in the city.  And the best way to explore Kandy is definitely by Tuk Tuk. You not only avoid the traffic jams, but also receive the best local knowledge at a fraction of the cost of organised tours. Our Tuk Tuk driver Saman was brilliant - warm, friendly and very knowledgeable - one the best in Sri Lanka (Whats App +94 72 290 9182).  Saman took us to through the amazing meat, fish and vegetable markets in central Kandy (I think they're the best in Sri Lanka). We also explored the local shopping area, colonial buildings and stunning lookouts of Kandy city.  But the best was yet to come, Saman took us to a local restaurant where we had our best Sri Lankan meal of the trip. The black curry ckicken was amazing.  And to top it off, Saman dropped us off at Kandy station the next day and waited until we boarded, to make sure we on board and no one took our seats !  A truly memorable experience which deserves 6 stars, not 5 !","February 26, 2024",0.0,0.0
https://www.tripadvisor.com/Attraction_Review-g304138-d4896053-Reviews-Kandy_City_Center-Kandy_Kandy_District_Central_Province.html,Kandy City Center,4.0,295,https://dynamic-media-cdn.tripadvisor.com/media/photo-o/28/bb/db/a2/caption.jpg?w=200&h=200&s=1&cx=1920&cy=1080&chk=v1_a521032f34575745171a,Tom S,"Glasgow, United Kingdom",,5,Couples,Visited the food court on the forth floor. The variety of food was excellent and I'm sure there is something for everyone. The premises are spotless and the staff keen and helpful. The food was exceptionally nice especially the stir fried beef dish from the Chinese section,"January 27, 2024",0.0,0.0
https://www.tripadvisor.com/Attraction_Review-g304138-d4896053-Reviews-Kandy_City_Center-Kandy_Kandy_District_Central_Province.html,Kandy City Center,4.0,295,https://dynamic-media-cdn.tripadvisor.com/media/photo-o/28/bb/db/a2/caption.jpg?w=200&h=200&s=1&cx=1920&cy=1080&chk=v1_a521032f34575745171a,Marc Ollosson,"Norfolk, United Kingdom",,3,Couples,"It's nice to have a wander around, it's cooler than outside so also provides some respite in that regard Standard fare of mall shops with a few pop up stalls Nice to have a look around but if you don't get time you won't have missed anything","January 23, 2024",0.0,0.0
https://www.tripadvisor.com/Attraction_Review-g304138-d4896053-Reviews-Kandy_City_Center-Kandy_Kandy_District_Central_Province.html,Kandy City Center,4.0,295,https://dynamic-media-cdn.tripadvisor.com/media/photo-o/28/bb/db/a2/caption.jpg?w=200&h=200&s=1&cx=1920&cy=1080&chk=v1_a521032f34575745171a,Durgadiana,"Borculo, The Netherlands",,4,Missing,"We had diner in the restaurant at the top floor of the Kandy city center. When you enter you get a card to use with your order. The atmosphere was a little boring, but the food was good! You can choose from different meals and drinks, and the system with the tickets works well. You can go here to find a taste for everyone at your party!","January 7, 2024",0.0,0.0
https://www.tripadvisor.com/Attraction_Review-g304138-d4896053-Reviews-Kandy_City_Center-Kandy_Kandy_District_Central_Province.html,Kandy City Center,4.0,295,https://dynamic-media-cdn.tripadvisor.com/media/photo-o/28/bb/db/a2/caption.jpg?w=200&h=200&s=1&cx=1920&cy=1080&chk=v1_a521032f34575745171a,Nisha A,20 contributions,,3,Friends,"Nice mall. Have to pay rs 30 to use washroom, but the wash rooms were muddy and wet and without soap","December 31, 2023",0.0,0.0
https://www.tripadvisor.com/Attraction_Review-g304138-d4896053-Reviews-Kandy_City_Center-Kandy_Kandy_District_Central_Province.html,Kandy City Center,4.0,295,https://dynamic-media-cdn.tripadvisor.com/media/photo-o/28/bb/db/a2/caption.jpg?w=200&h=200&s=1&cx=1920&cy=1080&chk=v1_a521032f34575745171a,Giacomo P,"Padua, Italy",,2,Missing,"For us Europeans who are used to very high standards, it is difficult to find this shopping center in the heart of Kandy interesting.","August 27, 2023",0.0,0.0
https://www.tripadvisor.com/Attraction_Review-g304138-d4896053-Reviews-Kandy_City_Center-Kandy_Kandy_District_Central_Province.html,Kandy City Center,4.0,295,https://dynamic-media-cdn.tripadvisor.com/media/photo-o/28/bb/db/a2/caption.jpg?w=200&h=200&s=1&cx=1920&cy=1080&chk=v1_a521032f34575745171a,Mario De Silva,"Colombo, Sri Lanka",,4,Couples,"Good place to spend some time. Classy shops and ambiance. Live music at the lobby if your lucky. Things are a bit pricy, but quality is high. Bank stalls available","May 27, 2023",0.0,0.0
https://www.tripadvisor.com/Attraction_Review-g304138-d4896053-Reviews-Kandy_City_Center-Kandy_Kandy_District_Central_Province.html,Kandy City Center,4.0,295,https://dynamic-media-cdn.tripadvisor.com/media/photo-o/28/bb/db/a2/caption.jpg?w=200&h=200&s=1&cx=1920&cy=1080&chk=v1_a521032f34575745171a,Ruwindu,36 contributions,,5,Missing,It cover most of your shopping needs with vast variety of stalls. There is a decent indoor play area for kids at reasonable prices and well trained staff. Play zones issue tickets valid for 30 mins.,"April 1, 2023",0.0,0.0
https://www.tripadvisor.com/Attraction_Review-g304138-d4896053-Reviews-Kandy_City_Center-Kandy_Kandy_District_Central_Province.html,Kandy City Center,4.0,295,https://dynamic-media-cdn.tripadvisor.com/media/photo-o/28/bb/db/a2/caption.jpg?w=200&h=200&s=1&cx=1920&cy=1080&chk=v1_a521032f34575745171a,Marco,12 contributions,,4,Couples,"Very nice place, compared to the city being simple this a very advanced place. Clean, has few shops and the cloth price is relatively good. The food court is the highlight of the place, nice food and good variety with a good seating partially overseeing Kandy lake","October 10, 2022",0.0,0.0
https://www.tripadvisor.com/Attraction_Review-g304138-d4896053-Reviews-Kandy_City_Center-Kandy_Kandy_District_Central_Province.html,Kandy City Center,4.0,295,https://dynamic-media-cdn.tripadvisor.com/media/photo-o/28/bb/db/a2/caption.jpg?w=200&h=200&s=1&cx=1920&cy=1080&chk=v1_a521032f34575745171a,N!li,"Old Peradeniya, Sri Lanka",,4,Friends,Got the chance to visit the cinema for a special screening. It was a good experience. Clean and comfortable. Good sound system too.,"September 28, 2022",0.0,0.0
https://www.tripadvisor.com/Attraction_Review-g304138-d4896053-Reviews-Kandy_City_Center-Kandy_Kandy_District_Central_Province.html,Kandy City Center,4.0,295,https://dynamic-media-cdn.tripadvisor.com/media/photo-o/28/bb/db/a2/caption.jpg?w=200&h=200&s=1&cx=1920&cy=1080&chk=v1_a521032f34575745171a,mariechumack,7 contributions,,5,Friends,If you want to have full experience in Kandy you should hire him. He showed us so many beautiful places in just one day. He has a big comfortable van for a group and a Tuk tuk for two Namal  +94 77 661 8292 WhatsApp,"December 24, 2021",0.0,0.0
https://www.tripadvisor.com/Attraction_Review-g304138-d4896053-Reviews-Kandy_City_Center-Kandy_Kandy_District_Central_Province.html,Kandy City Center,4.0,295,https://dynamic-media-cdn.tripadvisor.com/media/photo-o/28/bb/db/a2/caption.jpg?w=200&h=200&s=1&cx=1920&cy=1080&chk=v1_a521032f34575745171a,Dayan C,"Moratuwa, Sri Lanka",,4,Missing,A lot of various shops having  Sri Lankan and famous international brands. Even the food court has many varieties. It is located at heart of the city and convenient to all. Finding the parking at the car park is bit tiring.,"July 27, 2020",0.0,0.0
https://www.tripadvisor.com/Attraction_Review-g304138-d4896053-Reviews-Kandy_City_Center-Kandy_Kandy_District_Central_Province.html,Kandy City Center,4.0,295,https://dynamic-media-cdn.tripadvisor.com/media/photo-o/28/bb/db/a2/caption.jpg?w=200&h=200&s=1&cx=1920&cy=1080&chk=v1_a521032f34575745171a,Kai Wah,Malaysia,,3,Couples,"This a shopping mall located in the city centre of Kandy. There is a foodcourt concept eatery place with variety of international cuisine, but we didn’t try the food there because it is rather pricey and we wanted to have local Sri Lankan food. There is a supermarket convenient for us since we are staying nearby. Nothing much for us since we are not the shopping type of tourists.","March 15, 2020",0.0,0.0
https://www.tripadvisor.com/Attraction_Review-g304138-d4896053-Reviews-Kandy_City_Center-Kandy_Kandy_District_Central_Province.html,Kandy City Center,4.0,295,https://dynamic-media-cdn.tripadvisor.com/media/photo-o/28/bb/db/a2/caption.jpg?w=200&h=200&s=1&cx=1920&cy=1080&chk=v1_a521032f34575745171a,Hisham H,Sri Lanka,,4,Family,"They have a play area and a food court right on top, and have a few Shoping attractions at the next few floors.","March 9, 2020",0.0,0.0
https://www.tripadvisor.com/Attraction_Review-g304138-d4896053-Reviews-Kandy_City_Center-Kandy_Kandy_District_Central_Province.html,Kandy City Center,4.0,295,https://dynamic-media-cdn.tripadvisor.com/media/photo-o/28/bb/db/a2/caption.jpg?w=200&h=200&s=1&cx=1920&cy=1080&chk=v1_a521032f34575745171a,MonteBurns,"New York City, New York",,3,Couples,"Kandy doesn’t really have much to offer.  A very congested city center with lots of cars, buses, and tuk tuks vying for the same small road. This shopping mall is par for that course.  Not much on offer.  Some clothes and electronics shops. A few shops selling fragrances.  A floor with a bunch of banks.  A small supermarket in the basement.  And food on the top floor. Not an impressive mall.","January 15, 2020",0.0,0.0
https://www.tripadvisor.com/Attraction_Review-g304138-d4896053-Reviews-Kandy_City_Center-Kandy_Kandy_District_Central_Province.html,Kandy City Center,4.0,295,https://dynamic-media-cdn.tripadvisor.com/media/photo-o/28/bb/db/a2/caption.jpg?w=200&h=200&s=1&cx=1920&cy=1080&chk=v1_a521032f34575745171a,Sam Weyman,"Basingstoke, United Kingdom",,4,Couples,Word spice is a great restaurant it's a spacious area and there's tons of options you can choose from. I had a lovely grilled chicken burger which was delicious. The only complaint I have is that the patty was bit under grilled but it was still very good.,"January 10, 2020",0.0,0.0
https://www.tripadvisor.com/Attraction_Review-g304138-d4896053-Reviews-Kandy_City_Center-Kandy_Kandy_District_Central_Province.html,Kandy City Center,4.0,295,https://dynamic-media-cdn.tripadvisor.com/media/photo-o/28/bb/db/a2/caption.jpg?w=200&h=200&s=1&cx=1920&cy=1080&chk=v1_a521032f34575745171a,Rajroshan,"Thane, India",,4,Missing,"We had dinner at the World Spice food court here on our first night in Kandy. There are 5-6 different cuisines to choose from. We had a Chicken Thai fried rice, fried cuttle fish & chicken fried rice and Carbonara Chicken & Pork spaghetti from Thai, Chinese and Italian counters respectively. Everything was delicious but we found the cuttle fish to be quite chewy. For desserts we had hazelnut mousse and blueberry cheese cake from the Mexican counter which again was quite good. Other available cuisines were Indian, Sri Lankan and there was also a counter serving all kinds of beverages. Seating and ambience is also quite nice. Overall a good experience.","December 18, 2019",0.0,0.0
https://www.tripadvisor.com/Attraction_Review-g304138-d4896053-Reviews-Kandy_City_Center-Kandy_Kandy_District_Central_Province.html,Kandy City Center,4.0,295,https://dynamic-media-cdn.tripadvisor.com/media/photo-o/28/bb/db/a2/caption.jpg?w=200&h=200&s=1&cx=1920&cy=1080&chk=v1_a521032f34575745171a,BlackforestGirlLondon,"Appenweier, Germany",,4,Couples,"My husband and I visited the food court twice during our stay in Kandy. You get a choice of Chinese,  Indian,  Thai, Sri Lankan and Italian food. The food is freshly made infront of you. We had spring rolls, chicken in honey glace  with rice and tandoori  paneer with naan . We also tried the butter chicken combo meal. All the food we had was delicious and the staff was throughout friendly and helpful We can highly recommend to visit the KCC food court, you also get free wifi  if you need a break and the seats are comfy to chill in with a view over the lake .","October 18, 2019",0.0,0.0
https://www.tripadvisor.com/Attraction_Review-g304138-d4896053-Reviews-Kandy_City_Center-Kandy_Kandy_District_Central_Province.html,Kandy City Center,4.0,295,https://dynamic-media-cdn.tripadvisor.com/media/photo-o/28/bb/db/a2/caption.jpg?w=200&h=200&s=1&cx=1920&cy=1080&chk=v1_a521032f34575745171a,Chanaka Lakmal,"Veyangoda, Sri Lanka",,5,Missing,"Hi, Its the real shopping complex included all thing and very close to the main temple . Also relaxing time spending walk can there.","September 20, 2019",0.0,0.0
https://www.tripadvisor.com/Attraction_Review-g304138-d4896053-Reviews-Kandy_City_Center-Kandy_Kandy_District_Central_Province.html,Kandy City Center,4.0,295,https://dynamic-media-cdn.tripadvisor.com/media/photo-o/28/bb/db/a2/caption.jpg?w=200&h=200&s=1&cx=1920&cy=1080&chk=v1_a521032f34575745171a,K Handun,"Dubai, United Arab Emirates",,4,Missing,"Nice place to visit. The modern food court is out of this world. We had Italian, Thai and Sri lankan food. Cooked in an open kitchen. Food wast tasty and well presented.","September 10, 2019",0.0,0.0
https://www.tripadvisor.com/Attraction_Review-g304138-d4896053-Reviews-Kandy_City_Center-Kandy_Kandy_District_Central_Province.html,Kandy City Center,4.0,295,https://dynamic-media-cdn.tripadvisor.com/media/photo-o/28/bb/db/a2/caption.jpg?w=200&h=200&s=1&cx=1920&cy=1080&chk=v1_a521032f34575745171a,Channagn,"Colombo, Sri Lanka",,4,Missing,Had lunch with my family. Lots of choices and the food tasted very good. The place was very clean and well maintained. The cutlery was also very clean and overall service is efficient.,"September 4, 2019",0.0,0.0
https://www.tripadvisor.com/Attraction_Review-g304138-d4896053-Reviews-Kandy_City_Center-Kandy_Kandy_District_Central_Province.html,Kandy City Center,4.0,295,https://dynamic-media-cdn.tripadvisor.com/media/photo-o/28/bb/db/a2/caption.jpg?w=200&h=200&s=1&cx=1920&cy=1080&chk=v1_a521032f34575745171a,Fawmy,1 contribution,,4,Missing,"We got nice and good hospitality service from the 4th floor restaurant @KCC, specially Mr.Lanthra (Restaurant F&B Manager) and the food was delicious - keep up the good work, Thank you very much to make our lunch time happy on 16/08/2019","August 18, 2019",0.0,0.0
https://www.tripadvisor.com/Attraction_Review-g304138-d4896053-Reviews-Kandy_City_Center-Kandy_Kandy_District_Central_Province.html,Kandy City Center,4.0,295,https://dynamic-media-cdn.tripadvisor.com/media/photo-o/28/bb/db/a2/caption.jpg?w=200&h=200&s=1&cx=1920&cy=1080&chk=v1_a521032f34575745171a,ADG,"Kolkata (Calcutta), India",,4,Couples,It is a nice shopping mall in Kandy. You get brand shops and food court. Air conditioned and clean. We enjoyed roaming around for some time there.,"August 16, 2019",0.0,0.0
https://www.tripadvisor.com/Attraction_Review-g304138-d4896053-Reviews-Kandy_City_Center-Kandy_Kandy_District_Central_Province.html,Kandy City Center,4.0,295,https://dynamic-media-cdn.tripadvisor.com/media/photo-o/28/bb/db/a2/caption.jpg?w=200&h=200&s=1&cx=1920&cy=1080&chk=v1_a521032f34575745171a,Mathew A,1 contribution,,5,Couples,"KCC is a amazing place for shopping and for dining with different varieties of food.we were guided by Mr.Lantra who was there and he was explaining everything about food and restaurants at KCC. I would highly recommend this place , superb service and excellent experience","August 7, 2019",0.0,0.0
https://www.tripadvisor.com/Attraction_Review-g304138-d4896053-Reviews-Kandy_City_Center-Kandy_Kandy_District_Central_Province.html,Kandy City Center,4.0,295,https://dynamic-media-cdn.tripadvisor.com/media/photo-o/28/bb/db/a2/caption.jpg?w=200&h=200&s=1&cx=1920&cy=1080&chk=v1_a521032f34575745171a,Sunniva M B,7 contributions,,1,Couples,"I had read many reviews explaining what a great city Kandy was, and how beautiful it was there - I don’t know what you were talking about. I’ve been to many Asian cities, and Kandy was by far the ugliest city. First it is a quite big, busy and noicy city. We got here by the train from Ella, and our hotel was in walking distance from the train station. The streets had garbage all over, and the city smelled bad. Also there was only bad quality shops there. No unique market items - just the same old elephant baggy trousers in every shop. So not much shopping here. Both Ella and Arugam Bay had much better shopping alternatives. We actually even got scammed by a person we Met in the street. He came over very enthusiastic saying Hello, and asking if we recognized him. He worked at our hotel but of course we didn’t recognize him without his uniform. Every other city in sri Lanka the people has been so friendly, that we didn’t think much about it. He asked if we wanted him to show us around, and we said sure. Suddenly we were in the market shop of his brother asking us to buy some Things to help his brothers shop going around. Felt obligated to buy an overpriced scarf. We also walked to the lake. To be honest it wasn’t that special - just an ordinary lake. Quite filthy and the rails were covered in plastic full of bird poop. Actually I would just recommend you to skip Kandy! There are so many beautiful cities in Sri Lanka that are better to see.","July 17, 2019",0.0,0.0
https://www.tripadvisor.com/Attraction_Review-g304138-d4896053-Reviews-Kandy_City_Center-Kandy_Kandy_District_Central_Province.html,Kandy City Center,4.0,295,https://dynamic-media-cdn.tripadvisor.com/media/photo-o/28/bb/db/a2/caption.jpg?w=200&h=200&s=1&cx=1920&cy=1080&chk=v1_a521032f34575745171a,Lak_Sur,"Colombo, Sri Lanka",,5,Friends,"Whenever we visit Kandy, we always like to visit KCC for shopping. It has everything form clothes, food to banks.","July 8, 2019",0.0,0.0
https://www.tripadvisor.com/Attraction_Review-g304138-d4896053-Reviews-Kandy_City_Center-Kandy_Kandy_District_Central_Province.html,Kandy City Center,4.0,295,https://dynamic-media-cdn.tripadvisor.com/media/photo-o/28/bb/db/a2/caption.jpg?w=200&h=200&s=1&cx=1920&cy=1080&chk=v1_a521032f34575745171a,Dananjaya,"Matale, Sri Lanka",,5,Couples,"Shopping complex was amazing, modern design and cleanliness was excellent. They are maintaining the property well. Security system was helpful for all customers.thank you for your great hospitality","July 5, 2019",0.0,0.0
https://www.tripadvisor.com/Attraction_Review-g304138-d4896053-Reviews-Kandy_City_Center-Kandy_Kandy_District_Central_Province.html,Kandy City Center,4.0,295,https://dynamic-media-cdn.tripadvisor.com/media/photo-o/28/bb/db/a2/caption.jpg?w=200&h=200&s=1&cx=1920&cy=1080&chk=v1_a521032f34575745171a,Kevin,"Colombo, Sri Lanka",,1,Couples,Categorize people by their wardrobes and poor customer service. Workers don’t bother for anything other than scanning you top to bottom. Food court is a utter mess. Never seen such an complicated food court anywhere in the world. WORST PLACE EVER,"July 3, 2019",0.0,0.0
https://www.tripadvisor.com/Attraction_Review-g304138-d4896053-Reviews-Kandy_City_Center-Kandy_Kandy_District_Central_Province.html,Kandy City Center,4.0,295,https://dynamic-media-cdn.tripadvisor.com/media/photo-o/28/bb/db/a2/caption.jpg?w=200&h=200&s=1&cx=1920&cy=1080&chk=v1_a521032f34575745171a,Saj,"Riyadh, Saudi Arabia",,3,Friends,wish there were coffee shops ... I hope there will be in the future. I enjoyed the cultural interior designs and the people were friendly too.,"June 17, 2019",0.0,0.0
https://www.tripadvisor.com/Attraction_Review-g304138-d4896053-Reviews-Kandy_City_Center-Kandy_Kandy_District_Central_Province.html,Kandy City Center,4.0,295,https://dynamic-media-cdn.tripadvisor.com/media/photo-o/28/bb/db/a2/caption.jpg?w=200&h=200&s=1&cx=1920&cy=1080&chk=v1_a521032f34575745171a,Darshana Ratnayake,"Amman, Jordan",,5,Friends,"This is in the hear of kandy city. Just walking distance from temple of tooth. There are many shops is 5 foors. Down foor is a bank street, you can find branches of every bank in sri lanka. All the major brands shops aee in other 3 floors. Top foor is food stalls and small  rollercoster. 4th foor good for children as it has many games to enjoy.","June 9, 2019",0.0,0.0
https://www.tripadvisor.com/Attraction_Review-g304138-d4896053-Reviews-Kandy_City_Center-Kandy_Kandy_District_Central_Province.html,Kandy City Center,4.0,295,https://dynamic-media-cdn.tripadvisor.com/media/photo-o/28/bb/db/a2/caption.jpg?w=200&h=200&s=1&cx=1920&cy=1080&chk=v1_a521032f34575745171a,Nayomini W,"Colombo, Sri Lanka",,4,Missing,Great food and a great choice. Kandy's only shopping mall with many choices to select from. Enjoyed spending time there.,"April 17, 2019",0.0,0.0
https://www.tripadvisor.com/Attraction_Review-g304138-d4896053-Reviews-Kandy_City_Center-Kandy_Kandy_District_Central_Province.html,Kandy City Center,4.0,295,https://dynamic-media-cdn.tripadvisor.com/media/photo-o/28/bb/db/a2/caption.jpg?w=200&h=200&s=1&cx=1920&cy=1080&chk=v1_a521032f34575745171a,Fahad Sawad AlShehhi,"Dibba Al Bay Ah, Oman",,3,Friends,It’s a quit good Centre. But I was wishing it’s bigger. They have plenty of shops. Very good variety food court. But there’s no coffee shops.,"April 14, 2019",0.0,0.0
https://www.tripadvisor.com/Attraction_Review-g304138-d4896053-Reviews-Kandy_City_Center-Kandy_Kandy_District_Central_Province.html,Kandy City Center,4.0,295,https://dynamic-media-cdn.tripadvisor.com/media/photo-o/28/bb/db/a2/caption.jpg?w=200&h=200&s=1&cx=1920&cy=1080&chk=v1_a521032f34575745171a,samithasiriwardana,"Colombo, Sri Lanka",,5,Missing,"one of the best shopping experience you could ever get at kandian kingdon of srilanka there are numerious shops ranging from clothing accessories,electric items , supermarkets book shops and many more. large parking area is also available a play area for kids with multiple gaming options . and finally the food court,,,its huge and you can find italian ,indian chinese thai and srilanka foods there and many more all together a good experience if you happen to visit kandy srilanka","April 12, 2019",0.0,0.0
https://www.tripadvisor.com/Attraction_Review-g304138-d4896053-Reviews-Kandy_City_Center-Kandy_Kandy_District_Central_Province.html,Kandy City Center,4.0,295,https://dynamic-media-cdn.tripadvisor.com/media/photo-o/28/bb/db/a2/caption.jpg?w=200&h=200&s=1&cx=1920&cy=1080&chk=v1_a521032f34575745171a,Mrs Ahsan,63 contributions,,4,Missing,A nice shopping place. You can go here if you are a Baskin Robins icecream fan. Oh well I am! There is one supermarket too. Some clothes stores with Sri Lankan specific clothes can be found too.,"April 1, 2019",0.0,0.0
https://www.tripadvisor.com/Attraction_Review-g304138-d4896053-Reviews-Kandy_City_Center-Kandy_Kandy_District_Central_Province.html,Kandy City Center,4.0,295,https://dynamic-media-cdn.tripadvisor.com/media/photo-o/28/bb/db/a2/caption.jpg?w=200&h=200&s=1&cx=1920&cy=1080&chk=v1_a521032f34575745171a,raj20002015,"Pune, India",,4,Friends,Good and nice place for shopping.  Located near Kandy lake it has big showrooms. Food Court on top floor is good having tasty cuisine from 5 regions.,"February 27, 2019",0.0,0.0
https://www.tripadvisor.com/Attraction_Review-g304138-d4896053-Reviews-Kandy_City_Center-Kandy_Kandy_District_Central_Province.html,Kandy City Center,4.0,295,https://dynamic-media-cdn.tripadvisor.com/media/photo-o/28/bb/db/a2/caption.jpg?w=200&h=200&s=1&cx=1920&cy=1080&chk=v1_a521032f34575745171a,Dilani Fonseka,3 contributions,,4,Friends,It was one of the best hangout places Ive been to.There were various choices of food and spices and it was very impressive..The day we visited was a bit crowded thou.overall it was a good recommendation to shop.,"February 11, 2019",0.0,0.0
https://www.tripadvisor.com/Attraction_Review-g304138-d4896053-Reviews-Kandy_City_Center-Kandy_Kandy_District_Central_Province.html,Kandy City Center,4.0,295,https://dynamic-media-cdn.tripadvisor.com/media/photo-o/28/bb/db/a2/caption.jpg?w=200&h=200&s=1&cx=1920&cy=1080&chk=v1_a521032f34575745171a,My Tropical Journal,"Colombo, Sri Lanka",,5,Couples,"Well maintained handy shopping mall located in the heart of the city centre.  Location has a reasonable collection of local/ global fashion brands, cosmetics, snacks, coffee shops, banks and ATMs . Ground floor has a supermarket with groceries needed for daily use. Upper floor food court ""Worldspice"" is a different experience fills the taste buds. A cozy attraction for all travelers.","February 2, 2019",0.0,0.0
https://www.tripadvisor.com/Attraction_Review-g304138-d4896053-Reviews-Kandy_City_Center-Kandy_Kandy_District_Central_Province.html,Kandy City Center,4.0,295,https://dynamic-media-cdn.tripadvisor.com/media/photo-o/28/bb/db/a2/caption.jpg?w=200&h=200&s=1&cx=1920&cy=1080&chk=v1_a521032f34575745171a,David Neil,"Haworth, United Kingdom",,5,Couples,A rarity in this part of the world - an indoor  air - conditioned  shopping centre. With plenty of international  standard shops to look at with good prices. Plus a proper food court with something for all tastes. Plenty of car parking next door. Well worth a visit,"January 23, 2019",0.0,0.0
