Destination URL,Destination Title,Destination Score,Total Reviews (Destination),Destination Image,Reviewer Name,Reviewer Location,Review Title,Review Score,Reviewer Category,Review Text,Written Date,  %,% %
https://www.tripadvisor.com/Attraction_Review-g304138-d4896053-Reviews-Kandy_City_Center-Kandy_Kandy_District_Central_Province.html,Kandy City Center,4.0,295,https://dynamic-media-cdn.tripadvisor.com/media/photo-o/28/bb/db/a2/caption.jpg?w=200&h=200&s=1&cx=1920&cy=1080&chk=v1_a521032f34575745171a,Kasun,Sri Lanka,,5,Missing,Quality mall with many good shops. Price tags are bit high end but you can find branded stuffs and very conveniently located at the city center as it’s name.,"June 18, 2018",0.0,0.0
https://www.tripadvisor.com/Attraction_Review-g304138-d4896053-Reviews-Kandy_City_Center-Kandy_Kandy_District_Central_Province.html,Kandy City Center,4.0,295,https://dynamic-media-cdn.tripadvisor.com/media/photo-o/28/bb/db/a2/caption.jpg?w=200&h=200&s=1&cx=1920&cy=1080&chk=v1_a521032f34575745171a,Niels L,"Middelburg, The Netherlands",,3,Couples,If you dont like the a very crowded smoggy city dont go to the city center to much. It takes alot of time to travel with any public transportation and walking isnt that comfortable. Tip!: stay at feel home hotel! Outside if the city center and a host who helps you with everything and even gives you rides to the city. Also fantastic view from the rooms.,"June 9, 2018",0.0,0.0
https://www.tripadvisor.com/Attraction_Review-g304138-d4896053-Reviews-Kandy_City_Center-Kandy_Kandy_District_Central_Province.html,Kandy City Center,4.0,295,https://dynamic-media-cdn.tripadvisor.com/media/photo-o/28/bb/db/a2/caption.jpg?w=200&h=200&s=1&cx=1920&cy=1080&chk=v1_a521032f34575745171a,Namal,"Galle, Sri Lanka",,5,Missing,"One of the best shopping center heart of the kandy. i would say much better that Colombo shopping centers coz will be able to purchase anything that you want in one roof. i  loved ""Roof Top"" food court it has amazing view  able to enjoy with many type of food. However this is the most convenient shopping center for all the travelers who are occupied in kandy. Thank you. Namal & Rajanie","June 1, 2018",0.0,0.0
https://www.tripadvisor.com/Attraction_Review-g304138-d4896053-Reviews-Kandy_City_Center-Kandy_Kandy_District_Central_Province.html,Kandy City Center,4.0,295,https://dynamic-media-cdn.tripadvisor.com/media/photo-o/28/bb/db/a2/caption.jpg?w=200&h=200&s=1&cx=1920&cy=1080&chk=v1_a521032f34575745171a,Renuka Anne,"Moratuwa, Sri Lanka",,5,Couples,This is a really good shopping complex with an awsome food court. It's better than the shopping complexes in Colombo for sure.,"May 27, 2018",0.0,0.0
https://www.tripadvisor.com/Attraction_Review-g304138-d4896053-Reviews-Kandy_City_Center-Kandy_Kandy_District_Central_Province.html,Kandy City Center,4.0,295,https://dynamic-media-cdn.tripadvisor.com/media/photo-o/28/bb/db/a2/caption.jpg?w=200&h=200&s=1&cx=1920&cy=1080&chk=v1_a521032f34575745171a,Lahiru Dulshan,"Colombo, Sri Lanka",,5,Friends,Best shopping complex in Sri Lanka yet. Majestic city or liberty plaza aint even close to this standers. It has a Good food court and a kids playing area. And also a roller coaster.,"May 19, 2018",0.0,0.0
https://www.tripadvisor.com/Attraction_Review-g304138-d4896053-Reviews-Kandy_City_Center-Kandy_Kandy_District_Central_Province.html,Kandy City Center,4.0,295,https://dynamic-media-cdn.tripadvisor.com/media/photo-o/28/bb/db/a2/caption.jpg?w=200&h=200&s=1&cx=1920&cy=1080&chk=v1_a521032f34575745171a,ZinamonKveen,"Colombo, Sri Lanka",,3,Friends,Not much was open as it was a holiday weekend. Did note that just about everything is available here. There's a whole area dedicated to different bank branches and a range of other clothing stores. There's ample parking at an adjacent car park.,"May 11, 2018",0.0,0.0
https://www.tripadvisor.com/Attraction_Review-g304138-d4896053-Reviews-Kandy_City_Center-Kandy_Kandy_District_Central_Province.html,Kandy City Center,4.0,295,https://dynamic-media-cdn.tripadvisor.com/media/photo-o/28/bb/db/a2/caption.jpg?w=200&h=200&s=1&cx=1920&cy=1080&chk=v1_a521032f34575745171a,Kari C,"Kolbotn, Norway",,4,Couples,"Trip with Asiatours with first stop Kandy for 3 days. Touch of old english colony and a lot of cultural impressions. Our driver and guide gave us insight in tea production, woodcarwing an gem mining. Very exciting.","April 2, 2018",0.0,0.0
https://www.tripadvisor.com/Attraction_Review-g304138-d4896053-Reviews-Kandy_City_Center-Kandy_Kandy_District_Central_Province.html,Kandy City Center,4.0,295,https://dynamic-media-cdn.tripadvisor.com/media/photo-o/28/bb/db/a2/caption.jpg?w=200&h=200&s=1&cx=1920&cy=1080&chk=v1_a521032f34575745171a,Malaka T,"Colombo, Sri Lanka",,4,Missing,Kcc operates an excellent food court. Everything is organized and clean. The gelato is fantastic. Try out the avocado. The kids play area is probably the best in Sri Lanka. Overall a very well maintained mall.,"March 2, 2018",0.0,0.0
https://www.tripadvisor.com/Attraction_Review-g304138-d4896053-Reviews-Kandy_City_Center-Kandy_Kandy_District_Central_Province.html,Kandy City Center,4.0,295,https://dynamic-media-cdn.tripadvisor.com/media/photo-o/28/bb/db/a2/caption.jpg?w=200&h=200&s=1&cx=1920&cy=1080&chk=v1_a521032f34575745171a,Suraj Perera,"Kandy, Sri Lanka",,5,Couples,"Visited the Food court recently and the food was flavourful as usual. They have a very wide choice of freshly made Drinks here.The drinks were top quality. We had Mutton Biriyani, Chicken Biriyani, Mutton Curry, Dhall Curry, and Rissoto. All dishes were flavourful and served hot. The colourful freshly made Drinks were a highlight of the visit. We will surely go again. Great value for money. Clean surroundings easy parking.","February 26, 2018",0.0,0.0
https://www.tripadvisor.com/Attraction_Review-g304138-d4896053-Reviews-Kandy_City_Center-Kandy_Kandy_District_Central_Province.html,Kandy City Center,4.0,295,https://dynamic-media-cdn.tripadvisor.com/media/photo-o/28/bb/db/a2/caption.jpg?w=200&h=200&s=1&cx=1920&cy=1080&chk=v1_a521032f34575745171a,Maxbrit,"Melton Mowbray, United Kingdom",,3,Couples,"Kandy City Centre is quite small and worth a visit. Start at the centre at the Queens Hotel, the temple of the Tooth is also worth an hour of your time but no more! We stopped for a coffee at the Empire cafe which was good. The best experience is just walking the streets and trying to avoid the colourful buses. The modern shopping centre is a wast of time you can find these shops anywhere! The lake looks nice but surrounded by traffic so we didn't venture all of the way round.","February 15, 2018",0.0,0.0
https://www.tripadvisor.com/Attraction_Review-g304138-d4896053-Reviews-Kandy_City_Center-Kandy_Kandy_District_Central_Province.html,Kandy City Center,4.0,295,https://dynamic-media-cdn.tripadvisor.com/media/photo-o/28/bb/db/a2/caption.jpg?w=200&h=200&s=1&cx=1920&cy=1080&chk=v1_a521032f34575745171a,thili88,"Auckland, New Zealand",,4,Couples,"We are visiting KCC most of the time when we visit kandy. A great place to do some shopping and to have a mouth- watering meal. Food court is clean and you can enjoy a delicious meal while looking at the kandy lake. Few branded products are selling in some shops in the shopping mall. You can buy most of the things you want under one roof. If they could separate some  space for a cinema hall, that would be wonderful.","February 6, 2018",0.0,0.0
https://www.tripadvisor.com/Attraction_Review-g304138-d4896053-Reviews-Kandy_City_Center-Kandy_Kandy_District_Central_Province.html,Kandy City Center,4.0,295,https://dynamic-media-cdn.tripadvisor.com/media/photo-o/28/bb/db/a2/caption.jpg?w=200&h=200&s=1&cx=1920&cy=1080&chk=v1_a521032f34575745171a,sanda,"Kandy District, Sri Lanka",,5,Missing,"Modern shopping center in kandy.it was nice and clean 💐place with modern facilitys ..restaurants ☕️,coffee shop,kid play area shopping mall,super market etc... It is a one stop solutions for busy life.","February 4, 2018",0.0,0.0
https://www.tripadvisor.com/Attraction_Review-g304138-d4896053-Reviews-Kandy_City_Center-Kandy_Kandy_District_Central_Province.html,Kandy City Center,4.0,295,https://dynamic-media-cdn.tripadvisor.com/media/photo-o/28/bb/db/a2/caption.jpg?w=200&h=200&s=1&cx=1920&cy=1080&chk=v1_a521032f34575745171a,La FiFi tou L'Amour,"London, United Kingdom",,3,Couples,"Came to Kandy as it is heavily marketed as a tourist attraction. And although it is rather lovely, very little to do unless you're into the Buddhist attraction and/or tea plantations and botonical gardens. Having done tea plantations in the passed and taken in my fair share of botanical gardens and not really interested in Buddhism, it was all a bit of a shame. Extremely Draconian licensing hours and the restaurants are few and far between. Thank goodness for TripAdvisor for finding those out for us. If coming, I suggest a whistle stop tour... unless you're into things mentioned above.","January 28, 2018",0.0,0.0
https://www.tripadvisor.com/Attraction_Review-g304138-d4896053-Reviews-Kandy_City_Center-Kandy_Kandy_District_Central_Province.html,Kandy City Center,4.0,295,https://dynamic-media-cdn.tripadvisor.com/media/photo-o/28/bb/db/a2/caption.jpg?w=200&h=200&s=1&cx=1920&cy=1080&chk=v1_a521032f34575745171a,profjoypc,"Alnwick, United Kingdom",,5,Couples,"The Kandy City Centre is a superb shopping mall in the heart of town where you will find pretty well all your needs. There is a huge and very well stocked supermarket with adjacent wine store, two excellent bookstores and numerous clothing, phone, souvenir and technology shops. There are ATMs and toilets (which you have to pay 10 rupees to enter.) The whole place has a clean and modern feel about. it. There are also excellent restaurants within the complex. We set off for shopping and banking in town and could do everything within this Centre.","January 28, 2018",0.0,0.0
https://www.tripadvisor.com/Attraction_Review-g304138-d4896053-Reviews-Kandy_City_Center-Kandy_Kandy_District_Central_Province.html,Kandy City Center,4.0,295,https://dynamic-media-cdn.tripadvisor.com/media/photo-o/28/bb/db/a2/caption.jpg?w=200&h=200&s=1&cx=1920&cy=1080&chk=v1_a521032f34575745171a,GamW2015,"Perth, Australia",,4,Missing,"A food court at top, with an excellent token based system, wide international selection & good service. No alcoholic drinks and limited local dishes. Cheap public carpark adjacent is open all hours. Additional option of a Gelateria opposite.","January 25, 2018",0.0,0.0
https://www.tripadvisor.com/Attraction_Review-g304138-d4896053-Reviews-Kandy_City_Center-Kandy_Kandy_District_Central_Province.html,Kandy City Center,4.0,295,https://dynamic-media-cdn.tripadvisor.com/media/photo-o/28/bb/db/a2/caption.jpg?w=200&h=200&s=1&cx=1920&cy=1080&chk=v1_a521032f34575745171a,Helliebel,"Lytham St Anne's, United Kingdom",,5,Couples,"This was a great find. In the same restaurant, there’s a choice of Indian, Thai, Chinese, Italian, plus plain old fish and chips.  You can choose any starter from any station of the above cuisines and same for main and side dishes.  So you can have a totally unique meal!  Go visit.","January 24, 2018",0.0,0.0
https://www.tripadvisor.com/Attraction_Review-g304138-d4896053-Reviews-Kandy_City_Center-Kandy_Kandy_District_Central_Province.html,Kandy City Center,4.0,295,https://dynamic-media-cdn.tripadvisor.com/media/photo-o/28/bb/db/a2/caption.jpg?w=200&h=200&s=1&cx=1920&cy=1080&chk=v1_a521032f34575745171a,Dhushan,"Kandy, Sri Lanka",,4,Friends,"A shopping mall/centre is nothing special with a lot of clothes, electronic & food outlets. Compared to some others in Sri Lanka, KCC is actually not that big. However, where it stands above the rest is because of the following. Has ample parking for cheap. Has all except one of the main banks in SL & multiple ATMs to deposit or withdraw cash; with some of the banks even open on weekends including Sundays. Has a post office for letters & deliveries, but also to pay your monthly electricity & water bills. Has 2 of the leading mobile, land line, & internet service providers. Has a supermarket for grocery shopping. Has a food court. Has a kids play area. This is all on top of the multiple clothes, shoes, electronics, jewellery, & souvenir shops, plus cafes & juice bars. The only downside is that you have to pay to use the toilets & the toilets are not as clean as they could be.","January 13, 2018",0.0,0.0
https://www.tripadvisor.com/Attraction_Review-g304138-d4896053-Reviews-Kandy_City_Center-Kandy_Kandy_District_Central_Province.html,Kandy City Center,4.0,295,https://dynamic-media-cdn.tripadvisor.com/media/photo-o/28/bb/db/a2/caption.jpg?w=200&h=200&s=1&cx=1920&cy=1080&chk=v1_a521032f34575745171a,Mahinda W,"Colombo, Sri Lanka",,4,Missing,"Kandy City Centre is a must visit place on a trip to the hill capital. As the name suggests it is located in the centre with ample parking. The shops cater for all needs from clothing to household appliances, banks and a super food court with food stalls catering to international cuisine at very affordable prices. All in all an experience for a day of shopping.","January 11, 2018",0.0,0.0
https://www.tripadvisor.com/Attraction_Review-g304138-d4896053-Reviews-Kandy_City_Center-Kandy_Kandy_District_Central_Province.html,Kandy City Center,4.0,295,https://dynamic-media-cdn.tripadvisor.com/media/photo-o/28/bb/db/a2/caption.jpg?w=200&h=200&s=1&cx=1920&cy=1080&chk=v1_a521032f34575745171a,Dr Sujat Nair,"Pune, India",,4,Missing,"We visited the Kandy city center very late evening when most of the shops and shopping mall were closed. We went straight to the topmost floor which has a great food court having various cuisines. Thai, Italian, Indian, Chinese food served at great prices. Self service and payment is while checking out.","January 4, 2018",0.0,0.0
https://www.tripadvisor.com/Attraction_Review-g304138-d4896053-Reviews-Kandy_City_Center-Kandy_Kandy_District_Central_Province.html,Kandy City Center,4.0,295,https://dynamic-media-cdn.tripadvisor.com/media/photo-o/28/bb/db/a2/caption.jpg?w=200&h=200&s=1&cx=1920&cy=1080&chk=v1_a521032f34575745171a,What We Found Travelling,"Sydney, Australia",,4,Friends,One of the better shopping centres in Kandy.  Good food court with many selections of international food.  Good supermarket to pick up almost anything you’ll need.  Best of all plenty of ATM’s to choose from.,"January 3, 2018",0.0,0.0
https://www.tripadvisor.com/Attraction_Review-g304138-d4896053-Reviews-Kandy_City_Center-Kandy_Kandy_District_Central_Province.html,Kandy City Center,4.0,295,https://dynamic-media-cdn.tripadvisor.com/media/photo-o/28/bb/db/a2/caption.jpg?w=200&h=200&s=1&cx=1920&cy=1080&chk=v1_a521032f34575745171a,Karin M,"Partille, Sweden",,4,Missing,"Nice modern mall with a great food court, which had Indian, Chinese, Sri Lankan, Italian and Thai food. The shops were surprisingly good. A couple of sport shops, menswear, womens wear, etc. Money changer on one of the lower floors, and a Mobitel shop where you can get or fill up local simcard for your phone and ipad.","January 2, 2018",0.0,0.0
https://www.tripadvisor.com/Attraction_Review-g304138-d4896053-Reviews-Kandy_City_Center-Kandy_Kandy_District_Central_Province.html,Kandy City Center,4.0,295,https://dynamic-media-cdn.tripadvisor.com/media/photo-o/28/bb/db/a2/caption.jpg?w=200&h=200&s=1&cx=1920&cy=1080&chk=v1_a521032f34575745171a,pops_kay,"Bengaluru, India",,2,Missing,"This is a mall with basic amenities, except for the number of banks and ATMs that helps international travelers with FOREX. The ODEL store at Kandy City Center, was rather disappointing as opposed to what I was told.","December 26, 2017",0.0,0.0
https://www.tripadvisor.com/Attraction_Review-g304138-d4896053-Reviews-Kandy_City_Center-Kandy_Kandy_District_Central_Province.html,Kandy City Center,4.0,295,https://dynamic-media-cdn.tripadvisor.com/media/photo-o/28/bb/db/a2/caption.jpg?w=200&h=200&s=1&cx=1920&cy=1080&chk=v1_a521032f34575745171a,Yohan P,"Negombo, Sri Lanka",,4,Couples,"The directions are explained in the name it self. In the heart of Kandy, kcc gives a nice mall like experience. The shops are alittle pricey. Everything under one roof supermarkets, ATMs a food court and outlet shopping. The food court Has a burger king, gelato places an automated card food court serving  Italian Chinese Thai and Indian food. Although it's not an attraction, if you have a couple hours to kill it's highly recommended. Will go again.","December 9, 2017",0.0,0.0
https://www.tripadvisor.com/Attraction_Review-g304138-d4896053-Reviews-Kandy_City_Center-Kandy_Kandy_District_Central_Province.html,Kandy City Center,4.0,295,https://dynamic-media-cdn.tripadvisor.com/media/photo-o/28/bb/db/a2/caption.jpg?w=200&h=200&s=1&cx=1920&cy=1080&chk=v1_a521032f34575745171a,Chitha P,"Ruapehu, New Zealand",,3,Missing,Such fabulous shopping center with a modern high tech food court KCC must visit in Kandy City. Have to give minus10 for the filthy smelly toilets in the ground floor this applies to both gents had to pay Rs10 (small amount) each to walk in to the toilet which is overflowing with water in the men's floor near the urinal covered in urine. When we approached the lady who collected money her reason for the condition was the cleaners has gone for lunch by the look of the conditions in the toilets it seems cleaners been taking a two day lunch brake. We weren't the only one complaining but they kept on issuing tickets for people to go in. We mange to talk to a powers to be a supervisor his poor excuse was that morning new contactors taken over the job and they are not up to standard because lack of training but no apology.,"November 8, 2017",0.0,0.0
https://www.tripadvisor.com/Attraction_Review-g304138-d4896053-Reviews-Kandy_City_Center-Kandy_Kandy_District_Central_Province.html,Kandy City Center,4.0,295,https://dynamic-media-cdn.tripadvisor.com/media/photo-o/28/bb/db/a2/caption.jpg?w=200&h=200&s=1&cx=1920&cy=1080&chk=v1_a521032f34575745171a,Rashinend,31 contributions,,4,Couples,It has a very good food court on roof top! Don't miss the Italian dishes there. I highly recommend the food court!,"November 6, 2017",0.0,0.0
https://www.tripadvisor.com/Attraction_Review-g304138-d4896053-Reviews-Kandy_City_Center-Kandy_Kandy_District_Central_Province.html,Kandy City Center,4.0,295,https://dynamic-media-cdn.tripadvisor.com/media/photo-o/28/bb/db/a2/caption.jpg?w=200&h=200&s=1&cx=1920&cy=1080&chk=v1_a521032f34575745171a,Venuja,"Dubbo, Australia",,5,Missing,Really love this place. The food court was superb!. There is a small roller coaster in the building as well.,"October 19, 2017",0.0,0.0
https://www.tripadvisor.com/Attraction_Review-g304138-d4896053-Reviews-Kandy_City_Center-Kandy_Kandy_District_Central_Province.html,Kandy City Center,4.0,295,https://dynamic-media-cdn.tripadvisor.com/media/photo-o/28/bb/db/a2/caption.jpg?w=200&h=200&s=1&cx=1920&cy=1080&chk=v1_a521032f34575745171a,Punch-77,"Dammartin-en-Goele, France",,3,Solo,"In the shopping mall of Kandy,modern eatery. Different kitchens offering a choice of dishes. Special dessert counter and a bar (no alcoholic drinks).","September 23, 2017",0.0,0.0
https://www.tripadvisor.com/Attraction_Review-g304138-d4896053-Reviews-Kandy_City_Center-Kandy_Kandy_District_Central_Province.html,Kandy City Center,4.0,295,https://dynamic-media-cdn.tripadvisor.com/media/photo-o/28/bb/db/a2/caption.jpg?w=200&h=200&s=1&cx=1920&cy=1080&chk=v1_a521032f34575745171a,sharifa_mohamed,"Al Muharraq, Bahrain",,5,Couples,"I enjoyed my time at the kandy city center since it was really 5to 7 min away from my hotel in which it was far the best place I had lunch it was excellent in taste, money and location . The view up from the restaurant is really pretty and nice you all will enjoy a romantic rain view will having your lunch.","September 10, 2017",0.0,0.0
https://www.tripadvisor.com/Attraction_Review-g304138-d4896053-Reviews-Kandy_City_Center-Kandy_Kandy_District_Central_Province.html,Kandy City Center,4.0,295,https://dynamic-media-cdn.tripadvisor.com/media/photo-o/28/bb/db/a2/caption.jpg?w=200&h=200&s=1&cx=1920&cy=1080&chk=v1_a521032f34575745171a,maninasuitcase1905,Asia,,4,Couples,A good combination for a trip especially if raining - a nice selection of shops to browse and at fair prices. The highlight for me was the food I like local spicy food which is almost impossible to find in the hotels and at a fraction of the prices.,"September 5, 2017",0.0,0.0
https://www.tripadvisor.com/Attraction_Review-g304138-d4896053-Reviews-Kandy_City_Center-Kandy_Kandy_District_Central_Province.html,Kandy City Center,4.0,295,https://dynamic-media-cdn.tripadvisor.com/media/photo-o/28/bb/db/a2/caption.jpg?w=200&h=200&s=1&cx=1920&cy=1080&chk=v1_a521032f34575745171a,Dr-Ing-Dchen,"Rapid City, South Dakota",,4,Solo,"This ""mall"" is in stark contrast to the small shops lining the main streets of Candy.  I would put the quality and shops in this center at a similar level to ones you'd find in Europe or the americas.  Clean, friendly, and a lot of variety.  The basement level had a grocery store, which was quite fun to walk through and get a sense of the types and variety of foods and goods available.  Worth a visit!","August 31, 2017",0.0,0.0
https://www.tripadvisor.com/Attraction_Review-g304138-d4896053-Reviews-Kandy_City_Center-Kandy_Kandy_District_Central_Province.html,Kandy City Center,4.0,295,https://dynamic-media-cdn.tripadvisor.com/media/photo-o/28/bb/db/a2/caption.jpg?w=200&h=200&s=1&cx=1920&cy=1080&chk=v1_a521032f34575745171a,Yashvardhan V,"Mumbai, India",,4,Couples,The only proper shopping mall I found in whole of Sri Lanka! And it lives up to its name by being at the centre of the city.,"August 29, 2017",0.0,0.0
https://www.tripadvisor.com/Attraction_Review-g304138-d4896053-Reviews-Kandy_City_Center-Kandy_Kandy_District_Central_Province.html,Kandy City Center,4.0,295,https://dynamic-media-cdn.tripadvisor.com/media/photo-o/28/bb/db/a2/caption.jpg?w=200&h=200&s=1&cx=1920&cy=1080&chk=v1_a521032f34575745171a,carina t,34 contributions,,5,Couples,World spice (KCC Dining Lost). Oh my God we enjoyed every bite. On our first day in Kandy we came across the food court in city centre. And for 2 days after our lunch and dinner was here. Cleanliness 5 stars Service 5 stars Atmosphere & music 5 stars Value for money .. excellent. So glad we found our way here. We had : - Italian 👌🏼the chef took care of us and added a little extra off the menu .. free of charge. we had a Seafood fettuccine. With extra veg and cheese on top. 5 stars - Thai Tom yum hed (mushroom soup) such a spicy yet soothing soup. 5 stars -Indian 🙌🏼 we had the Mattar paneer (cottage cheese) combo meal with garlic naan. And the Mutton Biriyani we enjoyed every bit. 5 stars,"August 5, 2017",0.0,0.0
https://www.tripadvisor.com/Attraction_Review-g304138-d4896053-Reviews-Kandy_City_Center-Kandy_Kandy_District_Central_Province.html,Kandy City Center,4.0,295,https://dynamic-media-cdn.tripadvisor.com/media/photo-o/28/bb/db/a2/caption.jpg?w=200&h=200&s=1&cx=1920&cy=1080&chk=v1_a521032f34575745171a,Aussie_Pearl,"Mackay, Australia",,5,Couples,There's a multi cultural food court upstairs with a huge variety on offer. Our driver recommended the biryani & it was absolutely delish! So tasty & excellent value for money. All washed down with an iced tea from the drink vendor. I would definitely go here again! Everything was super spotless & very hygienic looking.,"July 21, 2017",0.0,0.0
https://www.tripadvisor.com/Attraction_Review-g304138-d4896053-Reviews-Kandy_City_Center-Kandy_Kandy_District_Central_Province.html,Kandy City Center,4.0,295,https://dynamic-media-cdn.tripadvisor.com/media/photo-o/28/bb/db/a2/caption.jpg?w=200&h=200&s=1&cx=1920&cy=1080&chk=v1_a521032f34575745171a,Tamara M,"Cairns, Australia",,5,Missing,"Totally recommend the food court up stairs. The food was delicious, value for money and there was a wide variety of food.","July 15, 2017",0.0,0.0
https://www.tripadvisor.com/Attraction_Review-g304138-d4896053-Reviews-Kandy_City_Center-Kandy_Kandy_District_Central_Province.html,Kandy City Center,4.0,295,https://dynamic-media-cdn.tripadvisor.com/media/photo-o/28/bb/db/a2/caption.jpg?w=200&h=200&s=1&cx=1920&cy=1080&chk=v1_a521032f34575745171a,R. Layne Holley,"Bangkok, Thailand",,4,Solo,"The signage on this place does little to reveal that it is actually a fine shopping mall in Kandy. As are many in Asia, this one has a vertical orientation with several floors of all types of retail shops----upscale and not; with ubiquitous electronics stores there too. The Food Court is quite impressive for a mall, relatively speaking,  with various culinary genres present from Burger King to much finer venues. There is also a roller coaster up top albeit one with a very small footprint. The location is ideal---right in the middle of the city center across the street from the Kandy Lake and Temple of the Sacred Tooth. I liked the architectural design of the building with its blend of a modern glass pyramid and the more traditional Sri Lankan style with tiled roofs. Whether you just want to check out the local mall to distinguish it from others or whether you have that shopping urge, the Kandy City Center is a worthwhile stop.","July 13, 2017",0.0,0.0
https://www.tripadvisor.com/Attraction_Review-g304138-d4896053-Reviews-Kandy_City_Center-Kandy_Kandy_District_Central_Province.html,Kandy City Center,4.0,295,https://dynamic-media-cdn.tripadvisor.com/media/photo-o/28/bb/db/a2/caption.jpg?w=200&h=200&s=1&cx=1920&cy=1080&chk=v1_a521032f34575745171a,Ranushi J,"Colombo, Sri Lanka",,5,Couples,This must be one of the most updated shopping malls in sri lanka. The level of sophistication found here cannot be matched by any of the shopping malls in colombo. Their dining area caters to fine dining. The choices to choose from are endless. Washrooms were amazingly clean. Loved the hours spent here.,"July 10, 2017",0.0,0.0
