Destination URL,Destination Title,Destination Score,Total Reviews (Destination),Destination Image,Reviewer Name,Reviewer Location,Review Title,Review Score,Reviewer Category,Review Text,Written Date,% %,  %
https://www.tripadvisor.com/Attraction_Review-g1815618-d3477464-Reviews-Kumana_National_Park-Ampara_Eastern_Province.html,Kumana National Park,4.4,129,https://dynamic-media-cdn.tripadvisor.com/media/photo-o/0d/51/3a/2e/birds-at-kumana.jpg?w=700&h=400&s=1,Geertje J,10 contributions,,5,Friends,"We had a lovely safari at Kumana. We entered the park around 2.30pm by jeep and we paid 2150 rupees each, including tax. We drove around there for four hours and got to see pretty much everything. From the most colourful birds to foxes, crocodiles, a turtle, elephants, deer, buffalo's, some small alligators (sorry don't know the name) and to top it all off, we even spotted a leopard which was amazing!! Even without spotting that though, I would definitely recommend. We saw about 3 other jeeps and that's it.","April 27, 2017",0.0,0.0
https://www.tripadvisor.com/Attraction_Review-g1815618-d3477464-Reviews-Kumana_National_Park-Ampara_Eastern_Province.html,Kumana National Park,4.4,129,https://dynamic-media-cdn.tripadvisor.com/media/photo-o/0d/51/3a/2e/birds-at-kumana.jpg?w=700&h=400&s=1,anush,"Galle, Sri Lanka",,5,Friends,The best Safari Location in Sri Lanka where you can see many animals and birds. You have to stay in the park bungalow - Thummulla - for the best experience.  Very few safari jeeps which gives lot of freedom for animals and viewers. So don't go there just for fun - only if you really love watching them,"April 25, 2017",0.0,0.0
https://www.tripadvisor.com/Attraction_Review-g1815618-d3477464-Reviews-Kumana_National_Park-Ampara_Eastern_Province.html,Kumana National Park,4.4,129,https://dynamic-media-cdn.tripadvisor.com/media/photo-o/0d/51/3a/2e/birds-at-kumana.jpg?w=700&h=400&s=1,abbigailrose_,United Kingdom,,5,Couples,"We went on safari with Ecowave (based in Arugam Bay). It was so good!! We went in the morning and saw elephants, water buffalo, deer etc. There's lots of birds because of the lagoons. Such a gorgeous place and we were the only visitors - didn't see any other jeeps at all. Our guide was able to answer the endless questions I had about the animals and the park. We had breakfast by the birds information centre.","April 10, 2017",0.0,0.0
https://www.tripadvisor.com/Attraction_Review-g1815618-d3477464-Reviews-Kumana_National_Park-Ampara_Eastern_Province.html,Kumana National Park,4.4,129,https://dynamic-media-cdn.tripadvisor.com/media/photo-o/0d/51/3a/2e/birds-at-kumana.jpg?w=700&h=400&s=1,Laura D,"Cambridge, United Kingdom",,5,Friends,We went in the afternoon and saw tons of wildlife and no other jeeps! The scenery was stunning too. Would definitely recommend. Just make sure to bring food and water with you and wear comfortable clothes; it's a long time in a car!,"March 24, 2017",0.0,0.0
https://www.tripadvisor.com/Attraction_Review-g1815618-d3477464-Reviews-Kumana_National_Park-Ampara_Eastern_Province.html,Kumana National Park,4.4,129,https://dynamic-media-cdn.tripadvisor.com/media/photo-o/0d/51/3a/2e/birds-at-kumana.jpg?w=700&h=400&s=1,CTozer,Maryland,,5,Friends,"They are the best camping outfit in SL and their understanding of the National Parks, the flora and fauna within is fantastic. Highly recommend them","March 19, 2017",0.0,0.0
https://www.tripadvisor.com/Attraction_Review-g1815618-d3477464-Reviews-Kumana_National_Park-Ampara_Eastern_Province.html,Kumana National Park,4.4,129,https://dynamic-media-cdn.tripadvisor.com/media/photo-o/0d/51/3a/2e/birds-at-kumana.jpg?w=700&h=400&s=1,Fahadh Nazir,"Panadura, Sri Lanka",,4,Missing,"Our safari jeep combed through the lush greeny trees and streams.. the extend from the entrance to the border end, it took us solidly nearly 2 hours to reach. Expect bumpy sand roads throughout. At few locations, our jeep drove through small water streams - which was really exciting. The day before we went, the park have received a good amount of rain, thus inundating a few access roads. Our driver used some alternative routes and reached till the end of the park, which ends with a narrow river, the other bank of the river is the Yala National Park. On your way make sure you keep silent. Loud noises (shouts, screams, talking loudly) can scare away the animals and birds. Please make sure you don't disturb the wildlife as it's their home and we are just visitors. There are leopards, crocodiles, sloth bears, elephants on the way and plenty of herds of deer and peacocks. Bring plenty of water and wear a comfortable clothing, the climate is fairly hot. It's always recommended not to take plastic bags into the forest. Bring back what ever you take inside. Same like many other national parks, you are not allowed to get down from your vehicle, unless it's been adviced by your designated forest officer. There's a large mangrove reserve which looks stunning. It's a bird watcher's paradise, I'd say. Overall, our visit was really worthwhile and the entire safari took nearly 4 hours.","March 12, 2017",0.0,0.0
https://www.tripadvisor.com/Attraction_Review-g1815618-d3477464-Reviews-Kumana_National_Park-Ampara_Eastern_Province.html,Kumana National Park,4.4,129,https://dynamic-media-cdn.tripadvisor.com/media/photo-o/0d/51/3a/2e/birds-at-kumana.jpg?w=700&h=400&s=1,Prasad_Siriwardena,"Negombo, Sri Lanka",,4,Missing,This is one of the best wildlife park located in Sri Lanka. This park is good place to see birds. This is belongs to one of the Ramsa protected wetlands in Sri Lanka,"January 29, 2017",0.0,0.0
https://www.tripadvisor.com/Attraction_Review-g1815618-d3477464-Reviews-Kumana_National_Park-Ampara_Eastern_Province.html,Kumana National Park,4.4,129,https://dynamic-media-cdn.tripadvisor.com/media/photo-o/0d/51/3a/2e/birds-at-kumana.jpg?w=700&h=400&s=1,Lal D,4 contributions,,5,Missing,"Had a fantastic time inside the park with Jumbos, all sorts of birds & most importantly with three unforgettable sightings of well built young healthy Leopards. Although I have been in most other national parks in the island, Kumana was the park that had the best of the variety in wildlife.","January 19, 2017",0.0,0.0
https://www.tripadvisor.com/Attraction_Review-g1815618-d3477464-Reviews-Kumana_National_Park-Ampara_Eastern_Province.html,Kumana National Park,4.4,129,https://dynamic-media-cdn.tripadvisor.com/media/photo-o/0d/51/3a/2e/birds-at-kumana.jpg?w=700&h=400&s=1,D Jay,18 contributions,,5,Missing,"We spent a day inside Kumana national park with a safari driver. It was not that dry due to wet days in the previous days. We were lucky enough to watch lot of birds. There were few elephants close to the road. We enjoyed watching dancing peacocks everywhere. Thanks to safari driver and park guide, we had a wonderful day.","January 1, 2017",0.0,0.0
https://www.tripadvisor.com/Attraction_Review-g1815618-d3477464-Reviews-Kumana_National_Park-Ampara_Eastern_Province.html,Kumana National Park,4.4,129,https://dynamic-media-cdn.tripadvisor.com/media/photo-o/0d/51/3a/2e/birds-at-kumana.jpg?w=700&h=400&s=1,Dharman H,"Providence, Rhode Island",,5,Friends,We spent the day with by brothers and a friend of ours. It was a pretty dry time of the year and we were lucky enough to see a couple of elephants and lots of Bird life.,"October 31, 2016",0.0,0.0
https://www.tripadvisor.com/Attraction_Review-g1815618-d3477464-Reviews-Kumana_National_Park-Ampara_Eastern_Province.html,Kumana National Park,4.4,129,https://dynamic-media-cdn.tripadvisor.com/media/photo-o/0d/51/3a/2e/birds-at-kumana.jpg?w=700&h=400&s=1,Sameera Wanninayake,"Colombo, Sri Lanka",,5,Friends,That is very beautiful amazing place to visit.kumana situated 15 km away from Panama town.That road also not a carpet one.You could see the animal on that area also.You can rent a jeep from Arugam Bay or entrance of the park.It was really nice experience. We saw many animals and also very beautiful birds. Environment also very beautiful.We visited in very hot season.Even difficult to find water.But park area's tanks were full with water. It's about 360 km away from Colombo. Trackers said it will be very beautiful after rain.,"October 13, 2016",0.0,0.0
https://www.tripadvisor.com/Attraction_Review-g1815618-d3477464-Reviews-Kumana_National_Park-Ampara_Eastern_Province.html,Kumana National Park,4.4,129,https://dynamic-media-cdn.tripadvisor.com/media/photo-o/0d/51/3a/2e/birds-at-kumana.jpg?w=700&h=400&s=1,Afrar A,2 contributions,,4,Missing,Visited this beautiful place on February 2016 and camped a night..had the best experience in camping..will be visiting soon again!,"September 2, 2016",0.0,0.0
https://www.tripadvisor.com/Attraction_Review-g1815618-d3477464-Reviews-Kumana_National_Park-Ampara_Eastern_Province.html,Kumana National Park,4.4,129,https://dynamic-media-cdn.tripadvisor.com/media/photo-o/0d/51/3a/2e/birds-at-kumana.jpg?w=700&h=400&s=1,Prasad T,"Cheltenham, United Kingdom",,5,Missing,We did camping in Kumana last year. There are several camping sites inside the park. You need to reserve in advance through the Department of Wild Life. You have a great chance to see leopard and lot of elephants. Kumana is popular for bird watching. There are hundreds of varieties of birds. Safari Jeeps need to be booked form private suppliers. But not mandatory to book in advance. There are lot available in Panama area. It is difficult to reach park entrance by a car because road is not in good conditions. Vehicle with high ground clearance recommended.,"August 4, 2016",0.0,0.0
https://www.tripadvisor.com/Attraction_Review-g1815618-d3477464-Reviews-Kumana_National_Park-Ampara_Eastern_Province.html,Kumana National Park,4.4,129,https://dynamic-media-cdn.tripadvisor.com/media/photo-o/0d/51/3a/2e/birds-at-kumana.jpg?w=700&h=400&s=1,Rangit d,4 contributions,,4,Friends,"All the good things that you get in Yalla, but without the hundreds of jeeps. We were very keen to try and see a bear but unfortunately we just missed it!! saw leopard, and lots of wonderful birds","July 8, 2016",0.0,0.0
https://www.tripadvisor.com/Attraction_Review-g1815618-d3477464-Reviews-Kumana_National_Park-Ampara_Eastern_Province.html,Kumana National Park,4.4,129,https://dynamic-media-cdn.tripadvisor.com/media/photo-o/0d/51/3a/2e/birds-at-kumana.jpg?w=700&h=400&s=1,PRABHU60,"Colombo, Sri Lanka",,5,Couples,"Kumana Villu ( Lake ) is a wonderful place to visit and spend time in the months of June July and August. The Villu would have water and mangrove trees each on which birds like Painted Storks, Grey Herons, Pelicans, Darters, Purple Herons, Eurasian Spoon bills, Cormorants would be making nests or rearing the offsprings... The whole area reverberate with chirping noises from thousands of birds.. There is a watch tower where you can keep your tripod and telephoto lens to photograph the feast of a birder...","July 5, 2016",0.0,0.0
https://www.tripadvisor.com/Attraction_Review-g1815618-d3477464-Reviews-Kumana_National_Park-Ampara_Eastern_Province.html,Kumana National Park,4.4,129,https://dynamic-media-cdn.tripadvisor.com/media/photo-o/0d/51/3a/2e/birds-at-kumana.jpg?w=700&h=400&s=1,Sara F,"Oslo, Norway",,4,Couples,"Kumana National Park is well worth a visit if you are in Arugam Bay. The park is about one hour drive from Arugam Bay. We saw elephants even before we entered the park and the drive to the park was really beautiful. We saw many big crocodiles, deer, water buffalo, birds, elephants, rabbit and in the end we also saw a leopard crossing the road in front of us! That made the safari. The nature in the park is very beautiful and quiet, we only saw three other jeeps so we pretty much felt we were alone in the park. Well worth the money it costs (and you can make good deals in Arguam Bay)!","May 28, 2016",0.0,0.0
https://www.tripadvisor.com/Attraction_Review-g1815618-d3477464-Reviews-Kumana_National_Park-Ampara_Eastern_Province.html,Kumana National Park,4.4,129,https://dynamic-media-cdn.tripadvisor.com/media/photo-o/0d/51/3a/2e/birds-at-kumana.jpg?w=700&h=400&s=1,Rashmin M,11 contributions,,5,Missing,"The other day, after lunch we continued on our way to Kumana National Park, stopping at a pond and small creek where we saw the number of crocodiles in one place. Our guide took us to spots where we could closely, but safely observe these prehistoric reptiles. We also had a chance to encounter many of the regions birds, water buffaloes and monkeys that call the pond their home. And just on the edge of the park, at the Okanda Hindu Shrine. The temple has many colourful sculptures of Hindu Gods and we could learn about the stories behind these gods from a local priest. We enter the park at around 3-3:30 it was said that the best time for entering park, we found ourselves in one of the most bio diverse park in Sri Lanka. The park has several lagoons that are surrounded by tropical thorn forest. We were able to see monkeys, water buffaloes, elephant herds and jackals.","May 2, 2016",0.0,0.0
https://www.tripadvisor.com/Attraction_Review-g1815618-d3477464-Reviews-Kumana_National_Park-Ampara_Eastern_Province.html,Kumana National Park,4.4,129,https://dynamic-media-cdn.tripadvisor.com/media/photo-o/0d/51/3a/2e/birds-at-kumana.jpg?w=700&h=400&s=1,Nalaka d,"Athurugiriya, Sri Lanka",,4,Missing,"Visited to Kumana National Park on 18th April 2016 with my family, relations and family friends. When we visited to Ampara(3rd day of our trip)and following day suddenly we decided to go there. It took nearly two hours to go there. We bought water and snacks before go there. We had to buy those things before pass the Arugambay area. We had to travel nearly half an hour from main road to park entrance point. It's a gravel road very dusty because of no rain. At the entrance we had to pay nearly 100 per person as entrance ticket charge ( sorry I can't remember the exact amount ). If we like we can hire a person from National park staff to guide us. It's a good idea. We entered to the park using our own vehicles ( two vans ). Due to dry weather condition roads were not wet and muddy because of that we could go by our vehicles, but we had to careful from gravel roads with bad conditions. I recommend to go by hired Safari jeed. Rs.  6000 for a jeep, eight persons can go. If you are a bird lover, you have to go early morning to watch birds. We could see different kinds of birds, Deers, alligators, Elks, Wild pigs, Peacocks, Elephants, Foxes. If you are a photographer bring good lenses with well zooming capability. Because our busy schedule we had to turn back from the first bird watching point ( cement built place). We travel nearly 15 km's to that point from the start. It took one and half hours to get there. When we discuss with park staff, they told us May and June months are the best time to come and watch birds. Birds season ends in August. They informed us overnight camping area also available inside this park. We are coming back again to see all places of this park and watch many varieties of birds and animals, also stay overnight in this amazing Kumana National Park.","April 21, 2016",0.0,0.0
https://www.tripadvisor.com/Attraction_Review-g1815618-d3477464-Reviews-Kumana_National_Park-Ampara_Eastern_Province.html,Kumana National Park,4.4,129,https://dynamic-media-cdn.tripadvisor.com/media/photo-o/0d/51/3a/2e/birds-at-kumana.jpg?w=700&h=400&s=1,Kasun W,"Colombo, Sri Lanka",,5,Couples,"Entered this national park with the ambition of visiting Madamethota devalaya (also known as Kuda Kebiliththa) which is located at most southern point of this national park. This national park is full of wild life just like YALA national park. The two parks are separated from Kumbukkan oya. Mainly you can find tuskers, elephants, spotted deer, leopards and Sri Lankan bear. Also this place is famous for migrant birds. If you are visiting to Arugam bay, do not hesitate to pay a visit to this famous national park. Safari jeeps can be easily arranged from Arugam bay town. You can visit Okanda dewalaya and Kudumbigala Aranya Senasanaya (Buddhist temple) on the way to this national park.","April 17, 2016",0.0,0.0
https://www.tripadvisor.com/Attraction_Review-g1815618-d3477464-Reviews-Kumana_National_Park-Ampara_Eastern_Province.html,Kumana National Park,4.4,129,https://dynamic-media-cdn.tripadvisor.com/media/photo-o/0d/51/3a/2e/birds-at-kumana.jpg?w=700&h=400&s=1,Schoscha85,189 contributions,,3,Couples,"We decided to go on safari at the Kumana Park during our Arugam Bay stay. We did a morning tour and were almost alone the whole time. We haven't seen many elephants (3 in total) but the nature is great and we have seen millions of water buffallos, deers and beautiful birds. We liked the tour!","April 8, 2016",0.0,0.0
https://www.tripadvisor.com/Attraction_Review-g1815618-d3477464-Reviews-Kumana_National_Park-Ampara_Eastern_Province.html,Kumana National Park,4.4,129,https://dynamic-media-cdn.tripadvisor.com/media/photo-o/0d/51/3a/2e/birds-at-kumana.jpg?w=700&h=400&s=1,Merijn111,"Rosmalen, The Netherlands",,5,Friends,"Beautiful park with a lot of wildlife. The road to the park is already beautiful. You can do this strech with a scooter (though there are big elephants present!) or tuktuk and can see everything except maybe the leopard. But the park is worth the extra money. Scenery is very nice. Many birds, eliphants, crocodiles, fox, deer and many more. We saw within 10 minutes a big leopard.","March 29, 2016",0.0,0.0
https://www.tripadvisor.com/Attraction_Review-g1815618-d3477464-Reviews-Kumana_National_Park-Ampara_Eastern_Province.html,Kumana National Park,4.4,129,https://dynamic-media-cdn.tripadvisor.com/media/photo-o/0d/51/3a/2e/birds-at-kumana.jpg?w=700&h=400&s=1,ripepapaya,Slovenia,,4,Missing,"We found a budget friendly jeep and drove to the park. Before we entered we already saw monkeys and crocs. At the entrance we paid additional 2000 rupees each (4 persons). Inside we saw jackals, birds, deer, buffalos, wild boar, more crocodiles and a huge elephant. We drove pretty close to it, i would say at about 50 meters. Of course we didn't see any leopards or bears, as they are really hard to spot. You can also see marshes, lagoons and a dry zone vegetation. That was something for the eye. The road is extremely bad, so prepare for a bumpy ride.","February 27, 2016",0.0,0.0
https://www.tripadvisor.com/Attraction_Review-g1815618-d3477464-Reviews-Kumana_National_Park-Ampara_Eastern_Province.html,Kumana National Park,4.4,129,https://dynamic-media-cdn.tripadvisor.com/media/photo-o/0d/51/3a/2e/birds-at-kumana.jpg?w=700&h=400&s=1,Thusitha P,25 contributions,,3,Friends,"We few friends visited the park in January 2016 and spent a night at Thummulla Bungalow. Nice place with no hassle like other parks which you can see lots of birds. Thummulla Bungalow has been refurbished recently and staff there is very friendly. It is advisable to go by 4x4 vehicle, otherwise you will miss to reach some areas.","January 18, 2016",0.0,0.0
https://www.tripadvisor.com/Attraction_Review-g1815618-d3477464-Reviews-Kumana_National_Park-Ampara_Eastern_Province.html,Kumana National Park,4.4,129,https://dynamic-media-cdn.tripadvisor.com/media/photo-o/0d/51/3a/2e/birds-at-kumana.jpg?w=700&h=400&s=1,Sujanthan S,13 contributions,,4,Missing,Visited the national park after the arugam bay trip!! The entire stretch of gravel road is filled with rare flowers and birds !! We were lucky to spot 4 big crocodiles waiting for their prey !!! Different kinds of crane with different colors!! Recommend to go on a jeep since the road is bumpy all the way !! We stopped at kudumbigala Rock where you could get a sky view of national park !!! Overall awesome place to have a road trip !!!!,"January 5, 2016",0.0,0.0
https://www.tripadvisor.com/Attraction_Review-g1815618-d3477464-Reviews-Kumana_National_Park-Ampara_Eastern_Province.html,Kumana National Park,4.4,129,https://dynamic-media-cdn.tripadvisor.com/media/photo-o/0d/51/3a/2e/birds-at-kumana.jpg?w=700&h=400&s=1,Tim schelkens,"Willebroek, Belgium",,4,Couples,"We went to Kumana on a morning drive from Arugam bay. we were with only 4 people in the car so we had plenty of room. Already when we arrived at the entrance we were greeted by 10-30 monkeys. Inside the park we saw a few elephants, some deer and 4 leopards. Our guide heard the couple of leopards from the watch tower near the wetlands so we rushed to the car and found the leopards where he expected to find them. Very worthwhile trip.","January 4, 2016",0.0,0.0
https://www.tripadvisor.com/Attraction_Review-g1815618-d3477464-Reviews-Kumana_National_Park-Ampara_Eastern_Province.html,Kumana National Park,4.4,129,https://dynamic-media-cdn.tripadvisor.com/media/photo-o/0d/51/3a/2e/birds-at-kumana.jpg?w=700&h=400&s=1,Isida K,50 contributions,,5,Couples,"We rented a Safari tour Jeep from the small town of Kataragama. Our excellent driver and the beauty of nature can only get 5-stars however it is a tiring tour to take on for an entire day and I would go with the half-day version next time. The park is huge and you need an experienced and caring tour guide to explain the little details (like bird nests sightings, and what footsteps belong to which animal) but also to find the ultimate sighting of the leopard/s! Our driver scoured the grounds until we finally saw the magnificent feline! If you are lucky enough, you might also run into the single unruly tusked elephant that is known to throw a feat with the jeeps!","December 23, 2015",0.0,0.0
https://www.tripadvisor.com/Attraction_Review-g1815618-d3477464-Reviews-Kumana_National_Park-Ampara_Eastern_Province.html,Kumana National Park,4.4,129,https://dynamic-media-cdn.tripadvisor.com/media/photo-o/0d/51/3a/2e/birds-at-kumana.jpg?w=700&h=400&s=1,joseph t,"Tel Aviv, Israel",,4,Missing,"we were almost alone at the park. Though we did not see any leopards, we had the opportunity to watch crocodiles, elephants, special birds, water buffalos, pickocs and more. this is a different safari, at least at this time of the year (late september) because the park is almost empty from visitors. Very special opportunity to enjoy nature.","October 1, 2015",0.0,0.0
https://www.tripadvisor.com/Attraction_Review-g1815618-d3477464-Reviews-Kumana_National_Park-Ampara_Eastern_Province.html,Kumana National Park,4.4,129,https://dynamic-media-cdn.tripadvisor.com/media/photo-o/0d/51/3a/2e/birds-at-kumana.jpg?w=700&h=400&s=1,Carol H,"Alice Springs, Australia",,4,Friends,"We camped in the park which was great and although we did not see any Leopards we did see 3 sets of prints and narrowly missed seeing a bear (people in other car saw only minutes before).  The birds were amazing and a number of elephants, deer, boar, hare, buffalo etc. Could have spent much more time at the large waterhole than we had.  Well worth the visit if you are also going to other parks","September 9, 2015",0.0,0.0
https://www.tripadvisor.com/Attraction_Review-g1815618-d3477464-Reviews-Kumana_National_Park-Ampara_Eastern_Province.html,Kumana National Park,4.4,129,https://dynamic-media-cdn.tripadvisor.com/media/photo-o/0d/51/3a/2e/birds-at-kumana.jpg?w=700&h=400&s=1,kipi_travels,"Berlin, Germany",,5,Couples,"We came with a jeep from Arugam Bay which was pretty close and easy to arrange. We ended up seeing almost ""all"" the animals: even a leopard. The guide form the national park was great at spotting animals and pointing them out to us. Great experience and very convenient.","September 8, 2015",0.0,0.0
https://www.tripadvisor.com/Attraction_Review-g1815618-d3477464-Reviews-Kumana_National_Park-Ampara_Eastern_Province.html,Kumana National Park,4.4,129,https://dynamic-media-cdn.tripadvisor.com/media/photo-o/0d/51/3a/2e/birds-at-kumana.jpg?w=700&h=400&s=1,Chathura H,28 contributions,,3,Missing,"Kumana has been know to be a Bird sanctuary. Best time to visit is the morning shift. We went there in the after noon. We did spot plenty of birds but most being ones that you can easily spot. We also came across many deer's, foxes, crocs, elephants, wild bores, peacocks, buffaloes....etc. Bit disappointed that we didn't  come across any leopards. It was during the dry season we were there so most animals were struggling to find water..","August 12, 2015",0.0,0.0
https://www.tripadvisor.com/Attraction_Review-g1815618-d3477464-Reviews-Kumana_National_Park-Ampara_Eastern_Province.html,Kumana National Park,4.4,129,https://dynamic-media-cdn.tripadvisor.com/media/photo-o/0d/51/3a/2e/birds-at-kumana.jpg?w=700&h=400&s=1,baivw,190 contributions,,3,Couples,"We went on three game drives in Yala, and saw lots of animals and even a Leopard for a few seconds. We saw practically nothing in Kumana. My advice is don't even think about wasting your money during July/early August when the pilgrims are all marching right through the national park on their pilgrimage. They walk from Okanda through the park to Kataragama. All of the animals go into hiding. When we visited the park it was a few days after this, and all of the animals were still in hiding. We didn't even see an elephant grazing around. The mandatory guide they send along basically slept the while time and didn't bother looking for animals, so I added a photo of him sleeping. The safari's to Kumana from Arugam's Bay are far more expensive than the ones in Yala. However, we were the only jeep we saw all day, so it was much quieter than Yala. I would give it a go any other time of year though. We paid $100 for two people for a jeep. But we were quoted as much as $200.","August 6, 2015",0.0,0.0
