Destination URL,Destination Title,Destination Score,Total Reviews (Destination),Destination Image,Reviewer Name,Reviewer Location,Review Title,Review Score,Reviewer Category,Review Text,Written Date,% %,  %
https://www.tripadvisor.com/Attraction_Review-g1815618-d3477464-Reviews-Kumana_National_Park-Ampara_Eastern_Province.html,Kumana National Park,4.4,129,https://dynamic-media-cdn.tripadvisor.com/media/photo-o/0d/51/3a/2e/birds-at-kumana.jpg?w=700&h=400&s=1,Nugadhenitours,"Düsseldorf, Germany",My favorite national park in Sri Lanka (and I was in all),5,Solo,"Kumana NP is one of the most beautiful parks in the world, especially when the many lakes within are filled with water. You will then see countless birds, from the ibis to 5 diverse stork species, but also many Crocs, occasionally an elephant, wild boar and Axish - and, yes, leopards. Their density is said to be highest here in the world, not in Yala, for example. Kumana is never as crowded as neighbouring Yala, probably because most of Arugam are just for surfing or bathing...the drive here alone takes around an hour, but is scenically really super nice. Of course, good luck is always part of an animal observation, of course, sighting a leopard is never guaranteed. Beautiful places to get out and legs represented on the Kumbuk-lined shore of an inlet in the park","September 28, 2025",0.0,0.0
https://www.tripadvisor.com/Attraction_Review-g1815618-d3477464-Reviews-Kumana_National_Park-Ampara_Eastern_Province.html,Kumana National Park,4.4,129,https://dynamic-media-cdn.tripadvisor.com/media/photo-o/0d/51/3a/2e/birds-at-kumana.jpg?w=700&h=400&s=1,OnAir24785605555,"Kundasale, Sri Lanka",Kumana: Where Nature Whispers and History Waits,5,Missing,"his is a park bird lovers should not miss. Located in the southeastern corner of Sri Lanka, Kumana has preserved its pristine natural beauty. The drive from Arugam Bay is among the finest—evoking memories of colonial-era roadworks. With untouched jungle on one side and the shimmering sea on the other, the journey infuses an energetic sense of wonder. For those interested in Buddhist culture, Kudumbigala Monastery is another must-visit on this trip. With a history spanning over 2,000 years, its serene isolation has helped preserve the site's authenticity and spiritual charm.","July 14, 2025",0.0,0.0
https://www.tripadvisor.com/Attraction_Review-g1815618-d3477464-Reviews-Kumana_National_Park-Ampara_Eastern_Province.html,Kumana National Park,4.4,129,https://dynamic-media-cdn.tripadvisor.com/media/photo-o/0d/51/3a/2e/birds-at-kumana.jpg?w=700&h=400&s=1,Susan G,"Wellington, United Kingdom",Only ok,3,Couples,"Great safari if you like birds. Lots of different birds. Very very bad roads so your back in peril constantly. You don't expect a smooth ride on most safaris but this was exceptionally rough.We saw no elephants, no leopards and no bears. A few distant crocodiles and lots of peacocks. The scenery was pretty  but would  not go again or recommend.","June 7, 2025",0.0,0.0
https://www.tripadvisor.com/Attraction_Review-g1815618-d3477464-Reviews-Kumana_National_Park-Ampara_Eastern_Province.html,Kumana National Park,4.4,129,https://dynamic-media-cdn.tripadvisor.com/media/photo-o/0d/51/3a/2e/birds-at-kumana.jpg?w=700&h=400&s=1,Lucky J,"Digana, Sri Lanka",Half day jeep safari of Kumana national park,5,Friends,"Four of us did a half day jeep safari at Kumana national park from 5 A.M. to 11 AM. with Mr. Shantha in his jeep. He is an expert on the Kumana and nearby areas such as Kudumbigala. He took us on the trail very safely till the boundary of Yala along the coast and sometimes in the interior. We met a few other similar jerps with local and foreign tourists. We saw all the animals and birds at the park except for bear and leopard. Leopards and bear had been seen the previous day but we were not lucky on this day. We saw herds of elephants with young ones, a lot of deer, not so usual types of colourful birds, huge crocodiles and a lot of peacocks too. We witnessed at least 3 great peacock dances with full blown feather presentation. We can highly recommend Mr. Shantha (+94 77 662 5337) for leafing a half or full day safari jeep tour of Kumana and adjacent areas. By Lucky Jayaratne","May 30, 2025",0.0,0.0
https://www.tripadvisor.com/Attraction_Review-g1815618-d3477464-Reviews-Kumana_National_Park-Ampara_Eastern_Province.html,Kumana National Park,4.4,129,https://dynamic-media-cdn.tripadvisor.com/media/photo-o/0d/51/3a/2e/birds-at-kumana.jpg?w=700&h=400&s=1,GrandTour35200263948,2 contributions,Kumana fauna and excellent scenery,5,Friends,"They came to pick us up at the hotel at the right time. During the journey to the park, the driver has already indicated animals. During the safari, the driver showed us fauna and different areas with different vegetation. We saw quite a lot of local fauna... and even one of us spotted a leopard. All very well. Recommended experience for fauna and landscape. We'd be back.","March 10, 2025",0.0,0.0
https://www.tripadvisor.com/Attraction_Review-g1815618-d3477464-Reviews-Kumana_National_Park-Ampara_Eastern_Province.html,Kumana National Park,4.4,129,https://dynamic-media-cdn.tripadvisor.com/media/photo-o/0d/51/3a/2e/birds-at-kumana.jpg?w=700&h=400&s=1,Amendra,United Kingdom,Biodiverse paradise,5,Friends,"I am absolutely thrilled to talk about Kumana National Park, located on the southeastern coast of Sri Lanka, bordering the Indian Ocean. This biodiverse paradise is a haven for wildlife enthusiasts, boasting an incredible array of fauna and flora that are unique to this region. What makes Kumana stand out is its status as an important bird sanctuary, with over 200 species of birds including rare and endangered species like the black-necked stork and greater flamingo. In addition to birdwatching opportunities, visitors can also spot elephants, leopards, sloth bears, and many other animals in their natural habitat. The park's mix of wetlands, forests, and grasslands create a stunning landscape that offers a different kind of safari experience compared to other national parks in Sri Lanka. Truly a must-visit destination for any nature lover!","December 2, 2024",0.0,0.0
https://www.tripadvisor.com/Attraction_Review-g1815618-d3477464-Reviews-Kumana_National_Park-Ampara_Eastern_Province.html,Kumana National Park,4.4,129,https://dynamic-media-cdn.tripadvisor.com/media/photo-o/0d/51/3a/2e/birds-at-kumana.jpg?w=700&h=400&s=1,Wiraen,72 contributions,Smaller but just as beautiful,5,Missing,There were less than 10 vehicles when we arrived in the morning.  The trip was pleasant after the crowd at Yala even though there seemed to be less animals and birds.    Kumana is swampier than Yala but beautiful in its own way.  And we saw a leopard too!  We also saw more elephants around Kumana compared to Yala.,"August 18, 2024",0.0,0.0
https://www.tripadvisor.com/Attraction_Review-g1815618-d3477464-Reviews-Kumana_National_Park-Ampara_Eastern_Province.html,Kumana National Park,4.4,129,https://dynamic-media-cdn.tripadvisor.com/media/photo-o/0d/51/3a/2e/birds-at-kumana.jpg?w=700&h=400&s=1,Phileas Fogg,"Paris, France",Beautiful!,5,Solo,An excellent reserve for the Watching edge but also for leopards and bears. The diversity and beauty of the landscapes as well as its Buddhist ruins make it the favorite playground of photographers. To visit!,"July 15, 2024",0.0,0.0
https://www.tripadvisor.com/Attraction_Review-g1815618-d3477464-Reviews-Kumana_National_Park-Ampara_Eastern_Province.html,Kumana National Park,4.4,129,https://dynamic-media-cdn.tripadvisor.com/media/photo-o/0d/51/3a/2e/birds-at-kumana.jpg?w=700&h=400&s=1,john t,"Stourbridge, United Kingdom",Remote quiet interesting park.,4,Couples,"This National park which I think was called Yala East is a beautiful park with a good mixture of open park, large lakes/tanks and dense jungle. Very few jeeps enter the park so it is very relaxed and the animal/ bird life seems to completely oblivious to those. Similarly the jeep drivers are very relaxed and take plenty of time. Few vehicle tracks. Main problem is that the park entrance is 15-20 kilometres from Panama along a very rough dirt track. But well worth the effort. The local guides say the afternoon safaris are best for animals and the morning safaris for birds. We did one of each and didn’t notice a difference.","January 24, 2024",0.0,0.0
https://www.tripadvisor.com/Attraction_Review-g1815618-d3477464-Reviews-Kumana_National_Park-Ampara_Eastern_Province.html,Kumana National Park,4.4,129,https://dynamic-media-cdn.tripadvisor.com/media/photo-o/0d/51/3a/2e/birds-at-kumana.jpg?w=700&h=400&s=1,Kitta2,"Gold Coast, Australia",Great Safari !,4,Couples,"Being to Kumana National Park many times and this time we did an afternoon private safari. Located in the south coast of Sri Lanka and is the eastern sector of Yala. Less crowded. More famous for bird watching. Even though it was from far, we saw a leopard. So lucky to witness a sloth bear walking down the bridge. Unable to attach the video. Definitely the highlight of our safari.","November 27, 2023",0.0,0.0
https://www.tripadvisor.com/Attraction_Review-g1815618-d3477464-Reviews-Kumana_National_Park-Ampara_Eastern_Province.html,Kumana National Park,4.4,129,https://dynamic-media-cdn.tripadvisor.com/media/photo-o/0d/51/3a/2e/birds-at-kumana.jpg?w=700&h=400&s=1,Shardha,"Colombo, Sri Lanka",,4,Missing,"Good sightings of wild life without disturbance from other park visitors. Plenty of unusual sightings besides the elephant, leopard, bear, wild boar, buffalo. We saw an eagle hunting down a lizard and two red mongoose digging out their breakfast snake. The best way to enjoy the park is to book a camp site with generally luxury with extreamnaturetours.com","October 12, 2023",0.0,0.0
https://www.tripadvisor.com/Attraction_Review-g1815618-d3477464-Reviews-Kumana_National_Park-Ampara_Eastern_Province.html,Kumana National Park,4.4,129,https://dynamic-media-cdn.tripadvisor.com/media/photo-o/0d/51/3a/2e/birds-at-kumana.jpg?w=700&h=400&s=1,charuka k,16 contributions,,5,Missing,"I would say this is my favourite park. We were lucky to see 4 leopard, 3 tuskers and lot of wild animals and lot of endemic birds and migrative birds in one day. Our trackers and Park owners were very supportive. Special thanks goes to Mr. Samaranayake for the support.","June 20, 2023",0.0,0.0
https://www.tripadvisor.com/Attraction_Review-g1815618-d3477464-Reviews-Kumana_National_Park-Ampara_Eastern_Province.html,Kumana National Park,4.4,129,https://dynamic-media-cdn.tripadvisor.com/media/photo-o/0d/51/3a/2e/birds-at-kumana.jpg?w=700&h=400&s=1,Gianluca G,5 contributions,,1,Friends,"DO NOT GO THERE!! We were there at the 14 of juni in 2023. It was so that bad, i dont know where to start. - Costs around 12'000 per person - Driver drove more like he was at a racing car - GARBAGE ALL OVER THE ""REST"" AREAS AND FIRES,Because there was a religion walk from jaffna to there. - Saw 1 Elephant,and 2 buffalos thats it. - arround 2000 people who walk trough the park for this religion walk.....SAD I know its nature and u can not expect everything,but i really dont want to pay for an NATIONAL PARK WHO IS FULL OF PLASTIC BOTTLES. Common its a Nationl park an not anything else, really sad.... I DO NOT RECOMMEND IT. If you have time and money, go on Safari in Afrika as we are last year. Of course expensier BUT mooooost better then this.","June 14, 2023",0.0,0.0
https://www.tripadvisor.com/Attraction_Review-g1815618-d3477464-Reviews-Kumana_National_Park-Ampara_Eastern_Province.html,Kumana National Park,4.4,129,https://dynamic-media-cdn.tripadvisor.com/media/photo-o/0d/51/3a/2e/birds-at-kumana.jpg?w=700&h=400&s=1,neil j,"Colombo, Sri Lanka",,5,Missing,"the park is really good and less crowded but the road to it needs repairs very badly. it is a nightmare to travel to such a beautiful park.  With Arugambey surf season coming up if our tourism paternity gets together and synergy it with Kumana safari, it will help a grade deal as Arigambay is more or less like Hikkaduwa now.  the tallest but rare bird of Sri Lanka - black necked Stroke - and a leopard roaming around were seen in addition to numerous elephants and a majestic tusker .","April 21, 2023",0.0,0.0
https://www.tripadvisor.com/Attraction_Review-g1815618-d3477464-Reviews-Kumana_National_Park-Ampara_Eastern_Province.html,Kumana National Park,4.4,129,https://dynamic-media-cdn.tripadvisor.com/media/photo-o/0d/51/3a/2e/birds-at-kumana.jpg?w=700&h=400&s=1,Suresh K.,"Colombo, Sri Lanka",,5,Missing,"Kumana, is trule a gem for wildlife enthusiasts. One of the best Sri Lankan National Parks to spot Sri Lankan Leopards (Panthera Pardus Kotiya).  Park is also not as crowded as other nearby national parks such as Yala.","April 13, 2023",0.0,0.0
https://www.tripadvisor.com/Attraction_Review-g1815618-d3477464-Reviews-Kumana_National_Park-Ampara_Eastern_Province.html,Kumana National Park,4.4,129,https://dynamic-media-cdn.tripadvisor.com/media/photo-o/0d/51/3a/2e/birds-at-kumana.jpg?w=700&h=400&s=1,Ramesh W,"Colombo, Sri Lanka",,5,Missing,My absolute favorite NP in SL! Always see so many animals and very few visitors. A must go. You can stay in Arugam bay as its a close drive from there!,"March 7, 2022",0.0,0.0
https://www.tripadvisor.com/Attraction_Review-g1815618-d3477464-Reviews-Kumana_National_Park-Ampara_Eastern_Province.html,Kumana National Park,4.4,129,https://dynamic-media-cdn.tripadvisor.com/media/photo-o/0d/51/3a/2e/birds-at-kumana.jpg?w=700&h=400&s=1,Thambapanni Green Walkers Tours,"Colombo, Sri Lanka",,5,Missing,It is one of the best birding destinations in Sri Lanka. We recommend the Kumana national park for bird lovers and wildlife holiday seekers. while in Arugambay for surfing activity.,"January 16, 2022",0.0,0.0
https://www.tripadvisor.com/Attraction_Review-g1815618-d3477464-Reviews-Kumana_National_Park-Ampara_Eastern_Province.html,Kumana National Park,4.4,129,https://dynamic-media-cdn.tripadvisor.com/media/photo-o/0d/51/3a/2e/birds-at-kumana.jpg?w=700&h=400&s=1,Exploring the Paradise,"Colombo, Sri Lanka",,5,Missing,Kumana NP is one of the most peaceful parks where you can just enjoy nature and the animals in their natural habitat. Limited number of vehicles are in the park. The park has two Wildlife bungalows inside the park. Staying in one of those is a blessings since you have to drive for an hour from Arugambay/Pottuvil Area. The park has so many leopards as well as a paradise for Birds. Migratory season is the best for Kumana. The road to the park (Kudumbigala area) is a bit of a tough one. If you have a jeep or SUV it would be ideal. Inside the park you can hire a jeep and go on Safari's A park that is so much more peaceful than the Yala or the wildpattu.,"May 9, 2021",0.0,0.0
https://www.tripadvisor.com/Attraction_Review-g1815618-d3477464-Reviews-Kumana_National_Park-Ampara_Eastern_Province.html,Kumana National Park,4.4,129,https://dynamic-media-cdn.tripadvisor.com/media/photo-o/0d/51/3a/2e/birds-at-kumana.jpg?w=700&h=400&s=1,Pavel from 2HungryWanderers.com,74 contributions,,5,Missing,"Nice park with lots of animals, but not many tourists. Plenty of buffalos, wild pigs, deer, we also saw foxes, mongoose and an elephant. Myriad of birds, any bird lover will be thrilled.","July 31, 2020",0.0,0.0
https://www.tripadvisor.com/Attraction_Review-g1815618-d3477464-Reviews-Kumana_National_Park-Ampara_Eastern_Province.html,Kumana National Park,4.4,129,https://dynamic-media-cdn.tripadvisor.com/media/photo-o/0d/51/3a/2e/birds-at-kumana.jpg?w=700&h=400&s=1,CaraAdelaide,131 contributions,,5,Missing,This is one of the hidden delights of Sri Lanka - a very special place with lots of wildlife and gorgeous scenery!,"January 22, 2020",0.0,0.0
https://www.tripadvisor.com/Attraction_Review-g1815618-d3477464-Reviews-Kumana_National_Park-Ampara_Eastern_Province.html,Kumana National Park,4.4,129,https://dynamic-media-cdn.tripadvisor.com/media/photo-o/0d/51/3a/2e/birds-at-kumana.jpg?w=700&h=400&s=1,Jane.90,4 contributions,,5,Missing,"Very nice half day trip! The park is smaller, almost without tourists and with luck you can see a leopard! I recommend more than Yala Park itself, it's much quieter here and elephants are almost everywhere.","December 29, 2019",0.0,0.0
https://www.tripadvisor.com/Attraction_Review-g1815618-d3477464-Reviews-Kumana_National_Park-Ampara_Eastern_Province.html,Kumana National Park,4.4,129,https://dynamic-media-cdn.tripadvisor.com/media/photo-o/0d/51/3a/2e/birds-at-kumana.jpg?w=700&h=400&s=1,Ronald v,"Amsterdam, The Netherlands",,5,Couples,"Kumana national park is also called Yala East. It is a lot smaller than Yala and much less crowdy. We booked in Arugam Bay and paied 5000 LKR each, which included everything: entrance fee, 4x4 and driver/guide. You stay in the park for about 4 hours. We were lucky and saw all kinds of animals among which elephants and even a leopard.","August 31, 2019",0.0,0.0
https://www.tripadvisor.com/Attraction_Review-g1815618-d3477464-Reviews-Kumana_National_Park-Ampara_Eastern_Province.html,Kumana National Park,4.4,129,https://dynamic-media-cdn.tripadvisor.com/media/photo-o/0d/51/3a/2e/birds-at-kumana.jpg?w=700&h=400&s=1,Ian W,"Montreal, Canada",,5,Missing,"Did an afternoon safari (seems more common than morning).  Left at 1:30pm and came back at 7:30pm.  We saw too many animals to list here!  The only one we didn't see is the leopard.  The road to the park was very dusty.  Bring binoculars. July 15th 2019, the standard price was 4300-4500SRL per person for shared safari or 16000SRL if you want to hire a private vehicule(both peice include everything: guide, entrance fee, etc).","July 17, 2019",0.0,0.0
https://www.tripadvisor.com/Attraction_Review-g1815618-d3477464-Reviews-Kumana_National_Park-Ampara_Eastern_Province.html,Kumana National Park,4.4,129,https://dynamic-media-cdn.tripadvisor.com/media/photo-o/0d/51/3a/2e/birds-at-kumana.jpg?w=700&h=400&s=1,Pas_S,"Colombo, Sri Lanka",,5,Missing,"Excellent Place to Visit, Please enter the park as Early as possible, In the Morning the scenery is very beautiful","July 5, 2019",0.0,0.0
https://www.tripadvisor.com/Attraction_Review-g1815618-d3477464-Reviews-Kumana_National_Park-Ampara_Eastern_Province.html,Kumana National Park,4.4,129,https://dynamic-media-cdn.tripadvisor.com/media/photo-o/0d/51/3a/2e/birds-at-kumana.jpg?w=700&h=400&s=1,Dananjaya,"Matale, Sri Lanka",,5,Friends,"It was a great day to us at kumana. Nice place to visit with families and friends. Different kind of birds, lizards, snakes and nice environment. Hope to visit again with my family.","May 21, 2019",0.0,0.0
https://www.tripadvisor.com/Attraction_Review-g1815618-d3477464-Reviews-Kumana_National_Park-Ampara_Eastern_Province.html,Kumana National Park,4.4,129,https://dynamic-media-cdn.tripadvisor.com/media/photo-o/0d/51/3a/2e/birds-at-kumana.jpg?w=700&h=400&s=1,Rivon R,"Colombo, Sri Lanka",,5,Friends,"Tip 1 - Wanna spot the most elusive animal in the world, Leopard? Contact Manaf (0779690896) The way our driver tracked down the leopard was simply incredible! On that day almost every jeep we encountered said the leopards are no where to be found and they all left by 5.30 pm. But our driver was so determined and kept on repeating a small route (which he guessed there could be a leopard hiding) over and over again. When he repeated the same route for the 3rd time we got frustrated (thinking he's deceiving us) and almost asked him to leave the park. But when we came back for the 4th lap we were shocked to see some fresh leopard footprints over the tyre marks on the road (it had waited for us to move and then crossed the road!). Then he quickly took us to another route deep into the forest, all of a sudden booom the bad guy appeared on the road out of nowhere. The sighting lasted for about 5 min and we were the only jeep around :) By the end of the trip we almost ended up spotting all the animals the park had to offer! Tip 2 - Although we did the full day safari I guess an evening trip could be enough for you to spot all the main animals.","April 17, 2019",0.0,0.0
https://www.tripadvisor.com/Attraction_Review-g1815618-d3477464-Reviews-Kumana_National_Park-Ampara_Eastern_Province.html,Kumana National Park,4.4,129,https://dynamic-media-cdn.tripadvisor.com/media/photo-o/0d/51/3a/2e/birds-at-kumana.jpg?w=700&h=400&s=1,airlier,3 contributions,,5,Solo,The best of three stays in national parks this trip . Small group and solo specialist Extreme Nature Camp for three nights was a revelation in peaceful and beautiful river side simple camping with comforts. Highly qualified and experienced guiding and spotting in uncrowded locations let us experience animal behaviors not just ticking of a top five list. Personal favourite an encounter with King mongoose pair and a lovely Russells Viper. Exceptional waterbirding in this Ramsar listed lagoon landscape . Highly recommended.,"April 9, 2019",0.0,0.0
https://www.tripadvisor.com/Attraction_Review-g1815618-d3477464-Reviews-Kumana_National_Park-Ampara_Eastern_Province.html,Kumana National Park,4.4,129,https://dynamic-media-cdn.tripadvisor.com/media/photo-o/0d/51/3a/2e/birds-at-kumana.jpg?w=700&h=400&s=1,Kate,"Greymouth, New Zealand",,5,Couples,"We visited the park one week ago, and I can tell you that it was great. We are luckly enough to take our road, and we travel through the park along with our friendly ranger. The animals were so cute and amazing.","March 23, 2019",0.0,0.0
https://www.tripadvisor.com/Attraction_Review-g1815618-d3477464-Reviews-Kumana_National_Park-Ampara_Eastern_Province.html,Kumana National Park,4.4,129,https://dynamic-media-cdn.tripadvisor.com/media/photo-o/0d/51/3a/2e/birds-at-kumana.jpg?w=700&h=400&s=1,PRD2002-UK,3 contributions,,5,Couples,It is one of the best safari locations in Sri Lanka. We started the tour at about 02.30 pm. We were lucky enough to watch lot of birds. Dancing peacocks can be seen everywhere. There were few elephants close to the road. It was a really fantastic experience for me and my girlfriend.,"March 18, 2019",0.0,0.0
https://www.tripadvisor.com/Attraction_Review-g1815618-d3477464-Reviews-Kumana_National_Park-Ampara_Eastern_Province.html,Kumana National Park,4.4,129,https://dynamic-media-cdn.tripadvisor.com/media/photo-o/0d/51/3a/2e/birds-at-kumana.jpg?w=700&h=400&s=1,Buddhike G,"Colombo, Sri Lanka",,5,Missing,One of the best place to watch endemic birds in Sri Lanka. Must visit early in the morning to have a better experience,"January 15, 2019",0.0,0.0
https://www.tripadvisor.com/Attraction_Review-g1815618-d3477464-Reviews-Kumana_National_Park-Ampara_Eastern_Province.html,Kumana National Park,4.4,129,https://dynamic-media-cdn.tripadvisor.com/media/photo-o/0d/51/3a/2e/birds-at-kumana.jpg?w=700&h=400&s=1,Attanayake P,"Kandy, Sri Lanka",,4,Friends,"Relatively smaller national park located in the eastern province, in continuation with yala national park. But cannot visit yala from Kumana without special permission. You have to hire a safari jeep from Arugambay or panama. Usually half a day is enough. Much less crowded than yala. But lesser animals and birds compared to yala.","December 30, 2018",0.0,0.0
https://www.tripadvisor.com/Attraction_Review-g1815618-d3477464-Reviews-Kumana_National_Park-Ampara_Eastern_Province.html,Kumana National Park,4.4,129,https://dynamic-media-cdn.tripadvisor.com/media/photo-o/0d/51/3a/2e/birds-at-kumana.jpg?w=700&h=400&s=1,slsisira,"Kuwait City, Kuwait",,4,Missing,"This is a bounty of nature indeed! Wonderful place where you can collect lots of experience with respect to extremely rare  types of colorful birds, animals reptiles etc.  Compare to other national parks in Sri Lanka, Kumana is a calm and quiet place where you can enjoy the unique fascinating beauty of the nature intact till now. The safari guide provide by the wild life office had also done his best to make us understand the nature of the place, birds, animals, and its persistence under the thorough control of the wild life department.","December 14, 2018",0.0,0.0
https://www.tripadvisor.com/Attraction_Review-g1815618-d3477464-Reviews-Kumana_National_Park-Ampara_Eastern_Province.html,Kumana National Park,4.4,129,https://dynamic-media-cdn.tripadvisor.com/media/photo-o/0d/51/3a/2e/birds-at-kumana.jpg?w=700&h=400&s=1,Upul P,11 contributions,,5,Friends,"Such a beautiful scenic jungle with a variety of animals, birds and reptiles. One can enjoy the park as it is not spoilt with too many visitors and vehicles. Roaming animals have their freedom and we can enjoy the viewimg them in their Marital habitat. People of the country has to value these without dumping their rubbish out of their vehicles as plastics can be seen around and feel sorry. Authorities must take more care about the people who stay overnight in those rented bungalows with stringent rules requesting them to take their own rubbish out as they dump their alcohol empty bottles out in the beach and under the trees. Animals have left their foot prints only on the sand, beach and its so admirable while people leave their rubbish in a vergin jungle having a brain to think that it does not decay for centuries. Enjoy the view of the nature and leave nothing other than the type marks.","November 11, 2018",0.0,0.0
