Destination URL,Destination Title,Destination Score,Total Reviews (Destination),Destination Image,Reviewer Name,Reviewer Location,Review Title,Review Score,Reviewer Category,Review Text,Written Date,% %,  %
https://www.tripadvisor.com/Attraction_Review-g1815618-d3477464-Reviews-Kumana_National_Park-Ampara_Eastern_Province.html,Kumana National Park,4.4,129,https://dynamic-media-cdn.tripadvisor.com/media/photo-o/0d/51/3a/2e/birds-at-kumana.jpg?w=700&h=400&s=1,Sanna M,2 contributions,,5,Friends,"We saw so many different animals, elephants, crocodiles, colorful and big birds, buffalos, deers etc!! Also the area was really beautiful. We spent there about 5hours and after almost lost our hope to see leopard, we saw three(!!!) on the same road and also hear their voice from the jungle. It was almost 6pm and I think we were last ones there, we were so lucky! We book our tickets from Arugam travels. The driver was as excited about the leopards as we were, he stop the car on the road and we just sit there and wait to see them. This is also called Yala east national park, you can see same animals here than there but there are less people and less cars.","October 31, 2018",0.0,0.0
https://www.tripadvisor.com/Attraction_Review-g1815618-d3477464-Reviews-Kumana_National_Park-Ampara_Eastern_Province.html,Kumana National Park,4.4,129,https://dynamic-media-cdn.tripadvisor.com/media/photo-o/0d/51/3a/2e/birds-at-kumana.jpg?w=700&h=400&s=1,KettsOnTour,"Albion Park, Australia",,5,Missing,"This park is amazing. We did 3 safaris while in Sri Lanka, they were all great but and this was our favourite. The park was so quiet, we only saw one other jeep the whole afternoon, which was so refreshing after our busy safari at Kaudulla NP. The animals were abundant and so much variety. We saw elephants, buffalo, spotted deer, mongoose, countless birds, crocodiles. The only thing we weren't lucky to see was a leopard, maybe next time. The park itself is well kept and had a variety of environments. We just loved it. Our guide had a good eye and pointed out lots of animals, unfortunately we didnt get his name, but his picture is below, he was lovely and tried really hard to spot a leopard for us. If your in the area and love animals do this safari.","October 25, 2018",0.0,0.0
https://www.tripadvisor.com/Attraction_Review-g1815618-d3477464-Reviews-Kumana_National_Park-Ampara_Eastern_Province.html,Kumana National Park,4.4,129,https://dynamic-media-cdn.tripadvisor.com/media/photo-o/0d/51/3a/2e/birds-at-kumana.jpg?w=700&h=400&s=1,Anja W,10 contributions,,5,Friends,"I liked the park more than expected. We visited mid/end of September and saw lots of water buffaloes, deer, some elephants (one was really close and we could watch it for a while), crocodiles, monkeys, mungos and many colourful birds. Other groups even seemed to have spotted a leopard. Also there were not too many Jeeps, at times it felt as if we were the only ones there. Furthermore the landscape alone is just stunning and varies a lot throughout the park. In my opinion Kumana is a great option for people who want to avoid the crowds and want to see some local fauna in their natural habitat, but do not necessarily need to see huge herds of elephants and see spotting leopards as a nice bonus and not as the main reason to visit the park.","September 24, 2018",0.0,0.0
https://www.tripadvisor.com/Attraction_Review-g1815618-d3477464-Reviews-Kumana_National_Park-Ampara_Eastern_Province.html,Kumana National Park,4.4,129,https://dynamic-media-cdn.tripadvisor.com/media/photo-o/0d/51/3a/2e/birds-at-kumana.jpg?w=700&h=400&s=1,David C,"London, United Kingdom",,5,Couples,"I was expecting this to be mainly birds but we were about 5 metres from a leopard, saw crocodiles and such an excellent range of birds. Really quiet when we went, around 6am, with hardly another car in sight.Highly, highly recommended.","August 30, 2018",0.0,0.0
https://www.tripadvisor.com/Attraction_Review-g1815618-d3477464-Reviews-Kumana_National_Park-Ampara_Eastern_Province.html,Kumana National Park,4.4,129,https://dynamic-media-cdn.tripadvisor.com/media/photo-o/0d/51/3a/2e/birds-at-kumana.jpg?w=700&h=400&s=1,Francesco C,12 contributions,,5,Couples,"Amazing experience with Arugambay tour and his collaborators!! Manà, the driver, was really kind and explained carefully everything to us. We went for a nice swim in river in the park and saw really close elephants, crocodiles, buffalos, deers etc. The food also was great. We recommend this tour.","August 20, 2018",0.0,0.0
https://www.tripadvisor.com/Attraction_Review-g1815618-d3477464-Reviews-Kumana_National_Park-Ampara_Eastern_Province.html,Kumana National Park,4.4,129,https://dynamic-media-cdn.tripadvisor.com/media/photo-o/0d/51/3a/2e/birds-at-kumana.jpg?w=700&h=400&s=1,chanuruban,"Kandy, Sri Lanka",,4,Friends,not as populated as other national parks! real safari experience with tracking of animals is needed. good for bird watching in November to January.,"August 14, 2018",0.0,0.0
https://www.tripadvisor.com/Attraction_Review-g1815618-d3477464-Reviews-Kumana_National_Park-Ampara_Eastern_Province.html,Kumana National Park,4.4,129,https://dynamic-media-cdn.tripadvisor.com/media/photo-o/0d/51/3a/2e/birds-at-kumana.jpg?w=700&h=400&s=1,Maxi L,"Pottuvil, Sri Lanka",,5,Couples,"A very  nice place, you can see a lot of animals. Birds they looks so nice, elephants, leopard, crocodile and so on. The tour was with arugam bay tours. They are very good organizer","August 14, 2018",0.0,0.0
https://www.tripadvisor.com/Attraction_Review-g1815618-d3477464-Reviews-Kumana_National_Park-Ampara_Eastern_Province.html,Kumana National Park,4.4,129,https://dynamic-media-cdn.tripadvisor.com/media/photo-o/0d/51/3a/2e/birds-at-kumana.jpg?w=700&h=400&s=1,KriKrixx,2 contributions,,1,Couples,"The safari we booked was very poorly organized. A jeep broke down during the safari, so that it could only drive very slowly, our jeep had to stay behind all the time and could / did not want to overtake. In addition, our Jeep was in a very bad condition, dirty and with limited visibility. The return trip was therefore unbearably long. From the provider there was not even an apology at the end of the tour, which would have been the least, after all the circumstances!","August 11, 2018",0.0,0.0
https://www.tripadvisor.com/Attraction_Review-g1815618-d3477464-Reviews-Kumana_National_Park-Ampara_Eastern_Province.html,Kumana National Park,4.4,129,https://dynamic-media-cdn.tripadvisor.com/media/photo-o/0d/51/3a/2e/birds-at-kumana.jpg?w=700&h=400&s=1,Alex,"Galle, Sri Lanka",,5,Missing,"This park is next to Yala so it has a similar variety of wildlife but we were some of the only jeeps in the park. We saw 3 leopards walking down the dirt road, plenty of elephants etc","August 11, 2018",0.0,0.0
https://www.tripadvisor.com/Attraction_Review-g1815618-d3477464-Reviews-Kumana_National_Park-Ampara_Eastern_Province.html,Kumana National Park,4.4,129,https://dynamic-media-cdn.tripadvisor.com/media/photo-o/0d/51/3a/2e/birds-at-kumana.jpg?w=700&h=400&s=1,Gokul B,13 contributions,,5,Couples,"Booked a shared trip with Lemon Tree travel company in Arugam Bay. It cost us LKR 4500 per person. We had 2 other couples as well as one subdue traveller with us on our jeep. I would say the shared option was really good as it was lighter on the pocket for us, while we also got to meet some fellow travellers. If you hire the jeep solo from Lemon Tree the quote was around LKR 14000. We were super pleased with Lemon Tree’s service all around. We asked around all the tour companies in Arugam Bay before finalising, and we found most of them either not transparent or not properly communicative. In particular the guy in Ceylon Walking tours lied to us overstating the government entree fees to the park as LKR 4500 (when its common knowledge that it’s arounf LKR 2200) and also lied to us that the pilgrimage season was in November even though it was happening then. Manas from Lemon Tree on the other hand came across as a very ethical salesperson staying everything transparently and not trying to increase prices for us even when we were in a rush towards the end. Lemon tree was also the only one who arranged shared trips; all other operators would only arrange singular trips and if you want to share you would’ve to find other travellers! The drive through Kumana National park was fun. We had quite a few close elephant sightings. Buffaloes, birds, deers and monkeys we sighted in the plentiful. I also had a fleeting glimpse at a leopard before the shy animal strode off into the brush. I can imagine why they say it’s a birder’s paradise. Even though I am not a bird watcher I found the sheer variety of birds amazing. One tip would be to avoid going on weekends though as the number of jeeps in the park would be relatively higher as the locals too would be in to watch the animals on their day off. But again it’s still way less crowded than any other park I have been to, so go for it if you can’t pick any other day.","July 10, 2018",0.0,0.0
https://www.tripadvisor.com/Attraction_Review-g1815618-d3477464-Reviews-Kumana_National_Park-Ampara_Eastern_Province.html,Kumana National Park,4.4,129,https://dynamic-media-cdn.tripadvisor.com/media/photo-o/0d/51/3a/2e/birds-at-kumana.jpg?w=700&h=400&s=1,Annie Rose C,7 contributions,,4,Friends,"We booked our tour with the Ceylon Walking Tours office on the main Street in Arugam Bay. Nice company and okay pricing. The Safari truck could hold 6 passengers, we are a group of three, so they found a couple to join us. This was nice. Half day safari is fine - full day might be too much driving around. The roads are bunoy which adds to the experience. Our driver was great, friendly and abit knowledgeable.  He had a good eye for spotting animals. We saw three solo elephants and lots of deer and water buffalo, and crocodiles. We thought that maybe our Safari included. Guide but this wasn't the case - but that was okay. If you are a bird watcher this place would be paradise! Also nice for anybody to see the natural surroundings.","June 15, 2018",0.0,0.0
https://www.tripadvisor.com/Attraction_Review-g1815618-d3477464-Reviews-Kumana_National_Park-Ampara_Eastern_Province.html,Kumana National Park,4.4,129,https://dynamic-media-cdn.tripadvisor.com/media/photo-o/0d/51/3a/2e/birds-at-kumana.jpg?w=700&h=400&s=1,Chamila A,"Kandy, Sri Lanka",,5,Business,If you a birding guy this is the place you should visit. We saw more than 27 different species of birds within 1 square kilometer. No traffic inside the park as there were few jeeps running for the whole park.,"June 2, 2018",0.0,0.0
https://www.tripadvisor.com/Attraction_Review-g1815618-d3477464-Reviews-Kumana_National_Park-Ampara_Eastern_Province.html,Kumana National Park,4.4,129,https://dynamic-media-cdn.tripadvisor.com/media/photo-o/0d/51/3a/2e/birds-at-kumana.jpg?w=700&h=400&s=1,Kitta2,"Gold Coast, Australia",,4,Couples,"Started our safari around 1.30 pm and main target was to see leopard & bear. From Panama to park entrance is about 45 min as the roads are bumpy and unsealed. After paying entrance fee we were joined by a tracker - Chanaka who had a good knowledge and an eagle eye to look for animals. Within half an hour we were thrilled to see a leopard under a tree. In two seconds he slowly disappeared into bushes. Guaranteed sight in KNP is water buffaloes, Spotted deer, wild fox and wild pigs. Saw a crocodile resting on the bank. Bird information centre  where there is a tower overlooks the lagoon is the best place to watch birds. Fantastic info about different kind of birds on the walls at lookout point. Even though KNP is rich in bird life and most popular bird sanctuary in SL, we saw only few of them. Green bee eaters are commonly seen. Road conditions inside the park is much better than Yala NP. Better to start early morning or mid afternoon. On our way back saw a leopard in the treetop. As it was getting dark, didn't see him clearly. Well worth 4.5 hrs drive. Will be back to see bears and more birds later !!","May 24, 2018",0.0,0.0
https://www.tripadvisor.com/Attraction_Review-g1815618-d3477464-Reviews-Kumana_National_Park-Ampara_Eastern_Province.html,Kumana National Park,4.4,129,https://dynamic-media-cdn.tripadvisor.com/media/photo-o/0d/51/3a/2e/birds-at-kumana.jpg?w=700&h=400&s=1,adtravels2018,20 contributions,,5,Missing,"Less busy compared to Yala National Park, Kumana National Park boasts a wide range of wildlife including a large number of birds, mammals, lakes and trees. It's a bit hard to spot leopards or bears, but you're very likely to spot other animals like elephants, deer, buffalo etc.","April 23, 2018",0.0,0.0
https://www.tripadvisor.com/Attraction_Review-g1815618-d3477464-Reviews-Kumana_National_Park-Ampara_Eastern_Province.html,Kumana National Park,4.4,129,https://dynamic-media-cdn.tripadvisor.com/media/photo-o/0d/51/3a/2e/birds-at-kumana.jpg?w=700&h=400&s=1,Ruwan W,"Ratmalana, Sri Lanka",,4,Missing,"Visited Kumana national park for two days as it was the first visit to this area for my wife and kids. Had a pleasant safari with lots of birds, elephants, two Bears (mother and cub) and finally a leopard on our final game drive before leaving. My main intention was to see a tusker as the last tusker I saw in kumana was the late great ""Poottuwa"" before 2003 Had an enjoyable time at the Edakumbuka 1 campsite. The park was full of water so it was difficult to see much animals, visited the ruins of the Kumana village and school which brought me back memories of the village which I visited a few times as a young boy.","April 21, 2018",0.0,0.0
https://www.tripadvisor.com/Attraction_Review-g1815618-d3477464-Reviews-Kumana_National_Park-Ampara_Eastern_Province.html,Kumana National Park,4.4,129,https://dynamic-media-cdn.tripadvisor.com/media/photo-o/0d/51/3a/2e/birds-at-kumana.jpg?w=700&h=400&s=1,biresonvalois,"Montreal, Canada",,5,Friends,"The park: Had a great variety of animals. We saw jungle fowl, mongoose, wild boars, peacocks galore, samba and spotted deer, buffallo, monkeys, crocodiles and elephants. It wasn't very crowded, maybe 4 other jeeps were spotted. Gorgeous mangrove area with lookout point. Very interesting trees and birds. Best safari we had in Sri Lanka for variety of animals and sparsity of humans! The tour: Our tour was organized through our accommodation and it was definitely overpriced! 160 000 LAKs for 2 people. I would have really loved seat belts for the drive to and from the park, the driver was speeding through the local streets and it was bumpy, was quite nervous at times. Once in the park, he respected the speed limits. Their was no guide included, and he was not able to answer any questions in english about the animals or park. He went outside of the jeep at one point and picked up large mushrooms and peacock feathers until a local park ranger caught him and he had to put them back. He kept intimidating the elephants, even after we repeatedly asked to keep moving as we didn't want to scare them (we understand when it's for our safety if a lone male elephant shows signs of aggressivity, but this one was not). Finally at the end he asked for a tip which we said was included in the price of the tour.","April 10, 2018",0.0,0.0
https://www.tripadvisor.com/Attraction_Review-g1815618-d3477464-Reviews-Kumana_National_Park-Ampara_Eastern_Province.html,Kumana National Park,4.4,129,https://dynamic-media-cdn.tripadvisor.com/media/photo-o/0d/51/3a/2e/birds-at-kumana.jpg?w=700&h=400&s=1,Philip R,14 contributions,,2,Couples,"The tour I went on was poorly managed by Arugam Bay Khan Surfaris, located across the road from no worries restaurant. We paid 5000rupees per person for 6 people and a four hour tour with an English speaking guide. The steering of the safari jeep broke 10 seconds into the tour before we made it onto the road. We waited for an hour before a guy rocked up in a tuk tuk and started welding on the bottom of the car. We then set off again only for the engine to stop working 100m down the road. We then waited while they organised another jeep. Finally we set off on the tour of the park 2 hours later than planned. Since we were so late and the park closes 630pm they refunded 1000rupees, which is the normal price they charge for the short tour. When we got to the park gates at 350pm we were told there would be no guide. We had requested both when we booked and on the day of the tour to have a guide, and they assured me this would be arranged. The park itself is lovely, with lots of elephants, birds, deer, hogs, and buffalo. I would happily recommend it. We left the park after a bit less that 2hr30min. I explained I was unsatisfied with the tour and expected a partial refund as no guide was supplied, but no refund was given. Given the tour was shorter than even their shortest advertised tour and with no guide this is not good enough. Do visit Kumana national Park but avoid Arugam Bay Khan Surfaris.","March 31, 2018",0.0,0.0
https://www.tripadvisor.com/Attraction_Review-g1815618-d3477464-Reviews-Kumana_National_Park-Ampara_Eastern_Province.html,Kumana National Park,4.4,129,https://dynamic-media-cdn.tripadvisor.com/media/photo-o/0d/51/3a/2e/birds-at-kumana.jpg?w=700&h=400&s=1,Prasad U,Sri Lanka,,5,Friends,"I got the opportunity to have a Jeep Safari to kumana National park during my annual staff trip to Arugam bay. kumana Safari is the best safari I have in Sri Lanka so far with many u forgettable memories. Overall there are few reasons to be made this journey most attractive. First is the timing chosen for the Safari. It is January so that after having some rains whole park is in lush greenery. We started the journey from Arugam bay at about 2.30 pm and after about one hour travel we reached to the Kumana National park entrance. Total safari inside the park was about 3 hours from 3.30 to 6.30 pm so that it is one of the best time to see animals in kumana. Second reason; Kumana is still remain untouched by many visitors and Safari is not yet spoiled by lot of jeeps at once like in some other National parks in Sri Lanka. In some other parks it seems nos. Of jeeps are more than the animals in the park hence can not feel and enjoy the real Safari. In kumana, most attractively there are lot of animals and birds with many verities. Deers , elephants , wild bore, buffaloes , peacocks & many migrant birds, crocadiles and many others. Unforgettable climax point of the Safari is we were very lucky to see a leopard at very close distance. This is very rare opportunity in Sri Lanka and some travelers have to spend over night in camping site to eye catch such a scenery . So Kumana safari is recommended as one of the best safari in Sri Lanka . We all 4 jeeps together in this journey and paid Rs. 6000/- per seven seated Jeep for its whole journey of 5 hours","January 20, 2018",0.0,0.0
https://www.tripadvisor.com/Attraction_Review-g1815618-d3477464-Reviews-Kumana_National_Park-Ampara_Eastern_Province.html,Kumana National Park,4.4,129,https://dynamic-media-cdn.tripadvisor.com/media/photo-o/0d/51/3a/2e/birds-at-kumana.jpg?w=700&h=400&s=1,Rock J,Sri Lanka,,5,Missing,it's a very beautiful place. it's located in pothuvil city. mostly if you go to arugamby don't forget go to kumana national park. its a 1.30 hore jurny to inside the forest. full and full natural and you can see the live animals. you can't go by walk to the inside. you have to hire a safari vehicle for that. more info +94779992177 what's up me,"January 10, 2018",0.0,0.0
https://www.tripadvisor.com/Attraction_Review-g1815618-d3477464-Reviews-Kumana_National_Park-Ampara_Eastern_Province.html,Kumana National Park,4.4,129,https://dynamic-media-cdn.tripadvisor.com/media/photo-o/0d/51/3a/2e/birds-at-kumana.jpg?w=700&h=400&s=1,Harsha H,"Melbourne, Australia",,5,Friends,"Lovely place to visit during the season. Can see thousands of different variety of non natiove birds flown from thousands of kilometers to have their summer holiday here in Kumana marshy lands. Do not forget to carry a binoculars if you want to watch the birds seriously. Beautiful drive in a 4 wheel drive through waterways. Lots of Elephants,Lepords, deer, Elk,Water Buffolows. It was a fantastic journey with a very good tracker and the park office you get loads of information about its habitat. Can visit the ""Kuda Kabilittha"", devalaya too on this visit.","August 23, 2017",0.0,0.0
https://www.tripadvisor.com/Attraction_Review-g1815618-d3477464-Reviews-Kumana_National_Park-Ampara_Eastern_Province.html,Kumana National Park,4.4,129,https://dynamic-media-cdn.tripadvisor.com/media/photo-o/0d/51/3a/2e/birds-at-kumana.jpg?w=700&h=400&s=1,Juan Román Luque,"Madrid, Spain",,3,Friends,"We had a great time in this place. The landscape is really beautiful and we saw all the animals expected to see, even de elusive leopard. It is not a crowded place so you can enjoy the nature in relative calm, but we also had a sad feeling as we realized that every two meters there was plastic rubbish along the sides of every path. We found plastic bottles and bags scattered everywhere near the paths inside the National Park. Authorities and neglectful visitors should be ashamed of this situation. Surprisingly, other more crowded National Parks, such as Horton or Kaudulla, were much more clean.","August 23, 2017",0.0,0.0
https://www.tripadvisor.com/Attraction_Review-g1815618-d3477464-Reviews-Kumana_National_Park-Ampara_Eastern_Province.html,Kumana National Park,4.4,129,https://dynamic-media-cdn.tripadvisor.com/media/photo-o/0d/51/3a/2e/birds-at-kumana.jpg?w=700&h=400&s=1,Charith B,"Colombo, Sri Lanka",,5,Couples,"The early morning safari is the best for birds watching as we saw so many birds during 4 hr safari. While on the way back, you can visit Kudumbigala temple which has a unique physical location.","August 6, 2017",0.0,0.0
https://www.tripadvisor.com/Attraction_Review-g1815618-d3477464-Reviews-Kumana_National_Park-Ampara_Eastern_Province.html,Kumana National Park,4.4,129,https://dynamic-media-cdn.tripadvisor.com/media/photo-o/0d/51/3a/2e/birds-at-kumana.jpg?w=700&h=400&s=1,Clacla L,"Guignen, France",,5,Couples,"We made a 6-hours safari in the national park in a jeep with a Sri Lankan driver. We saw all we wanted to see (elephants, leopard, deers...) even if there was a pilgrimage crossing the park. Really great moment!","July 28, 2017",0.0,0.0
https://www.tripadvisor.com/Attraction_Review-g1815618-d3477464-Reviews-Kumana_National_Park-Ampara_Eastern_Province.html,Kumana National Park,4.4,129,https://dynamic-media-cdn.tripadvisor.com/media/photo-o/0d/51/3a/2e/birds-at-kumana.jpg?w=700&h=400&s=1,181ShellBell,"Sydney, Australia",,3,Missing,"I think we were the unlucky ones that didn't get to see groups of elephants which is all we wanted to see. We saw one elephant in the far distance and then one elephant in the bushes and one outside the park heading to the beach. Everyone else I spoke to that had done this tour said they saw loads of elephants. There were lots of water buffulo and deers plus we saw some crocodiles towards the end. Oh and lots of peacocks plus monkeys at one stop.  Need to take a good camera. Prices to vary a bit we paid 5,500 LKR per person  including jeep and entry.","July 21, 2017",0.0,0.0
https://www.tripadvisor.com/Attraction_Review-g1815618-d3477464-Reviews-Kumana_National_Park-Ampara_Eastern_Province.html,Kumana National Park,4.4,129,https://dynamic-media-cdn.tripadvisor.com/media/photo-o/0d/51/3a/2e/birds-at-kumana.jpg?w=700&h=400&s=1,Maleeha B,"Colombo, Sri Lanka",,3,Missing,I've enjoyed the yala safari better - for the size of this national park there aren't many living there.,"July 15, 2017",0.0,0.0
https://www.tripadvisor.com/Attraction_Review-g1815618-d3477464-Reviews-Kumana_National_Park-Ampara_Eastern_Province.html,Kumana National Park,4.4,129,https://dynamic-media-cdn.tripadvisor.com/media/photo-o/0d/51/3a/2e/birds-at-kumana.jpg?w=700&h=400&s=1,Chris M,24 contributions,,4,Couples,"We opted for an early morning tour of the park, departing at 5am from Arugam Bay. A jeep with Ceylon Walking Tours cost 8,000LKR including driver and guide, and we split it among 4 people. The journey to the park entrance takes about 40 minutes. We arrived as the park opened up at 6am. Entrance for 4 tourists was 8600LKR, so 2150LKR each. As with everything else in Sri Lanka, it is much cheaper for locals, and you do get the feeling you are once again just subsidising their own domestic tourism industry, rather than supporting a good cause. The climate is noticeably cooler at this time of day. The park is enormous. We spent about 4 hours there in total, driving all the way to the river which divides it and Yala Strict Natural Reserve. Along the way we spotted one large and very surprised elephant, mongooses, deer, crocs, water buffalo and numerous wild bird species (although our guide informed us that we had missed the main migratory season to see all the bird life). All the while we were desperately looking for any sign of a leopard, straining our eyes up to every tree branch and rock we passed. However despite bumping along miles of track, all we saw were pawprints. Disappointing but given a park of this size where animals are also free to roam into Yala, understandable. It was a shame because we did feel we were mis-sold the trip a little, in that we were assured the morning would be a great time to spot leopards, and many visitors had seen them recently. Go with limited expectations, and a packed lunch, and you won't be disappointed!","June 24, 2017",0.0,0.0
