Destination URL,Destination Title,Destination Score,Total Reviews (Destination),Destination Image,Reviewer Name,Reviewer Location,Review Title,Review Score,Reviewer Category,Review Text,Written Date,% %,  %
https://www.tripadvisor.com/Attraction_Review-g304138-d2534649-Reviews-Udawattekele_Sanctuary-Kandy_Kandy_District_Central_Province.html,Udawattekele Sanctuary,4.2,400,https://dynamic-media-cdn.tripadvisor.com/media/photo-o/16/30/91/77/view-from-the-sanctuary.jpg?w=700&h=400&s=1,Devika F,"Kandy, Sri Lanka",,4,Missing,"Not far from one of the main attractions (the Temple of the Sacred Tooth Relic) and from the hustle and bustle of the city, this sanctuary is the perfect place to breathe easy and feast your eyes on some local flora. You can walk around for several hours, the ticket price is fair, and you'll find it much less crowded than for example the Botanical Garden in Peradeniya. Chances are high that you'll catch a glimpse of monkeys. While there's nothing spectacular awaiting you at Udawattekele, it offers a great opportunity for easy hiking, a spot to view the city below, and some old hermit monk dwellings.","August 13, 2018",0.0,0.0
https://www.tripadvisor.com/Attraction_Review-g304138-d2534649-Reviews-Udawattekele_Sanctuary-Kandy_Kandy_District_Central_Province.html,Udawattekele Sanctuary,4.2,400,https://dynamic-media-cdn.tripadvisor.com/media/photo-o/16/30/91/77/view-from-the-sanctuary.jpg?w=700&h=400&s=1,the_finchley_lees,"London, United Kingdom",,5,Couples,"Even tho our visit was short, it was a highlight of Kandy. We saw monkeys only. Perhaps mid-afternoon was not the best time to go. We did see a giant monitor lizard and a scorpion. The trees were magnificent. We walked past it at first, it is set back off the road by the side of a Buddhist edifice. The loos were nice. It was a bit expensive and getting past the bureaucracy in the hut was very amusing and colonial","August 5, 2018",0.0,0.0
https://www.tripadvisor.com/Attraction_Review-g304138-d2534649-Reviews-Udawattekele_Sanctuary-Kandy_Kandy_District_Central_Province.html,Udawattekele Sanctuary,4.2,400,https://dynamic-media-cdn.tripadvisor.com/media/photo-o/16/30/91/77/view-from-the-sanctuary.jpg?w=700&h=400&s=1,Diana Mangalagiu,"Paris, France",,5,Couples,"Reading the review on this site we were very hesitant to go. But the forest is a really rewarding experience, The forest is beautiful, the paths are very easy to walk on and not artificial, so you have the feeling of being in a forest and not in a park. We were alone for most of the time. It’s definitely worth the couple of dollars of entrance fees.","August 2, 2018",0.0,0.0
https://www.tripadvisor.com/Attraction_Review-g304138-d2534649-Reviews-Udawattekele_Sanctuary-Kandy_Kandy_District_Central_Province.html,Udawattekele Sanctuary,4.2,400,https://dynamic-media-cdn.tripadvisor.com/media/photo-o/16/30/91/77/view-from-the-sanctuary.jpg?w=700&h=400&s=1,Catherine,"Singapore, Singapore",,4,Solo,"If you need to escape the City, but don’t want to have to travel out too far or pay too much, then this is a great option. Easy to walk there and then walk around (I would say child friendly), it costs half of what the Botanical Gardens does (662 rupees)- it still annoys me when you have to pay to enter such places, but maybe I have been spoilt back home with free entry. Anyway, it is a very well preserved natural park full of wildlife. I saw deer, butterfly, monkeys and even an eagle soar overhead. You can hear so much more though. I spent a lovely 2 hours wandering around the paths and enjoying the view out across Kandy from the viewpoint. Really glad I went.","July 26, 2018",0.0,0.0
https://www.tripadvisor.com/Attraction_Review-g304138-d2534649-Reviews-Udawattekele_Sanctuary-Kandy_Kandy_District_Central_Province.html,Udawattekele Sanctuary,4.2,400,https://dynamic-media-cdn.tripadvisor.com/media/photo-o/16/30/91/77/view-from-the-sanctuary.jpg?w=700&h=400&s=1,wkhasintha,"Colombo, Sri Lanka",,4,Missing,"As a nature lover, this must be me favourite place in Kandy. Towering high trees and silence absorbs you into its warmth. Dunno who's genius ideas was to name signboards in Sinhala as most of the visitors are foreign. (irony)","July 25, 2018",0.0,0.0
https://www.tripadvisor.com/Attraction_Review-g304138-d2534649-Reviews-Udawattekele_Sanctuary-Kandy_Kandy_District_Central_Province.html,Udawattekele Sanctuary,4.2,400,https://dynamic-media-cdn.tripadvisor.com/media/photo-o/16/30/91/77/view-from-the-sanctuary.jpg?w=700&h=400&s=1,prabhu dop,"Chennai (Madras), India",,3,Solo,located between beautiful ......green hills ........with lovely wind .....good walk wear proper comfortable peaceful walk with lots of wildlife,"July 24, 2018",0.0,0.0
https://www.tripadvisor.com/Attraction_Review-g304138-d2534649-Reviews-Udawattekele_Sanctuary-Kandy_Kandy_District_Central_Province.html,Udawattekele Sanctuary,4.2,400,https://dynamic-media-cdn.tripadvisor.com/media/photo-o/16/30/91/77/view-from-the-sanctuary.jpg?w=700&h=400&s=1,simplykarina,"Manila, Philippines",,4,Solo,Perfect morning stroll with wildlife--- way to escape the busy overwhelming streets of Kandy. I absolutely loved this park--- it was a good walk around.,"July 22, 2018",0.0,0.0
https://www.tripadvisor.com/Attraction_Review-g304138-d2534649-Reviews-Udawattekele_Sanctuary-Kandy_Kandy_District_Central_Province.html,Udawattekele Sanctuary,4.2,400,https://dynamic-media-cdn.tripadvisor.com/media/photo-o/16/30/91/77/view-from-the-sanctuary.jpg?w=700&h=400&s=1,Ibrahim Razvi,"Lahore, Pakistan",,4,Missing,We had a wonderful walk at this place. There are a lot of fish in this water. We were giving them food and they were just coming close to us. We also had a beautiful view of this lake from our apartment.,"July 21, 2018",0.0,0.0
https://www.tripadvisor.com/Attraction_Review-g304138-d2534649-Reviews-Udawattekele_Sanctuary-Kandy_Kandy_District_Central_Province.html,Udawattekele Sanctuary,4.2,400,https://dynamic-media-cdn.tripadvisor.com/media/photo-o/16/30/91/77/view-from-the-sanctuary.jpg?w=700&h=400&s=1,KellynJames999,"Perth, Australia",,5,Couples,"We went to the sanctuary on a Monday morning and had a wonderful experience. We were literally the only people in the sanctuary aside from a couple workers cleaning the paths - it was very peaceful. We saw barking deer, monkeys, wild boars and heard and saw about a hundred bird species. The sanctuary is very well maintained. We spent about 3 hours there and think the money for entry was well worth it. You do not need a guide, although they may be able to provide explanation of the sanctuary’s history (we read about it before and after and found that was enough). The only thing to watch out for is the leeches. We only had an issue with this when trying to hike to the lookout (which in the end we couldn’t find - it may be overgrown by large trees now or we may have missed the trail as there are a few leading to the top). The leeches are quite small but easy to spot wriggling up your shoes. Spraying your shoes/feet and legs with insect repellent beforehand would solve this problem. It was also raining a little off and on while we were there so you may not have this issue on dry days. Enjoy the sanctuary and keep it as clean as it was when we visited!","July 19, 2018",0.0,0.0
https://www.tripadvisor.com/Attraction_Review-g304138-d2534649-Reviews-Udawattekele_Sanctuary-Kandy_Kandy_District_Central_Province.html,Udawattekele Sanctuary,4.2,400,https://dynamic-media-cdn.tripadvisor.com/media/photo-o/16/30/91/77/view-from-the-sanctuary.jpg?w=700&h=400&s=1,Emma B,50 contributions,,2,Couples,"A nice walk in the forest but cost to foreigners is now about 1100 rupees ($10) and not worth it.  We may have been unlucky as saw or heard few birds. Saw monkeys. Nice view over Kandy from top. Paths are well kept and clean, and quiet place to walk but way way too expensive and had to argue with booth personnel for change.  He had change but did not want to give it out.","June 19, 2018",0.0,0.0
https://www.tripadvisor.com/Attraction_Review-g304138-d2534649-Reviews-Udawattekele_Sanctuary-Kandy_Kandy_District_Central_Province.html,Udawattekele Sanctuary,4.2,400,https://dynamic-media-cdn.tripadvisor.com/media/photo-o/16/30/91/77/view-from-the-sanctuary.jpg?w=700&h=400&s=1,Vishwa N,"Kandy, Sri Lanka",,5,Business,"While enjoying the beauty of the forest, we can cycle along the marked trails through the forest. This would be an unforgettable experience for anyone.","June 4, 2018",0.0,0.0
https://www.tripadvisor.com/Attraction_Review-g304138-d2534649-Reviews-Udawattekele_Sanctuary-Kandy_Kandy_District_Central_Province.html,Udawattekele Sanctuary,4.2,400,https://dynamic-media-cdn.tripadvisor.com/media/photo-o/16/30/91/77/view-from-the-sanctuary.jpg?w=700&h=400&s=1,Wellingt0n_Traveller,"London, United Kingdom",,4,Couples,"This is a lovely forest close to Kandy town. As the streets are so busy we loved the opportunity to be able to walk around freely. The entrance fee for two of us was 1350 rupees. We saw lots of gorgeous monkeys and had some friendly dogs walk with us for awhile. My husband also saw a large snake cross the path (maybe 2m)!! The track is easy and not muddy, we were fine in flip flops.  I was a little bit worried after the snake sighting but I'm sure it's fine if you stick to the paths.","May 3, 2018",0.0,0.0
https://www.tripadvisor.com/Attraction_Review-g304138-d2534649-Reviews-Udawattekele_Sanctuary-Kandy_Kandy_District_Central_Province.html,Udawattekele Sanctuary,4.2,400,https://dynamic-media-cdn.tripadvisor.com/media/photo-o/16/30/91/77/view-from-the-sanctuary.jpg?w=700&h=400&s=1,ksamarasrna,"Colombo, Sri Lanka",,5,Missing,"go as early as possible, few pleasures of Kandy can match the beauty of the long walk in Udawaththekele in the Morning. leave behind the camera and let the foliage ,the greenery and chirping of birds dive in to the mind.The jungle seductively envelops the self ,leaving virtually zero sense of the bustling town.. an excellent array of butterflies and the occasional mountain eagle perched on a branch ,getting ready for the day's chores would not miss the eye.","April 27, 2018",0.0,0.0
https://www.tripadvisor.com/Attraction_Review-g304138-d2534649-Reviews-Udawattekele_Sanctuary-Kandy_Kandy_District_Central_Province.html,Udawattekele Sanctuary,4.2,400,https://dynamic-media-cdn.tripadvisor.com/media/photo-o/16/30/91/77/view-from-the-sanctuary.jpg?w=700&h=400&s=1,EnglandFoodie1,72 contributions,,4,Missing,It is hard to imagine you are so close to the noise and bustle of Kandy city centre as you walk through along the paths of this former royal forest.  It makes a cool peaceful interlude in sightseeing,"April 3, 2018",0.0,0.0
https://www.tripadvisor.com/Attraction_Review-g304138-d2534649-Reviews-Udawattekele_Sanctuary-Kandy_Kandy_District_Central_Province.html,Udawattekele Sanctuary,4.2,400,https://dynamic-media-cdn.tripadvisor.com/media/photo-o/16/30/91/77/view-from-the-sanctuary.jpg?w=700&h=400&s=1,palawanismyhome,"Palawan Island, Philippines",,5,Solo,"If you are visiting Kandy you should not miss the opportunity to spend a few hours in Udawattekele Sanctuary where you can see deer, wild boar monkeys and possibly some birds. As soon as you have aid your entrance fee you will see the rather muddy Royal Pond then you can wander on to the viewpoint and the information center before hiking round the other side and seeing the meditation caves. This is really a beautiful forest which shelters you from the heat of Kandy, and gets you away from the polluted city due to exhaust fumes. there are plenty of benches to rest on and you will see many monkeys.","March 23, 2018",0.0,0.0
https://www.tripadvisor.com/Attraction_Review-g304138-d2534649-Reviews-Udawattekele_Sanctuary-Kandy_Kandy_District_Central_Province.html,Udawattekele Sanctuary,4.2,400,https://dynamic-media-cdn.tripadvisor.com/media/photo-o/16/30/91/77/view-from-the-sanctuary.jpg?w=700&h=400&s=1,SEBM1981,"London, United Kingdom",,5,Solo,This should really feature much higher on the list of things to do! It’s a lovely hours walk around the jungle and it’s in the middle of the city!! Saw some monkeys and jungle dear and the vegetation is amazing just look out for leaches. The only annoying thing was that they wouldn’t let me go on my own so the tuk tuk driver had to come with me - for safety - as I’m just a woman...grrr,"March 12, 2018",0.0,0.0
https://www.tripadvisor.com/Attraction_Review-g304138-d2534649-Reviews-Udawattekele_Sanctuary-Kandy_Kandy_District_Central_Province.html,Udawattekele Sanctuary,4.2,400,https://dynamic-media-cdn.tripadvisor.com/media/photo-o/16/30/91/77/view-from-the-sanctuary.jpg?w=700&h=400&s=1,esalagean,"Lausanne, Switzerland",,4,Missing,"We spent 2 hours waliking in this Forrest which is basically located right above the temple of the tooth, but is unknown to most tourists. We Saw wild boars, monkeys, birds. There is a great viewpoint over the lake & city. It is a really relaxing activity to do to escape Kandys pollution and noise. Recommended!","March 2, 2018",0.0,0.0
https://www.tripadvisor.com/Attraction_Review-g304138-d2534649-Reviews-Udawattekele_Sanctuary-Kandy_Kandy_District_Central_Province.html,Udawattekele Sanctuary,4.2,400,https://dynamic-media-cdn.tripadvisor.com/media/photo-o/16/30/91/77/view-from-the-sanctuary.jpg?w=700&h=400&s=1,Oak & Heather,"Rhayader, United Kingdom",,5,Couples,This is a jungle nature reserve just a stones throw from the busy centre.  It felt as though we were the only people there.  You can walk for miles through it.  There is a rangers hut with an interesting display of the wildlife you may see.,"February 26, 2018",0.0,0.0
https://www.tripadvisor.com/Attraction_Review-g304138-d2534649-Reviews-Udawattekele_Sanctuary-Kandy_Kandy_District_Central_Province.html,Udawattekele Sanctuary,4.2,400,https://dynamic-media-cdn.tripadvisor.com/media/photo-o/16/30/91/77/view-from-the-sanctuary.jpg?w=700&h=400&s=1,Albia-Newton,"Evanton, United Kingdom",,5,Couples,A peaceful place to escape the city and go walking in the forest Lots of birds and monkeys A pleasant series of trails exist which vary from about a mile up to three miles in length,"February 23, 2018",0.0,0.0
https://www.tripadvisor.com/Attraction_Review-g304138-d2534649-Reviews-Udawattekele_Sanctuary-Kandy_Kandy_District_Central_Province.html,Udawattekele Sanctuary,4.2,400,https://dynamic-media-cdn.tripadvisor.com/media/photo-o/16/30/91/77/view-from-the-sanctuary.jpg?w=700&h=400&s=1,Lesley S,"Didcot, United Kingdom",,5,Couples,Went to the entrance by tuk tuk and then walked one of the trails on the map we were given. Huge trees with amazing lianas trailing over them. Great treat was a large group of monkeys crossing the path and completely ignoring us whilst playing / squabbling amongst themselves,"February 20, 2018",0.0,0.0
https://www.tripadvisor.com/Attraction_Review-g304138-d2534649-Reviews-Udawattekele_Sanctuary-Kandy_Kandy_District_Central_Province.html,Udawattekele Sanctuary,4.2,400,https://dynamic-media-cdn.tripadvisor.com/media/photo-o/16/30/91/77/view-from-the-sanctuary.jpg?w=700&h=400&s=1,rdubbs08,"Edmond, Oklahoma",,5,Missing,"There is a minimal entry fee, but it is well worth it for an awesome morning walk among Sri Lankan nature. The trails were easy to navigate and we saw numerous deer and monkey's. There are different trail options, but we spent just over an hour or so exploring the ""jungle."" It is mostly shaded, so makes for a nice leisurely stroll or jog. We ran into a few other folks along the way, but not too many. This was well worth our time and gave us a serene break from the somewhat other chaos of Kandy!","February 20, 2018",0.0,0.0
https://www.tripadvisor.com/Attraction_Review-g304138-d2534649-Reviews-Udawattekele_Sanctuary-Kandy_Kandy_District_Central_Province.html,Udawattekele Sanctuary,4.2,400,https://dynamic-media-cdn.tripadvisor.com/media/photo-o/16/30/91/77/view-from-the-sanctuary.jpg?w=700&h=400&s=1,D_Arthur123,"Brussels, Belgium",,2,Couples,"How to get there by foot: Indentify Kandy municipality council on the map and walk there. The building will be on your left, you continue up on that main street. A panel will then point you in the direction of the entrance (always straight on anyway). The entrance fee is only 30LKR for Sril Lankan people. But for the ""foreigners"", who are of course very wealthy, it is 660LKR, which is ""only"" 22 times the normal price. Wouhou! Nevermind... you are now in the forest, and you can enjoy the walk. We spend 2 hours and saw lots of deers and monkeys. However, it is a forest, nothing special, and you can generaly walk in any forest in the world for free. The only reason we went there is because we had so extra time to spend in Kandy, but if you skip it, you won't miss anything. PS: for the amount of money they get from the ""foreigners"", they could at least clean the toilets (just after the entrance, on the left). They are absolutely disgusting and have never been clean, that's for sure.","February 19, 2018",0.0,0.0
https://www.tripadvisor.com/Attraction_Review-g304138-d2534649-Reviews-Udawattekele_Sanctuary-Kandy_Kandy_District_Central_Province.html,Udawattekele Sanctuary,4.2,400,https://dynamic-media-cdn.tripadvisor.com/media/photo-o/16/30/91/77/view-from-the-sanctuary.jpg?w=700&h=400&s=1,"QICONG, ZHENG",Taiwan,,2,Solo,I travelled in the late morning when there are people scattered in the park. A lone local man wandering around and asked me if I have water. Quite strange already. Then he followed me into a small dirt trail to a view point (with no view actually). Luckily there were a couple there. After that he followed me to like every single corner! And he seems to know the park really well so that he knew to take a short cut when I walked very fast to try to get rid of him. I made sure I was not mistaken by waiting and let him pass and retrieved to the crossing and saw him coming back. I did not know what he wanted. Finally I went with other travellers and exit the park. This totally ruined my experience of the park. I wrote this to warn other female solo traveller especially physically small like me to be very careful when you visit this park.,"February 17, 2018",0.0,0.0
https://www.tripadvisor.com/Attraction_Review-g304138-d2534649-Reviews-Udawattekele_Sanctuary-Kandy_Kandy_District_Central_Province.html,Udawattekele Sanctuary,4.2,400,https://dynamic-media-cdn.tripadvisor.com/media/photo-o/16/30/91/77/view-from-the-sanctuary.jpg?w=700&h=400&s=1,Melchiorum,"Vilnius, Lithuania",,4,Solo,"If you get tired of all the urban hustle and bustle, this forest sanctuary is exactly what you need. It is literally a piece of a rainforest right in the middle of the city. Simply the umbral paths, listen to numerous birds and observe the wildlife. Visit it early morning for best experience, as you will enjoy the incredible misty atmosphere with beautiful rays of light breaking through the canopy. You will also pretty much have the entire forest for yourself, as there’re no tourists there in the morning. The entrance price for foreigners is a tad too high though and it seems to only get higher as time goes by.","February 14, 2018",0.0,0.0
https://www.tripadvisor.com/Attraction_Review-g304138-d2534649-Reviews-Udawattekele_Sanctuary-Kandy_Kandy_District_Central_Province.html,Udawattekele Sanctuary,4.2,400,https://dynamic-media-cdn.tripadvisor.com/media/photo-o/16/30/91/77/view-from-the-sanctuary.jpg?w=700&h=400&s=1,lakshmanisaac,"Kandy District, Sri Lanka",,5,Friends,Beautiful location with many varieties of trees and plants five minutes walk from the busy kandy city good location to get away from the city pollution,"February 9, 2018",0.0,0.0
https://www.tripadvisor.com/Attraction_Review-g304138-d2534649-Reviews-Udawattekele_Sanctuary-Kandy_Kandy_District_Central_Province.html,Udawattekele Sanctuary,4.2,400,https://dynamic-media-cdn.tripadvisor.com/media/photo-o/16/30/91/77/view-from-the-sanctuary.jpg?w=700&h=400&s=1,Joanne C,74 contributions,,4,Couples,"Spent a couple of hours exploring this park. Once past the entrance we weren’t inundated by monkeys and could enjoy the walk. As many people have said, the map they give you is useless, as is google maps. The cave was super creepy.","February 7, 2018",0.0,0.0
https://www.tripadvisor.com/Attraction_Review-g304138-d2534649-Reviews-Udawattekele_Sanctuary-Kandy_Kandy_District_Central_Province.html,Udawattekele Sanctuary,4.2,400,https://dynamic-media-cdn.tripadvisor.com/media/photo-o/16/30/91/77/view-from-the-sanctuary.jpg?w=700&h=400&s=1,Pat G,"Gaborone, Botswana",,3,Couples,This udawattekel is on the Kandy Lake . As I said all these buildings  are well kept and painted  white. It on the lake  and I dud not visit inside.,"February 6, 2018",0.0,0.0
https://www.tripadvisor.com/Attraction_Review-g304138-d2534649-Reviews-Udawattekele_Sanctuary-Kandy_Kandy_District_Central_Province.html,Udawattekele Sanctuary,4.2,400,https://dynamic-media-cdn.tripadvisor.com/media/photo-o/16/30/91/77/view-from-the-sanctuary.jpg?w=700&h=400&s=1,Chilliflakes3,"London, United Kingdom",,5,Missing,"We had a lovely walk in this jungle. In the space of just an hour we saw terrapin, barking deer, wild boar and a variety of birds.","February 1, 2018",0.0,0.0
https://www.tripadvisor.com/Attraction_Review-g304138-d2534649-Reviews-Udawattekele_Sanctuary-Kandy_Kandy_District_Central_Province.html,Udawattekele Sanctuary,4.2,400,https://dynamic-media-cdn.tripadvisor.com/media/photo-o/16/30/91/77/view-from-the-sanctuary.jpg?w=700&h=400&s=1,GamW2015,"Perth, Australia",,3,Missing,"Quiet forest with low visitor numbers in Kandy. Good place for a walk, the paths were hilly  in places. Did not see any inside but the paths inside appeared to have been used by vehicles. Not much wildlife at the time (late in the day). Lots of tall tropical trees (some in flower), few local fruit trees, vines, a large waterhole were seen. This was effectively a small rain forest area, good for a few hours of walking.","January 31, 2018",0.0,0.0
https://www.tripadvisor.com/Attraction_Review-g304138-d2534649-Reviews-Udawattekele_Sanctuary-Kandy_Kandy_District_Central_Province.html,Udawattekele Sanctuary,4.2,400,https://dynamic-media-cdn.tripadvisor.com/media/photo-o/16/30/91/77/view-from-the-sanctuary.jpg?w=700&h=400&s=1,Sarah P,"Norwich, United Kingdom",,4,Couples,"We visited for three and a half hours. It cost 1255 rupees for two of us to enter. As usual locals got served first, so it took a while to get through. You get given a map but it’s not detailed so take a photo of the large map on a board on your left just as you go through. It details both routes you can walk. Easy to follow though there are some signs to direct you. Toilets near the entrance but really filthy and full of used sanitary products so I chose to pee in the woods! Take water as there’s nowhere to buy any refreshments. The forest is beautiful. We saw hundreds of monkeys very close up as they have no fear of humans. One stole my boyfriends lunch! We saw a deer too and heard many birds. The paths are easy to walk, I managed fine in flipflops. A welcome break from the traffic and easy to walk to from town. About 20 mins walk from the temple of the tooth relic.","January 28, 2018",0.0,0.0
https://www.tripadvisor.com/Attraction_Review-g304138-d2534649-Reviews-Udawattekele_Sanctuary-Kandy_Kandy_District_Central_Province.html,Udawattekele Sanctuary,4.2,400,https://dynamic-media-cdn.tripadvisor.com/media/photo-o/16/30/91/77/view-from-the-sanctuary.jpg?w=700&h=400&s=1,Clare M,"Uga, Spain",,5,Couples,A must see place for lovers of nature. The map isn't the best but part of the experience... Lots of places to explore and find ... A great few hours enjoying nature at its best. Not many people which helped make it enjoyable. We took a tuk tuk up and walked back down from the entrance.,"January 23, 2018",0.0,0.0
https://www.tripadvisor.com/Attraction_Review-g304138-d2534649-Reviews-Udawattekele_Sanctuary-Kandy_Kandy_District_Central_Province.html,Udawattekele Sanctuary,4.2,400,https://dynamic-media-cdn.tripadvisor.com/media/photo-o/16/30/91/77/view-from-the-sanctuary.jpg?w=700&h=400&s=1,Daniel B,"Fuerteventura, Spain",,5,Couples,Very nice park just in the middle of the city. We saw some wildlife and had a quiet morning walking around.,"January 23, 2018",0.0,0.0
https://www.tripadvisor.com/Attraction_Review-g304138-d2534649-Reviews-Udawattekele_Sanctuary-Kandy_Kandy_District_Central_Province.html,Udawattekele Sanctuary,4.2,400,https://dynamic-media-cdn.tripadvisor.com/media/photo-o/16/30/91/77/view-from-the-sanctuary.jpg?w=700&h=400&s=1,Jessica K,9 contributions,,3,Solo,"Took a 3 hr walk around the place. They need a better map, but i managed to find my way back to the entrance okay.  There is only one entrance into the park even though it looks like there are roads that go up into it from just beside the temple - the guards will let you know if you are wrong.","January 17, 2018",0.0,0.0
https://www.tripadvisor.com/Attraction_Review-g304138-d2534649-Reviews-Udawattekele_Sanctuary-Kandy_Kandy_District_Central_Province.html,Udawattekele Sanctuary,4.2,400,https://dynamic-media-cdn.tripadvisor.com/media/photo-o/16/30/91/77/view-from-the-sanctuary.jpg?w=700&h=400&s=1,Jonas Gunnarsson,"Stockholm, Sweden",,4,Missing,"It is kind of strange to take a walk in the jungle in the middle of the city, but Udawattekele offers just that. The paths are in the shade underneath the canopies, and there are quite a few birds around. Most of them are just heard, but sometimes, they can be spotted as well (bring binoculars). We didn't see any mammals but the toque macaques, but I understand they are there somewhere.","January 17, 2018",0.0,0.0
