Destination URL,Destination Title,Destination Score,Total Reviews (Destination),Destination Image,Reviewer Name,Reviewer Location,Review Title,Review Score,Reviewer Category,Review Text,Written Date,% %,  %
https://www.tripadvisor.com/Attraction_Review-g304138-d2534649-Reviews-Udawattekele_Sanctuary-Kandy_Kandy_District_Central_Province.html,Udawattekele Sanctuary,4.2,400,https://dynamic-media-cdn.tripadvisor.com/media/photo-o/16/30/91/77/view-from-the-sanctuary.jpg?w=700&h=400&s=1,Jess R,"Wolverhampton, United Kingdom",,3,Couples,"We stayed in Kandy two nights but only really had one day. Kandy town itself is quite overwhelming, very busy, dusty and dirty. Generally in Sri Lanka the people are friendly, welcoming and kind, however we found many people in Kandy (and certainly not all) quiet rude and always trying to con tourists. For example tuk tuks should cost around 100 rupees per mile but we were charged 500 rupees to go from town to the sanctuary (just over a mile). I know you are expected to negotiate however the people here seem to have gotten wind of prices in the U.K. and the west generally and just charge whatever they think you will pay. To some extent I don't mind paying more as a tourist however here you get the impression that the locals are enjoying conning you. The sanctuary was a nice way to get out of the town. It was quiet and peaceful and offered a quick getaway from town. We only really saw monkeys in the park and there was nowhere to buy water. There are toilets but they aren't the nicest.. there was also quite a lot of rubbish around the place which was a shame as the monkeys were playing with the plastic bottles. The entrance fee is 650 rupees (approximately £4ish) which is very reasonable however the local entry cost which is listed at the door is 30 rupees (20p) another example of how people seem to think here. Again I really don't mind paying double or even triple the local cost as a tourist but twenty times the cost is crazy especially when the same goes for food, transport and accommodation. The prices are higher in other cities for a reason, the place is clean and sewage is not flowing through the streets! If you do need to go to Kandy the park is worth a visit but if going to Sigiria rock or attractions in the north then stay closer to them for a more enjoyable day trip and to avoid Kandy town.","October 16, 2016",0.0,0.0
https://www.tripadvisor.com/Attraction_Review-g304138-d2534649-Reviews-Udawattekele_Sanctuary-Kandy_Kandy_District_Central_Province.html,Udawattekele Sanctuary,4.2,400,https://dynamic-media-cdn.tripadvisor.com/media/photo-o/16/30/91/77/view-from-the-sanctuary.jpg?w=700&h=400&s=1,Mireille G,"London, United Kingdom",,5,Couples,"A great walk. I would advise to take a tuk tuk to the entrance or you  will be exhausted climbing to reach it before you even get in. Walk back to the lake when you come out. Beautiful place, no one else around, we didn't see any birds or wild pigs at all, only lots of monkeys by the monastery and caves. Hot an humid, take some salt with you, if you get leeches stuck to your skin, don't pull them out, sprinkle salt on them and they will drop off. You cannot beat the view of Kandy and the lake from this sanctuary viewpoint.","October 16, 2016",0.0,0.0
https://www.tripadvisor.com/Attraction_Review-g304138-d2534649-Reviews-Udawattekele_Sanctuary-Kandy_Kandy_District_Central_Province.html,Udawattekele Sanctuary,4.2,400,https://dynamic-media-cdn.tripadvisor.com/media/photo-o/16/30/91/77/view-from-the-sanctuary.jpg?w=700&h=400&s=1,EmilyO1088,19 contributions,,5,Friends,"Spent the morning here, perfect to escape the busy city despite it being so close to the centre. Could do a variety of walks the longest being 5km. Saw various wildlife including lots of monkeys.","September 29, 2016",0.0,0.0
https://www.tripadvisor.com/Attraction_Review-g304138-d2534649-Reviews-Udawattekele_Sanctuary-Kandy_Kandy_District_Central_Province.html,Udawattekele Sanctuary,4.2,400,https://dynamic-media-cdn.tripadvisor.com/media/photo-o/16/30/91/77/view-from-the-sanctuary.jpg?w=700&h=400&s=1,waruna2013,"Kandy, Sri Lanka",,5,Friends,Udawattekelle is situated  in the ancient hill capital of srilanka . (Kandy ) It is one of the interesting  tracking  place . When you go inside the jungle can get unfogetable  experience .it is amazing .,"September 17, 2016",0.0,0.0
https://www.tripadvisor.com/Attraction_Review-g304138-d2534649-Reviews-Udawattekele_Sanctuary-Kandy_Kandy_District_Central_Province.html,Udawattekele Sanctuary,4.2,400,https://dynamic-media-cdn.tripadvisor.com/media/photo-o/16/30/91/77/view-from-the-sanctuary.jpg?w=700&h=400&s=1,James T,"Dubai, United Arab Emirates",,5,Solo,"This is a wonderful place to escape from the noise and traffic of Kandy. Just a short walk from the centre of town, you get to see local wildlife including monkeys, deer and maybe a snake or two. There is a brilliant view of the town from the viewpoint. Take water and enjoy a few hours away from it all....","September 15, 2016",0.0,0.0
https://www.tripadvisor.com/Attraction_Review-g304138-d2534649-Reviews-Udawattekele_Sanctuary-Kandy_Kandy_District_Central_Province.html,Udawattekele Sanctuary,4.2,400,https://dynamic-media-cdn.tripadvisor.com/media/photo-o/16/30/91/77/view-from-the-sanctuary.jpg?w=700&h=400&s=1,lakshmanisaac,"Kandy District, Sri Lanka",,5,Friends,It was great to see this place very clean and the very destructive monkeys around and most of the protected trees and plants was lucky to see some barking deer.,"September 13, 2016",0.0,0.0
https://www.tripadvisor.com/Attraction_Review-g304138-d2534649-Reviews-Udawattekele_Sanctuary-Kandy_Kandy_District_Central_Province.html,Udawattekele Sanctuary,4.2,400,https://dynamic-media-cdn.tripadvisor.com/media/photo-o/16/30/91/77/view-from-the-sanctuary.jpg?w=700&h=400&s=1,Sam I,"Liverpool, United Kingdom",,5,Couples,"This is a beautiful jungle retreat in the heart of bustling Kandy. Really worth the 650 LKR entrance fee, and providing you go when it is dry there is a very obvious path with no leeches in sight. The view over Kandy at point 4 on the map is worth the admission price alone. However, do NOT go to the washroom where. The men's are 'OK', but the women's are in some kind of faeces-strewn dungeon. Seriously, avoid at all costs. Also, take some bottled water with you, as they don't sell any in the park.","September 6, 2016",0.0,0.0
https://www.tripadvisor.com/Attraction_Review-g304138-d2534649-Reviews-Udawattekele_Sanctuary-Kandy_Kandy_District_Central_Province.html,Udawattekele Sanctuary,4.2,400,https://dynamic-media-cdn.tripadvisor.com/media/photo-o/16/30/91/77/view-from-the-sanctuary.jpg?w=700&h=400&s=1,Alicia_s8765,Slovakia,,5,Friends,It is near by Kandy city centre. You can walk there. It is quiet place where you can rest and beautiful view on Kandy.,"September 4, 2016",0.0,0.0
https://www.tripadvisor.com/Attraction_Review-g304138-d2534649-Reviews-Udawattekele_Sanctuary-Kandy_Kandy_District_Central_Province.html,Udawattekele Sanctuary,4.2,400,https://dynamic-media-cdn.tripadvisor.com/media/photo-o/16/30/91/77/view-from-the-sanctuary.jpg?w=700&h=400&s=1,marsheen72,"Liverpool, United Kingdom",,5,Missing,"Quite a walk on a hot day, but SO worth it for all the wonderful macaques - we observed 3 different families and were awe struck by them. Wear proper walking shoes/boots and stay on the main paths and out of the wetter undergrowth to avoid the much-reviewed leeches.","August 19, 2016",0.0,0.0
https://www.tripadvisor.com/Attraction_Review-g304138-d2534649-Reviews-Udawattekele_Sanctuary-Kandy_Kandy_District_Central_Province.html,Udawattekele Sanctuary,4.2,400,https://dynamic-media-cdn.tripadvisor.com/media/photo-o/16/30/91/77/view-from-the-sanctuary.jpg?w=700&h=400&s=1,JJ EDEN TOUR,"Kandy, Sri Lanka",,5,Missing,"Udawattekele sanctuary located just behind the tooth of temple in Kandy. it has well organize path for walking and cyclical tour. some of the endemic birds, monkeys, wild bore, and many reptiles...etc..","August 11, 2016",0.0,0.0
https://www.tripadvisor.com/Attraction_Review-g304138-d2534649-Reviews-Udawattekele_Sanctuary-Kandy_Kandy_District_Central_Province.html,Udawattekele Sanctuary,4.2,400,https://dynamic-media-cdn.tripadvisor.com/media/photo-o/16/30/91/77/view-from-the-sanctuary.jpg?w=700&h=400&s=1,Alex K,"Shanghai, China",,5,Couples,"This was one of our first experiences of the Sri Lankan countryside and we saw lots of interesting wildlife including monkeys, deer, turtles, snakes etc.  Definitely worth a visit, the only thing was that the signage was a little poor and we didn't go to all the places we wished to.","August 5, 2016",0.0,0.0
https://www.tripadvisor.com/Attraction_Review-g304138-d2534649-Reviews-Udawattekele_Sanctuary-Kandy_Kandy_District_Central_Province.html,Udawattekele Sanctuary,4.2,400,https://dynamic-media-cdn.tripadvisor.com/media/photo-o/16/30/91/77/view-from-the-sanctuary.jpg?w=700&h=400&s=1,Blaze705,"Sheffield, United Kingdom",,4,Missing,"After a morning being squashed at the Temple of the Tooth the Udawattekele Sanctuary was an oasis of calm. The walk through the forest was almost deserted apart from some monkeys, wild pigs and lots of butterflies. The viewpoint over Kandy was worth a visit as was the small visitor's centre which gave some information about the local wildlife. Despite being given a small map we managed to get lost as the signage is not good and the map is useless. However we thoroughly enjoyed the walk. make sure you wear sensible shoes as leeches lurk in the undergrowth.","August 1, 2016",0.0,0.0
https://www.tripadvisor.com/Attraction_Review-g304138-d2534649-Reviews-Udawattekele_Sanctuary-Kandy_Kandy_District_Central_Province.html,Udawattekele Sanctuary,4.2,400,https://dynamic-media-cdn.tripadvisor.com/media/photo-o/16/30/91/77/view-from-the-sanctuary.jpg?w=700&h=400&s=1,matthewgaskin,"London, United Kingdom",,3,Couples,"Worth going for the walk alone but don't hold out for much wildlife. We saw a few monkeys, a deer and a few birds but thats about it. The view of Kandy is great though. Don't fret about getting lost, though the sinage is terrible all paths lead to Kandy!","July 24, 2016",0.0,0.0
https://www.tripadvisor.com/Attraction_Review-g304138-d2534649-Reviews-Udawattekele_Sanctuary-Kandy_Kandy_District_Central_Province.html,Udawattekele Sanctuary,4.2,400,https://dynamic-media-cdn.tripadvisor.com/media/photo-o/16/30/91/77/view-from-the-sanctuary.jpg?w=700&h=400&s=1,Lahiyru,"Auckland Central, New Zealand",,5,Missing,"Amazing place. Quite unbelievable that Kandy city hosts such a great forest. Very clean and evergreen. The best place to look for tranquility in Kandy. Apart from the giant flora and fauna, the forest possesses a Kandy view point, a temple, a few caves, giant liana etc. There are some unfair restrictions for locals. No unmarried couples would be allowed inside and no food or bags would be allowed as well. No such restrictions for foreigners. Tickets 650LKR for foreigners and only 30LKR for locals. A must visit if you are travelling to hill country.","July 22, 2016",0.0,0.0
https://www.tripadvisor.com/Attraction_Review-g304138-d2534649-Reviews-Udawattekele_Sanctuary-Kandy_Kandy_District_Central_Province.html,Udawattekele Sanctuary,4.2,400,https://dynamic-media-cdn.tripadvisor.com/media/photo-o/16/30/91/77/view-from-the-sanctuary.jpg?w=700&h=400&s=1,CamboVego,"Phnom Penh, Cambodia",,5,Couples,"This is worth a visit and is an easy stroll through beautiful forest. I'm not sure why people complain of leeches because the main track is actually a dry dirt road fit for cars to drive on. Maybe it's different after a lot of rain, but just make sure you wear covered shoes. There are options of going off the main track into the forest for a more challenging hike and in that case you might want to be more covered up. It was a very easy 5km walk to go the whole way around on the main track. We didn't see any animals or birds other than 2 separate groups of macaques that were on the track. Im a little afraid of macaques and don't like going near them. Both times, the larger leader of the troupe came close to check us out but they mostly kept their distance from us. I've learnt it's always best not to feed them or show them you have any food at all. I don't look at them directly and just keep walking. There were deer or boar tracks everywhere so there must be quite a few animals in the forest, but it was a public holiday and maybe too many people around. It really wasn't crowded though, with only a few groups of people on the tracks. Even without seeing many animals or birds (we could hear them though), there are some amazing trees, the park is free of rubbish and it's a very calming and enjoyable walk. Cost 650 rupee and you get a leaflet/map.","July 19, 2016",0.0,0.0
https://www.tripadvisor.com/Attraction_Review-g304138-d2534649-Reviews-Udawattekele_Sanctuary-Kandy_Kandy_District_Central_Province.html,Udawattekele Sanctuary,4.2,400,https://dynamic-media-cdn.tripadvisor.com/media/photo-o/16/30/91/77/view-from-the-sanctuary.jpg?w=700&h=400&s=1,Anand_Lobo,"Mumbai, India",,4,Solo,"This is a bit isolated and not many people visit. But if walking in a forest is something you enjoy, then do spend half a day here. A local tuk tuk can drop you here. While returning you have a short walk to get transportation. Carry lots of water and some snacks as there is no food available. Ensure you have thick socks and good footwear, there are leeches lurking around. And an umbrella would be handy as it rains sometimes.","July 4, 2016",0.0,0.0
https://www.tripadvisor.com/Attraction_Review-g304138-d2534649-Reviews-Udawattekele_Sanctuary-Kandy_Kandy_District_Central_Province.html,Udawattekele Sanctuary,4.2,400,https://dynamic-media-cdn.tripadvisor.com/media/photo-o/16/30/91/77/view-from-the-sanctuary.jpg?w=700&h=400&s=1,RenB,"Crouch End, United Kingdom",,4,Couples,"This was actually my favourite place in Kandy. There was hardly anyone there, it was peaceful and teeming with wildlife. We saw baboons, wild boar, a snake, fish, birds and my friend swears he saw a crocodile! Great place for a leisurely walk to get out of the hustle and bustle and away from the coach loads of tourists.","July 2, 2016",0.0,0.0
https://www.tripadvisor.com/Attraction_Review-g304138-d2534649-Reviews-Udawattekele_Sanctuary-Kandy_Kandy_District_Central_Province.html,Udawattekele Sanctuary,4.2,400,https://dynamic-media-cdn.tripadvisor.com/media/photo-o/16/30/91/77/view-from-the-sanctuary.jpg?w=700&h=400&s=1,Sri Lenka CZ,5 contributions,,5,Friends,"If you have few days in Kandy, worth to see, it is a nice walk, there might be some leaches on the way","June 28, 2016",0.0,0.0
https://www.tripadvisor.com/Attraction_Review-g304138-d2534649-Reviews-Udawattekele_Sanctuary-Kandy_Kandy_District_Central_Province.html,Udawattekele Sanctuary,4.2,400,https://dynamic-media-cdn.tripadvisor.com/media/photo-o/16/30/91/77/view-from-the-sanctuary.jpg?w=700&h=400&s=1,Virginia T,12 contributions,,4,Couples,"The Sanctuary is a wonderful place - wild vegetation and lots of animals. We saw monkeys, owls and deers. However, I strongly suggest to wear sneakers because of leeches, that you can find especially on the longer walks. The Lovers walk is very easy and charming.","June 23, 2016",0.0,0.0
https://www.tripadvisor.com/Attraction_Review-g304138-d2534649-Reviews-Udawattekele_Sanctuary-Kandy_Kandy_District_Central_Province.html,Udawattekele Sanctuary,4.2,400,https://dynamic-media-cdn.tripadvisor.com/media/photo-o/16/30/91/77/view-from-the-sanctuary.jpg?w=700&h=400&s=1,chalanisp,11 contributions,,4,Friends,The sanctuary is rich with unique flora and fauna. It is good for a school trip and as well as for an university trip. Luckily could visit the Maithri Lena which is a Buddhist monk spends his life with the horrible sounds of nature. He is old and we should respect him for his effort. N.B. This place is not for couples and and this is a family or friends entry place.,"June 16, 2016",0.0,0.0
https://www.tripadvisor.com/Attraction_Review-g304138-d2534649-Reviews-Udawattekele_Sanctuary-Kandy_Kandy_District_Central_Province.html,Udawattekele Sanctuary,4.2,400,https://dynamic-media-cdn.tripadvisor.com/media/photo-o/16/30/91/77/view-from-the-sanctuary.jpg?w=700&h=400&s=1,putney2015,"London, United Kingdom",,5,Couples,"Loved this place. Could walk around and forget that you're in a bustling city. Nice and cool - shaded by trees. Saw monkeys, scorpions and some amazing tree formations. Only takes an hour or so if you don't do the full loop so easy to find the time!!","June 15, 2016",0.0,0.0
https://www.tripadvisor.com/Attraction_Review-g304138-d2534649-Reviews-Udawattekele_Sanctuary-Kandy_Kandy_District_Central_Province.html,Udawattekele Sanctuary,4.2,400,https://dynamic-media-cdn.tripadvisor.com/media/photo-o/16/30/91/77/view-from-the-sanctuary.jpg?w=700&h=400&s=1,Severine & Lukasz,"Ghent, Belgium",,3,Couples,"We did a big tour around the park and heared a lot of birds, but we didn't see any because we were not properly equipped. Be sure to put on you leech socks. The park is beautiful and there is a wide variety of plants.","June 7, 2016",0.0,0.0
https://www.tripadvisor.com/Attraction_Review-g304138-d2534649-Reviews-Udawattekele_Sanctuary-Kandy_Kandy_District_Central_Province.html,Udawattekele Sanctuary,4.2,400,https://dynamic-media-cdn.tripadvisor.com/media/photo-o/16/30/91/77/view-from-the-sanctuary.jpg?w=700&h=400&s=1,Srividya G,"Chennai (Madras), India",,4,Missing,"We had a wonderful time walking in this sanctuary. They had maps and directions in place and we could walk on our own without the need of guides. Being birdwatchers, we could spot many bird species. We visited twice as we enjoyed the trek. Very calm place with sounds of birds chirping.","May 19, 2016",0.0,0.0
https://www.tripadvisor.com/Attraction_Review-g304138-d2534649-Reviews-Udawattekele_Sanctuary-Kandy_Kandy_District_Central_Province.html,Udawattekele Sanctuary,4.2,400,https://dynamic-media-cdn.tripadvisor.com/media/photo-o/16/30/91/77/view-from-the-sanctuary.jpg?w=700&h=400&s=1,TripAdviser71Colombo,"Sri Jayawardenepura, Sri Lanka",,5,Solo,"this is a cool, small beautiful Jungle. A lot of magestic trees and huge vines are there. But you have to be very careful from leaches. This is a good place for a bird watching too. There is a little lake in the middle of the jungle. Ideal place for a picnic. It want take much time to go round.","May 16, 2016",0.0,0.0
https://www.tripadvisor.com/Attraction_Review-g304138-d2534649-Reviews-Udawattekele_Sanctuary-Kandy_Kandy_District_Central_Province.html,Udawattekele Sanctuary,4.2,400,https://dynamic-media-cdn.tripadvisor.com/media/photo-o/16/30/91/77/view-from-the-sanctuary.jpg?w=700&h=400&s=1,SUDATH2013,"Kandy, Sri Lanka",,5,Friends,"Rich in bio diversity. Rich in flora and fauna. Several foot paths within the sanctuary. Large number of insects,small animals and mammals live there. There is a large pool with many varieties of fish. Strol around with a camera to relieve stress.","May 12, 2016",0.0,0.0
https://www.tripadvisor.com/Attraction_Review-g304138-d2534649-Reviews-Udawattekele_Sanctuary-Kandy_Kandy_District_Central_Province.html,Udawattekele Sanctuary,4.2,400,https://dynamic-media-cdn.tripadvisor.com/media/photo-o/16/30/91/77/view-from-the-sanctuary.jpg?w=700&h=400&s=1,Seetalusha,"Singapore, Singapore",,5,Couples,This is also a beautiful place . It was a royal forest reserve where no one was allowed to go . It feels nice walking around this place and learn the history.,"May 10, 2016",0.0,0.0
https://www.tripadvisor.com/Attraction_Review-g304138-d2534649-Reviews-Udawattekele_Sanctuary-Kandy_Kandy_District_Central_Province.html,Udawattekele Sanctuary,4.2,400,https://dynamic-media-cdn.tripadvisor.com/media/photo-o/16/30/91/77/view-from-the-sanctuary.jpg?w=700&h=400&s=1,Sahan P,7 contributions,,5,Couples,A place you must visit.. Foreigners Rs. 650/- p.p.. Local Rs. 30/- p.p.. Snacks not allowed to bring in. Only a bottle of water. Cycling is permitted (should bring your own). Vehicles not allowed. Walk about 5 km into the jungle. No need to afraid. Totally safe place. No harm from animals or from people. Do not go away from the track. Take a photo of the map on the entrance board before entering the jungle.,"May 5, 2016",0.0,0.0
https://www.tripadvisor.com/Attraction_Review-g304138-d2534649-Reviews-Udawattekele_Sanctuary-Kandy_Kandy_District_Central_Province.html,Udawattekele Sanctuary,4.2,400,https://dynamic-media-cdn.tripadvisor.com/media/photo-o/16/30/91/77/view-from-the-sanctuary.jpg?w=700&h=400&s=1,din,"Colombo, Sri Lanka",,4,Friends,"It was a nice place close to the kandy city. You may bring umbrella, water bottle and some snacks while you are visiting there. Ask for the map from the counter and you can follow the numbers given for each location.","April 30, 2016",0.0,0.0
https://www.tripadvisor.com/Attraction_Review-g304138-d2534649-Reviews-Udawattekele_Sanctuary-Kandy_Kandy_District_Central_Province.html,Udawattekele Sanctuary,4.2,400,https://dynamic-media-cdn.tripadvisor.com/media/photo-o/16/30/91/77/view-from-the-sanctuary.jpg?w=700&h=400&s=1,Adam T,"London, United Kingdom",,4,Couples,"Entrance price seems a little steep but this area has been conserved for nature since the 19th century. If you can get over that cost you'll probably see a load of trees, some lizards, a whole bunch of monkeys and maybe a deer or two. Not to mention the birds and the views over Kandy. A pleasant way to kill an hour or two and get away from the city. There's an easy 3km trail to follow.","April 27, 2016",0.0,0.0
https://www.tripadvisor.com/Attraction_Review-g304138-d2534649-Reviews-Udawattekele_Sanctuary-Kandy_Kandy_District_Central_Province.html,Udawattekele Sanctuary,4.2,400,https://dynamic-media-cdn.tripadvisor.com/media/photo-o/16/30/91/77/view-from-the-sanctuary.jpg?w=700&h=400&s=1,SHW200382,39 contributions,,1,Couples,"A recurring theme in Sri Lanka is that there are always 2 prices for everything. The cost for tourists can be 4x or 5x more expensive, here is no different. It's 650 for a tourist a 30 rupees for a local. There is no reason to even have an entrance fee. Save your money and avoid! (Walk around the lake instead)","April 21, 2016",0.0,0.0
https://www.tripadvisor.com/Attraction_Review-g304138-d2534649-Reviews-Udawattekele_Sanctuary-Kandy_Kandy_District_Central_Province.html,Udawattekele Sanctuary,4.2,400,https://dynamic-media-cdn.tripadvisor.com/media/photo-o/16/30/91/77/view-from-the-sanctuary.jpg?w=700&h=400&s=1,Raina,"Miami, Florida",,4,Couples,"The sun is blocked by the tall, tall trees, and the birds are chirping to each other. Enjoy the walk, the many trails, the calm nature and seeing the different animals! You won't want to miss this place. We saw a snake, some monkeys, birds, butterflies, etc. such a lovely afternoon!!! Definitely recommend","April 13, 2016",0.0,0.0
https://www.tripadvisor.com/Attraction_Review-g304138-d2534649-Reviews-Udawattekele_Sanctuary-Kandy_Kandy_District_Central_Province.html,Udawattekele Sanctuary,4.2,400,https://dynamic-media-cdn.tripadvisor.com/media/photo-o/16/30/91/77/view-from-the-sanctuary.jpg?w=700&h=400&s=1,Buddheesha Pitawala,"Kandy, Sri Lanka",,5,Friends,"This sanctuary is a beautiful place to visit in kandy. If u r so tired with the kandy crowd and need a place to rest or make you calm, this is the best place. Walking distance from kandy town. Can see many birds in there.  There is a beautiful kandy view point. If u can find bicycles ,there is a bicycle root in the sanctuary and you can have so much fun riding through the jungle.","April 10, 2016",0.0,0.0
https://www.tripadvisor.com/Attraction_Review-g304138-d2534649-Reviews-Udawattekele_Sanctuary-Kandy_Kandy_District_Central_Province.html,Udawattekele Sanctuary,4.2,400,https://dynamic-media-cdn.tripadvisor.com/media/photo-o/16/30/91/77/view-from-the-sanctuary.jpg?w=700&h=400&s=1,Mar186525,"Edinburgh, United Kingdom",,5,Couples,Although very close to the town even the tuktuk driver did not know where this was and had to ask directions!  Very little visited this is a lovely peaceful place with abundant birdlife and mammals.  Best time to go is the morning.  The easy to follow trails - although the provided map is useful - are mostly shaded and open out every so often giving splendid views of the countryside and over Kandy.,"April 4, 2016",0.0,0.0
https://www.tripadvisor.com/Attraction_Review-g304138-d2534649-Reviews-Udawattekele_Sanctuary-Kandy_Kandy_District_Central_Province.html,Udawattekele Sanctuary,4.2,400,https://dynamic-media-cdn.tripadvisor.com/media/photo-o/16/30/91/77/view-from-the-sanctuary.jpg?w=700&h=400&s=1,Raymond F,"Exeter, United Kingdom",,5,Missing,This really is a sanctuary in the middle of the city. The old Royal Gardens and now a Nature Reserve and Forest is a haven from the hustle and bustle of central Kandy. Well worth a visit. See if you can find the hermit monk living in a cave.,"April 2, 2016",0.0,0.0
