Destination URL,Destination Title,Destination Score,Total Reviews (Destination),Destination Image,Reviewer Name,Reviewer Location,Review Title,Review Score,Reviewer Category,Review Text,Written Date,% %,  %
https://www.tripadvisor.com/Attraction_Review-g304138-d2534649-Reviews-Udawattekele_Sanctuary-Kandy_Kandy_District_Central_Province.html,Udawattekele Sanctuary,4.2,400,https://dynamic-media-cdn.tripadvisor.com/media/photo-o/16/30/91/77/view-from-the-sanctuary.jpg?w=700&h=400&s=1,kum2006,"Kandy, Sri Lanka",,5,Friends,This is a very calm place which is situated near the Kandy City. It is a calm and Quiet place which is suitable for those who like to do meditation.,"June 2, 2015",0.0,0.0
https://www.tripadvisor.com/Attraction_Review-g304138-d2534649-Reviews-Udawattekele_Sanctuary-Kandy_Kandy_District_Central_Province.html,Udawattekele Sanctuary,4.2,400,https://dynamic-media-cdn.tripadvisor.com/media/photo-o/16/30/91/77/view-from-the-sanctuary.jpg?w=700&h=400&s=1,Tharindu Wettewa,"Galagedara, Sri Lanka",,5,Friends,"From the busy city of Kandy, you can't imagine this type of quite beautiful forest is situated there. This is man-made forest made by king Rajasinghe for his palace wood requirement of kitchen and other things.. Now it's a huge forest.. Very quiet and calm place.. You need atleast 4 to 5 hours to explore full jungle..","May 25, 2015",0.0,0.0
https://www.tripadvisor.com/Attraction_Review-g304138-d2534649-Reviews-Udawattekele_Sanctuary-Kandy_Kandy_District_Central_Province.html,Udawattekele Sanctuary,4.2,400,https://dynamic-media-cdn.tripadvisor.com/media/photo-o/16/30/91/77/view-from-the-sanctuary.jpg?w=700&h=400&s=1,Cozy apartment in kundasale,"Kandy District, Sri Lanka",,5,Friends,That forest is very attractive.no need to spend  big amount..very peaceful THIS  PLACE IS INTERESTING  ONLY FOR NATURAL LOVERS. There are lot of  road ways long distance to walk.If you need you can use bicycle . There are 3 forest monestries  in side the forest .buddist  monks are maditating Don't disturb them TRY TO KEEP UP  SILENT BACKGROUND.,"April 13, 2015",0.0,0.0
https://www.tripadvisor.com/Attraction_Review-g304138-d2534649-Reviews-Udawattekele_Sanctuary-Kandy_Kandy_District_Central_Province.html,Udawattekele Sanctuary,4.2,400,https://dynamic-media-cdn.tripadvisor.com/media/photo-o/16/30/91/77/view-from-the-sanctuary.jpg?w=700&h=400&s=1,BeingJoy,"Brisbane, Australia",,5,Friends,"So close to bustling Kandy city, it is difficult to imagine one can find such a beautiful quiet forest area to enjoy nature and interesting walking tracks! This forest is reportedly over 200 years now, and feels a special place of history. I would suggest two to three hours be allowed so that one can truly enjoy the serenity of the forest, such a relief from the noise and business of the town. Only downside are the leeches, of whoch there appear to be a multitude! Mostly if venturing off the paths, however. Recently I am shocked to hear that it is being proposed to cut a bypass road through this beauiful, historic, nature reserve and forest!!! I certainly hope this never happens! We need to preserve every patch of forest on the planet, no matter how small! My advice...go visit this patch of paradise before it perhaps disappears! Have they also considered that the revenue from visitors fees will also be lost?","April 9, 2015",0.0,0.0
https://www.tripadvisor.com/Attraction_Review-g304138-d2534649-Reviews-Udawattekele_Sanctuary-Kandy_Kandy_District_Central_Province.html,Udawattekele Sanctuary,4.2,400,https://dynamic-media-cdn.tripadvisor.com/media/photo-o/16/30/91/77/view-from-the-sanctuary.jpg?w=700&h=400&s=1,Ingrid P,3 contributions,,5,Friends,It was an amazing walk even tought we got supprised by some wild boar and chased by monkeys - dont bring any food :D,"April 9, 2015",0.0,0.0
https://www.tripadvisor.com/Attraction_Review-g304138-d2534649-Reviews-Udawattekele_Sanctuary-Kandy_Kandy_District_Central_Province.html,Udawattekele Sanctuary,4.2,400,https://dynamic-media-cdn.tripadvisor.com/media/photo-o/16/30/91/77/view-from-the-sanctuary.jpg?w=700&h=400&s=1,Jasmine L,"London, United Kingdom",,2,Couples,"Our walk around the sanctuary was nice, nothing extraordinary. There were lots of monkeys which at first excited me greatly, until I realised there are monkeys everywhere in Sri Lanka, and I didn't have to pay to see them. We didn't see anyone other than park rangers on the walk which was lovely and relaxing, but again confused as to what we were paying for. At the end of the walk we found ourself having to exit the reserve through a dodgy area, we ended up on a back road behind a temple scrambling over plants. According to the map, this was the exit. At the bottom there was a chained up elephant which left me in tears, he looked so sad and badly treated. Overall we had a nice walk in the sanctuary but wouldn't recommend it especially with the price tag.","April 9, 2015",0.0,0.0
https://www.tripadvisor.com/Attraction_Review-g304138-d2534649-Reviews-Udawattekele_Sanctuary-Kandy_Kandy_District_Central_Province.html,Udawattekele Sanctuary,4.2,400,https://dynamic-media-cdn.tripadvisor.com/media/photo-o/16/30/91/77/view-from-the-sanctuary.jpg?w=700&h=400&s=1,karino,34 contributions,,4,Missing,"We enjoyed our walk in the forest. It was nice to get out of town. We didn't see any monkeys and got caught in a downpour, but we saw a few nice birds, and enjoyed looking at the luxuriant vegetation. Watch out for the leeches though.","April 7, 2015",0.0,0.0
https://www.tripadvisor.com/Attraction_Review-g304138-d2534649-Reviews-Udawattekele_Sanctuary-Kandy_Kandy_District_Central_Province.html,Udawattekele Sanctuary,4.2,400,https://dynamic-media-cdn.tripadvisor.com/media/photo-o/16/30/91/77/view-from-the-sanctuary.jpg?w=700&h=400&s=1,JPDM 🇨🇦🍷🍷🍷,"Austin, Canada",,4,Couples,Only came across 2 groups of people in the 90 minutes that we spent there. Some of the signs are not so clear so we wasted a bit of time. Saw one deer and a lot of monkeys. It is just a forest but it nice given the high energy level of Kandy.,"March 17, 2015",0.0,0.0
https://www.tripadvisor.com/Attraction_Review-g304138-d2534649-Reviews-Udawattekele_Sanctuary-Kandy_Kandy_District_Central_Province.html,Udawattekele Sanctuary,4.2,400,https://dynamic-media-cdn.tripadvisor.com/media/photo-o/16/30/91/77/view-from-the-sanctuary.jpg?w=700&h=400&s=1,Leala,"Colombo, Sri Lanka",,5,Missing,Udawatta kale Sanctuary is a Green wet forest boudaring to Sri Dalandaa Maaligaawa Kandy. 365 day green leaved thick forest with huge trees old more than hundreds of years. flora and fona Inheritant to Sri Lanka can be found in their natural habitat here. Ideal place for environmental researchers and who love the nature!.,"February 27, 2015",0.0,0.0
https://www.tripadvisor.com/Attraction_Review-g304138-d2534649-Reviews-Udawattekele_Sanctuary-Kandy_Kandy_District_Central_Province.html,Udawattekele Sanctuary,4.2,400,https://dynamic-media-cdn.tripadvisor.com/media/photo-o/16/30/91/77/view-from-the-sanctuary.jpg?w=700&h=400&s=1,pwau98,"Hong Kong, China",,3,Friends,A cozy walk in a circle for about 1.5 hours.  Not many sites and the signs along the route are not so detailed and informative.  We even could not find the German caves.  Can skip for limieted time.,"February 24, 2015",0.0,0.0
https://www.tripadvisor.com/Attraction_Review-g304138-d2534649-Reviews-Udawattekele_Sanctuary-Kandy_Kandy_District_Central_Province.html,Udawattekele Sanctuary,4.2,400,https://dynamic-media-cdn.tripadvisor.com/media/photo-o/16/30/91/77/view-from-the-sanctuary.jpg?w=700&h=400&s=1,Chris W,"Royston, United Kingdom",,5,Couples,"This forest is pretty easy to navigate without a guide, using the map given out at the entrance. Even if you do lose your way, you can't go too wrong and you'll inevitably find your way back to the entrance. The forest is really lovely and there's a lot of wildlife. We saw lots of monkeys as well as wild boar, deer, a snake and some nice birds. A great way to spend a couple of hours and also a good way to avoid the heat of the sun.","February 16, 2015",0.0,0.0
https://www.tripadvisor.com/Attraction_Review-g304138-d2534649-Reviews-Udawattekele_Sanctuary-Kandy_Kandy_District_Central_Province.html,Udawattekele Sanctuary,4.2,400,https://dynamic-media-cdn.tripadvisor.com/media/photo-o/16/30/91/77/view-from-the-sanctuary.jpg?w=700&h=400&s=1,krs_kristoffer,"Gothenburg, Sweden",,5,Couples,"Easy walking distance from Kandy city center. Beautiful forest with monkeys, birds and probably other animals (that we didn't see). So nice to get away from the sun (the trees give shade) and city for a while. Also good walking tracks and a nice view point with a great view of Kandy Lake.","January 14, 2015",0.0,0.0
https://www.tripadvisor.com/Attraction_Review-g304138-d2534649-Reviews-Udawattekele_Sanctuary-Kandy_Kandy_District_Central_Province.html,Udawattekele Sanctuary,4.2,400,https://dynamic-media-cdn.tripadvisor.com/media/photo-o/16/30/91/77/view-from-the-sanctuary.jpg?w=700&h=400&s=1,Saulatali,"Lahore, Pakistan",,4,Missing,"A beautiful and Fantastic place to see lots of wildlife ..Loved the hike into this sanctuary, we saw monkeys and birds. A must visit place.","January 14, 2015",0.0,0.0
https://www.tripadvisor.com/Attraction_Review-g304138-d2534649-Reviews-Udawattekele_Sanctuary-Kandy_Kandy_District_Central_Province.html,Udawattekele Sanctuary,4.2,400,https://dynamic-media-cdn.tripadvisor.com/media/photo-o/16/30/91/77/view-from-the-sanctuary.jpg?w=700&h=400&s=1,Geschaeftsmannnnn,49 contributions,,5,Couples,"A lovely rain forest with a huge ""pus wela"", which covers 2 acres and is over 200 years old. Mind the many leeches, which are all over the place after rain. Although leeches are not dangerous, their bites hurt, so don't wear sandals! We saw monkeys, a boar and many birds.","January 13, 2015",0.0,0.0
https://www.tripadvisor.com/Attraction_Review-g304138-d2534649-Reviews-Udawattekele_Sanctuary-Kandy_Kandy_District_Central_Province.html,Udawattekele Sanctuary,4.2,400,https://dynamic-media-cdn.tripadvisor.com/media/photo-o/16/30/91/77/view-from-the-sanctuary.jpg?w=700&h=400&s=1,Alex S,"Deventer, The Netherlands",,3,Couples,"The entrance fee is OK (650 Rps per person) and you get a map. The map is fine, but we couldn't find some of the caves, which are indicated on the map and the signposts in the park. We are birdwatchers, so we walk very slowly, listening for every sound and looking for every movement in the trees or in the understory. Although the sanctuary is on the edge of Kandy, you here the sounds of the city all the time and a few times a car was driving on the main track. We liked the big group of macaques, which are hanging around the entrance area. We liked the walk and the sanctuary, but except for some spots with Giant Bamboo or beautiful vines it felt like an ordinary forest. That's why we give 3*.","January 6, 2015",0.0,0.0
https://www.tripadvisor.com/Attraction_Review-g304138-d2534649-Reviews-Udawattekele_Sanctuary-Kandy_Kandy_District_Central_Province.html,Udawattekele Sanctuary,4.2,400,https://dynamic-media-cdn.tripadvisor.com/media/photo-o/16/30/91/77/view-from-the-sanctuary.jpg?w=700&h=400&s=1,Bandu N,368 contributions,,4,Business,"I don't know how many people choose this place as their another attraction in Kandy, but this is a very good place to travel for nature lover. You wont feel that you were so close to Kandy city center.","December 27, 2014",0.0,0.0
https://www.tripadvisor.com/Attraction_Review-g304138-d2534649-Reviews-Udawattekele_Sanctuary-Kandy_Kandy_District_Central_Province.html,Udawattekele Sanctuary,4.2,400,https://dynamic-media-cdn.tripadvisor.com/media/photo-o/16/30/91/77/view-from-the-sanctuary.jpg?w=700&h=400&s=1,Roylav,"Colchester, United Kingdom",,2,Friends,"As a ""birdie"" I had expected this to be a rich source of interest, but it is composed almost entirely of forest, and viewable birds were at a distinct premium!  There were very few other visitors, and we all seemed to be outnumbered by soldiers in combat gear with AK47s.  They were very friendly, but their presence was a bit unnerving! Then there were the persistent leaches that went for my legs after a brief rain shower.  All very entertaining, but not quite what I'd expected!","December 21, 2014",0.0,0.0
https://www.tripadvisor.com/Attraction_Review-g304138-d2534649-Reviews-Udawattekele_Sanctuary-Kandy_Kandy_District_Central_Province.html,Udawattekele Sanctuary,4.2,400,https://dynamic-media-cdn.tripadvisor.com/media/photo-o/16/30/91/77/view-from-the-sanctuary.jpg?w=700&h=400&s=1,Khosrojerdi,"Mashhad, Iran",,4,Friends,"we had an advanture when we were there. we  walked slowly in this forest. suddenly our leader sayed to us ""do not stop and run  please run"". we can not see anything or any animal but while we were runing he explained some worms with ability to seek your blood are here and if you stay and stop any where they attack you, if any person like to know what happen for us please contact with my email address:  hkhosrojerdi@gmail.com","December 16, 2014",0.0,0.0
https://www.tripadvisor.com/Attraction_Review-g304138-d2534649-Reviews-Udawattekele_Sanctuary-Kandy_Kandy_District_Central_Province.html,Udawattekele Sanctuary,4.2,400,https://dynamic-media-cdn.tripadvisor.com/media/photo-o/16/30/91/77/view-from-the-sanctuary.jpg?w=700&h=400&s=1,Upali A,13 contributions,,4,Missing,"The forrest was absolutely stunning. It quiet and serene however, the further you climb, the more leeches you are likely to encounter. We were unaware of this and as such we wore open shoes. I would recommend closed footwear and tight pants and perhaps, some repellant. Other than this very minor complaint, the Udawattekele Sanctuary is beautiful and the scenery is stunning.","December 13, 2014",0.0,0.0
https://www.tripadvisor.com/Attraction_Review-g304138-d2534649-Reviews-Udawattekele_Sanctuary-Kandy_Kandy_District_Central_Province.html,Udawattekele Sanctuary,4.2,400,https://dynamic-media-cdn.tripadvisor.com/media/photo-o/16/30/91/77/view-from-the-sanctuary.jpg?w=700&h=400&s=1,Kitty W,3 contributions,,1,Couples,"After having travelled all the way to Kandy we were not granted permission to enter, was a terrible experience.","November 5, 2014",0.0,0.0
https://www.tripadvisor.com/Attraction_Review-g304138-d2534649-Reviews-Udawattekele_Sanctuary-Kandy_Kandy_District_Central_Province.html,Udawattekele Sanctuary,4.2,400,https://dynamic-media-cdn.tripadvisor.com/media/photo-o/16/30/91/77/view-from-the-sanctuary.jpg?w=700&h=400&s=1,Amit Gupta,"Doha, Qatar",,3,Missing,Having to pay the steep entrance fees along with the safari charges and guide tips - certainly not worth just to see few elephants. Safari in some other national parks around the world are far far better. Just another commercial establishment like the many others in Srilanka.,"October 13, 2014",0.0,0.0
https://www.tripadvisor.com/Attraction_Review-g304138-d2534649-Reviews-Udawattekele_Sanctuary-Kandy_Kandy_District_Central_Province.html,Udawattekele Sanctuary,4.2,400,https://dynamic-media-cdn.tripadvisor.com/media/photo-o/16/30/91/77/view-from-the-sanctuary.jpg?w=700&h=400&s=1,JustFreeYourself,"Taipei, Taiwan",,5,Solo,"I was completely alone and in 20 minutes walk from Kandy center I felt like I was in a real jungle/forest with monkeys swinging around and peace in the air. Tip: Watch out for leeches. Little ones that will sneakily to your shoe and then to your ankle :)  Don't be scared of that. Go check it out for some fresh air, a GREAT view of Kandy at point E (I think) on the map, and a chance to watch monkeys in their habit and possible little deer that cruise through there.","October 12, 2014",0.0,0.0
https://www.tripadvisor.com/Attraction_Review-g304138-d2534649-Reviews-Udawattekele_Sanctuary-Kandy_Kandy_District_Central_Province.html,Udawattekele Sanctuary,4.2,400,https://dynamic-media-cdn.tripadvisor.com/media/photo-o/16/30/91/77/view-from-the-sanctuary.jpg?w=700&h=400&s=1,varunaja,84 contributions,,5,Couples,"The Forest is located with in the city and no one would assume a natural, tropical forest to be located in once a Capital City. A walk through the forest will make you close to the nature. You can observe many flora and fauna. The forest is well preserved and protected and dropping litter and plastic is prohibited. Be a bit careful, if you step away (or when set foot on foliage) from the provided trails as there are serpents in abundance. I have been here many many times. Though I caution here, it is very safe.","October 8, 2014",0.0,0.0
https://www.tripadvisor.com/Attraction_Review-g304138-d2534649-Reviews-Udawattekele_Sanctuary-Kandy_Kandy_District_Central_Province.html,Udawattekele Sanctuary,4.2,400,https://dynamic-media-cdn.tripadvisor.com/media/photo-o/16/30/91/77/view-from-the-sanctuary.jpg?w=700&h=400&s=1,Florian Z,"Neuchâtel, Switzerland",,4,Couples,"This forest is quite dense and it gives a break from the buzz in Kandy. We saw wild boars, an owl, a snake and many birds.","October 7, 2014",0.0,0.0
https://www.tripadvisor.com/Attraction_Review-g304138-d2534649-Reviews-Udawattekele_Sanctuary-Kandy_Kandy_District_Central_Province.html,Udawattekele Sanctuary,4.2,400,https://dynamic-media-cdn.tripadvisor.com/media/photo-o/16/30/91/77/view-from-the-sanctuary.jpg?w=700&h=400&s=1,Shaary,"Prague, Czech Republic",,5,Couples,"Nice and peaceful walk in a forest. You can see many animals like monkeys, agamas, etc. You will get a map at entrance. You need about 2 hours for it.","September 21, 2014",0.0,0.0
https://www.tripadvisor.com/Attraction_Review-g304138-d2534649-Reviews-Udawattekele_Sanctuary-Kandy_Kandy_District_Central_Province.html,Udawattekele Sanctuary,4.2,400,https://dynamic-media-cdn.tripadvisor.com/media/photo-o/16/30/91/77/view-from-the-sanctuary.jpg?w=700&h=400&s=1,chuwa k,"Hong Kong, China",,5,Couples,"A breath of fresh air (so to speak in the heat) after the center of Kandy. A beautiful forest with one side a beautiful view of the city but quite noisy as close to the road. On the other you are surrounded by nature with very few visitors, damage some cars or motorcycles go through some trails. Another bad point, the plan is anything but clear to find some points of view. Anyway we enjoyed the meet monkeys, iguanas, snakes and wild boars !!","September 16, 2014",0.0,0.0
https://www.tripadvisor.com/Attraction_Review-g304138-d2534649-Reviews-Udawattekele_Sanctuary-Kandy_Kandy_District_Central_Province.html,Udawattekele Sanctuary,4.2,400,https://dynamic-media-cdn.tripadvisor.com/media/photo-o/16/30/91/77/view-from-the-sanctuary.jpg?w=700&h=400&s=1,bas k,"Amstelveen, The Netherlands",,5,Friends,Udawattekele forest is close to the centre of KANDY and very easy to reach by tuctuc taxi. There are views toward the city  and kandy lake . Easy broad paths that lead through the tropical forest around the pond. A lot of rainforest birds can be heard and spiders and monkeys can be seen. recommended.,"September 14, 2014",0.0,0.0
https://www.tripadvisor.com/Attraction_Review-g304138-d2534649-Reviews-Udawattekele_Sanctuary-Kandy_Kandy_District_Central_Province.html,Udawattekele Sanctuary,4.2,400,https://dynamic-media-cdn.tripadvisor.com/media/photo-o/16/30/91/77/view-from-the-sanctuary.jpg?w=700&h=400&s=1,Frankascanbe,"Dublin, Ireland",,4,Missing,"After three days hill walking in the tea plantation of Sri Lanka at 3000mtrs we decided to have a rest day today in Kandy. That lasted till 12noon when the hotel manager suggested that we go to the rain forest for a walk. One tuk tuk later, We headed in with our map and local emergence phone, provided by the hotel. At first it was wonderful, huge trees covered in giant vines with monkeys and snakes all over the place. Ants and millepedes the size of your largest finger. Confidently guiding my family with the map i directed them deeper and deeper into the rain forest. The canopy was so dense that it made the forest floor dark. We stopped for a drink then I felt it! I though it was an ant bite, sharpe and pin point pain. I looked down and nearly dropped with the shock. There were five or six leeches on my leg and foot. Bear Grills I am not, I flicked them off and sprinted forward hoping to leave them behind us, the kids followed in panic as there father led the way. My Wife calm and collected walked along, laughing until she too realised that if you stood still the leeches were all over you. I looked down at the ground and the forest floor was alive with leeches. Every two or three inches there was a leech stretching it's neck upward, swaying hoping to find some pale Irish skin. We ran for 3 to 4km through deep jungle as the leeches could not latch on when you ran. In the panic and noise of us all getting eaten alive I realised that i missed jogging. This was fun, soft ground, great scenery and laughs (fear). Who knew, all I missed was the correct motivation. I wondered if they used leeches on usain bolt, no? Should have, they work. Well after a 30min run we got back to the path and onto civilisation. My 10yr old son looked up at me and said ""Dad you have three leeches on your face"" f€&@....... I shouted. I had read the map backwards and led us all into the jungle and off trail. Sorry guys! Two hours later in a super market I found the last leech in my runner, full and bloated. Kids want to move back to Eire!","August 27, 2014",0.0,0.0
https://www.tripadvisor.com/Attraction_Review-g304138-d2534649-Reviews-Udawattekele_Sanctuary-Kandy_Kandy_District_Central_Province.html,Udawattekele Sanctuary,4.2,400,https://dynamic-media-cdn.tripadvisor.com/media/photo-o/16/30/91/77/view-from-the-sanctuary.jpg?w=700&h=400&s=1,suraj F,7 contributions,,4,Missing,"I took a recording kit and spent a good half a day visiting this place, which is located in a forest within the city. the birds insects and other creatures including monkeys produce a cocktail of sound which is fascinating and amazing to listen too.","August 14, 2014",0.0,0.0
https://www.tripadvisor.com/Attraction_Review-g304138-d2534649-Reviews-Udawattekele_Sanctuary-Kandy_Kandy_District_Central_Province.html,Udawattekele Sanctuary,4.2,400,https://dynamic-media-cdn.tripadvisor.com/media/photo-o/16/30/91/77/view-from-the-sanctuary.jpg?w=700&h=400&s=1,ChristineCat1960,"Wing, United Kingdom",,4,Solo,"Great opportunity to get up close to an elephant, be prepared though the handlers will expect paying, but well worth the 1000 rupees I paid, excellent experience.","August 6, 2014",0.0,0.0
https://www.tripadvisor.com/Attraction_Review-g304138-d2534649-Reviews-Udawattekele_Sanctuary-Kandy_Kandy_District_Central_Province.html,Udawattekele Sanctuary,4.2,400,https://dynamic-media-cdn.tripadvisor.com/media/photo-o/16/30/91/77/view-from-the-sanctuary.jpg?w=700&h=400&s=1,Liesl W,391 contributions,,3,Missing,"A beautiful forest, amazing vines, trees, Dorian fruit trees  Nice view over kandy,. Saw very little wildlife. husband attracted a couple of leeches, rest of us were fine. Cost almost £10 for a family of 4 which I think is too much.  I know we need to pay to preserve such lovely areas, but I feel Sri Lanka is cashing in too much. Visit if you have some spare time, makes a pleasant escape from the bustle of kandy.","August 3, 2014",0.0,0.0
https://www.tripadvisor.com/Attraction_Review-g304138-d2534649-Reviews-Udawattekele_Sanctuary-Kandy_Kandy_District_Central_Province.html,Udawattekele Sanctuary,4.2,400,https://dynamic-media-cdn.tripadvisor.com/media/photo-o/16/30/91/77/view-from-the-sanctuary.jpg?w=700&h=400&s=1,Gina P,4 contributions,,2,Missing,"I'll preface this by saying I should have done my research beforehand... My fiancé and I came here during wet season and our tuk tuk driver joked that he and his wife avoid it in the wet season due to leaches. We were swearing thongs and sandals respectively - mistake! There were leaches everywhere we went and the tracks are really poorly sign posted. As a result, we took a wrong turn and found ourselves face-to-face with a huge snake. With our path blocked, we detoured and came face-to-face with a wild boar. After thankfully finding some other tourists in a similar boat (i.e lost), we managed to make our way out thanks to Google maps 2 hours after we started. While I can appreciated the beauty of the place, it was a pretty scary experience. Be prepared!","July 29, 2014",0.0,0.0
https://www.tripadvisor.com/Attraction_Review-g304138-d2534649-Reviews-Udawattekele_Sanctuary-Kandy_Kandy_District_Central_Province.html,Udawattekele Sanctuary,4.2,400,https://dynamic-media-cdn.tripadvisor.com/media/photo-o/16/30/91/77/view-from-the-sanctuary.jpg?w=700&h=400&s=1,PastorVasanta,"Kandy, Sri Lanka",,5,Missing,"If it hasn't rained a day or two before you visit this gem of a forest in the middle of Kandy, you are going to be in your imagined 7th heaven! Go to the pool where many a King beheaded his mistresses.","July 23, 2014",0.0,0.0
https://www.tripadvisor.com/Attraction_Review-g304138-d2534649-Reviews-Udawattekele_Sanctuary-Kandy_Kandy_District_Central_Province.html,Udawattekele Sanctuary,4.2,400,https://dynamic-media-cdn.tripadvisor.com/media/photo-o/16/30/91/77/view-from-the-sanctuary.jpg?w=700&h=400&s=1,Ayyaz Mirza,"Solihull, United Kingdom",,3,Missing,"We enjoyed the walk. Nothing special.  Couldn't understand why it was so expensive (almost 2000 lkr) for 2 adults and 2 kids. Harldy anyone visits the place because the price is relatively expensive.  You can enjoy a place in the UK (Brecon Beacons) for zero cost and its much more spectacular with its waterfalls and lush hills. So, no, sorry to say, but poor value for an otherwise attractive walk.","July 5, 2014",0.0,0.0
