Destination URL,Destination Title,Destination Score,Total Reviews (Destination),Destination Image,Reviewer Name,Reviewer Location,Review Title,Review Score,Reviewer Category,Review Text,Written Date,  %,% %
https://www.tripadvisor.com/Attraction_Review-g644047-d15708228-Reviews-Unawatuna_Beach-Unawatuna_Galle_District_Southern_Province.html,Unawatuna Beach,3.9,189,https://dynamic-media-cdn.tripadvisor.com/media/photo-o/0b/50/b5/81/20160518-152153-largejpg.jpg?w=200&h=200&s=1,Lakshani,"Colombo, Sri Lanka",,3,Missing,"Unfortunately just like most other beautiful places, it is polluted with plastic bags and waste from near by establishments. In addition to pollution the beach is over crowded . The road to the beach is narrow and not carpeted properly. Surprisingly the water did look blue and clear despite having  a stream polluted water meet the sea near the bathing area. On the bright side, the shallow water reduces the risk of drowning, so it's a safe place for the entire family to bathe (even toddlers) Also the area is safe as there are many tourists and locals. There were some boats offering short sea tours for LKR 1500 (10 min)  and LKR 2500 (20 min)  we paid LKR 200 for parking the car for about 2 hr and LKR to shower after bathing in the sea","April 19, 2019",0.0,0.0
https://www.tripadvisor.com/Attraction_Review-g644047-d15708228-Reviews-Unawatuna_Beach-Unawatuna_Galle_District_Southern_Province.html,Unawatuna Beach,3.9,189,https://dynamic-media-cdn.tripadvisor.com/media/photo-o/0b/50/b5/81/20160518-152153-largejpg.jpg?w=200&h=200&s=1,D&F,8 contributions,,3,Couples,"Lovely beach which shelves quite dramatically. Lots of chaotic buildings,stalls and bars at rear of beach. Great for young people?","April 10, 2019",0.0,0.0
https://www.tripadvisor.com/Attraction_Review-g644047-d15708228-Reviews-Unawatuna_Beach-Unawatuna_Galle_District_Southern_Province.html,Unawatuna Beach,3.9,189,https://dynamic-media-cdn.tripadvisor.com/media/photo-o/0b/50/b5/81/20160518-152153-largejpg.jpg?w=200&h=200&s=1,Eat Meat Wine Repeat,"Dubai, United Arab Emirates",,2,Friends,"In comparison to other beaches in Sri Lanka, it’s not great. There’s little complexity to the beach itself although there are plenty of restaurants on the beach front And it is still a decent beach. There are water sports available but again in comparison not as many. There are also a lot more people trying to sell you things and a lot more dogs than in Mirissa or Hikkaduwa!","April 8, 2019",0.0,0.0
https://www.tripadvisor.com/Attraction_Review-g644047-d15708228-Reviews-Unawatuna_Beach-Unawatuna_Galle_District_Southern_Province.html,Unawatuna Beach,3.9,189,https://dynamic-media-cdn.tripadvisor.com/media/photo-o/0b/50/b5/81/20160518-152153-largejpg.jpg?w=200&h=200&s=1,Dunee's Kitchen,"Athurugiriya, Sri Lanka",,5,Couples,unawatuna beach not far from the Galle train station and able to take tuktuk and go. Morning can have breakfast in the unawatuna beach as there are restaurants those who offer nice breakfast there. It is more relaxing beach,"March 29, 2019",0.0,0.0
https://www.tripadvisor.com/Attraction_Review-g644047-d15708228-Reviews-Unawatuna_Beach-Unawatuna_Galle_District_Southern_Province.html,Unawatuna Beach,3.9,189,https://dynamic-media-cdn.tripadvisor.com/media/photo-o/0b/50/b5/81/20160518-152153-largejpg.jpg?w=200&h=200&s=1,Melanie F,"Berkhamsted, United Kingdom",,3,Couples,Firstly the sand on the main beach is not the powdery white stuff that used to be there.  Unfortunately the beach has been extended  using sand dredged from the seabed which is more orangy and grittier.  Not a huge problem but a bit disappointing and had i read my lonely planet guide i would have been prepared.  However we did find lovely powdery white beaches a short tuk tuk ride away at jungle beach and dalawella. Also  i was horrified to see a dreadful monolith of a hotel being built at the end of unawatuna beach at least 12 stories high and easily visible from Galle and dalawella. The locals are horrified too... apparently it is a vanity project initiated by the president's son and such a shame as nothing else exceeds the height of a palm tree. And it's planted at the end with the lovely buddha statue so iconic views are ruined,"March 26, 2019",0.0,0.0
https://www.tripadvisor.com/Attraction_Review-g644047-d15708228-Reviews-Unawatuna_Beach-Unawatuna_Galle_District_Southern_Province.html,Unawatuna Beach,3.9,189,https://dynamic-media-cdn.tripadvisor.com/media/photo-o/0b/50/b5/81/20160518-152153-largejpg.jpg?w=200&h=200&s=1,wendym21,50 contributions,,4,Business,"Not been here for a couple of years, and was pleasantly surprised on our return. The beach appeared cleaner than last time., the ambience was good and the water beautiful. We enjoyed a lovely day off, relaxing and soaking up the sun","March 26, 2019",0.0,0.0
https://www.tripadvisor.com/Attraction_Review-g644047-d15708228-Reviews-Unawatuna_Beach-Unawatuna_Galle_District_Southern_Province.html,Unawatuna Beach,3.9,189,https://dynamic-media-cdn.tripadvisor.com/media/photo-o/0b/50/b5/81/20160518-152153-largejpg.jpg?w=200&h=200&s=1,rubikon,"Englefield Green, United Kingdom",,3,Couples,We only visited for one night. We had heard it was rated in the top 10 in the world! No way can this be and we ave found many nicer ones in SL alone. It is nice enough with a lovely expansive view. But the sand is a little gritty compared to softer sand you can find on other beaches. The beach has a steep shelf into the sea so be careful. There is a wide range of bars and restaurants on the beach; a lot of shisha too. It also had more litter than I have seen elsewhere.,"March 24, 2019",0.0,0.0
https://www.tripadvisor.com/Attraction_Review-g644047-d15708228-Reviews-Unawatuna_Beach-Unawatuna_Galle_District_Southern_Province.html,Unawatuna Beach,3.9,189,https://dynamic-media-cdn.tripadvisor.com/media/photo-o/0b/50/b5/81/20160518-152153-largejpg.jpg?w=200&h=200&s=1,Nicked2016,"Cobham, United Kingdom",,4,Couples,Nothing not to like and it is a lovely beach. It is a bit overdeveloped but still has some charm. there is however more development on the way. For a quieter time try Jungle Beach nearby.,"March 11, 2019",0.0,0.0
https://www.tripadvisor.com/Attraction_Review-g644047-d15708228-Reviews-Unawatuna_Beach-Unawatuna_Galle_District_Southern_Province.html,Unawatuna Beach,3.9,189,https://dynamic-media-cdn.tripadvisor.com/media/photo-o/0b/50/b5/81/20160518-152153-largejpg.jpg?w=200&h=200&s=1,Hawkar Hussein,"Istanbul, Türkiye",,4,Friends,"Well it's nice beach,like others in Sri Lanka, we did jet ski here and it was amazing if you want to do some water sport, also the bazaar at back of the beach is also nice, enjoy 3 hours here...","March 11, 2019",0.0,0.0
https://www.tripadvisor.com/Attraction_Review-g644047-d15708228-Reviews-Unawatuna_Beach-Unawatuna_Galle_District_Southern_Province.html,Unawatuna Beach,3.9,189,https://dynamic-media-cdn.tripadvisor.com/media/photo-o/0b/50/b5/81/20160518-152153-largejpg.jpg?w=200&h=200&s=1,AMohsen,"Port Said, Egypt",,5,Friends,"It was clean beach, warm water, and existing beach casinos are serving the sittings, food, and beverages. We saw far playing whales through the Indian ocean.","March 11, 2019",0.0,0.0
https://www.tripadvisor.com/Attraction_Review-g644047-d15708228-Reviews-Unawatuna_Beach-Unawatuna_Galle_District_Southern_Province.html,Unawatuna Beach,3.9,189,https://dynamic-media-cdn.tripadvisor.com/media/photo-o/0b/50/b5/81/20160518-152153-largejpg.jpg?w=200&h=200&s=1,Christine S,"Harrogate, United Kingdom",,4,Couples,Wide sandy beach with plenty of sun loungers available in the cafes as long as you buy drinks and food from them. The sea is warm but quite rough with moderate surf. The sea is unsuitable for children or those not confident out of their depth. Initial it shelves gently for a few metres and then suddenly drops steeply as if you are stepping of a ledge into deep water. There are a lot of vendors on the beach who can be quite persistent. Unfortunatly the overall appearance has been spoilt by the construction of a tower block hotel at one end of the beach.,"March 10, 2019",0.0,0.0
https://www.tripadvisor.com/Attraction_Review-g644047-d15708228-Reviews-Unawatuna_Beach-Unawatuna_Galle_District_Southern_Province.html,Unawatuna Beach,3.9,189,https://dynamic-media-cdn.tripadvisor.com/media/photo-o/0b/50/b5/81/20160518-152153-largejpg.jpg?w=200&h=200&s=1,Pangdongelf,104 contributions,,5,Couples,"Nice place to swim with less rocks on the beach. At the end of the beach you can enjoy the evening sunset with the sound of waves hitting seashore. Very beautiful beach with variety of activities to choose from like diving, snorkeling, surfing, SUP and so on","March 10, 2019",0.0,0.0
https://www.tripadvisor.com/Attraction_Review-g644047-d15708228-Reviews-Unawatuna_Beach-Unawatuna_Galle_District_Southern_Province.html,Unawatuna Beach,3.9,189,https://dynamic-media-cdn.tripadvisor.com/media/photo-o/0b/50/b5/81/20160518-152153-largejpg.jpg?w=200&h=200&s=1,V4324JWdave,"Brussels, Belgium",,3,Missing,"not so bad, but we have been on nicer and cleaner beaches in Sri-Lanka with less people. becoming too touristic","March 7, 2019",0.0,0.0
https://www.tripadvisor.com/Attraction_Review-g644047-d15708228-Reviews-Unawatuna_Beach-Unawatuna_Galle_District_Southern_Province.html,Unawatuna Beach,3.9,189,https://dynamic-media-cdn.tripadvisor.com/media/photo-o/0b/50/b5/81/20160518-152153-largejpg.jpg?w=200&h=200&s=1,Martina,"Ljubljana, Slovenia",,4,Missing,"The beach was great, with small or none waves, so very good for swimming. Snorkling is possible right by the beach, but the visability is not so good. Also the corals are almost all dead. The beach is with golden sand and it gets deep very quickly. Due to a lot of shells and coralls on the bottom you can use some beach shoes.","March 5, 2019",0.0,0.0
https://www.tripadvisor.com/Attraction_Review-g644047-d15708228-Reviews-Unawatuna_Beach-Unawatuna_Galle_District_Southern_Province.html,Unawatuna Beach,3.9,189,https://dynamic-media-cdn.tripadvisor.com/media/photo-o/0b/50/b5/81/20160518-152153-largejpg.jpg?w=200&h=200&s=1,Colin E,"Bristol, United Kingdom",,4,Couples,Very pleasant especially early morning and late afternoon. Good clean sea with shelf so can get to waist height quickly. Good to swim with light waves. We arrived on a Sunday afternoon which was busy with families. Hotels with restaurants and loungers. May be getting busier as what looks like a large hotel is under construction.,"March 5, 2019",0.0,0.0
https://www.tripadvisor.com/Attraction_Review-g644047-d15708228-Reviews-Unawatuna_Beach-Unawatuna_Galle_District_Southern_Province.html,Unawatuna Beach,3.9,189,https://dynamic-media-cdn.tripadvisor.com/media/photo-o/0b/50/b5/81/20160518-152153-largejpg.jpg?w=200&h=200&s=1,Jitendra Bhatnagar,"Ghaziabad, India",,4,Couples,Unawatuna Beach was a welcome respite after three days of hectic activity and driving. A comfortable night's sleep had rejuvenated us and we hit the beach soon after breakfast. It is a nice clean beach with many eating places to suit all pockets. What interested us most was the boating in Indian Ocean. We got some good snaps of the corals.,"February 28, 2019",0.0,0.0
https://www.tripadvisor.com/Attraction_Review-g644047-d15708228-Reviews-Unawatuna_Beach-Unawatuna_Galle_District_Southern_Province.html,Unawatuna Beach,3.9,189,https://dynamic-media-cdn.tripadvisor.com/media/photo-o/0b/50/b5/81/20160518-152153-largejpg.jpg?w=200&h=200&s=1,Jenny S,"High Wycombe, United Kingdom",,4,Couples,"Good to walk on the beach from one end to the other. Swimming was popular and jet ski, snorkelling and scuba all available. Plenty of beach restaurants and bars.","February 27, 2019",0.0,0.0
https://www.tripadvisor.com/Attraction_Review-g644047-d15708228-Reviews-Unawatuna_Beach-Unawatuna_Galle_District_Southern_Province.html,Unawatuna Beach,3.9,189,https://dynamic-media-cdn.tripadvisor.com/media/photo-o/0b/50/b5/81/20160518-152153-largejpg.jpg?w=200&h=200&s=1,Susie,"Melbourne, Australia",,4,Solo,"Lengthy, clean beach with lots of restaurants, sun-loungers, water-sport offerings and shops; but space for everyone. Very few hustlers trying to sell stuff whilst you rest.","February 22, 2019",0.0,0.0
https://www.tripadvisor.com/Attraction_Review-g644047-d15708228-Reviews-Unawatuna_Beach-Unawatuna_Galle_District_Southern_Province.html,Unawatuna Beach,3.9,189,https://dynamic-media-cdn.tripadvisor.com/media/photo-o/0b/50/b5/81/20160518-152153-largejpg.jpg?w=200&h=200&s=1,SLVS-22,82 contributions,,4,Couples,"There were HUGE waves while we were visiting. Like hardly can walk in the water waves. Lots of tourists on the beach. Not a lot of areas of shade, unless you commit to staying at a restaurant. Nice beach to walk along.","February 22, 2019",0.0,0.0
https://www.tripadvisor.com/Attraction_Review-g644047-d15708228-Reviews-Unawatuna_Beach-Unawatuna_Galle_District_Southern_Province.html,Unawatuna Beach,3.9,189,https://dynamic-media-cdn.tripadvisor.com/media/photo-o/0b/50/b5/81/20160518-152153-largejpg.jpg?w=200&h=200&s=1,amit m,"New Delhi, India",,5,Couples,"I have sent quite some time here so I might just be a bit bias, but it's a great beach, with good people and atmosphere, a must visit for anyone coming to Sri Lanka","February 19, 2019",0.0,0.0
https://www.tripadvisor.com/Attraction_Review-g644047-d15708228-Reviews-Unawatuna_Beach-Unawatuna_Galle_District_Southern_Province.html,Unawatuna Beach,3.9,189,https://dynamic-media-cdn.tripadvisor.com/media/photo-o/0b/50/b5/81/20160518-152153-largejpg.jpg?w=200&h=200&s=1,Equis I,"Ocean City, Maryland",,5,Solo,"Beautiful beach with plenty of little restaurants and water sports activities. You can find a lot of snorkelling, diving, SUP and surf options, although surfing is more practices in Weligama. There are also a lot of restaurants from which you can choose.","February 16, 2019",0.0,0.0
https://www.tripadvisor.com/Attraction_Review-g644047-d15708228-Reviews-Unawatuna_Beach-Unawatuna_Galle_District_Southern_Province.html,Unawatuna Beach,3.9,189,https://dynamic-media-cdn.tripadvisor.com/media/photo-o/0b/50/b5/81/20160518-152153-largejpg.jpg?w=200&h=200&s=1,Jane P,"Sydney, Australia",,5,Missing,"After travelling around Sri Lanka for 2 weeks, it was lovely to finally get our toes into the sand and experience one of Sri Lanka’s lovely pristine beaches. Our teenage daughters very grateful to be finally at a beach and not seeing another Tea Leaf or Temple!! Sun lounges line the beach with umbrellas, so you can really set yourself up here to enjoy the whole day Beach front. Nice relaxed & chilled out cafes and beach restaurants couple of footsteps  back from the beach. The whole area filled with back packers and a great mix of very interesting people from all walks of life!! We only came here for a few hours but this place definitely on our list of places to stay next visit to SL","February 2, 2019",0.0,0.0
https://www.tripadvisor.com/Attraction_Review-g644047-d15708228-Reviews-Unawatuna_Beach-Unawatuna_Galle_District_Southern_Province.html,Unawatuna Beach,3.9,189,https://dynamic-media-cdn.tripadvisor.com/media/photo-o/0b/50/b5/81/20160518-152153-largejpg.jpg?w=200&h=200&s=1,Nolsie1,"Melbourne, Australia",,5,Friends,"Unawatuna beach is beautiful, clean sandy beach, clear water with prefect temperature (in January). There are dozens of shady bars and restaurants along the back of the beach where you can go for lunch and dinner (they move extra tables out onto the sand at night so you can dine on the beach at night). There is a narrow village street that runs from the beach up to the main road that has lots of restaurants, bars, shops etc, which for us was a highlight of the place. If you stay at Calamander Beach Resort they do not tell about this street and if you don’t know where it is, it is possible that you can stay at Unawatuna beach for a week and not even know that it is there, so make sure you find it! (You can walk through to the village street from some of the other hotels, such as Tartaruga Hotel & restaurant, you walk through the driveway, turn left and right along a few short laneways and then you pop out into the middle of the village!). We loved this village, there are good rooftop bars such as The hideout, and good restaurants such as the Happy Spice, which is down the lane way behind the Pink Elephant (another good restaurant), and the Shifting Sands. We stayed at Calamander Beach Resort and although our rooms were pretty good, the service was underwhelming, meals took far too long so the restaurants were not busy, and we think there were better (and probably better value) places to stay that are also on the beachfront or in/near the village, with a very short walk to the beach. We stayed in 6 different hotels in Sri Lanka and we rated Calamander as the lowest in terms of value for money and service. But we loved Unawatuna both as a beach and a village, thoroughly recommend staying there.","January 26, 2019",0.0,0.0
https://www.tripadvisor.com/Attraction_Review-g644047-d15708228-Reviews-Unawatuna_Beach-Unawatuna_Galle_District_Southern_Province.html,Unawatuna Beach,3.9,189,https://dynamic-media-cdn.tripadvisor.com/media/photo-o/0b/50/b5/81/20160518-152153-largejpg.jpg?w=200&h=200&s=1,Guido C,"Lima, Peru",,4,Couples,"Wide, white sand beach with clear waters.  You can ride 20' on a wave runner for US$40.  Para-gliding is also offered on the beach.","January 9, 2019",0.0,0.0
