Destination URL,Destination Title,Destination Score,Total Reviews (Destination),Destination Image,Reviewer Name,Reviewer Location,Review Title,Review Score,Reviewer Category,Review Text,Written Date,  %,% %
https://www.tripadvisor.com/Attraction_Review-g644047-d15708228-Reviews-Unawatuna_Beach-Unawatuna_Galle_District_Southern_Province.html,Unawatuna Beach,3.9,189,https://dynamic-media-cdn.tripadvisor.com/media/photo-o/0b/50/b5/81/20160518-152153-largejpg.jpg?w=200&h=200&s=1,Jet Lanka Tours (Dinu),"Kandy, Sri Lanka",,5,Business,"Unawatuna Beach in Sri Lanka is renowned for its picturesque scenery, golden sands, and clear turquoise waters. It's a popular destination for both locals and tourists, offering a range of activities like snorkeling, diving, and surfing. The surrounding area is dotted with cozy cafes and beachfront bars, providing a relaxed atmosphere for visitors to unwind and enjoy the stunning sunset views. However, like many tourist spots, it can get crowded during peak seasons, so it's worth considering the timing of your visit for a more tranquil experience. Overall, Unawatuna Beach is a must-visit for anyone seeking sun, sea, and serenity in Sri Lanka.","March 24, 2024",0.0,0.0
https://www.tripadvisor.com/Attraction_Review-g644047-d15708228-Reviews-Unawatuna_Beach-Unawatuna_Galle_District_Southern_Province.html,Unawatuna Beach,3.9,189,https://dynamic-media-cdn.tripadvisor.com/media/photo-o/0b/50/b5/81/20160518-152153-largejpg.jpg?w=200&h=200&s=1,Fata S,"Murmansk, Russia",,4,Couples,"We lived near the beach in Aralia. The coastline is long, sand, sand in the water, but there were also stones. The underwater world is not rich, but we saw an octopus and turtles. There are many cafes and a disco along the beach. The beach is public and on weekends there are a lot of local people. The beach is good for swimming, which is rare in Sri Lanka. There are a couple of diving companies.","March 6, 2024",0.0,0.0
https://www.tripadvisor.com/Attraction_Review-g644047-d15708228-Reviews-Unawatuna_Beach-Unawatuna_Galle_District_Southern_Province.html,Unawatuna Beach,3.9,189,https://dynamic-media-cdn.tripadvisor.com/media/photo-o/0b/50/b5/81/20160518-152153-largejpg.jpg?w=200&h=200&s=1,Анна,"Moscow, Russia",,5,Friends,"Nice beach, clean, many cafes and water activities. The sand is pleasant, the entrance to the water is neat, there are waves, but they don’t “spin.”","March 1, 2024",0.0,0.0
https://www.tripadvisor.com/Attraction_Review-g644047-d15708228-Reviews-Unawatuna_Beach-Unawatuna_Galle_District_Southern_Province.html,Unawatuna Beach,3.9,189,https://dynamic-media-cdn.tripadvisor.com/media/photo-o/0b/50/b5/81/20160518-152153-largejpg.jpg?w=200&h=200&s=1,Елена Ш,1 contribution,,3,Missing,"We arrived at the rental from the hotel in a tuk-tuk, we had a backpack with us, in it were swimsuits and a wallet with $800 and rupees in small change for travel (the plan was to exchange dollars), we rented a surfboard, we wanted to take turns surfing, but the nice employees were free They offered to lock personal belongings in a wooden box near their service so that we could ride together. We rode for a long time, it got dark and we didn’t go to the bank. We arrived at the hotel and took out money in a tuk-tuk to put in the safe, it turned out to be $400, but it was a waste. The next day was lost to the police, to no avail. Because they didn’t count the money right away, they accepted the complaint, not the statement. Be careful! Here is this orange box for things on the left in the photo and the scammers themselves (there is a third one)! And the beach is wonderful, and so is the surfing!","February 29, 2024",0.0,0.0
https://www.tripadvisor.com/Attraction_Review-g644047-d15708228-Reviews-Unawatuna_Beach-Unawatuna_Galle_District_Southern_Province.html,Unawatuna Beach,3.9,189,https://dynamic-media-cdn.tripadvisor.com/media/photo-o/0b/50/b5/81/20160518-152153-largejpg.jpg?w=200&h=200&s=1,Patrik Å,"Boracay, Philippines",,2,Solo,I was really dissapointed by this beach. Coming from Tangalle and Mirissa. I changed hotel and stayed at Dalawella beach instead which was more nice. However this beach was nice at the nights for going out to eat and shop.,"February 20, 2024",0.0,0.0
https://www.tripadvisor.com/Attraction_Review-g644047-d15708228-Reviews-Unawatuna_Beach-Unawatuna_Galle_District_Southern_Province.html,Unawatuna Beach,3.9,189,https://dynamic-media-cdn.tripadvisor.com/media/photo-o/0b/50/b5/81/20160518-152153-largejpg.jpg?w=200&h=200&s=1,Laurane D,31 contributions,,2,Couples,"It is a nice large beach but absolutely full with tourists, especially Russians, who do not respect anything. There are so much other nicer beaches than going here","February 3, 2024",0.0,0.0
https://www.tripadvisor.com/Attraction_Review-g644047-d15708228-Reviews-Unawatuna_Beach-Unawatuna_Galle_District_Southern_Province.html,Unawatuna Beach,3.9,189,https://dynamic-media-cdn.tripadvisor.com/media/photo-o/0b/50/b5/81/20160518-152153-largejpg.jpg?w=200&h=200&s=1,Ruud C,"Kursk, Russia",,5,Couples,"Very nice beach, clean and low waves. Dogs and no dirt . Good food at bar "" sand beach"" perfect praws and very nice mango juice. Find sand, but the water gets deep very fast here. Maybe not very suitable with little children","January 24, 2024",0.0,0.0
https://www.tripadvisor.com/Attraction_Review-g644047-d15708228-Reviews-Unawatuna_Beach-Unawatuna_Galle_District_Southern_Province.html,Unawatuna Beach,3.9,189,https://dynamic-media-cdn.tripadvisor.com/media/photo-o/0b/50/b5/81/20160518-152153-largejpg.jpg?w=200&h=200&s=1,jaapinamsterdam,"Amsterdam, The Netherlands",,2,Couples,"Steeply sloping beach with a lot of plastic rubbish at one end and a filthy sewer draining into the seawater at the other end. Very busy with a cheaper type of tourism. Avoid, and find a beach elsewhere.","January 23, 2024",0.0,0.0
https://www.tripadvisor.com/Attraction_Review-g644047-d15708228-Reviews-Unawatuna_Beach-Unawatuna_Galle_District_Southern_Province.html,Unawatuna Beach,3.9,189,https://dynamic-media-cdn.tripadvisor.com/media/photo-o/0b/50/b5/81/20160518-152153-largejpg.jpg?w=200&h=200&s=1,Mao M,4 contributions,,5,Couples,"A wonderful beach for swimming, there are rarely big waves here, the entry into the water is smooth at first, then the drop - and then the depth, and on the southern part of the beach this is more pronounced, the beach itself is wide, full of cafes and restaurants, there are also hotels. Along the beach there is a tourist street, which is also full of everything. For those who prefer a relaxing holiday and love to swim, this is the place!","January 22, 2024",0.0,0.0
https://www.tripadvisor.com/Attraction_Review-g644047-d15708228-Reviews-Unawatuna_Beach-Unawatuna_Galle_District_Southern_Province.html,Unawatuna Beach,3.9,189,https://dynamic-media-cdn.tripadvisor.com/media/photo-o/0b/50/b5/81/20160518-152153-largejpg.jpg?w=200&h=200&s=1,Lynette Shaw,"Bacup, United Kingdom",,1,Missing,The beach was full of rubbish and dogs doing their business. Such a shame. Avoid ! We travelled all the way from England and whilst  the people of Sri Lanka are wonderful and can’t do enough for you the situation is a serious problem !,"January 6, 2024",0.0,0.0
https://www.tripadvisor.com/Attraction_Review-g644047-d15708228-Reviews-Unawatuna_Beach-Unawatuna_Galle_District_Southern_Province.html,Unawatuna Beach,3.9,189,https://dynamic-media-cdn.tripadvisor.com/media/photo-o/0b/50/b5/81/20160518-152153-largejpg.jpg?w=200&h=200&s=1,Marc S,3 contributions,,1,Couples,"The surfer and local culture has been completely replaced by reckless, mainly Russian, package tourism.  The restaurants try to outdo each other with loud music.  Sometimes until midnight.  You can hardly understand your own words or even a single song.  The quality of the food has fallen significantly and the prices have risen.  Better to avoid.","December 20, 2023",0.0,0.0
https://www.tripadvisor.com/Attraction_Review-g644047-d15708228-Reviews-Unawatuna_Beach-Unawatuna_Galle_District_Southern_Province.html,Unawatuna Beach,3.9,189,https://dynamic-media-cdn.tripadvisor.com/media/photo-o/0b/50/b5/81/20160518-152153-largejpg.jpg?w=200&h=200&s=1,Jayaseeli Christiansen,"Stenloese, Denmark",,4,Friends,"We had lunch in the Tartaruga Beach Restaurant which is just on the Unawatuna Beach, so enjoyed a walk on the beach! Fantastic beach to enjoying the surroundings while indulging fresh breeze blowing from the Indian Ocean!","October 29, 2023",0.0,0.0
https://www.tripadvisor.com/Attraction_Review-g644047-d15708228-Reviews-Unawatuna_Beach-Unawatuna_Galle_District_Southern_Province.html,Unawatuna Beach,3.9,189,https://dynamic-media-cdn.tripadvisor.com/media/photo-o/0b/50/b5/81/20160518-152153-largejpg.jpg?w=200&h=200&s=1,Explore Sri Lanka,"Galle, Sri Lanka",,5,Missing,"Stunning beach. Ideal location for snorkeling and swimming. There are plenty of eateries, cafes, and villas face to the beach. The road's approach is constrained. Available parking spaces are low. Your car can be parked on either side of the street.","October 8, 2023",0.0,0.0
https://www.tripadvisor.com/Attraction_Review-g644047-d15708228-Reviews-Unawatuna_Beach-Unawatuna_Galle_District_Southern_Province.html,Unawatuna Beach,3.9,189,https://dynamic-media-cdn.tripadvisor.com/media/photo-o/0b/50/b5/81/20160518-152153-largejpg.jpg?w=200&h=200&s=1,NLB-Artem,"Moscow, Russia",,5,Couples,"Comfortable wide sandy beach, gentle entry into the water, no special shoes needed - sand without stones or anything else. Not bad cafes with low prices and delicious food, as well as amazing pina coladas.","September 28, 2023",0.0,0.0
https://www.tripadvisor.com/Attraction_Review-g644047-d15708228-Reviews-Unawatuna_Beach-Unawatuna_Galle_District_Southern_Province.html,Unawatuna Beach,3.9,189,https://dynamic-media-cdn.tripadvisor.com/media/photo-o/0b/50/b5/81/20160518-152153-largejpg.jpg?w=200&h=200&s=1,Mar,"Granada, Spain",,5,Missing,"Nice beach to spend a few days of rest with the family. I would recommend as a vacation spot to any family that likes beach, sun and tranquility.","August 27, 2023",0.0,0.0
https://www.tripadvisor.com/Attraction_Review-g644047-d15708228-Reviews-Unawatuna_Beach-Unawatuna_Galle_District_Southern_Province.html,Unawatuna Beach,3.9,189,https://dynamic-media-cdn.tripadvisor.com/media/photo-o/0b/50/b5/81/20160518-152153-largejpg.jpg?w=200&h=200&s=1,Gama -My driver Sri Lanka,"Galle, Sri Lanka",,5,Missing,unawatuna beach is located in southern coastal lone of sri lanka. one of the best beaches in the world.,"July 30, 2023",0.0,0.0
https://www.tripadvisor.com/Attraction_Review-g644047-d15708228-Reviews-Unawatuna_Beach-Unawatuna_Galle_District_Southern_Province.html,Unawatuna Beach,3.9,189,https://dynamic-media-cdn.tripadvisor.com/media/photo-o/0b/50/b5/81/20160518-152153-largejpg.jpg?w=200&h=200&s=1,TravellingPye,"Southampton, United Kingdom",,1,Couples,"Admittedly, there are dirtier and uglier beaches on this planet (not to say it’s anything other than bang average). But what absolutely ruins this beach is the vibe of the place… Most big areas have a Little India or a China Town… well here lies a Mini Russia. Filled with dodgy locals offering you everything from magic mushrooms to photos with baby monkeys on leashes that they stole from the jungle. We spent half hour on the beach and were approached about 5 or 6 times by people offering all of the above… and more. This is no longer the tropical paradise as it’s sold online, it’s a tainted beauty spot. There is nothing Sri Lankan about Unawatuna beach at all anymore. All character and purity has been ripped from underneath it, such a shame as it’s not a true reflection on the rest of the stunning country.","May 12, 2023",0.0,0.0
https://www.tripadvisor.com/Attraction_Review-g644047-d15708228-Reviews-Unawatuna_Beach-Unawatuna_Galle_District_Southern_Province.html,Unawatuna Beach,3.9,189,https://dynamic-media-cdn.tripadvisor.com/media/photo-o/0b/50/b5/81/20160518-152153-largejpg.jpg?w=200&h=200&s=1,Alexandra H,"Paris, France",,1,Missing,"An eroded beach, dirty murky water, a canal of raw sewage in one end of the beach, draining into the ocean. Tons of trash. Boaters and jet ski machines operating right next to swimmers with no supervision. Fat women of A Country That Shall Not Be Named screaming at their kids. And no snorkelling, due to the human activity and murky foul water.","May 11, 2023",0.0,0.0
https://www.tripadvisor.com/Attraction_Review-g644047-d15708228-Reviews-Unawatuna_Beach-Unawatuna_Galle_District_Southern_Province.html,Unawatuna Beach,3.9,189,https://dynamic-media-cdn.tripadvisor.com/media/photo-o/0b/50/b5/81/20160518-152153-largejpg.jpg?w=200&h=200&s=1,strachanBristol,130 contributions,,5,Couples,"Great beach , has changed in recent years due to the big influx of Russians … won’t go back again sadly to say as not many Europeans there now","March 4, 2023",0.0,0.0
https://www.tripadvisor.com/Attraction_Review-g644047-d15708228-Reviews-Unawatuna_Beach-Unawatuna_Galle_District_Southern_Province.html,Unawatuna Beach,3.9,189,https://dynamic-media-cdn.tripadvisor.com/media/photo-o/0b/50/b5/81/20160518-152153-largejpg.jpg?w=200&h=200&s=1,L2_R3,394 contributions,,5,Missing,"Rather popular but with a lot of places and perfectly clean water.  Good infrastructure, bars and services in place.","March 2, 2023",0.0,0.0
https://www.tripadvisor.com/Attraction_Review-g644047-d15708228-Reviews-Unawatuna_Beach-Unawatuna_Galle_District_Southern_Province.html,Unawatuna Beach,3.9,189,https://dynamic-media-cdn.tripadvisor.com/media/photo-o/0b/50/b5/81/20160518-152153-largejpg.jpg?w=200&h=200&s=1,Kulz,"Singapore, Singapore",,5,Missing,"If you go to galle, visit here! Its a 20min drive from galle fort. Beautiful beach compared to galle fort. Visit during sunset! And sign up for one hour boatride! Many good food options. Good place to chill in the evening.","March 1, 2023",0.0,0.0
https://www.tripadvisor.com/Attraction_Review-g644047-d15708228-Reviews-Unawatuna_Beach-Unawatuna_Galle_District_Southern_Province.html,Unawatuna Beach,3.9,189,https://dynamic-media-cdn.tripadvisor.com/media/photo-o/0b/50/b5/81/20160518-152153-largejpg.jpg?w=200&h=200&s=1,Channa D,6 contributions,,5,Friends,One of the best beaches on earth. Safe clean and lots of marine life.Many good Diving sites close to the beach.Submarine Diving school well located on the beach for this purpose  and PADI instructor Shirly and his crew are well explained on SCUBA Diving.,"May 3, 2022",0.0,0.0
https://www.tripadvisor.com/Attraction_Review-g644047-d15708228-Reviews-Unawatuna_Beach-Unawatuna_Galle_District_Southern_Province.html,Unawatuna Beach,3.9,189,https://dynamic-media-cdn.tripadvisor.com/media/photo-o/0b/50/b5/81/20160518-152153-largejpg.jpg?w=200&h=200&s=1,KingsDXB,"Dubai, United Arab Emirates",,5,Missing,Great beach offering a large amount of restaurants and bars. Several options for diving and glass bottom boat tours.,"April 15, 2022",0.0,0.0
https://www.tripadvisor.com/Attraction_Review-g644047-d15708228-Reviews-Unawatuna_Beach-Unawatuna_Galle_District_Southern_Province.html,Unawatuna Beach,3.9,189,https://dynamic-media-cdn.tripadvisor.com/media/photo-o/0b/50/b5/81/20160518-152153-largejpg.jpg?w=200&h=200&s=1,Dia Lanka Travels,"Colombo, Sri Lanka",,5,Missing,Unawatuna Beach is ideal location people who are looking for sun sand and Sea. Very Beautiful and one of Sri Lankas Top and attractive beach. Its safe and November to April season is very good to swim and enjoy the Unawatuna Area. There are few restaurants around there.,"March 17, 2022",0.0,0.0
https://www.tripadvisor.com/Attraction_Review-g644047-d15708228-Reviews-Unawatuna_Beach-Unawatuna_Galle_District_Southern_Province.html,Unawatuna Beach,3.9,189,https://dynamic-media-cdn.tripadvisor.com/media/photo-o/0b/50/b5/81/20160518-152153-largejpg.jpg?w=200&h=200&s=1,Alfredo R,"Olhao, Portugal",,3,Missing,"The beach itself is good with plenty of options for sun beds, drinks and food. However I can't give 5* to this due to its VISITORS! Summing up the facts: this place is starting to look more like Russia than anything else. Many restaurants have the menu in Sinhalese and Russian with hidden English menus (in some, you even have to ask for it). I wouldn't mind that if it wasn't for the fact that tourists from this specific country are ruining the island. Of course there is good people and bad people everywhere, but I haven't seen other foreigners (from other countries) doing any of the following things: throwing rocks at dogs and laughing, removing corals from the sea into the land or throwing empty bottles of alcohol into the ocean. The behavior of these tourists is just unacceptable. Instead of seeing locals defending their area, we see them supporting this type of stuff/behavior. It's very sad to see this. We know Sri Lanka is in desperate need of tourism, but this type of tourism will destroy beautiful places. They get drunk and ruin your experience with their drunkenness.  I hope the police starts patrolling the beach and making tourists have some respect for the public areas. They also have locals with wild caught monkeys on a leash passing by for pictures on top of you. Animal abuse, bad behavior and habitat destruction to say the least.","February 12, 2022",0.0,0.0
https://www.tripadvisor.com/Attraction_Review-g644047-d15708228-Reviews-Unawatuna_Beach-Unawatuna_Galle_District_Southern_Province.html,Unawatuna Beach,3.9,189,https://dynamic-media-cdn.tripadvisor.com/media/photo-o/0b/50/b5/81/20160518-152153-largejpg.jpg?w=200&h=200&s=1,Ian-Jacki,"Didcot, United Kingdom",,3,Missing,Beach is set in a horseshoe format with many bars and restaurants along the way. Sea is calm in most areas good for bathing,"February 5, 2022",0.0,0.0
https://www.tripadvisor.com/Attraction_Review-g644047-d15708228-Reviews-Unawatuna_Beach-Unawatuna_Galle_District_Southern_Province.html,Unawatuna Beach,3.9,189,https://dynamic-media-cdn.tripadvisor.com/media/photo-o/0b/50/b5/81/20160518-152153-largejpg.jpg?w=200&h=200&s=1,Goutham Shetlur,"Bengaluru, India",,3,Friends,"A very average beach. Certainly not a white sand beach. Sand quality is just okay, must be a good place for a swim. Quite a lot of beach restaurants and shacks. But none of them worth mentioning. Given a choice between this and Mirissa for lack of time, would choose the latter.","January 2, 2022",0.0,0.0
https://www.tripadvisor.com/Attraction_Review-g644047-d15708228-Reviews-Unawatuna_Beach-Unawatuna_Galle_District_Southern_Province.html,Unawatuna Beach,3.9,189,https://dynamic-media-cdn.tripadvisor.com/media/photo-o/0b/50/b5/81/20160518-152153-largejpg.jpg?w=200&h=200&s=1,Sarala K B,"Mysuru (Mysore), India",,4,Couples,"A Sandy beach lined with comfy beach shacks which serve food and drinks and also have accommodation . If you like to stay amongst people then choose a place to stay right here. There are night parties on the beach too. If you are a couple who prefers to have some personal space , chose a hotel a little away from unawatuna and visit this place for meals and shopping . I found the best price for picking up souvenirs in the shops around Unawatuna beach . You can visit during the day or at night and enjoy a meal with a beautiful view and the sound of the waves . Can also take a dip in the ocean here . Since we visited post lock down the crowd wasn’t much but This seems to be the happening place to be during the peak.","December 16, 2021",0.0,0.0
https://www.tripadvisor.com/Attraction_Review-g644047-d15708228-Reviews-Unawatuna_Beach-Unawatuna_Galle_District_Southern_Province.html,Unawatuna Beach,3.9,189,https://dynamic-media-cdn.tripadvisor.com/media/photo-o/0b/50/b5/81/20160518-152153-largejpg.jpg?w=200&h=200&s=1,Dhammika P,2 contributions,,5,Missing,"Hay this is an excellent place. This is like my home. where I found a holiday I almost visit there for to have a safe sea swim. Lifeguards are there watching so no issues. Like to experience swimming with different nationals and swimming skills. For novice swimmers, there is a safe area near the temple. This is believed to be a spiritual place, A god who helps novice swimmers to become experienced swimmers  , a god who was a  life rescuer and who died when he tried to save his 4th life at the Tsunami day 2004. I individually believe that faith. If you come here and if you are not swimming, you are against the God ! So come and swim and enjoy ! Snokering is great here, even in shallow water you can do snokering. Please don't put plastics and bear cans to the ocean , please keep this place clean and beautiful , the marine -life depends on it. Bad: Even I put 5/5. There are some bad things to acknowledge. ""Male prostitutes"" : in this area, you can rarely find the female prostitutes. Almost all prostitutes here are male. They exist as 'beach boys', who are trying to fraud some money from the solo female travelers. Again they are not professional escorts, if you are looking for an escort then go for a professional escort service instead. pimps and thugs are not actually there, but beach boys and amateur tour guides , Stay away from them ! Beach boys are neither escort service providers or tour guides. They are cunning trying to cheat the female solo tourists who are looking for a easy money. You can have a room here for 1000$ a night to less than 10$ per a night. luxury one to very budget one. if you are a foreign traveler and looking for a help, then ask about accommodation from local tourists who visit this area regularly. Budget room ,no A/C, no hot water, but clean around 5$-30$. Middle budget room , with A/C hot water, swimming pool is around 30$-100$, High-end room in a 3 star - 4star hotel will cost over 100$-1000$ per night. Even you don't need to book a room here if you are not staying a night. if you want to swim for a couple of hours here, you can park your car at a nearby hotel , 300LKR car park charges and then take a meal from the bar/restaurant near the temple and you can have free shower after sea swim. Otherwise, it will be 50LKR. not bad. diving is great near the ""Aluth gala"" area. Discovery will cost around 5000/-LKR. Don't spend beyond that. Romantic activities in the beach: Well, actually it's illegal since this is a public place. But it's quite okay if children and not too much crowded. This is a little bit crowded beach, if you are looking for a less crowded beach, then you may find it near Hikkaduwa. Not a good beach for romantic activities but great for swimming.","November 14, 2021",0.0,0.0
https://www.tripadvisor.com/Attraction_Review-g644047-d15708228-Reviews-Unawatuna_Beach-Unawatuna_Galle_District_Southern_Province.html,Unawatuna Beach,3.9,189,https://dynamic-media-cdn.tripadvisor.com/media/photo-o/0b/50/b5/81/20160518-152153-largejpg.jpg?w=200&h=200&s=1,Poul,"Aarhus, Denmark",,3,Couples,"Unawatuna beach is in a bay, giving possibility for svimming in not to big wawes. The sand is ok, a bit rough, but sand. The water was when we where there not totally clear, about 2m visibility. But the locals said that it was due to much rain the past days, normally much clearer water. The surrundings was maybe lacking from the covid closedown. We where some of the first guests. But there was many left buildings, garbage and closed hotels/bars. I notised that many signs was both in english and russian…","November 12, 2021",0.0,0.0
https://www.tripadvisor.com/Attraction_Review-g644047-d15708228-Reviews-Unawatuna_Beach-Unawatuna_Galle_District_Southern_Province.html,Unawatuna Beach,3.9,189,https://dynamic-media-cdn.tripadvisor.com/media/photo-o/0b/50/b5/81/20160518-152153-largejpg.jpg?w=200&h=200&s=1,Julie B,"Worsley, United Kingdom",,5,Couples,"One of the nicest beaches we visited in sri Lanka.  If you go the far end of the beach you can get into the sea easier, the end near the temple. Sunbeds were free if you bought a drink at most bars or something to eat. Few sellers on beach but if you weren't interested they didnt pester you.","April 11, 2020",0.0,0.0
https://www.tripadvisor.com/Attraction_Review-g644047-d15708228-Reviews-Unawatuna_Beach-Unawatuna_Galle_District_Southern_Province.html,Unawatuna Beach,3.9,189,https://dynamic-media-cdn.tripadvisor.com/media/photo-o/0b/50/b5/81/20160518-152153-largejpg.jpg?w=200&h=200&s=1,TravelIRE88,"London, United Kingdom",,2,Friends,"I thought long and hard about if I should stay at Unawatuna beach and thought I would give it a shot. It ended up been the worst beach I stayed at on my trip. We spend one afternoon on it then went to Angel Beach club which is a 7 min tuk tuk drive. Highly recommend Angel as it’s on a nice beach and has a nice pool with good food and drink, don’t waste your time with Unawatuna","April 6, 2020",0.0,0.0
