Destination URL,Destination Title,Destination Score,Total Reviews (Destination),Destination Image,Reviewer Name,Reviewer Location,Review Title,Review Score,Reviewer Category,Review Text,Written Date,  %,% %
https://www.tripadvisor.com/Attraction_Review-g644047-d15708228-Reviews-Unawatuna_Beach-Unawatuna_Galle_District_Southern_Province.html,Unawatuna Beach,3.9,189,https://dynamic-media-cdn.tripadvisor.com/media/photo-o/0b/50/b5/81/20160518-152153-largejpg.jpg?w=200&h=200&s=1,Jordan C,"Dubai, United Arab Emirates",,1,Solo,"If you are spending your hard earned money to go on holiday, then do not come to this beach. The place is scruffy, its become a draw for the budget traveller who has little money to spend. Its got groups of people who will buy bottles of vodka from the liqueur store and then sit next to you and order 1 bottle of coke and six empty glasses and spend all night getting drunk. Ladies be aware of the rastsa beach boys, they will be all over you, and watch your drinks, as illegal substances are offered in the the twilight hours. Men be aware, that knives are hidden under the sand around some popular night spots, and if you query a bar bill, then you will be surrounded. The tuk tuks are a rip off, the sand has been imported and is full of broken shells and cigarette buts. Dogs roam freely, and are allowed in the restaurant areas while you are trying to eat your meal. There are so many better areas in Sri Lanka to holiday, give this place a miss.","March 14, 2020",0.0,0.0
https://www.tripadvisor.com/Attraction_Review-g644047-d15708228-Reviews-Unawatuna_Beach-Unawatuna_Galle_District_Southern_Province.html,Unawatuna Beach,3.9,189,https://dynamic-media-cdn.tripadvisor.com/media/photo-o/0b/50/b5/81/20160518-152153-largejpg.jpg?w=200&h=200&s=1,lutz,29 contributions,,3,Solo,Nice sandy beach in a bay with sometimes really big waves. Too bad the water is sometimes quite full of rubbish and the beach starts to be full of plastic dirt too. Diving and snorkeling boats cross with high speed the swimming zone and if you are in the way they'd rather whistle that you'd step out of way than slow down itself. A pity for this beautiful beach.,"March 12, 2020",0.0,0.0
https://www.tripadvisor.com/Attraction_Review-g644047-d15708228-Reviews-Unawatuna_Beach-Unawatuna_Galle_District_Southern_Province.html,Unawatuna Beach,3.9,189,https://dynamic-media-cdn.tripadvisor.com/media/photo-o/0b/50/b5/81/20160518-152153-largejpg.jpg?w=200&h=200&s=1,karen w,44 contributions,,4,Missing,There are lots of bars and restaurants on the beach each with it's own character so it doesn't feel too touristy.During the day most of the restaurants have sun loungers and umbrellas which you can use for the price of a drink.,"March 7, 2020",0.0,0.0
https://www.tripadvisor.com/Attraction_Review-g644047-d15708228-Reviews-Unawatuna_Beach-Unawatuna_Galle_District_Southern_Province.html,Unawatuna Beach,3.9,189,https://dynamic-media-cdn.tripadvisor.com/media/photo-o/0b/50/b5/81/20160518-152153-largejpg.jpg?w=200&h=200&s=1,TravelerRanitha,"Moratuwa, Sri Lanka",,4,Missing,"Best time to visit unawatuna is from Jan-Apr as the waters as calm , many family restaurants are their to enjoy snack","March 6, 2020",0.0,0.0
https://www.tripadvisor.com/Attraction_Review-g644047-d15708228-Reviews-Unawatuna_Beach-Unawatuna_Galle_District_Southern_Province.html,Unawatuna Beach,3.9,189,https://dynamic-media-cdn.tripadvisor.com/media/photo-o/0b/50/b5/81/20160518-152153-largejpg.jpg?w=200&h=200&s=1,Villa S,"Panadura, Sri Lanka",,4,Missing,"from Jan-Apr is the season to visit unawatuna beach as their are less waves and water calm to getting with family and your ones , many restaurants are their to enjoy shacks","March 6, 2020",0.0,0.0
https://www.tripadvisor.com/Attraction_Review-g644047-d15708228-Reviews-Unawatuna_Beach-Unawatuna_Galle_District_Southern_Province.html,Unawatuna Beach,3.9,189,https://dynamic-media-cdn.tripadvisor.com/media/photo-o/0b/50/b5/81/20160518-152153-largejpg.jpg?w=200&h=200&s=1,Elena Ciocan,"Timisoara, Romania",,4,Missing,"First thing you will notice is that the sand is different. This is because of the horrible tsunami. They did a perfect job to rebuild the beach, but the sand is brought from the ocean and is different than rest of Sri Lanka. The sunset here is amazing.","February 27, 2020",0.0,0.0
https://www.tripadvisor.com/Attraction_Review-g644047-d15708228-Reviews-Unawatuna_Beach-Unawatuna_Galle_District_Southern_Province.html,Unawatuna Beach,3.9,189,https://dynamic-media-cdn.tripadvisor.com/media/photo-o/0b/50/b5/81/20160518-152153-largejpg.jpg?w=200&h=200&s=1,Christina,"Hamburg, Germany",,5,Missing,"Superb beach. Clean. Has a lot of activities, but very popular for scuba. There are plenty of good restaurants and shacks right on the beach. And a very good night life.","February 20, 2020",0.0,0.0
https://www.tripadvisor.com/Attraction_Review-g644047-d15708228-Reviews-Unawatuna_Beach-Unawatuna_Galle_District_Southern_Province.html,Unawatuna Beach,3.9,189,https://dynamic-media-cdn.tripadvisor.com/media/photo-o/0b/50/b5/81/20160518-152153-largejpg.jpg?w=200&h=200&s=1,Davbob54,"Dundee, United Kingdom",,3,Missing,"Busy beach but worth a couple of hours of your time to visit, nice sand and with bars on the beach a place to sit, relax and take in the Indian Ocean","February 17, 2020",0.0,0.0
https://www.tripadvisor.com/Attraction_Review-g644047-d15708228-Reviews-Unawatuna_Beach-Unawatuna_Galle_District_Southern_Province.html,Unawatuna Beach,3.9,189,https://dynamic-media-cdn.tripadvisor.com/media/photo-o/0b/50/b5/81/20160518-152153-largejpg.jpg?w=200&h=200&s=1,prashant v,"New Delhi, India",,4,Missing,"Clean. Has a lot of activities, but very popular for scuba. There are plenty of good restaurants and shacks right on the beach. And a very good night life.","February 8, 2020",0.0,0.0
https://www.tripadvisor.com/Attraction_Review-g644047-d15708228-Reviews-Unawatuna_Beach-Unawatuna_Galle_District_Southern_Province.html,Unawatuna Beach,3.9,189,https://dynamic-media-cdn.tripadvisor.com/media/photo-o/0b/50/b5/81/20160518-152153-largejpg.jpg?w=200&h=200&s=1,tonyandelaine,"Durban, South Africa",,5,Missing,"Any trip to Sri Lanka must include Unawatuna Beach. The restauarnts are really plentiful & good. The people are friendly & it's easy to get around with Tuk tuks in abundance. It's a short tuk tuk ride to Galle if you need a bit of sightseeing , history & shopping, but if relaxing is your plan then the beaches are perfect.","February 2, 2020",0.0,0.0
https://www.tripadvisor.com/Attraction_Review-g644047-d15708228-Reviews-Unawatuna_Beach-Unawatuna_Galle_District_Southern_Province.html,Unawatuna Beach,3.9,189,https://dynamic-media-cdn.tripadvisor.com/media/photo-o/0b/50/b5/81/20160518-152153-largejpg.jpg?w=200&h=200&s=1,Terry M,"Hamilton, Canada",,4,Missing,"The town of  Unawatuna has grown leaps and bounds over the years, the beach the economic driver. It is a nice, sandy beach in which you sink with every step. The stretch opposite my hotel was just for swimming and chilling. The waves were not a big issue. If you stand with your back to the water you have a string of resorts and restaurants. Fresh fish caught offshore can be on your plate every night though it is appreciably higher priced than your standard curry and rice fare. Dinner on the beach is a good experience. Could not get the hotel wifi to upload pix in any reasonable amount of time.","February 1, 2020",0.0,0.0
https://www.tripadvisor.com/Attraction_Review-g644047-d15708228-Reviews-Unawatuna_Beach-Unawatuna_Galle_District_Southern_Province.html,Unawatuna Beach,3.9,189,https://dynamic-media-cdn.tripadvisor.com/media/photo-o/0b/50/b5/81/20160518-152153-largejpg.jpg?w=200&h=200&s=1,tooting terror,8 contributions,,3,Couples,"Somewhat unusually I've found that the last dozen reviews sum this place up pretty accuracy. The main beach is over developed but very pleasant. Many restaurants from the fantastic to mediocre. Beach safeish for kids (slopes away quickly with some undertow - don't leave them unsupervised). Plenty of Russians. Ok for a couple of days, but not the real Sri Lanka.","January 31, 2020",0.0,0.0
https://www.tripadvisor.com/Attraction_Review-g644047-d15708228-Reviews-Unawatuna_Beach-Unawatuna_Galle_District_Southern_Province.html,Unawatuna Beach,3.9,189,https://dynamic-media-cdn.tripadvisor.com/media/photo-o/0b/50/b5/81/20160518-152153-largejpg.jpg?w=200&h=200&s=1,Nilusha Alahakoon,"Colombo, Sri Lanka",,5,Missing,The beach is very safe to relax and have a sea bath. Beach is very free comparing to other locations in Galle. Welle Devalaya also nearby to visit.,"January 22, 2020",0.0,0.0
https://www.tripadvisor.com/Attraction_Review-g644047-d15708228-Reviews-Unawatuna_Beach-Unawatuna_Galle_District_Southern_Province.html,Unawatuna Beach,3.9,189,https://dynamic-media-cdn.tripadvisor.com/media/photo-o/0b/50/b5/81/20160518-152153-largejpg.jpg?w=200&h=200&s=1,andrew w,"Nottingham, United Kingdom",,5,Missing,Unwatuna beach is a nice bay to walk round at one end is a buddest temple .The beach is lined with bars and restaurants and dive centres.Plenty of boats offering sea excursions and there is jet skis.It is an ideal beach for families and the sea is ideal for snorkelling.,"January 21, 2020",0.0,0.0
https://www.tripadvisor.com/Attraction_Review-g644047-d15708228-Reviews-Unawatuna_Beach-Unawatuna_Galle_District_Southern_Province.html,Unawatuna Beach,3.9,189,https://dynamic-media-cdn.tripadvisor.com/media/photo-o/0b/50/b5/81/20160518-152153-largejpg.jpg?w=200&h=200&s=1,uzmelissa,"Dubai, United Arab Emirates",,5,Missing,"After a long and tired trip in Sri Lanka, we reached to Galle and spend our one day on ıts popular beach. It has very long and tidy beach and so many local resorts,guesthouses, restaurants. When searching that are for accomadition i was so tired to decide for choosing on right on beach local resorts. They dont like organised and comfort for my familys style. So we decided to stay in Galle Amari and went there especially for the beach. I cant not say that is an amazing beach,sea and resorts side about here but you can come for a lazy day, keep a restaurants sun lounge and feel relax so much.","January 19, 2020",0.0,0.0
https://www.tripadvisor.com/Attraction_Review-g644047-d15708228-Reviews-Unawatuna_Beach-Unawatuna_Galle_District_Southern_Province.html,Unawatuna Beach,3.9,189,https://dynamic-media-cdn.tripadvisor.com/media/photo-o/0b/50/b5/81/20160518-152153-largejpg.jpg?w=200&h=200&s=1,Tomáš Roud,"Kutna Hora, Czech Republic",,5,Missing,"Very good organised beach. Very long and not so full of people. If you count number of people in the city of Galle, beach is still free. My children had a place for sand plays and for swimming too. There are not so big waves and my 2 years baby can manage them. Near the beach are a lot of hotels and restaurants and bars for avg 300 LKR for a drink like ice tea or beer. I recommend this place for all day.","January 13, 2020",0.0,0.0
https://www.tripadvisor.com/Attraction_Review-g644047-d15708228-Reviews-Unawatuna_Beach-Unawatuna_Galle_District_Southern_Province.html,Unawatuna Beach,3.9,189,https://dynamic-media-cdn.tripadvisor.com/media/photo-o/0b/50/b5/81/20160518-152153-largejpg.jpg?w=200&h=200&s=1,SaffJM,"Saffron Walden, United Kingdom",,2,Solo,I have travelled solo round Sri Lanka for the last 3 weeks and thought it would be nice to stop for two nights in Unawantuna beach to relax on way back to airport and also so I could visit Galle. This was not the place for me it is packed full of tourists mostly from Russia and if you like the full on tourist party noisy experience abroad then this is the place for you.  I did find a a great place for dinner at Koha Surf Lounge away from the beach which had a lovely relaxed feel and great food and cocktails try the Gin Basil. So glad only doing short stop here very disappointed as thought it would be much quieter so glad I experienced the real Sri Lanka on my trip which was definitely not here!,"January 11, 2020",0.0,0.0
https://www.tripadvisor.com/Attraction_Review-g644047-d15708228-Reviews-Unawatuna_Beach-Unawatuna_Galle_District_Southern_Province.html,Unawatuna Beach,3.9,189,https://dynamic-media-cdn.tripadvisor.com/media/photo-o/0b/50/b5/81/20160518-152153-largejpg.jpg?w=200&h=200&s=1,otahala,"Prague, Czech Republic",,3,Missing,"Beach nice, clean, large. Lots of restaurants that turn into hunting grounds in the evening. Restaurant staff literally hunts you to eat with them, annoying. Prices do not match the quality, but there are exceptions, you have to look. Nothing special but very pleasant bathing.","January 6, 2020",0.0,0.0
https://www.tripadvisor.com/Attraction_Review-g644047-d15708228-Reviews-Unawatuna_Beach-Unawatuna_Galle_District_Southern_Province.html,Unawatuna Beach,3.9,189,https://dynamic-media-cdn.tripadvisor.com/media/photo-o/0b/50/b5/81/20160518-152153-largejpg.jpg?w=200&h=200&s=1,Honest_Critic,"London, United Kingdom",,3,Missing,the tsunami 15 years ago has changed the landscape dramatically. not the calm beach it used to be.. sigh...! recommend jungle beach about 2km away...,"January 5, 2020",0.0,0.0
https://www.tripadvisor.com/Attraction_Review-g644047-d15708228-Reviews-Unawatuna_Beach-Unawatuna_Galle_District_Southern_Province.html,Unawatuna Beach,3.9,189,https://dynamic-media-cdn.tripadvisor.com/media/photo-o/0b/50/b5/81/20160518-152153-largejpg.jpg?w=200&h=200&s=1,Siriol S,37 contributions,,1,Friends,"This beach has changed an incredible amount over the past few years, and for the worse. Over populated and over priced, it is basically like how I imagine going to Benidorm in the 80s was. The entire beach is covered in restaurants, and there is not a quiet patch anywhere. Go elsewhere if you want to see the beauty of Sri Lanka and not just a package holiday tourist beach.","December 30, 2019",0.0,0.0
https://www.tripadvisor.com/Attraction_Review-g644047-d15708228-Reviews-Unawatuna_Beach-Unawatuna_Galle_District_Southern_Province.html,Unawatuna Beach,3.9,189,https://dynamic-media-cdn.tripadvisor.com/media/photo-o/0b/50/b5/81/20160518-152153-largejpg.jpg?w=200&h=200&s=1,JT24,"London, United Kingdom",,4,Couples,Beautiful clean beach. Lots of places to eat and drink. Just be careful to choose a good one as we had a bad experience with slow service at one of them but had a fantastic meal with exceptional service at another.,"December 24, 2019",0.0,0.0
https://www.tripadvisor.com/Attraction_Review-g644047-d15708228-Reviews-Unawatuna_Beach-Unawatuna_Galle_District_Southern_Province.html,Unawatuna Beach,3.9,189,https://dynamic-media-cdn.tripadvisor.com/media/photo-o/0b/50/b5/81/20160518-152153-largejpg.jpg?w=200&h=200&s=1,Alex A,"Unawatuna, Sri Lanka",,4,Couples,"+ good beach, mostly clean, no stones. + lot of restaurants etc. - deep water. - lot of russian tourists.","December 5, 2019",0.0,0.0
https://www.tripadvisor.com/Attraction_Review-g644047-d15708228-Reviews-Unawatuna_Beach-Unawatuna_Galle_District_Southern_Province.html,Unawatuna Beach,3.9,189,https://dynamic-media-cdn.tripadvisor.com/media/photo-o/0b/50/b5/81/20160518-152153-largejpg.jpg?w=200&h=200&s=1,debbie o,"Dubai, United Arab Emirates",,3,Missing,"This picture postcard location has been over-exploited and literally trashed in some aspects. The basics are all still good, but are tarnished by uncontrolled development of hotels and bars, most shockingly in the case of the multi-storey monstrosity being built at the right hand side; unregulated and therefore extremely dangerous jetski and boat use in the swimming area; noise from beach parties into the early hours, and lack of regular cleaning up of litter and plastic washed up on the shore. All of these nuisances could be prevented and fixed so that the special charm of this lovely spot continues to attract holidaymakers and provide a living for the friendly and laid-back locals.","December 3, 2019",0.0,0.0
https://www.tripadvisor.com/Attraction_Review-g644047-d15708228-Reviews-Unawatuna_Beach-Unawatuna_Galle_District_Southern_Province.html,Unawatuna Beach,3.9,189,https://dynamic-media-cdn.tripadvisor.com/media/photo-o/0b/50/b5/81/20160518-152153-largejpg.jpg?w=200&h=200&s=1,Adele F,"Paris, France",,5,Missing,Beautiful beach with white sand and blue water. Appear like a natural pool and very safe to swim. I would recommend trying snorkeling which we really enjoyed. Lots of places to eat and drink.,"November 17, 2019",0.0,0.0
https://www.tripadvisor.com/Attraction_Review-g644047-d15708228-Reviews-Unawatuna_Beach-Unawatuna_Galle_District_Southern_Province.html,Unawatuna Beach,3.9,189,https://dynamic-media-cdn.tripadvisor.com/media/photo-o/0b/50/b5/81/20160518-152153-largejpg.jpg?w=200&h=200&s=1,selen,"Istanbul, Türkiye",,5,Solo,"Nice, cool, clean atmosphere. Peoples are kind and friendly also the foods are delicious and amazing thank u 🙏","November 6, 2019",0.0,0.0
https://www.tripadvisor.com/Attraction_Review-g644047-d15708228-Reviews-Unawatuna_Beach-Unawatuna_Galle_District_Southern_Province.html,Unawatuna Beach,3.9,189,https://dynamic-media-cdn.tripadvisor.com/media/photo-o/0b/50/b5/81/20160518-152153-largejpg.jpg?w=200&h=200&s=1,Ron,147 contributions,,3,Missing,"You are not in Unawatuna for Swimming and snorkeling.  It is a touristic beach, which is nice , but not tue best at all","October 14, 2019",0.0,0.0
https://www.tripadvisor.com/Attraction_Review-g644047-d15708228-Reviews-Unawatuna_Beach-Unawatuna_Galle_District_Southern_Province.html,Unawatuna Beach,3.9,189,https://dynamic-media-cdn.tripadvisor.com/media/photo-o/0b/50/b5/81/20160518-152153-largejpg.jpg?w=200&h=200&s=1,Chanaka Lakmal,"Veyangoda, Sri Lanka",,5,Missing,"Hi, Its golden white sand with blue water paradise of located Galle . Safety sea bath with fully relaxing please with great sea food tasting . Also lots of activities area there spend time mean fully . Thanks .","September 20, 2019",0.0,0.0
https://www.tripadvisor.com/Attraction_Review-g644047-d15708228-Reviews-Unawatuna_Beach-Unawatuna_Galle_District_Southern_Province.html,Unawatuna Beach,3.9,189,https://dynamic-media-cdn.tripadvisor.com/media/photo-o/0b/50/b5/81/20160518-152153-largejpg.jpg?w=200&h=200&s=1,Angela,68 contributions,,4,Missing,Nice beach with several bars and restaurants along the shore. Unfortunately too stormy to swim in the sea in August.,"September 5, 2019",0.0,0.0
https://www.tripadvisor.com/Attraction_Review-g644047-d15708228-Reviews-Unawatuna_Beach-Unawatuna_Galle_District_Southern_Province.html,Unawatuna Beach,3.9,189,https://dynamic-media-cdn.tripadvisor.com/media/photo-o/0b/50/b5/81/20160518-152153-largejpg.jpg?w=200&h=200&s=1,ayazlovejapan,"Doha, Qatar",,5,Missing,"Very clean and beautiful beach, many restaurants and shops around, parties at the nights in some hotel on the beach.","August 27, 2019",0.0,0.0
https://www.tripadvisor.com/Attraction_Review-g644047-d15708228-Reviews-Unawatuna_Beach-Unawatuna_Galle_District_Southern_Province.html,Unawatuna Beach,3.9,189,https://dynamic-media-cdn.tripadvisor.com/media/photo-o/0b/50/b5/81/20160518-152153-largejpg.jpg?w=200&h=200&s=1,Tintin,6 contributions,,4,Missing,"People go to beaches for different reasons. My ideal beach has no undertow or current and is deep enough to swim as if you are in a swimming pool. Unawatuna beach ticks those boxes. It is a bay protected by a reef that keeps the dangerous current of the Indian Ocean out. It is actually one of the few beaches in Sri Lanka where you can swim without getting drowned. The safest side is towards the temple. There the water is even suitable for small children. When you swim from the temple towards the main road you feel when the waves get stronger. There will be no undertow, but the waves will be too strong to swim pleasant swimming pool like laps. The downside of the Unawatuna beach is that all the boats are floating in the part that is most suitable for swimming! You will have to swim around these boats or worse inhale the petrol fumes! How can tourist enjoy the freshness of the sea air when the have to inhale stinking petrol! The beach is for Sri Lankan standards wide. Non swimming tourists like to enjoy this beach to lie in the sun or drink cocktails. This beach is however completely artificial. The municipality puts this sand which is different from real beach sand. The sea erodes this sand and then more sand needs to be put to keep the beach. The result is a smaller bay to swim and less clear water due to the eroding sand floating on the water!","August 13, 2019",0.0,0.0
https://www.tripadvisor.com/Attraction_Review-g644047-d15708228-Reviews-Unawatuna_Beach-Unawatuna_Galle_District_Southern_Province.html,Unawatuna Beach,3.9,189,https://dynamic-media-cdn.tripadvisor.com/media/photo-o/0b/50/b5/81/20160518-152153-largejpg.jpg?w=200&h=200&s=1,Clare F,"Abu Dhabi, United Arab Emirates",,4,Missing,"We are visiting out of season so we had practically the whole beach to ourselves. Lovely beach to walk along and to jump in the waves. Be careful though as there is a strong current in some places. The beach has beach bars and restaurants and I can see it being a hive of activity in the peak season months.  We opted to have drinks and a snack at The Lucky Tuna and they allowed us to use their sunloungers for free. I would have given the beach a 5, but the number of people offering massages, surfing, diving, clothes, hair braiding, bracelets, sarongs, jewellery, coconuts and stories of the tsunami ..... well with the list of things offered you can see it was not relaxing. They were relentless with the same people asking time and time again. I am always polite, but did finally have to ask them to go away as I was not interested. I know they are desperate for sales, but pestering people deters them...well in my case it does. Beautiful beach though and we enjoyed our day.","August 8, 2019",0.0,0.0
https://www.tripadvisor.com/Attraction_Review-g644047-d15708228-Reviews-Unawatuna_Beach-Unawatuna_Galle_District_Southern_Province.html,Unawatuna Beach,3.9,189,https://dynamic-media-cdn.tripadvisor.com/media/photo-o/0b/50/b5/81/20160518-152153-largejpg.jpg?w=200&h=200&s=1,Judith T,30 contributions,,4,Couples,"It is a really pretty and charming beach, with lots of different food options to select from with a spectacular view. And it is peaceful to just sit and be part of the beach life. :)","June 17, 2019",0.0,0.0
https://www.tripadvisor.com/Attraction_Review-g644047-d15708228-Reviews-Unawatuna_Beach-Unawatuna_Galle_District_Southern_Province.html,Unawatuna Beach,3.9,189,https://dynamic-media-cdn.tripadvisor.com/media/photo-o/0b/50/b5/81/20160518-152153-largejpg.jpg?w=200&h=200&s=1,Lyudmilawestrik1972,"Nizhny Novgorod, Russia",,5,Solo,I have been to this place 6 times.. I am ready to come back and again...I feel like home here. Strongly recommend to visit this beach)),"June 5, 2019",0.0,0.0
https://www.tripadvisor.com/Attraction_Review-g644047-d15708228-Reviews-Unawatuna_Beach-Unawatuna_Galle_District_Southern_Province.html,Unawatuna Beach,3.9,189,https://dynamic-media-cdn.tripadvisor.com/media/photo-o/0b/50/b5/81/20160518-152153-largejpg.jpg?w=200&h=200&s=1,TOPCAT05,"Sydney, Australia",,5,Friends,"Nice to sit, relax and enjoy a cocktail or two. Wasn't too busy which was nice. Great restaurants all along the beach.","May 6, 2019",0.0,0.0
https://www.tripadvisor.com/Attraction_Review-g644047-d15708228-Reviews-Unawatuna_Beach-Unawatuna_Galle_District_Southern_Province.html,Unawatuna Beach,3.9,189,https://dynamic-media-cdn.tripadvisor.com/media/photo-o/0b/50/b5/81/20160518-152153-largejpg.jpg?w=200&h=200&s=1,BC,"West Kirby, United Kingdom",,5,Solo,"Great beach, was empty when I went last March/April which I loved. Also so many bars and cafes along it so you're spoiled for choice if you want food, drink or a shisha. The water was nice and warm and I swam 45 minutes to a rocky island (which I enjoyed but wouldn't recommend haha). I sat in one cafe and had a beer and a shisha whilst petting a local stray dog for an hour, a very wholesome experience.","May 5, 2019",0.0,0.0
https://www.tripadvisor.com/Attraction_Review-g644047-d15708228-Reviews-Unawatuna_Beach-Unawatuna_Galle_District_Southern_Province.html,Unawatuna Beach,3.9,189,https://dynamic-media-cdn.tripadvisor.com/media/photo-o/0b/50/b5/81/20160518-152153-largejpg.jpg?w=200&h=200&s=1,GloriaSome,"Hobart, Australia",,4,Couples,"We went to Unawatuna twice during our holiday. The beach was disappearing with the Monsoon season starting and in some spots the loungers were teetering on the edge of a drop! There are lots of lounge areas with prices ranging hugely in price, from a very basic 100slr through to 2500slr but this comes with cool water spritzing, extremely comfortable lounge areas and attentive service. There are safe flagged areas to swim and you can go out to the reef on a glass bottom boat (for a price) there are a few sellers but they are not pushy and will move on with a gentle no thank you! Lots of restaurants and bars along the beach","May 2, 2019",0.0,0.0
