Destination URL,Destination Title,Destination Score,Total Reviews (Destination),Destination Image,Reviewer Name,Reviewer Location,Review Title,Review Score,Reviewer Category,Review Text,Written Date,% %,  %
https://www.tripadvisor.com/Attraction_Review-g424963-d10756130-Reviews-Uppuveli_Beach-Trincomalee_Eastern_Province.html,Uppuveli Beach,4.0,150,https://dynamic-media-cdn.tripadvisor.com/media/photo-o/2c/df/2b/5e/caption.jpg?w=200&h=200&s=1&cx=1920&cy=1080&chk=v1_74f1292c16859f88a83b,Andrew W,1 contribution,,1,Couples,"Here is an honest review. Maybe I'm spoilt coming from Australia, but I've travelled a bit and can honestly say this rates in the bottom of the list for beaches I've enjoyed swimming at. The sand has a horrible blackness inside it spoiling its attempt at white colour. There is a polluted river washing in from its northern end and nearly all ""storm water"" from the city runs directly into the beach at regular intervals. It is populated with incredibly overpriced dining options, and touts wanting you to take a diving trip with them. We saw a dead dog not 100metres from the most expensive resort in the area. All in all, the lack of a single international hotel chain should be enough of a red flag to anyone, but hopefully this review helps against the tide of goodwill others have provided and which made us come here.","July 13, 2017",0.0,0.0
https://www.tripadvisor.com/Attraction_Review-g424963-d10756130-Reviews-Uppuveli_Beach-Trincomalee_Eastern_Province.html,Uppuveli Beach,4.0,150,https://dynamic-media-cdn.tripadvisor.com/media/photo-o/2c/df/2b/5e/caption.jpg?w=200&h=200&s=1&cx=1920&cy=1080&chk=v1_74f1292c16859f88a83b,Pat S,27 contributions,,4,Friends,"Golden sand, palm trees, large breaking waves, local fishing boats (and fish), boat-trips to see dolphins - and blue whales in season - scuba and snorkelling trips, banana boat etc ...  This beach has everything, though food is probably cheaper in the small lanes which lead to the beach. Lots to do and see - or just relax.  And nearby Trincomalee is also interesting.","July 6, 2017",0.0,0.0
https://www.tripadvisor.com/Attraction_Review-g424963-d10756130-Reviews-Uppuveli_Beach-Trincomalee_Eastern_Province.html,Uppuveli Beach,4.0,150,https://dynamic-media-cdn.tripadvisor.com/media/photo-o/2c/df/2b/5e/caption.jpg?w=200&h=200&s=1&cx=1920&cy=1080&chk=v1_74f1292c16859f88a83b,AllBlacks30,"Ponta Delgada, Portugal",,5,Couples,"Fantastic beach. In my opinion is the best beach in Trincomalee. It has deserted areas, Hindu temples, fishing areas. It is worth strolling along the beach.","May 30, 2017",0.0,0.0
https://www.tripadvisor.com/Attraction_Review-g424963-d10756130-Reviews-Uppuveli_Beach-Trincomalee_Eastern_Province.html,Uppuveli Beach,4.0,150,https://dynamic-media-cdn.tripadvisor.com/media/photo-o/2c/df/2b/5e/caption.jpg?w=200&h=200&s=1&cx=1920&cy=1080&chk=v1_74f1292c16859f88a83b,RuwanTech,"Kurunegala, Sri Lanka",,4,Missing,Many fishing boats can see. Great place to relax. Lovely beach with lot space. Also nice place to have a boat ride,"May 22, 2017",0.0,0.0
https://www.tripadvisor.com/Attraction_Review-g424963-d10756130-Reviews-Uppuveli_Beach-Trincomalee_Eastern_Province.html,Uppuveli Beach,4.0,150,https://dynamic-media-cdn.tripadvisor.com/media/photo-o/2c/df/2b/5e/caption.jpg?w=200&h=200&s=1&cx=1920&cy=1080&chk=v1_74f1292c16859f88a83b,Joe B,65 contributions,,5,Friends,"Great spot after a long ride, lovely beach but bloody hot! Great place for relaxation, food and drinks.","May 12, 2017",0.0,0.0
https://www.tripadvisor.com/Attraction_Review-g424963-d10756130-Reviews-Uppuveli_Beach-Trincomalee_Eastern_Province.html,Uppuveli Beach,4.0,150,https://dynamic-media-cdn.tripadvisor.com/media/photo-o/2c/df/2b/5e/caption.jpg?w=200&h=200&s=1&cx=1920&cy=1080&chk=v1_74f1292c16859f88a83b,mythili_rm19,"Bengaluru, India",,4,Missing,My Cab driver went on telling me the private beach of the hotel where i stayed is also Uppuveli but the actual beach spot of uppuveli is real good for long walk and the water colour and tides are different from Marble beach,"May 4, 2017",0.0,0.0
https://www.tripadvisor.com/Attraction_Review-g424963-d10756130-Reviews-Uppuveli_Beach-Trincomalee_Eastern_Province.html,Uppuveli Beach,4.0,150,https://dynamic-media-cdn.tripadvisor.com/media/photo-o/2c/df/2b/5e/caption.jpg?w=200&h=200&s=1&cx=1920&cy=1080&chk=v1_74f1292c16859f88a83b,Kahye,"Zurich, Switzerland",,5,Couples,"We were supposed to stay in uppuveli 2 nights but we book one more. The beach is huge and you have lots of space to relax. It is a nice place to relax and take a break. We stayed at trinco blu hotel, nice beach bungalow and you also have good restaurants around where you can eat fresh sea food. The only sad thing is that the beach is just cleaned in front of the restaurants and hotels, maybe the Sri Lanka government such put more an effort on cleaning not just the beaches but The country it self, but anyway I still recommend it :)","April 28, 2017",0.0,0.0
https://www.tripadvisor.com/Attraction_Review-g424963-d10756130-Reviews-Uppuveli_Beach-Trincomalee_Eastern_Province.html,Uppuveli Beach,4.0,150,https://dynamic-media-cdn.tripadvisor.com/media/photo-o/2c/df/2b/5e/caption.jpg?w=200&h=200&s=1&cx=1920&cy=1080&chk=v1_74f1292c16859f88a83b,Louise,"Edinburgh, United Kingdom",,4,Friends,"Took a tuk tuk here from Trinco as heard great things about the beach and beach area.  It was a lovely beach in parts however we walked back to Trinco along the beach and the middle section wasn't good.  I suspect it's generally not visited by tourists as there are no facilities, attractions or restaurants, it appears to be more residential.  Litter is a significant problem in this stretch of the beach","April 26, 2017",0.0,0.0
https://www.tripadvisor.com/Attraction_Review-g424963-d10756130-Reviews-Uppuveli_Beach-Trincomalee_Eastern_Province.html,Uppuveli Beach,4.0,150,https://dynamic-media-cdn.tripadvisor.com/media/photo-o/2c/df/2b/5e/caption.jpg?w=200&h=200&s=1&cx=1920&cy=1080&chk=v1_74f1292c16859f88a83b,Mathurahan S,"Vavuniya, Sri Lanka",,4,Couples,Most of the famous beaches in trinco are over crowded and you won't feel comfortable if u are visiting with family. But Uppuveli is still offering that privacy and comfort.,"April 16, 2017",0.0,0.0
https://www.tripadvisor.com/Attraction_Review-g424963-d10756130-Reviews-Uppuveli_Beach-Trincomalee_Eastern_Province.html,Uppuveli Beach,4.0,150,https://dynamic-media-cdn.tripadvisor.com/media/photo-o/2c/df/2b/5e/caption.jpg?w=200&h=200&s=1&cx=1920&cy=1080&chk=v1_74f1292c16859f88a83b,VeggiegirlMarlow,"Marlow, United Kingdom",,2,Couples,"I am amazed at the reviews for this beach!. I stayed at the Trinco Blu for 4 nights in February . The Trinco Blu looks after the beach right outside its property very well but just look to your left and right and it's a very different story. Bottles, cans, cartons, straws, plastic bags, dead chickens, burger containers - I could go on and on. It's utterly disgusting. These things also find their way into the sea, and after a while I decided not to swim in it, it was far too dirty. I observed the fishermen throw all their rubbish on the sand and discard dead puffer fish by just leaving them on the sea edge for someone to tread on. The sea is their rubbish bin. They wait for the tide to take it out but their nets were full of trash as well as fish. They literally are catching their own rubbish. I also saw tourists who should know better leave their empty cigarette packets and water bottles on the beach. Open your eyes to how things really are, not how you want to see them. Our oceans and world should be treated with more respect and as tourists we have the power to change things by refusing to pretend it's not there.","March 11, 2017",0.0,0.0
https://www.tripadvisor.com/Attraction_Review-g424963-d10756130-Reviews-Uppuveli_Beach-Trincomalee_Eastern_Province.html,Uppuveli Beach,4.0,150,https://dynamic-media-cdn.tripadvisor.com/media/photo-o/2c/df/2b/5e/caption.jpg?w=200&h=200&s=1&cx=1920&cy=1080&chk=v1_74f1292c16859f88a83b,don c,"Redruth, United Kingdom",,4,Couples,Lovely clean beach backed with palm trees with enough shacks to keep you supplied with food and beer .. The beach is gently sloping so you can walk out into the sea a long way before it gets deep  and i detected no strong currents so it appears about as safe as you can get .,"March 7, 2017",0.0,0.0
https://www.tripadvisor.com/Attraction_Review-g424963-d10756130-Reviews-Uppuveli_Beach-Trincomalee_Eastern_Province.html,Uppuveli Beach,4.0,150,https://dynamic-media-cdn.tripadvisor.com/media/photo-o/2c/df/2b/5e/caption.jpg?w=200&h=200&s=1&cx=1920&cy=1080&chk=v1_74f1292c16859f88a83b,Andromachos D,"Athens, Greece",,5,Couples,"An amazing laid back beach, perfect for long afternoon walks, relaxation and swimming. The best part is in Alles Garden, on the northern end.","February 26, 2017",0.0,0.0
https://www.tripadvisor.com/Attraction_Review-g424963-d10756130-Reviews-Uppuveli_Beach-Trincomalee_Eastern_Province.html,Uppuveli Beach,4.0,150,https://dynamic-media-cdn.tripadvisor.com/media/photo-o/2c/df/2b/5e/caption.jpg?w=200&h=200&s=1&cx=1920&cy=1080&chk=v1_74f1292c16859f88a83b,Guy_Reed,"London, United Kingdom",,5,Missing,"One of the best beaches in Sri Lanka. Sandy golden beach. But due to recent influx of tourist there are bags, plastics cans here and there. Overall great for sunbatch.","February 22, 2017",0.0,0.0
https://www.tripadvisor.com/Attraction_Review-g424963-d10756130-Reviews-Uppuveli_Beach-Trincomalee_Eastern_Province.html,Uppuveli Beach,4.0,150,https://dynamic-media-cdn.tripadvisor.com/media/photo-o/2c/df/2b/5e/caption.jpg?w=200&h=200&s=1&cx=1920&cy=1080&chk=v1_74f1292c16859f88a83b,Hemanth Reddy,"Tirupati, India",,5,Missing,this beach is a bit off the main road... and is well maintained and clean.. the JKAB resort and a few moe are located here and excellent view,"January 12, 2017",0.0,0.0
https://www.tripadvisor.com/Attraction_Review-g424963-d10756130-Reviews-Uppuveli_Beach-Trincomalee_Eastern_Province.html,Uppuveli Beach,4.0,150,https://dynamic-media-cdn.tripadvisor.com/media/photo-o/2c/df/2b/5e/caption.jpg?w=200&h=200&s=1&cx=1920&cy=1080&chk=v1_74f1292c16859f88a83b,seekingmoose,"Trincomalee, Sri Lanka",,5,Couples,A Paradise for swimming - snorkeling - diving - or simply chilling on the beach BYOB - there are many guesthouse ranging from budget to ultra-expensive - very few places to eat outside the resorts where food is overpriced - it is only 6 km - 200 ruppees Tuk-Tuk ride - We prefer Trinco Town - Still Great easy day trip,"November 23, 2016",0.0,0.0
https://www.tripadvisor.com/Attraction_Review-g424963-d10756130-Reviews-Uppuveli_Beach-Trincomalee_Eastern_Province.html,Uppuveli Beach,4.0,150,https://dynamic-media-cdn.tripadvisor.com/media/photo-o/2c/df/2b/5e/caption.jpg?w=200&h=200&s=1&cx=1920&cy=1080&chk=v1_74f1292c16859f88a83b,valery r,0 contributions,,5,Missing,"nice beach nice people all are in one place not like nilaveli there are nothing to do boring, have beach parties","November 18, 2016",0.0,0.0
https://www.tripadvisor.com/Attraction_Review-g424963-d10756130-Reviews-Uppuveli_Beach-Trincomalee_Eastern_Province.html,Uppuveli Beach,4.0,150,https://dynamic-media-cdn.tripadvisor.com/media/photo-o/2c/df/2b/5e/caption.jpg?w=200&h=200&s=1&cx=1920&cy=1080&chk=v1_74f1292c16859f88a83b,Geir,"Oslo, Norway",,4,Couples,"We visited Uppuveli in the low season and still couldn´t quite figure out why people don´t visit this place in this time of the year. It´s still some beach tirsty tourist strolling around and blending in with local fishermen pulling their nets on to the beach in the afternoon. The beach is vast and deep with a lot of space and around the restaurants and resorts they clean the beach every day (you can still find patches in between with some garbage that floated ashore). The beach meet some swell in the middle but are more calm in the north and the south side. You´ll might struggle with finding a good place to eat but there is a good and fairly priced restaurant called the Crab on the beach´s north end that hold local food to a high standard, check it out! If you like to go for a little adventere you can wade over the stream where the lagoon meets the ocean and find a private little beach and much more =)","November 16, 2016",0.0,0.0
https://www.tripadvisor.com/Attraction_Review-g424963-d10756130-Reviews-Uppuveli_Beach-Trincomalee_Eastern_Province.html,Uppuveli Beach,4.0,150,https://dynamic-media-cdn.tripadvisor.com/media/photo-o/2c/df/2b/5e/caption.jpg?w=200&h=200&s=1&cx=1920&cy=1080&chk=v1_74f1292c16859f88a83b,gegerarrardodo,0 contributions,,5,Couples,"Great golden sand beach in a beautiful environment. Good backpacker atmosphere. There are a few not so well priced restaurants but with great food. At nights, fresh fish is cooked on grills. We had a lovely three day break from seeing temple after temple. I expect that in a couple of years, it won't be as authentic as it is now, so enjoy it while it lasts! Fishermen can be seen bringing their nets in full of fish. Amazing experience!","September 20, 2016",0.0,0.0
https://www.tripadvisor.com/Attraction_Review-g424963-d10756130-Reviews-Uppuveli_Beach-Trincomalee_Eastern_Province.html,Uppuveli Beach,4.0,150,https://dynamic-media-cdn.tripadvisor.com/media/photo-o/2c/df/2b/5e/caption.jpg?w=200&h=200&s=1&cx=1920&cy=1080&chk=v1_74f1292c16859f88a83b,louis B,"Ixelles, Belgium",,4,Couples,"A lovely beach made of soft white sand. Still genuine, fishermen working on the beach, not too much tourist, even if a huge part of the beach is surrounded by hotels and guesthouse. Such as other places in Sri Lanka, it smells sometimes the benzine, and some restaurants/places such as Fernando's bar are transformed to loud and noisy disco bar as from 7PM, with a boring beat sound and flashing multicolour lights polluting the whole beach and any stars watching moment you would like to be romantic. So this is definitely a place to discover as it is still authentic, but let's hope that development of tourism will go in a positive direction","August 30, 2016",0.0,0.0
https://www.tripadvisor.com/Attraction_Review-g424963-d10756130-Reviews-Uppuveli_Beach-Trincomalee_Eastern_Province.html,Uppuveli Beach,4.0,150,https://dynamic-media-cdn.tripadvisor.com/media/photo-o/2c/df/2b/5e/caption.jpg?w=200&h=200&s=1&cx=1920&cy=1080&chk=v1_74f1292c16859f88a83b,Prudence W,"London, United Kingdom",,5,Friends,"Stayed right on the beach (a range of hostelries on the beach here). Sand is soft. Beach is clean. A few water sport places (shake watching, scuba diving etc) too. Twice a day watch the fishermen haul in their nets and sell their catch on the beach to local restaurants and hotels. Came here in August and the sea was clear and calm enough for swimming (but be prepared to do a bit of wave jumping!) Currently this place is very under developed. No high rise hotels, chain hotels or rowdy bars.","August 25, 2016",0.0,0.0
