Destination URL,Destination Title,Destination Score,Total Reviews (Destination),Destination Image,Reviewer Name,Reviewer Location,Review Title,Review Score,Reviewer Category,Review Text,Written Date,% %,  %
https://www.tripadvisor.com/Attraction_Review-g3595837-d3613552-Reviews-Water_World_Lanka-Kelaniya_Western_Province.html,Water World Lanka,4.0,85,https://dynamic-media-cdn.tripadvisor.com/media/photo-o/29/12/2b/91/caption.jpg?w=200&h=200&s=1&cx=1920&cy=1080&chk=v1_c338440b96ab10dd37ff,Ehsaan99,5 contributions,,3,Missing,"I visited water world accompanied by family including a few youngsters aged four and seven. Cutting to the chase; The visit was an exciting experience for the kids, while for the adults the diversity of aquatic life was sufficient to hold our interest. There is also a bird park which is smaller in comparison but is still worth a mention. The fish and the birds are kept in very small, cramped enclosures which is reminiscent of the Dehiwala zoo and I felt uneasy at times as we progressed through the exhibits (which in a few instances were in a dilapidated condition). I would sincerely request the management to look at a facelift for the park while also looking at reducing the specimens carried in each enclosure as it was sad to see so many animals cramped into very small spaces. This is not bad place for a field trip, or a one time visit. There are very interesting sites which must be seen. That being said I am unlikely to visit again.","November 5, 2017",0.0,0.0
https://www.tripadvisor.com/Attraction_Review-g3595837-d3613552-Reviews-Water_World_Lanka-Kelaniya_Western_Province.html,Water World Lanka,4.0,85,https://dynamic-media-cdn.tripadvisor.com/media/photo-o/29/12/2b/91/caption.jpg?w=200&h=200&s=1&cx=1920&cy=1080&chk=v1_c338440b96ab10dd37ff,Nagalingam K,20 contributions,,3,Missing,There are lot of new fishes from deep sea in all over world and birds. In every tank They have written about the fish in English and Sinhala languages.,"September 6, 2017",0.0,0.0
https://www.tripadvisor.com/Attraction_Review-g3595837-d3613552-Reviews-Water_World_Lanka-Kelaniya_Western_Province.html,Water World Lanka,4.0,85,https://dynamic-media-cdn.tripadvisor.com/media/photo-o/29/12/2b/91/caption.jpg?w=200&h=200&s=1&cx=1920&cy=1080&chk=v1_c338440b96ab10dd37ff,lakshansilva,"Nelson, New Zealand",,4,Missing,This is a good place to see animals & fish. Children love this place & unexpectedly  a good place to visit for an outing.,"March 30, 2017",0.0,0.0
https://www.tripadvisor.com/Attraction_Review-g3595837-d3613552-Reviews-Water_World_Lanka-Kelaniya_Western_Province.html,Water World Lanka,4.0,85,https://dynamic-media-cdn.tripadvisor.com/media/photo-o/29/12/2b/91/caption.jpg?w=200&h=200&s=1&cx=1920&cy=1080&chk=v1_c338440b96ab10dd37ff,SKY T,"Colombo, Sri Lanka",,5,Missing,"The place is very nice with variation of fish, birds and other animals as well. It's so nice to have evening walk through the canels and the area. The bad experience was they don't have a place to buy lunch but you can bring lunch from out side and have it there. They have a small canteen which you can order drinks. They maintain it well.","February 6, 2017",0.0,0.0
https://www.tripadvisor.com/Attraction_Review-g3595837-d3613552-Reviews-Water_World_Lanka-Kelaniya_Western_Province.html,Water World Lanka,4.0,85,https://dynamic-media-cdn.tripadvisor.com/media/photo-o/29/12/2b/91/caption.jpg?w=200&h=200&s=1&cx=1920&cy=1080&chk=v1_c338440b96ab10dd37ff,Martti U,"Vantaa, Finland",,4,Couples,Guite nice place..plenty local children visered same time there...Cleanliness was not the best ...but quite normal at Sri Lanka😀style...,"February 1, 2017",0.0,0.0
https://www.tripadvisor.com/Attraction_Review-g3595837-d3613552-Reviews-Water_World_Lanka-Kelaniya_Western_Province.html,Water World Lanka,4.0,85,https://dynamic-media-cdn.tripadvisor.com/media/photo-o/29/12/2b/91/caption.jpg?w=200&h=200&s=1&cx=1920&cy=1080&chk=v1_c338440b96ab10dd37ff,ChuckOfAllTrades,"Goa, India",,5,Solo,"I've been to several aquariums and this is one of the best! LOTS of varieties of fish - perhaps a hundred - and lots of care to explain each of them. The experience is great - tunnels, good railings and lighting. The underwater tunnel is a lovely - if short - attraction. The entry fee is close to nothing. So while it's a bit of a bother getting all the way here, it's certainly worth it. Highly recommended.","January 15, 2017",0.0,0.0
https://www.tripadvisor.com/Attraction_Review-g3595837-d3613552-Reviews-Water_World_Lanka-Kelaniya_Western_Province.html,Water World Lanka,4.0,85,https://dynamic-media-cdn.tripadvisor.com/media/photo-o/29/12/2b/91/caption.jpg?w=200&h=200&s=1&cx=1920&cy=1080&chk=v1_c338440b96ab10dd37ff,Shashi D,36 contributions,,5,Missing,A place I did not know existed & for sure took me by surprise !!! Your kids will love it. The place needs more advertising/publicity. Many kinds of fish and birds. They even have a specific time they feed the fish and you can see this when you walk through the tunnel. No doubt this has to be the best aquarium in the country. Well maintained & not much of crowd. (I believe this is due to the lack of publicity) A good place for a family outing specially for the kids. But that doesn't mean the adults will not enjoy :),"January 9, 2017",0.0,0.0
https://www.tripadvisor.com/Attraction_Review-g3595837-d3613552-Reviews-Water_World_Lanka-Kelaniya_Western_Province.html,Water World Lanka,4.0,85,https://dynamic-media-cdn.tripadvisor.com/media/photo-o/29/12/2b/91/caption.jpg?w=200&h=200&s=1&cx=1920&cy=1080&chk=v1_c338440b96ab10dd37ff,manasha d,"Panadura, Sri Lanka",,5,Friends,Kids can enjoy lot here with looking different kind of fishes. the fishes who are in cartoons and book covers can see here.,"December 30, 2016",0.0,0.0
https://www.tripadvisor.com/Attraction_Review-g3595837-d3613552-Reviews-Water_World_Lanka-Kelaniya_Western_Province.html,Water World Lanka,4.0,85,https://dynamic-media-cdn.tripadvisor.com/media/photo-o/29/12/2b/91/caption.jpg?w=200&h=200&s=1&cx=1920&cy=1080&chk=v1_c338440b96ab10dd37ff,IsuruMa,"Colombo, Sri Lanka",,3,Missing,This place is not a super attractive place. But compared to all the aquarium in the country this is the best. If I was not mistaken there are not much aquarium tunnels present in south Asia and this is unique to them. A good outing with the family.,"December 28, 2016",0.0,0.0
https://www.tripadvisor.com/Attraction_Review-g3595837-d3613552-Reviews-Water_World_Lanka-Kelaniya_Western_Province.html,Water World Lanka,4.0,85,https://dynamic-media-cdn.tripadvisor.com/media/photo-o/29/12/2b/91/caption.jpg?w=200&h=200&s=1&cx=1920&cy=1080&chk=v1_c338440b96ab10dd37ff,Kasun H,"Sharjah, United Arab Emirates",,4,Missing,kids will love this place. worth the visit. good holiday attraction. close to colombo and on holydays crowd is more.,"December 12, 2016",0.0,0.0
https://www.tripadvisor.com/Attraction_Review-g3595837-d3613552-Reviews-Water_World_Lanka-Kelaniya_Western_Province.html,Water World Lanka,4.0,85,https://dynamic-media-cdn.tripadvisor.com/media/photo-o/29/12/2b/91/caption.jpg?w=200&h=200&s=1&cx=1920&cy=1080&chk=v1_c338440b96ab10dd37ff,Thejan001,17 contributions,,4,Missing,"since sri lanka doesn't have large scale aquariums i suggest waterworld is the best place, they have somewhat big collection of fish and birds,","November 18, 2016",0.0,0.0
https://www.tripadvisor.com/Attraction_Review-g3595837-d3613552-Reviews-Water_World_Lanka-Kelaniya_Western_Province.html,Water World Lanka,4.0,85,https://dynamic-media-cdn.tripadvisor.com/media/photo-o/29/12/2b/91/caption.jpg?w=200&h=200&s=1&cx=1920&cy=1080&chk=v1_c338440b96ab10dd37ff,Thamara T,"Anchorage, Alaska",,5,Friends,"After coming to sri lanka  yearly for the last ten years,  A friend suggested we come here for the day. it is so worth the visit. I was impressed! there are many type of fish and also a large variety of birds.  there are benches through out the park and also a small playground.  it took us about three hours to explore this nice park. cost as of yesterday visit. Foreign ticket is rs 600 and local is rs 280.","November 14, 2016",0.0,0.0
https://www.tripadvisor.com/Attraction_Review-g3595837-d3613552-Reviews-Water_World_Lanka-Kelaniya_Western_Province.html,Water World Lanka,4.0,85,https://dynamic-media-cdn.tripadvisor.com/media/photo-o/29/12/2b/91/caption.jpg?w=200&h=200&s=1&cx=1920&cy=1080&chk=v1_c338440b96ab10dd37ff,Hetty M,"Bintan Island, Indonesia",,4,Friends,"This is my 1st time visit under water tunnel and it was in Sri Lanka. The place is close to Colombo, 20mins by train from colombo fort, ticket price is LKR 10 per person. Once you reach kelaniya station, u can get tuk-tuk or bajaj to drop you to water world LKR100. Entrance ticket is LKR 280 (include bird watching) the ticket quite law because I have resident visa 😊 The area very clean and all staff friendly also helpful. 1 suggestion, need to take care the animals more, because i can see some of them are tired and old The opening hours is 9.30am to 5pm. You can get there from Colombo by taxi, however it is take 1 hour without traffic","November 12, 2016",0.0,0.0
https://www.tripadvisor.com/Attraction_Review-g3595837-d3613552-Reviews-Water_World_Lanka-Kelaniya_Western_Province.html,Water World Lanka,4.0,85,https://dynamic-media-cdn.tripadvisor.com/media/photo-o/29/12/2b/91/caption.jpg?w=200&h=200&s=1&cx=1920&cy=1080&chk=v1_c338440b96ab10dd37ff,Mytrips H,"Gampaha, Sri Lanka",,5,Missing,"We visited Water World Last week with my kids, they love that place. Nice collection of Fish around the world. Well maintained and some construction still going on birds section.","October 2, 2016",0.0,0.0
https://www.tripadvisor.com/Attraction_Review-g3595837-d3613552-Reviews-Water_World_Lanka-Kelaniya_Western_Province.html,Water World Lanka,4.0,85,https://dynamic-media-cdn.tripadvisor.com/media/photo-o/29/12/2b/91/caption.jpg?w=200&h=200&s=1&cx=1920&cy=1080&chk=v1_c338440b96ab10dd37ff,kasun005,"Panadura, Sri Lanka",,4,Missing,very clean place to visit with family to enjoy the nature and see the fish. it offers large number of fish and small number of birds in the location. its a small distance from the highway and from kelaniya temple,"September 20, 2016",0.0,0.0
https://www.tripadvisor.com/Attraction_Review-g3595837-d3613552-Reviews-Water_World_Lanka-Kelaniya_Western_Province.html,Water World Lanka,4.0,85,https://dynamic-media-cdn.tripadvisor.com/media/photo-o/29/12/2b/91/caption.jpg?w=200&h=200&s=1&cx=1920&cy=1080&chk=v1_c338440b96ab10dd37ff,Leala,"Colombo, Sri Lanka",,4,Missing,Good place to visit with childrens  - Young or Small - They defenetly love it. Can spend hours with no Fuss!.,"August 29, 2016",0.0,0.0
https://www.tripadvisor.com/Attraction_Review-g3595837-d3613552-Reviews-Water_World_Lanka-Kelaniya_Western_Province.html,Water World Lanka,4.0,85,https://dynamic-media-cdn.tripadvisor.com/media/photo-o/29/12/2b/91/caption.jpg?w=200&h=200&s=1&cx=1920&cy=1080&chk=v1_c338440b96ab10dd37ff,NishD,"Kandy, Sri Lanka",,4,Missing,So many water species and birds are available to view .Some times fish are not seen inside the under water tunnel .pretty hot out there as well.,"July 14, 2016",0.0,0.0
https://www.tripadvisor.com/Attraction_Review-g3595837-d3613552-Reviews-Water_World_Lanka-Kelaniya_Western_Province.html,Water World Lanka,4.0,85,https://dynamic-media-cdn.tripadvisor.com/media/photo-o/29/12/2b/91/caption.jpg?w=200&h=200&s=1&cx=1920&cy=1080&chk=v1_c338440b96ab10dd37ff,Samantha  J,20 contributions,,4,Missing,We visited this place with kids and witnessed various kinds of fish and animals here. This is a good place to go with your friends and family. They have given a good description about all animals that they have with the history of them.,"July 1, 2016",0.0,0.0
https://www.tripadvisor.com/Attraction_Review-g3595837-d3613552-Reviews-Water_World_Lanka-Kelaniya_Western_Province.html,Water World Lanka,4.0,85,https://dynamic-media-cdn.tripadvisor.com/media/photo-o/29/12/2b/91/caption.jpg?w=200&h=200&s=1&cx=1920&cy=1080&chk=v1_c338440b96ab10dd37ff,Don Anton,"Negombo, Sri Lanka",,3,Friends,We could see some fish and exotic birds. The place was small and was not maintained properly could be seen. I hope now it would be maintained properly. There's no much variety of birds and fish.,"June 21, 2016",0.0,0.0
https://www.tripadvisor.com/Attraction_Review-g3595837-d3613552-Reviews-Water_World_Lanka-Kelaniya_Western_Province.html,Water World Lanka,4.0,85,https://dynamic-media-cdn.tripadvisor.com/media/photo-o/29/12/2b/91/caption.jpg?w=200&h=200&s=1&cx=1920&cy=1080&chk=v1_c338440b96ab10dd37ff,buddhika s,"Colombo, Sri Lanka",,4,Friends,"Nice and clean place,both water park and birds park.But gets crowded in weekends.If visiting as a family or friends better pack lunches.Water tunnel is a good attraction.","June 18, 2016",0.0,0.0
https://www.tripadvisor.com/Attraction_Review-g3595837-d3613552-Reviews-Water_World_Lanka-Kelaniya_Western_Province.html,Water World Lanka,4.0,85,https://dynamic-media-cdn.tripadvisor.com/media/photo-o/29/12/2b/91/caption.jpg?w=200&h=200&s=1&cx=1920&cy=1080&chk=v1_c338440b96ab10dd37ff,Jalal Iqbal,"Dhaka City, Bangladesh",,4,Solo,its a good place. nice water park in south asian standard. but they have 2 typs of ticket. and the ticket price for the foreigners is very high. i was really surprised seeing such ticket rate almost all over in SL.,"April 5, 2016",0.0,0.0
https://www.tripadvisor.com/Attraction_Review-g3595837-d3613552-Reviews-Water_World_Lanka-Kelaniya_Western_Province.html,Water World Lanka,4.0,85,https://dynamic-media-cdn.tripadvisor.com/media/photo-o/29/12/2b/91/caption.jpg?w=200&h=200&s=1&cx=1920&cy=1080&chk=v1_c338440b96ab10dd37ff,Rasika Bandara,"Nugegoda, Sri Lanka",,4,Missing,"The place was reasonably good if you are a Sri Lankan and have never visited will never have the chance to visit such a place in a developed country. This is not up to the mark compared to the ones I have visited in Japan. But, there were some interesting fish, which are indigenous to Sri Lanka and also dangerous to Sri Lanka. Also, lots of fish from the Amazon river also! So if you are eager to know about them and see them, this is the place to go, specially if you are a foreigner. There is a bird park too. Good for children. Prices for locals were: Rs. 280 for adults and Rs. 180 for children. As I can remember, price for a foreign adult was around Rs. 400.","February 28, 2016",0.0,0.0
https://www.tripadvisor.com/Attraction_Review-g3595837-d3613552-Reviews-Water_World_Lanka-Kelaniya_Western_Province.html,Water World Lanka,4.0,85,https://dynamic-media-cdn.tripadvisor.com/media/photo-o/29/12/2b/91/caption.jpg?w=200&h=200&s=1&cx=1920&cy=1080&chk=v1_c338440b96ab10dd37ff,awLKA,"Colombo, Sri Lanka",,4,Couples,"Visited this place on a sunday morning. It was moderately crowded. They have a small car park but this may not be sufficient for long. There were no queues and it was easy to get in. Ticket is a little pricier than accustomed to, but nothing too expensive. The place is fairly well laid out, ensuring you do not miss anything. There are signs, and descriptions next to the exhibits, however the descriptions are not consistent in that some exhibits do not have descriptions, while others have extremely interesting to read and detailed ones, with highlights of the species, and indicates if it is something exhibited for the first time in Sri Lanka, hybrid species, etc... There is a very large variety of fish and birds on display here, and some very stunning exhibits. They also have a small (10meter) underwater tunnel with a moving walkway, which is a first for Sri Lanka and despite the small size, they should be given a special mention for building and operating it. While a decent effort, the entire place gives off that ""almost there at International levels but not quite"" vibe. With a little finishing work done, such as better descriptions on the animals, it could be a star attraction. The biggest disappointment has to be the shark tank; all the sharks were very small ones (maybe less than 3 feet length). The best part has to be the birds on exhibit; there is a wide variety of colourful birds that will delight all ages. It should also be noted that this place does not appear to be disabled friendly: floor levels are uneven, there are stairs to be navigated, and in the fish tanks area there is very almost no lighting at floor level. Cleanliness is decent.","January 2, 2016",0.0,0.0
https://www.tripadvisor.com/Attraction_Review-g3595837-d3613552-Reviews-Water_World_Lanka-Kelaniya_Western_Province.html,Water World Lanka,4.0,85,https://dynamic-media-cdn.tripadvisor.com/media/photo-o/29/12/2b/91/caption.jpg?w=200&h=200&s=1&cx=1920&cy=1080&chk=v1_c338440b96ab10dd37ff,S T Maxlin,Singapore,,3,Missing,"Water world Kelaniya.. This water park is well kept in as much as safety and cleanliness. The attractions are averagely amazing. Although quite expensive and I recomend to arrive early on a sunny day, it could mark a highlight on any kid's (or adult's) visit.. I proud that we Srilankan's have this kind of water parks... Thank you guys...!","December 4, 2015",0.0,0.0
https://www.tripadvisor.com/Attraction_Review-g3595837-d3613552-Reviews-Water_World_Lanka-Kelaniya_Western_Province.html,Water World Lanka,4.0,85,https://dynamic-media-cdn.tripadvisor.com/media/photo-o/29/12/2b/91/caption.jpg?w=200&h=200&s=1&cx=1920&cy=1080&chk=v1_c338440b96ab10dd37ff,h_milroyperera,"Kadawata, Sri Lanka",,5,Missing,"This is near to kaduwela & Kalaniya temple. It's nice to see so many variations of fishes. It has one & only underwater tunnel in Sri Lanka, & really nice, but it was 30 feet long. :( This place has not only fish but also many variety of birds.  It was a great experience.. :)","November 16, 2015",0.0,0.0
https://www.tripadvisor.com/Attraction_Review-g3595837-d3613552-Reviews-Water_World_Lanka-Kelaniya_Western_Province.html,Water World Lanka,4.0,85,https://dynamic-media-cdn.tripadvisor.com/media/photo-o/29/12/2b/91/caption.jpg?w=200&h=200&s=1&cx=1920&cy=1080&chk=v1_c338440b96ab10dd37ff,gankande,"Colombo, Sri Lanka",,3,Missing,"This is a follow up review from six months ago. This is an attraction that we visit once a month, and it continues to sustain our toddler's interest. A possible improvement would be introducing a feeding pool so children can see the fish eating; and developing the play area so kids have more to do.","September 29, 2015",0.0,0.0
https://www.tripadvisor.com/Attraction_Review-g3595837-d3613552-Reviews-Water_World_Lanka-Kelaniya_Western_Province.html,Water World Lanka,4.0,85,https://dynamic-media-cdn.tripadvisor.com/media/photo-o/29/12/2b/91/caption.jpg?w=200&h=200&s=1&cx=1920&cy=1080&chk=v1_c338440b96ab10dd37ff,kalpz23,"Negombo, Sri Lanka",,1,Missing,"We went to this place on a weekend. Place was overcrowded... All the vehicle parks were full and we had to wait in que for sometime in the hot sun. Once we entered from the gates, we had to stay in line to go through the tunnels with a huge crowd where there were no lights or ventilation... It was suffocating.... We just wanted to get-out through the tunnels.... It was a bad experience for us. The birds were kept in too small cages.... There were not enough spaces for some of the birds to fly freely.... It was such a sad sight.... Will never go there again...","August 30, 2015",0.0,0.0
https://www.tripadvisor.com/Attraction_Review-g3595837-d3613552-Reviews-Water_World_Lanka-Kelaniya_Western_Province.html,Water World Lanka,4.0,85,https://dynamic-media-cdn.tripadvisor.com/media/photo-o/29/12/2b/91/caption.jpg?w=200&h=200&s=1&cx=1920&cy=1080&chk=v1_c338440b96ab10dd37ff,Fahadh Nazir,"Panadura, Sri Lanka",,4,Missing,"It's nice to see so many variations of fishes. The pathways needs to a bit lit as it was pitch dark inside the tunnels.. I was heading with full hope to see the underwater tunnel, but it was mere 30 feet long and walk within the tunnel lasted only for a few minutes... Was a great experience though.. Saw so many sea creatures we never even heard of..","April 20, 2015",0.0,0.0
https://www.tripadvisor.com/Attraction_Review-g3595837-d3613552-Reviews-Water_World_Lanka-Kelaniya_Western_Province.html,Water World Lanka,4.0,85,https://dynamic-media-cdn.tripadvisor.com/media/photo-o/29/12/2b/91/caption.jpg?w=200&h=200&s=1&cx=1920&cy=1080&chk=v1_c338440b96ab10dd37ff,Thimalee A,"Norwood, Massachusetts",,4,Friends,"Went with some friends, average place for fun but a good place for education. No high class facilities but the place is clean and well maintained.","February 16, 2015",0.0,0.0
https://www.tripadvisor.com/Attraction_Review-g3595837-d3613552-Reviews-Water_World_Lanka-Kelaniya_Western_Province.html,Water World Lanka,4.0,85,https://dynamic-media-cdn.tripadvisor.com/media/photo-o/29/12/2b/91/caption.jpg?w=200&h=200&s=1&cx=1920&cy=1080&chk=v1_c338440b96ab10dd37ff,winswills,42 contributions,,3,Missing,"The places ok for an evening / for children. the tickets includes access for fish section and bird park. The fish section is good but the bird park is small and some variety of birds and cages single. The charges are higher compared to the ticket price of Colombo Zoo. You have nothing to do beyond two hours, unless you want to study about each varieties of fish they have. The under water section is ver small, but that is the only place contains under water view in Sri Lanka. Very poor facilities for parking, but you can park along the road / neighboring lands, but thy too charge 150 rupees for one or two hours. They do have a website which provides some essential informations.","January 10, 2015",0.0,0.0
https://www.tripadvisor.com/Attraction_Review-g3595837-d3613552-Reviews-Water_World_Lanka-Kelaniya_Western_Province.html,Water World Lanka,4.0,85,https://dynamic-media-cdn.tripadvisor.com/media/photo-o/29/12/2b/91/caption.jpg?w=200&h=200&s=1&cx=1920&cy=1080&chk=v1_c338440b96ab10dd37ff,gankande,"Colombo, Sri Lanka",,4,Missing,"We take our daughter here frequently. This is a facility with aquariums and birds. It does not include any water play. The park is clean and well maintained although you need to go early because parking is limited. It has long cool passageways with aquariums which are engaging and educational; the bird park has room for improvement, but includes a decent range to keep you occupied. There is a playground which provides some distraction for children; and the underwater passageway, although small, is a major hit. There is a kiosk that sells food and beverages and aside from the beverages we would advise you to bring your own food if you intend to have lunch. The entrance fee is reasonable for locals and foreigners alike.","December 9, 2014",0.0,0.0
https://www.tripadvisor.com/Attraction_Review-g3595837-d3613552-Reviews-Water_World_Lanka-Kelaniya_Western_Province.html,Water World Lanka,4.0,85,https://dynamic-media-cdn.tripadvisor.com/media/photo-o/29/12/2b/91/caption.jpg?w=200&h=200&s=1&cx=1920&cy=1080&chk=v1_c338440b96ab10dd37ff,erangatennakoon,"Colombo, Sri Lanka",,4,Missing,"I went with my family and friends to this aquarium and bird sanctuary near Kelaniya temple which was one the places visited by Lord Buddha on his visit to Sri Lanka. There was quite a variety of fish from jelly fish to many others. There was no guide available and website says educational tours are available. Some information was provided in multiple languages nearby. Water tunnel was too short, 30 feet long, but you can repeatedly go through it. Limited types of fish were there in the tunnel. Bird Park is also worth to visit, next to the water world. However, through half inch wire mesh it was really hard to see the beauty of birds. I couldn’t capture at least one bird in the park. One reason would be that to stop feeding by visitors. Limited parking facilities and I didn’t see enough security provided by the management. Cafeteria running understaff with limited choices. If you are going with kids better well prepared.","November 14, 2014",0.0,0.0
https://www.tripadvisor.com/Attraction_Review-g3595837-d3613552-Reviews-Water_World_Lanka-Kelaniya_Western_Province.html,Water World Lanka,4.0,85,https://dynamic-media-cdn.tripadvisor.com/media/photo-o/29/12/2b/91/caption.jpg?w=200&h=200&s=1&cx=1920&cy=1080&chk=v1_c338440b96ab10dd37ff,Curtis B,"Tucson, Arizona",,4,Missing,"I went with 20 adults, teens, young children, and babies to this aquarium and bird sanctuary. There is quite a variety of fish from sea horses to sharks. A relatively new and probably the best exhibit is the aquarium tunnel. The kids went through that repeatedly. There are playgrounds and many shady spots. The bird sanctuary is large and houses a worldly collection. Last, there is a paddle boat in a small man made lake; stand in line; 2 people at a time. Adult admission 450 LKR if I remember correctly.","September 2, 2014",0.0,0.0
https://www.tripadvisor.com/Attraction_Review-g3595837-d3613552-Reviews-Water_World_Lanka-Kelaniya_Western_Province.html,Water World Lanka,4.0,85,https://dynamic-media-cdn.tripadvisor.com/media/photo-o/29/12/2b/91/caption.jpg?w=200&h=200&s=1&cx=1920&cy=1080&chk=v1_c338440b96ab10dd37ff,Ilyas G,"Doha, Qatar",,3,Missing,"It's website does not do justice to the actual location, its exhibits are interesting, however the pathways around the aquariums need to be better illuminated. I hope that the management betters the environs of this place if they want to attract more visitors.","September 2, 2014",0.0,0.0
