Destination URL,Destination Title,Destination Score,Total Reviews (Destination),Destination Image,Reviewer Name,Reviewer Location,Review Title,Review Score,Reviewer Category,Review Text,Written Date,% %,  %
https://www.tripadvisor.com/Attraction_Review-g3595837-d3613552-Reviews-Water_World_Lanka-Kelaniya_Western_Province.html,Water World Lanka,4.0,85,https://dynamic-media-cdn.tripadvisor.com/media/photo-o/29/12/2b/91/caption.jpg?w=200&h=200&s=1&cx=1920&cy=1080&chk=v1_c338440b96ab10dd37ff,Sinnathamby V,"Colombo, Sri Lanka",,4,Missing,"Actually a great place for kids and adults too. Especially the Underwater world is amazing, similar to Singapore but we must proud that we have it here!!! Really my son enjoyed hence he is SHARK fan. We may come again with many kids and their families too.","June 6, 2014",0.0,0.0
https://www.tripadvisor.com/Attraction_Review-g3595837-d3613552-Reviews-Water_World_Lanka-Kelaniya_Western_Province.html,Water World Lanka,4.0,85,https://dynamic-media-cdn.tripadvisor.com/media/photo-o/29/12/2b/91/caption.jpg?w=200&h=200&s=1&cx=1920&cy=1080&chk=v1_c338440b96ab10dd37ff,Prasanna,"Panadura, Sri Lanka",,3,Missing,Beautiful collection of fish in reasonably well maintained aquarium. Newly added tunnel so miniature and so little fish.No where near international standards. Adjoining bird wold kills the beauty of the birds due to half inch wire mesh fixed at every cage from largest bird to smallest. cafeteria is much to desired and understaffed,"May 17, 2014",0.0,0.0
https://www.tripadvisor.com/Attraction_Review-g3595837-d3613552-Reviews-Water_World_Lanka-Kelaniya_Western_Province.html,Water World Lanka,4.0,85,https://dynamic-media-cdn.tripadvisor.com/media/photo-o/29/12/2b/91/caption.jpg?w=200&h=200&s=1&cx=1920&cy=1080&chk=v1_c338440b96ab10dd37ff,Thiranka,"Colombo, Sri Lanka",,3,Missing,"Went to see this place with family members. Even though they have advertised it is the first and the biggest underwater tunnel in South Asia, this tunnel is very short. The water above on this tunnel is very shallow. You can see few small fish only there and the tunnel is built on the soil and not under water. Since there is an electric walk track, you cannot wait or stop inside the tunnel. But you can go on that any number of times. Since that was a slightly rainy day, we were on trouble due to that. No proper car parking. The car park was full on that day. Then we decided to park in the private land which is near that and had to pay Rs.100 for parking. Bird Park has a large and rare collection of birds when compared to Dehiwala Zoo. But the bird cages are poorly built with 2 layers where it is quite hard to see the bird inside properly. Water world has a large collection of fish. Best place for kids. Also there was only 1 small cafeteria inside with nothing much to eat or drink. This place is better to avoid on weekends/holidays and rainy days as it can be crowded and parking can be difficult.","May 10, 2014",0.0,0.0
https://www.tripadvisor.com/Attraction_Review-g3595837-d3613552-Reviews-Water_World_Lanka-Kelaniya_Western_Province.html,Water World Lanka,4.0,85,https://dynamic-media-cdn.tripadvisor.com/media/photo-o/29/12/2b/91/caption.jpg?w=200&h=200&s=1&cx=1920&cy=1080&chk=v1_c338440b96ab10dd37ff,Nothernstar85,"Singapore, Singapore",,4,Missing,Visited recently with friends. Less than an hour journey by motor bike. Situated near Kelaniya vihara and in biyagama road. It is a good place to visit with children.  An hour or two can be spent there. My personal humble  suggestion is that maintenance and the categories of fish can be improved or increased.....,"February 21, 2014",0.0,0.0
https://www.tripadvisor.com/Attraction_Review-g3595837-d3613552-Reviews-Water_World_Lanka-Kelaniya_Western_Province.html,Water World Lanka,4.0,85,https://dynamic-media-cdn.tripadvisor.com/media/photo-o/29/12/2b/91/caption.jpg?w=200&h=200&s=1&cx=1920&cy=1080&chk=v1_c338440b96ab10dd37ff,Hilsmedic,113 contributions,,4,Friends,"Visited water world with friends in January 2014 after a short journey from Negombo, it was not quite what I expected, I had wanted to see & hear a it more about the marine life on display. The fish & aquatic creatures where kept in large enough tanks, some information was provided in several languages outside the tanks, there was no guide or tour available despite the website saying there were 'educational tours available'. The last few meters you step onto a moving walkway and within fifteen seconds if you are not careful you have to step off it's so short. Worth it if you want to amuse the children for a few hours. Next door is a park for birds which is also worth a visit.","February 5, 2014",0.0,0.0
https://www.tripadvisor.com/Attraction_Review-g3595837-d3613552-Reviews-Water_World_Lanka-Kelaniya_Western_Province.html,Water World Lanka,4.0,85,https://dynamic-media-cdn.tripadvisor.com/media/photo-o/29/12/2b/91/caption.jpg?w=200&h=200&s=1&cx=1920&cy=1080&chk=v1_c338440b96ab10dd37ff,sundomain,"Colombo, Sri Lanka",,4,Couples,Bit of a drive from Colombo but the diverse range of marine and bird life make up for it. The place exhibits many species of rare aquatic creatures (mainly fish) and some beautiful (caged) birds in their bird park. The entrance fee of LKR 280 per adult didn't seem a rip-off. The music blaring at the entrance was very disturbing but thankfully it faded away as we moved along. The tunnel (apparently the first in south-asia) is short. The water above it is very shallow so you won't find any big fish you find in Singapore or Dubai. This somewhat renders the tunnel useless. This place is best avoided on weekends and holidays as it can get crowded and parking can be an ordeal.,"July 27, 2013",0.0,0.0
https://www.tripadvisor.com/Attraction_Review-g3595837-d3613552-Reviews-Water_World_Lanka-Kelaniya_Western_Province.html,Water World Lanka,4.0,85,https://dynamic-media-cdn.tripadvisor.com/media/photo-o/29/12/2b/91/caption.jpg?w=200&h=200&s=1&cx=1920&cy=1080&chk=v1_c338440b96ab10dd37ff,Nuzraan,"Colombo, Sri Lanka",,5,Missing,"I took my family (wife and 2 kids below 7) in June 2013. This is a 2-in-1 facility / attraction. Water World and Birds park. We have visited many aquariums and Bird Parks around the world. However, in Sri lankan context, this place need very special appreciation. Lots of efforts and energy has gone in to produce such an outstanding facility. We were amazed how this was maintained and kept tidy! This is commendable! Kids enjoyed thoroughly. Water world has a great variety of fish from various parts of the world. You can experience the first “Under Water Tunnel Aquarium” in South Asia. Its a lovely experience. Very reasonably priced attarction, popular among locals and tourist. Bird park has many variety of birds from different origins and a pair of most expensive macav too. Request every body to help keep this attarction clean and tidy. Distances: Airport to Water World: approx 45 minutes, Colombo  to Water World: approx 30 to 45 minutes","July 26, 2013",0.0,0.0
https://www.tripadvisor.com/Attraction_Review-g3595837-d3613552-Reviews-Water_World_Lanka-Kelaniya_Western_Province.html,Water World Lanka,4.0,85,https://dynamic-media-cdn.tripadvisor.com/media/photo-o/29/12/2b/91/caption.jpg?w=200&h=200&s=1&cx=1920&cy=1080&chk=v1_c338440b96ab10dd37ff,madushi101,70 contributions,,5,Couples,Well why i called this journey as a short distnace ancient spirit is....Kelaniya temple is one of the 12 places visit by Lord Budha on his visit to Sri lanka. And its so much worshipped by local and forign Bhuddists all over the world. Kelaniya is only a short distance from Colombo. Less than an hours drive. The arts and the structure the sthoopa is made is quite unique compaired to other temples. It is said that the sthoopa is built tresuring the golden chair which was offered to Lord Budha to preech to the King who reighned Keleniya at that time. Best days to visit the temple is on poya days to see how much people devote. And theres free food.,"July 12, 2013",0.0,0.0
https://www.tripadvisor.com/Attraction_Review-g3595837-d3613552-Reviews-Water_World_Lanka-Kelaniya_Western_Province.html,Water World Lanka,4.0,85,https://dynamic-media-cdn.tripadvisor.com/media/photo-o/29/12/2b/91/caption.jpg?w=200&h=200&s=1&cx=1920&cy=1080&chk=v1_c338440b96ab10dd37ff,Bodi L,"Panadura, Sri Lanka",,3,Missing,This could be a new & great experience to majority of Sri Lankans who are unable to travel outside the country to enjoy such an attraction specially for an affordable price. Kids would love the place & no other place gives such an experience of an aquarium in the country. The idea of Underwater tunnel should be commended. However the parking facilities are very poor & no security at all. You may have to be extra cautious specially for your kids as well as your vehicle. Dining facilities specially for visiting school children should be improved a lot with a well arranged Cafeteria. It will helpful to improve the cleanliness too. The Under Water Tunnel should have been longer for better experience & filled with more species. More attention should be given to the cleanliness. Anyway comparing to a country where such a modern way of enjoyment facilities are limited the idea of the Water World Lanka & the effort should be highly appreciated.,"June 7, 2013",0.0,0.0
https://www.tripadvisor.com/Attraction_Review-g3595837-d3613552-Reviews-Water_World_Lanka-Kelaniya_Western_Province.html,Water World Lanka,4.0,85,https://dynamic-media-cdn.tripadvisor.com/media/photo-o/29/12/2b/91/caption.jpg?w=200&h=200&s=1&cx=1920&cy=1080&chk=v1_c338440b96ab10dd37ff,Treshi,"Colombo, Sri Lanka",,4,Missing,One of the nice aquariums in the country situated in Kelaniya. It has over 500 varieties of fish and the place is very famous among children.,"June 7, 2013",0.0,0.0
https://www.tripadvisor.com/Attraction_Review-g3595837-d3613552-Reviews-Water_World_Lanka-Kelaniya_Western_Province.html,Water World Lanka,4.0,85,https://dynamic-media-cdn.tripadvisor.com/media/photo-o/29/12/2b/91/caption.jpg?w=200&h=200&s=1&cx=1920&cy=1080&chk=v1_c338440b96ab10dd37ff,Vanjikumaran S,29 contributions,,3,Missing,"This will be new experience to you if you not have visited to any other overseas countries that has the real underwater world!! to spend a weekend day with your friends or family this will be Average rated place! and they have considerable amount of water spies and Birds in bird world!! Price is 280 per adult and 140 for children! Nevertheless, I was disappointed after visiting to water Wolrd lanka! once i see the place. On rainy day you will feel sorry for you! since there is proper shelters! and there is no good cafeteria as well!","June 3, 2013",0.0,0.0
https://www.tripadvisor.com/Attraction_Review-g3595837-d3613552-Reviews-Water_World_Lanka-Kelaniya_Western_Province.html,Water World Lanka,4.0,85,https://dynamic-media-cdn.tripadvisor.com/media/photo-o/29/12/2b/91/caption.jpg?w=200&h=200&s=1&cx=1920&cy=1080&chk=v1_c338440b96ab10dd37ff,SimonitaPrague,139 contributions,,4,Couples,"It was nice experience but I can tell visit it when you have free time in Colombo. Price for non-lanka people is 400 rupies per person. Where I see the problem is very small parking and very poor selection in caffeteria. The size of attraction is good but I though that Underwater tunnel will be bigger. I was there for 1,5 hours and it is enough.","May 5, 2013",0.0,0.0
https://www.tripadvisor.com/Attraction_Review-g3595837-d3613552-Reviews-Water_World_Lanka-Kelaniya_Western_Province.html,Water World Lanka,4.0,85,https://dynamic-media-cdn.tripadvisor.com/media/photo-o/29/12/2b/91/caption.jpg?w=200&h=200&s=1&cx=1920&cy=1080&chk=v1_c338440b96ab10dd37ff,Raj39,6 contributions,,4,Missing,"It's easy to citisize but the owner has made a tremendous effort all of his own to offer something unique to the general public , the majority who cannot travel abroad. In any country the national zoo must take the lead but here it's another story. Ddirector after Ddirector who was appointed to the national zoo ruined the place. Today Dehiwela is a concrete jungle. At least this man has wide experience in Aqua culture and avi culture and he has made a good effort. We need to encourage such people not discourage.","March 13, 2013",0.0,0.0
https://www.tripadvisor.com/Attraction_Review-g3595837-d3613552-Reviews-Water_World_Lanka-Kelaniya_Western_Province.html,Water World Lanka,4.0,85,https://dynamic-media-cdn.tripadvisor.com/media/photo-o/29/12/2b/91/caption.jpg?w=200&h=200&s=1&cx=1920&cy=1080&chk=v1_c338440b96ab10dd37ff,Asanke G,"Sydney, Australia",,4,Missing,"There are three ways to look in to this place as per March 2013. [1] Form the eye of a local who, have not experienced a popular aquarium in a foreign country. [2] From the eye of a person who has been to at least one of the popular foreign aquariums , but still want to spend some time in a local aquarium with friends, kids and family. [3] from the eye of a person who is looking for a world class aquarium to visit. I recommend this place to the first two group of people. When compared to the other aquariums in Sri Lanaka, I believe this place is well maintained.(More to improve of course). The displays are well maintained, informative and spacious. The tour is worth for the amount we pay. I went with few friends and few kids aging around 5 years. They had a nice time there. The under water tunnel they market these days (2013) is well set up and I believe this is a good achievement in the Sri Lnakan  context. The tunnel is 30 feet long and the setup has well established with standards. There is a large play area with loads of play equipment. Overall, this is a great experience for the locals who do not have  the luxury of traveling abroad. There are many points to improve: As tharinduc mentioned [1] First place limited Car parking. management should look in to this seriously. There are few adjoining land plots converted in to car parks by neighbors and started a business there. But I recommend this should be organised, otherwise this will become a mafia. [2] Overall the pace get hot when its around noon, mainly because the concrete structures. Air conditioning will not be a feasible option. But spraying cool water in places can be done. [3] The Bird cages are double meshed , making it hard to see the birds. Sometimes its necessary to protect birds from crazy visitors. But this needs to be addressed without comprising the main course of displaying the birds. [4] The only canteen is not sufficient when the place is crowded. The management should set up a good canteen and a souvenir shop. Overall, This is a good place for a local who want to witness a good aquarium or want to spend few hours with your loved ones showing them some beautiful fish and birds. If you are a traveler who already have experienced aquariums abroad or want to experience a world class aquarium, this may not be the place for you. Hope the management improve the place to give a convenient  experience to visitors.","March 11, 2013",0.0,0.0
https://www.tripadvisor.com/Attraction_Review-g3595837-d3613552-Reviews-Water_World_Lanka-Kelaniya_Western_Province.html,Water World Lanka,4.0,85,https://dynamic-media-cdn.tripadvisor.com/media/photo-o/29/12/2b/91/caption.jpg?w=200&h=200&s=1&cx=1920&cy=1080&chk=v1_c338440b96ab10dd37ff,Tharindu W,"Panadura, Sri Lanka",,2,Friends,"Went to see this place today as they were advertising mentioning as the first underwater tunnel in South Asia. But we were really disappointed after going to the place. Quality of the place is no way near to the quality you get in other countries. Price is reasonable, 280Rs for a local adult for both water world and bird park and it is 400Rs for a foreign adult. First of all, no proper car parking. There is a small car park which is full. Then we had to wait in queue for 30 minutes as it's a holiday. The queue is poorly managed and people have to stand in sun for long to get a ticket. At least a shade should be built. We got tickets to both the bird park and water world. Bird park has a larger and expensive collection of birds when compared to Dehiwala zoo. But the bird cages are poorly built with 2 layers where it is quite hard to see the bird inside. Many birds caged alone in small cages making us sad about the creature inside. Water world has a large collection of fish. Again it's quite hot inside the tunnels making us very uncomfortable. There was a tiny piece of tunnel called under water tunnel, but it's nothing much to see really as it's a poorly built mini tunnel about 15 feet in length. You can only see few small fish there and the tunnel is built on the soil and not under water. Also there was only 1 small cafeteria inside with nothing much to eat or drink. Overall, if you are a tourist, avoid this place at all costs. If you are a local and have not traveled abroad, this maybe something to amuse you. Hope things will improve later with the large amount of money they draw from ticket sales.","February 5, 2013",0.0,0.0
