Destination URL,Destination Title,Destination Score,Total Reviews (Destination),Destination Image,Reviewer Name,Reviewer Location,Review Title,Review Score,Reviewer Category,Review Text,Written Date,% %,  %
https://www.tripadvisor.com/Attraction_Review-g3595837-d3613552-Reviews-Water_World_Lanka-Kelaniya_Western_Province.html,Water World Lanka,4.0,85,https://dynamic-media-cdn.tripadvisor.com/media/photo-o/29/12/2b/91/caption.jpg?w=200&h=200&s=1&cx=1920&cy=1080&chk=v1_c338440b96ab10dd37ff,Nilushen,"Colombo, Sri Lanka",This place is filled with a variety of local and exotic birds and fish.,4,Friends,"place where you can go to see fish and birds in one place is the Water World in the Kelaniya area. This place is filled with a variety of local and exotic birds and fish. This place, which attracts special attention from young children, is also suitable for adults. The park is divided into four sections: Sea World, Bird Park, Underwater Tunnel, and River  Safari . There is a restaurant where you can buy food and drinks and you can get lunch from there. The weak point I saw here is that the amount of underwater space is very small and the path for electricity to travel through it is not working properly. The highlight of the here is the small boat ride that is offered to us. If you're looking for a place to go to entertain your child during the holidays, this is a great place to do it.","November 14, 2025",0.0,0.0
https://www.tripadvisor.com/Attraction_Review-g3595837-d3613552-Reviews-Water_World_Lanka-Kelaniya_Western_Province.html,Water World Lanka,4.0,85,https://dynamic-media-cdn.tripadvisor.com/media/photo-o/29/12/2b/91/caption.jpg?w=200&h=200&s=1&cx=1920&cy=1080&chk=v1_c338440b96ab10dd37ff,Chrishanthi P,1 contribution,IMPROVE THE PLACE TO BE A WONDER OF SRI LANKA,3,Friends,"I was happy to see something like this in Sri Lanka but sad to say that the place doesn't seem to be properly maintained. This lacks cleanliness and to see that the property is not maintained properly. People have literd the place and the gardens could be landscaped and planted with tropical plants that grow without much caring, seating could be arranged nicely, more bins to be kept in the gardens. The seats were all dirty never washed even the place doesn't seem to be swept and well kept. Actually to bring this type of places to a foreign standard only a little is necessary to be done. The upkeep must be high then the ticket price should be raised at least to 1500 for adults and 750 for a child. Sri Lanka has to think ahead not to be where we are today. Just a matter of improvement which could make this place into a wonder.","August 23, 2025",0.0,0.0
https://www.tripadvisor.com/Attraction_Review-g3595837-d3613552-Reviews-Water_World_Lanka-Kelaniya_Western_Province.html,Water World Lanka,4.0,85,https://dynamic-media-cdn.tripadvisor.com/media/photo-o/29/12/2b/91/caption.jpg?w=200&h=200&s=1&cx=1920&cy=1080&chk=v1_c338440b96ab10dd37ff,Vidurajith Darshana,"Kalutara, Sri Lanka",Under the Sea,4,Missing,"One of the biggest aquariums in Sri Lanka. They had various kinds of fish and animals in this park. You can see a lot of birds in the birds park. Usually a busy place and not much parking space in this area. They have an under water tunnel, but actually a much shorter one than I thought. It's not a fair experience. But they have a river safari that went through different kinds of animals and it was like an adventure tour. You can contribute to feed the birds and it would be a lovely experience. Fair ticket rates and you can earn a nice experience. Toilets available. Good for kids.","January 27, 2025",0.0,0.0
https://www.tripadvisor.com/Attraction_Review-g3595837-d3613552-Reviews-Water_World_Lanka-Kelaniya_Western_Province.html,Water World Lanka,4.0,85,https://dynamic-media-cdn.tripadvisor.com/media/photo-o/29/12/2b/91/caption.jpg?w=200&h=200&s=1&cx=1920&cy=1080&chk=v1_c338440b96ab10dd37ff,Susantha K,4 contributions,Nice,5,Missing,"Visited Water World recently,  The Christmas decorations were absolutely magical, adding a festive touch to the incredible underwater tunnel and exhibits. The river safari ride was a true adventure—spotting the tribal man amidst the lush surroundings made it even more exciting. A perfect blend of nature, wildlife, and holiday cheer! Highly recommend for families and nature enthusiasts alike!","December 24, 2024",0.0,0.0
https://www.tripadvisor.com/Attraction_Review-g3595837-d3613552-Reviews-Water_World_Lanka-Kelaniya_Western_Province.html,Water World Lanka,4.0,85,https://dynamic-media-cdn.tripadvisor.com/media/photo-o/29/12/2b/91/caption.jpg?w=200&h=200&s=1&cx=1920&cy=1080&chk=v1_c338440b96ab10dd37ff,HDZ S,2 contributions,Simply lovely,5,Missing,"I recently visited Water World Kelaniya, and it was an unforgettable experience! The underwater tunnel was absolutely mesmerizing – walking through it felt like being transported into the heart of the ocean. The variety of marine life on display was stunning, and the aquariums were well-maintained. The bird park was another highlight, with a beautiful collection of exotic birds in a serene environment. The whole place is perfect for families, nature lovers, or anyone looking for a peaceful and educational outing. Highly recommend visiting if you’re near Colombo – it’s a unique attraction that truly stands out in Sri Lanka!","December 16, 2024",0.0,0.0
https://www.tripadvisor.com/Attraction_Review-g3595837-d3613552-Reviews-Water_World_Lanka-Kelaniya_Western_Province.html,Water World Lanka,4.0,85,https://dynamic-media-cdn.tripadvisor.com/media/photo-o/29/12/2b/91/caption.jpg?w=200&h=200&s=1&cx=1920&cy=1080&chk=v1_c338440b96ab10dd37ff,L. Siva,"Seeduwa, Sri Lanka",Water world lanka kelaniya,5,Missing,Nice place to visit with family.beautiful fish aquarium more than hundered of sea fish variety. Beautiful birds and boat ride.,"July 12, 2024",0.0,0.0
https://www.tripadvisor.com/Attraction_Review-g3595837-d3613552-Reviews-Water_World_Lanka-Kelaniya_Western_Province.html,Water World Lanka,4.0,85,https://dynamic-media-cdn.tripadvisor.com/media/photo-o/29/12/2b/91/caption.jpg?w=200&h=200&s=1&cx=1920&cy=1080&chk=v1_c338440b96ab10dd37ff,Mananga K,2 contributions,Newly opened River Safari - A world class attraction,5,Missing,"Amazing place! can recommend it to all ages, specially for families. The place had so many species of fish, probably 500+ species and impressive collection of birds. Very friendly staff, free parking, free bird feeding, free fish feeding, so many interesting activities that were all given free of charge.  Fish and birds look well taken care of. Spacious tanks and cages that were clean and very well maintained. For a aquatic fan, there were lots of information boards. The best attraction was the newly opened River Safari. This was a world class theme ride, and very unique. The cafeteria needs improvement as they did not serve lunch. All in all a great experience. Highly recommended.","February 28, 2024",0.0,0.0
https://www.tripadvisor.com/Attraction_Review-g3595837-d3613552-Reviews-Water_World_Lanka-Kelaniya_Western_Province.html,Water World Lanka,4.0,85,https://dynamic-media-cdn.tripadvisor.com/media/photo-o/29/12/2b/91/caption.jpg?w=200&h=200&s=1&cx=1920&cy=1080&chk=v1_c338440b96ab10dd37ff,thanu b,Maldives,Better experience,4,Missing,Bird experience is fair but could have made it better. Bathroom need to be more clean and easy accessible. And some of the birds need to be kept more clean environment,"July 25, 2023",0.0,0.0
https://www.tripadvisor.com/Attraction_Review-g3595837-d3613552-Reviews-Water_World_Lanka-Kelaniya_Western_Province.html,Water World Lanka,4.0,85,https://dynamic-media-cdn.tripadvisor.com/media/photo-o/29/12/2b/91/caption.jpg?w=200&h=200&s=1&cx=1920&cy=1080&chk=v1_c338440b96ab10dd37ff,Mananga K,2 contributions,Amazing place,5,Missing,"Amazing place with lots of species of fish and birds. Fish looked healthy and matured. Clean and large bird cages, birds were active and looked well taken care of. Lots of trees, maybe the most green attraction in Colombo! Good for kids and adults alike. They can improve the cafeteria. Staff were friendly and helpful. They also have free bird feeding, free fish feeding and diving shows. The best attraction was the newly opened River Safari. It was a new experience filled with beautiful natural scapes, plants, fish and free flying birds. The River safari bird cages were huge! Maybe 100 feet long and 20+ feet tall. It was a treat to watch them so free. Highly recommend this place for all.","March 3, 2023",0.0,0.0
https://www.tripadvisor.com/Attraction_Review-g3595837-d3613552-Reviews-Water_World_Lanka-Kelaniya_Western_Province.html,Water World Lanka,4.0,85,https://dynamic-media-cdn.tripadvisor.com/media/photo-o/29/12/2b/91/caption.jpg?w=200&h=200&s=1&cx=1920&cy=1080&chk=v1_c338440b96ab10dd37ff,khadi A,1 contribution,Make it pleasant,2,Couples,Can provide better conditions for animals. The birds looked miserable. It doesn't look humane how they have trapped starks in a tiny cage without even water. Cages can improve.,"February 21, 2023",0.0,0.0
https://www.tripadvisor.com/Attraction_Review-g3595837-d3613552-Reviews-Water_World_Lanka-Kelaniya_Western_Province.html,Water World Lanka,4.0,85,https://dynamic-media-cdn.tripadvisor.com/media/photo-o/29/12/2b/91/caption.jpg?w=200&h=200&s=1&cx=1920&cy=1080&chk=v1_c338440b96ab10dd37ff,HDZ S,2 contributions,,5,Friends,Visited Water World last week and it was breathtaking. Amazing array of Fishes.Under Water Tunnel was magnificent as surprisingly long.The bird cages were big and most birds were freely roaming.You could see the birds were enjoying their cages.The tunnel is relatively long but you can't expect it to be huge considering the ticket fee!!In Singapore prices of each ticket exceed Rs.5000.Here it is only 350.Amazing and totally worth the cost.,"February 24, 2022",0.0,0.0
https://www.tripadvisor.com/Attraction_Review-g3595837-d3613552-Reviews-Water_World_Lanka-Kelaniya_Western_Province.html,Water World Lanka,4.0,85,https://dynamic-media-cdn.tripadvisor.com/media/photo-o/29/12/2b/91/caption.jpg?w=200&h=200&s=1&cx=1920&cy=1080&chk=v1_c338440b96ab10dd37ff,MR,1 contribution,,1,Missing,"the worst aquarium and bird zoo we have ever seen. the animals, especially the birds, are held in absolutely unbelievably small cages, even the big ones - sometimes up to 10 big birds in a cage so small, they can hardly open their wings! birds who should be able to fly like cranichs, are held 4 in one cage, desperately trying to fly but the roof is very low and the cage extremely small... so when one opes his wings, the other cannot. same story with all the others! how they hold theirs animals is a real nightmare. and the tunnel? maybe 6m long or something, then over. the pictures of the tunnel are not what it looks like in reality. they make it look bigger and longer on the fotos, but it is a thing of 1 minute to watch and pass through. the childrens playground was dirty, the handwashing station there was broken, as well as one of the toilets was flooding everything because it was broken. no one cared, no one fixed it even after we told them that something is broken. no interest at all. do not support this thing called ""water world"". it's ""water hell"" for most of the animals there, especially the  birds. i have never seen a zoo or aquarium holding it's animals in such small cages and areas. a real nightmare.","February 1, 2022",0.0,0.0
https://www.tripadvisor.com/Attraction_Review-g3595837-d3613552-Reviews-Water_World_Lanka-Kelaniya_Western_Province.html,Water World Lanka,4.0,85,https://dynamic-media-cdn.tripadvisor.com/media/photo-o/29/12/2b/91/caption.jpg?w=200&h=200&s=1&cx=1920&cy=1080&chk=v1_c338440b96ab10dd37ff,Hasna_Haris,"Mawanella, Sri Lanka",,5,Missing,"one of the best aquarium and birds park. largest number of fishes. under the fish name written explanation of that fish or something. I went there after two years lots of changes, birds park fully opened there is lots of birds items. I went there on Saturday so much of rush of people, so avoid going on weekends. ticket price for adults for 320LKR for Sri Lankan (270LKR for Aquarium 50LKR for Birds) best place for kids and adults because its mind relaxing can learn new things. small parking area for parking. underwater tunnel's elevator not working this time don't know why. there is lots of birds there white peacocks and regular peacocks different verity of birds etc. sounds of birds and sounds of water mesmerizing.","January 28, 2022",0.0,0.0
https://www.tripadvisor.com/Attraction_Review-g3595837-d3613552-Reviews-Water_World_Lanka-Kelaniya_Western_Province.html,Water World Lanka,4.0,85,https://dynamic-media-cdn.tripadvisor.com/media/photo-o/29/12/2b/91/caption.jpg?w=200&h=200&s=1&cx=1920&cy=1080&chk=v1_c338440b96ab10dd37ff,dessertholiday,44 contributions,,5,Missing,"There are a large number of beautiful sea creatures to admire in this aquarium plus some exotic birds.  If you plan to go to the piranha feeding you should be on time since they only feed them what looks like one chicken leg. This place was more extensive then I expected it to be and we spent an enjoyable couple of hours here. The kiosk has reasonably priced food too. The main complaint is that the exhibits often bear no resemblance to what is on the sign for the tank. Though on the plus side almost all have an english description. Tourist prices are less then 3x local price, so almost a bargain ;)","January 17, 2020",0.0,0.0
https://www.tripadvisor.com/Attraction_Review-g3595837-d3613552-Reviews-Water_World_Lanka-Kelaniya_Western_Province.html,Water World Lanka,4.0,85,https://dynamic-media-cdn.tripadvisor.com/media/photo-o/29/12/2b/91/caption.jpg?w=200&h=200&s=1&cx=1920&cy=1080&chk=v1_c338440b96ab10dd37ff,Adventure570924,"Newport, Australia",,5,Friends,"Amazing creatures, great music, great sound, interesting descriptions. Don't miss Zungaro fish, play with electric catfish, hand feed the poi.","January 9, 2020",0.0,0.0
https://www.tripadvisor.com/Attraction_Review-g3595837-d3613552-Reviews-Water_World_Lanka-Kelaniya_Western_Province.html,Water World Lanka,4.0,85,https://dynamic-media-cdn.tripadvisor.com/media/photo-o/29/12/2b/91/caption.jpg?w=200&h=200&s=1&cx=1920&cy=1080&chk=v1_c338440b96ab10dd37ff,Ruwanthi Ananda,"Colombo, Sri Lanka",,4,Missing,"It's an amazing aquarium, complete with an underwater tunnel. The prices for adult is LKR 350, children above 3, LKR 120.( not really a tourist attraction) We went on a poya day, around midday so it was relatively crowded, and hot. It was  still quite enjoyable. I would recommend to take water and a snack if going with young kids, but they have a shops that sells fast food(noodles, fried rice) n chips,ice cream,drinks etc. It also has a bird park n a play ground. Parking can be difficult on a crowded day, had to park roadside. Takes about 2-3hrs to enjoy the park.","November 13, 2019",0.0,0.0
https://www.tripadvisor.com/Attraction_Review-g3595837-d3613552-Reviews-Water_World_Lanka-Kelaniya_Western_Province.html,Water World Lanka,4.0,85,https://dynamic-media-cdn.tripadvisor.com/media/photo-o/29/12/2b/91/caption.jpg?w=200&h=200&s=1&cx=1920&cy=1080&chk=v1_c338440b96ab10dd37ff,Hari N,"Colombo, Sri Lanka",,4,Missing,"Second place other than national Zoo of Sri  Lanka which has various species of fishes and Birds. Major attention given to Fishes and you can see some rare types too. Specially the first under water tunnel in South Asia and Sri Lanka is an amazing stuff. Though it was a small distance, but allowed Sri Lankan’s experience the underwater tunnel in an affordable rate. Overall if you time to spend or think to take your kid somewhere better place. Nearly spend about 3 hours... Tickets range for locals Rs. 320/- And nearly Rs.800 for foreigners....","September 15, 2019",0.0,0.0
https://www.tripadvisor.com/Attraction_Review-g3595837-d3613552-Reviews-Water_World_Lanka-Kelaniya_Western_Province.html,Water World Lanka,4.0,85,https://dynamic-media-cdn.tripadvisor.com/media/photo-o/29/12/2b/91/caption.jpg?w=200&h=200&s=1&cx=1920&cy=1080&chk=v1_c338440b96ab10dd37ff,Imesh G,"Kiribathgoda, Sri Lanka",,5,Couples,has developed a lot since the beginning. Hope its grows much bigger. good place to spend time with friends.,"September 13, 2019",0.0,0.0
https://www.tripadvisor.com/Attraction_Review-g3595837-d3613552-Reviews-Water_World_Lanka-Kelaniya_Western_Province.html,Water World Lanka,4.0,85,https://dynamic-media-cdn.tripadvisor.com/media/photo-o/29/12/2b/91/caption.jpg?w=200&h=200&s=1&cx=1920&cy=1080&chk=v1_c338440b96ab10dd37ff,oshanth,"Brampton, Canada",,4,Missing,Interesting place to visit. They have a good collection of fish from different parts of the world from the Amazon etc. Minimum of 2 hrs required. Good for both adults and children and a short drive from Colombo. There is an added section to see different species of birds including Canada Geese.,"July 11, 2019",0.0,0.0
https://www.tripadvisor.com/Attraction_Review-g3595837-d3613552-Reviews-Water_World_Lanka-Kelaniya_Western_Province.html,Water World Lanka,4.0,85,https://dynamic-media-cdn.tripadvisor.com/media/photo-o/29/12/2b/91/caption.jpg?w=200&h=200&s=1&cx=1920&cy=1080&chk=v1_c338440b96ab10dd37ff,Jiffry,"Colombo, Sri Lanka",,5,Missing,This place has a wide range of fishes and a bird park as well. You also have the opportunity to go into a underwater tunnel and see them feeding the fish. They also have a bird park which  we could not go due to heavy rain. So it a advisable to see the weather before you go if you want to see both. On some days they have where they will let you feed big Koi fish,"May 7, 2019",0.0,0.0
https://www.tripadvisor.com/Attraction_Review-g3595837-d3613552-Reviews-Water_World_Lanka-Kelaniya_Western_Province.html,Water World Lanka,4.0,85,https://dynamic-media-cdn.tripadvisor.com/media/photo-o/29/12/2b/91/caption.jpg?w=200&h=200&s=1&cx=1920&cy=1080&chk=v1_c338440b96ab10dd37ff,Thikeena,"Colombo, Sri Lanka",,5,Couples,"very attractive spot in Kelaniya,various fish types can see,very interesting to go with kids,mind relaxing with fish watching,beautiful fish are there,very much colourfull,feel amazing about the  nature creations,","April 29, 2019",0.0,0.0
https://www.tripadvisor.com/Attraction_Review-g3595837-d3613552-Reviews-Water_World_Lanka-Kelaniya_Western_Province.html,Water World Lanka,4.0,85,https://dynamic-media-cdn.tripadvisor.com/media/photo-o/29/12/2b/91/caption.jpg?w=200&h=200&s=1&cx=1920&cy=1080&chk=v1_c338440b96ab10dd37ff,rush thierry,1 contribution,,5,Couples,Great place to visit.most of the species are genuine. Species inherent to sri Lanka are there.also foreign species.,"April 25, 2019",0.0,0.0
https://www.tripadvisor.com/Attraction_Review-g3595837-d3613552-Reviews-Water_World_Lanka-Kelaniya_Western_Province.html,Water World Lanka,4.0,85,https://dynamic-media-cdn.tripadvisor.com/media/photo-o/29/12/2b/91/caption.jpg?w=200&h=200&s=1&cx=1920&cy=1080&chk=v1_c338440b96ab10dd37ff,Eranga,"Galway, Ireland",,3,Missing,What an experience leaned a lot.. as a fish lover there are so many different  rare fish and coral exhibits on display and well kept clean and well maintain tanks and bird cages lots of space well educated notes taking helpful staff Highly recommend for students who interested in Marine biology and of course fish lovers 👍😍,"April 20, 2019",0.0,0.0
https://www.tripadvisor.com/Attraction_Review-g3595837-d3613552-Reviews-Water_World_Lanka-Kelaniya_Western_Province.html,Water World Lanka,4.0,85,https://dynamic-media-cdn.tripadvisor.com/media/photo-o/29/12/2b/91/caption.jpg?w=200&h=200&s=1&cx=1920&cy=1080&chk=v1_c338440b96ab10dd37ff,thejan kodi,"Thalawathugoda, Sri Lanka",,3,Missing,I didnt expect it to be such a big park and to see such large number of fish and bird varieties there and from that point the park is fantastic to spend time. It cost Rs. 320 for adult and Rs. 220 for kid aged 3-11 years. It took 3 hr to 3.5 hrs to complete the experience and my kids were very happy. The place is not maintained properly. I feel fish tanks were not cleaned properly as the water quality of some of the tanks were very poor. The place need a upgrade immediately.,"March 12, 2019",0.0,0.0
https://www.tripadvisor.com/Attraction_Review-g3595837-d3613552-Reviews-Water_World_Lanka-Kelaniya_Western_Province.html,Water World Lanka,4.0,85,https://dynamic-media-cdn.tripadvisor.com/media/photo-o/29/12/2b/91/caption.jpg?w=200&h=200&s=1&cx=1920&cy=1080&chk=v1_c338440b96ab10dd37ff,Gayan Priyanatha,"Stockholm, Sweden",,4,Missing,"lovly palce to vist with your kids to learn about fish variations, nicely exhibited ans arranged. It will take more than 4hrs to complete the tour, Take your time and enjoy!","February 13, 2019",0.0,0.0
https://www.tripadvisor.com/Attraction_Review-g3595837-d3613552-Reviews-Water_World_Lanka-Kelaniya_Western_Province.html,Water World Lanka,4.0,85,https://dynamic-media-cdn.tripadvisor.com/media/photo-o/29/12/2b/91/caption.jpg?w=200&h=200&s=1&cx=1920&cy=1080&chk=v1_c338440b96ab10dd37ff,Muditha J,"Colombo, Sri Lanka",,4,Friends,This place is located near by Kelaniya Temple. This place has Aquarium and Bird Park. There are different types of fish categories are available at here. I was wondering about the variety of it. Very good and somewhat maintain well. I recommend you to visit there.,"January 11, 2019",0.0,0.0
https://www.tripadvisor.com/Attraction_Review-g3595837-d3613552-Reviews-Water_World_Lanka-Kelaniya_Western_Province.html,Water World Lanka,4.0,85,https://dynamic-media-cdn.tripadvisor.com/media/photo-o/29/12/2b/91/caption.jpg?w=200&h=200&s=1&cx=1920&cy=1080&chk=v1_c338440b96ab10dd37ff,mountain_standard,"Anaconda, Montana",,5,Missing,"Water World Lanka was fantastic. The number of tanks alone is staggering, and the fish are in good shape, and (usually) quite a bit more mature than most other aquariums we have visited. Most of the exhibits are in tunnels, well shielded from the hot sun. A couple notes: 1.) Like most such attractions we ran into in Sri Lanka, there is no place really to eat here. There is a small snack bar, but the fare is pretty limited.  2.) There is no wifi... anywhere.  3.) Be sure to have a ride back, especially if you are staying in Colombo. There are plenty of tuk tuks, and a bus depot accross the street, but we had difficulty finding a way back to our hotel. Thankfully we found a friendly gentlemen willing to help us out.","August 8, 2018",0.0,0.0
https://www.tripadvisor.com/Attraction_Review-g3595837-d3613552-Reviews-Water_World_Lanka-Kelaniya_Western_Province.html,Water World Lanka,4.0,85,https://dynamic-media-cdn.tripadvisor.com/media/photo-o/29/12/2b/91/caption.jpg?w=200&h=200&s=1&cx=1920&cy=1080&chk=v1_c338440b96ab10dd37ff,vikram araveni,"Colombo, Sri Lanka",,3,Missing,Best collections from amazon river and other good collections also. Tunnel Aquarium is at expected level.,"August 8, 2018",0.0,0.0
https://www.tripadvisor.com/Attraction_Review-g3595837-d3613552-Reviews-Water_World_Lanka-Kelaniya_Western_Province.html,Water World Lanka,4.0,85,https://dynamic-media-cdn.tripadvisor.com/media/photo-o/29/12/2b/91/caption.jpg?w=200&h=200&s=1&cx=1920&cy=1080&chk=v1_c338440b96ab10dd37ff,josemon g,"Kochi (Cochin), India",,3,Missing,Good place for kids and also if you like to know about various species of fish and birds.Double the rate (LKR.600/-) if you are a foreigner.,"May 29, 2018",0.0,0.0
https://www.tripadvisor.com/Attraction_Review-g3595837-d3613552-Reviews-Water_World_Lanka-Kelaniya_Western_Province.html,Water World Lanka,4.0,85,https://dynamic-media-cdn.tripadvisor.com/media/photo-o/29/12/2b/91/caption.jpg?w=200&h=200&s=1&cx=1920&cy=1080&chk=v1_c338440b96ab10dd37ff,Charitha Waravita,Sri Lanka,,5,Missing,I went there with my family and it was a great Experience. Clean environment and worth for every penny spent. Internal cafe Was also good enough. Really recommend it to any local or tourists. Cheers !!! 😊🤓💞,"April 15, 2018",0.0,0.0
https://www.tripadvisor.com/Attraction_Review-g3595837-d3613552-Reviews-Water_World_Lanka-Kelaniya_Western_Province.html,Water World Lanka,4.0,85,https://dynamic-media-cdn.tripadvisor.com/media/photo-o/29/12/2b/91/caption.jpg?w=200&h=200&s=1&cx=1920&cy=1080&chk=v1_c338440b96ab10dd37ff,Rasika Samantha,"Malabe, Sri Lanka",,5,Couples,We visited last month and enjoy and study in world and Sri Lanka fish birds . thanks for water world this project very well adults and children . for we are lucky Sri Lanka people s in the world.,"February 18, 2018",0.0,0.0
https://www.tripadvisor.com/Attraction_Review-g3595837-d3613552-Reviews-Water_World_Lanka-Kelaniya_Western_Province.html,Water World Lanka,4.0,85,https://dynamic-media-cdn.tripadvisor.com/media/photo-o/29/12/2b/91/caption.jpg?w=200&h=200&s=1&cx=1920&cy=1080&chk=v1_c338440b96ab10dd37ff,Sri Shan,"Victoria, Australia",,4,Missing,"It was a very good experience to watch the sea life in sri lanka . Entrance prices are cheap and can spent 2-3 hours. Few things to improve , such as clean toilets and good cafeteria.","January 28, 2018",0.0,0.0
