Destination URL,Destination Title,Destination Score,Total Reviews (Destination),Destination Image,Reviewer Name,Reviewer Location,Review Title,Review Score,Reviewer Category,Review Text,Written Date,Family %,Couples %,Solo %,Business %,Friends %,Missing %
https://www.tripadvisor.com/Attraction_Review-g304135-d7312819-Reviews-Jaffna_Public_Library-Jaffna_Northern_Province.html,Jaffna Public Library,3.7,216,https://dynamic-media-cdn.tripadvisor.com/media/photo-o/1c/86/bb/04/jaffna-public-library.jpg?w=700&h=400&s=1,Pete's Travelling Pans,"Melbourne, Australia",,3,Couples,"Architecturally a significant building with lovely laid out gardens. If you are visiting this place do yourselves a favour and avoid the frustration of being turned away from seeing anything but the corridors inside the building! Visiting Hours are limited to a couple in the evenings. It is clear that the staff here see visitors as an annoyance, they will not answer any questions and will simply walk away. There are signs everywhere that say 'Visitors Not allowed'. Best to take a couple of photos from the outside and move on.","August 9, 2017",0.0,25.66844919786097,13.903743315508022,2.13903743315508,20.32085561497326,37.96791443850268
https://www.tripadvisor.com/Attraction_Review-g304135-d7312819-Reviews-Jaffna_Public_Library-Jaffna_Northern_Province.html,Jaffna Public Library,3.7,216,https://dynamic-media-cdn.tripadvisor.com/media/photo-o/1c/86/bb/04/jaffna-public-library.jpg?w=700&h=400&s=1,Louderthanbomb,"Spring Lake, New Jersey",,3,Missing,The exterior looks a lot better than the interior. There is really nothing to see here. It is a good place walk around after visiting the fort. But definitely not a can't-miss attraction.,"August 7, 2017",0.0,25.66844919786097,13.903743315508022,2.13903743315508,20.32085561497326,37.96791443850268
https://www.tripadvisor.com/Attraction_Review-g304135-d7312819-Reviews-Jaffna_Public_Library-Jaffna_Northern_Province.html,Jaffna Public Library,3.7,216,https://dynamic-media-cdn.tripadvisor.com/media/photo-o/1c/86/bb/04/jaffna-public-library.jpg?w=700&h=400&s=1,babwara78,"Ixelles, Belgium",,3,Friends,"We have been told by the hotel owner to go there and we did. More than the building itself, it is observing the Which is pretty interesting!","August 7, 2017",0.0,25.66844919786097,13.903743315508022,2.13903743315508,20.32085561497326,37.96791443850268
https://www.tripadvisor.com/Attraction_Review-g304135-d7312819-Reviews-Jaffna_Public_Library-Jaffna_Northern_Province.html,Jaffna Public Library,3.7,216,https://dynamic-media-cdn.tripadvisor.com/media/photo-o/1c/86/bb/04/jaffna-public-library.jpg?w=700&h=400&s=1,Annasdotter,"Gothenburg, Sweden",,3,Couples,As tourists/visitors are not permitted to enter you only to see the library sections from the desk at the entrance. There are som interesting photos from the days of the blast of the place. Do take a stroll around the buildning to enjoy the architecture and the garden. Have a snack/ drink/ meal from the library restaurant before leaving,"July 20, 2017",0.0,25.66844919786097,13.903743315508022,2.13903743315508,20.32085561497326,37.96791443850268
https://www.tripadvisor.com/Attraction_Review-g304135-d7312819-Reviews-Jaffna_Public_Library-Jaffna_Northern_Province.html,Jaffna Public Library,3.7,216,https://dynamic-media-cdn.tripadvisor.com/media/photo-o/1c/86/bb/04/jaffna-public-library.jpg?w=700&h=400&s=1,DinaliJoaeph,6 contributions,,5,Friends,it's sad during d war many rare books treasures etc were burnt n distroyed. Also it's was damaged  now re buit it again.,"July 17, 2017",0.0,25.66844919786097,13.903743315508022,2.13903743315508,20.32085561497326,37.96791443850268
https://www.tripadvisor.com/Attraction_Review-g304135-d7312819-Reviews-Jaffna_Public_Library-Jaffna_Northern_Province.html,Jaffna Public Library,3.7,216,https://dynamic-media-cdn.tripadvisor.com/media/photo-o/1c/86/bb/04/jaffna-public-library.jpg?w=700&h=400&s=1,Manori W,"Colombo, Sri Lanka",,3,Business,"This was one of the biggest disappointments, as its such a hyped-up place. The visiting hours are restricted (between 4:30-6pm and you can only visit 2 small reading room areas - and everything else is closed to visitors! You might as well keep your shoes on (yes, its a library where you have to take off your shoes!!!) and look at the building from outside and save yourself the bother of going in. Not worth it at all.","July 13, 2017",0.0,25.66844919786097,13.903743315508022,2.13903743315508,20.32085561497326,37.96791443850268
https://www.tripadvisor.com/Attraction_Review-g304135-d7312819-Reviews-Jaffna_Public_Library-Jaffna_Northern_Province.html,Jaffna Public Library,3.7,216,https://dynamic-media-cdn.tripadvisor.com/media/photo-o/1c/86/bb/04/jaffna-public-library.jpg?w=700&h=400&s=1,Tony O,"Orpington, United Kingdom",,4,Solo,"I must have had a persuasive driver because I am unmistakenly a (white!) foreigner but was allowed in the library in the morning. I was able to have a good look round including a close look at the impressive array of books in the English section. There is also an Indian section recognising the close affinity between Jaffna and Southern India. The building is beautifully restored after the civil war. There were few people in the library but there was total silence and an air of learning just like I remember from English libraries in my boyhood. Nostalgia for a bygone age, a feeling of reconciliation after a bitter civil war and a building restored to its former glory all combine to make this a noteworthy place to visit and a welcome change (for me) from temple after temple. It's a great asset for local people and I could happily have browsed for half a day. It was my favourite place in Jaffna. I was privileged to have a chance to see it as a working library and it will always be difficult for the authorities to balance this with an opportunity for tourists to visit.","July 13, 2017",0.0,25.66844919786097,13.903743315508022,2.13903743315508,20.32085561497326,37.96791443850268
https://www.tripadvisor.com/Attraction_Review-g304135-d7312819-Reviews-Jaffna_Public_Library-Jaffna_Northern_Province.html,Jaffna Public Library,3.7,216,https://dynamic-media-cdn.tripadvisor.com/media/photo-o/1c/86/bb/04/jaffna-public-library.jpg?w=700&h=400&s=1,Samuel A,"Scottsdale, Arizona",,5,Missing,"The Jaffna Public Library is a tourist destination when visiting the city.  Unfortunately, it is only open after 4:00pm for foreign visitors.  Therefore, you should plan accordingly if you choose to visit.  The grounds are spectacular with an assortment of flowers adorning them.  This building was rebuilt after it was damaged during the war.","July 2, 2017",0.0,25.66844919786097,13.903743315508022,2.13903743315508,20.32085561497326,37.96791443850268
https://www.tripadvisor.com/Attraction_Review-g304135-d7312819-Reviews-Jaffna_Public_Library-Jaffna_Northern_Province.html,Jaffna Public Library,3.7,216,https://dynamic-media-cdn.tripadvisor.com/media/photo-o/1c/86/bb/04/jaffna-public-library.jpg?w=700&h=400&s=1,Jason H,40 contributions,,3,Missing,The building is nice and the grounds are pretty. Only locals are able to access the collections in the library though so don't expect to actually be able to read anything.,"June 13, 2017",0.0,25.66844919786097,13.903743315508022,2.13903743315508,20.32085561497326,37.96791443850268
https://www.tripadvisor.com/Attraction_Review-g304135-d7312819-Reviews-Jaffna_Public_Library-Jaffna_Northern_Province.html,Jaffna Public Library,3.7,216,https://dynamic-media-cdn.tripadvisor.com/media/photo-o/1c/86/bb/04/jaffna-public-library.jpg?w=700&h=400&s=1,alexwalters752017,"London, United Kingdom",,4,Solo,I spent a bit of time here in the afternoon and it's a great place to get away from the hustle and bustle of central Jaffna,"May 15, 2017",0.0,25.66844919786097,13.903743315508022,2.13903743315508,20.32085561497326,37.96791443850268
https://www.tripadvisor.com/Attraction_Review-g304135-d7312819-Reviews-Jaffna_Public_Library-Jaffna_Northern_Province.html,Jaffna Public Library,3.7,216,https://dynamic-media-cdn.tripadvisor.com/media/photo-o/1c/86/bb/04/jaffna-public-library.jpg?w=700&h=400&s=1,Nathasha u,"Bangkok, Thailand",,5,Friends,"There are visiting times from 4-6. Very close to the town- in the town itself I would say, jaffna fort, library, nallur kovil, rio ice cream all are nearby. Unfortunately they dont allow you yo walk inside the library very much! But you can read some history and get a glimpse of the inside of the building. You can spend about 30 minutes here overall.","May 7, 2017",0.0,25.66844919786097,13.903743315508022,2.13903743315508,20.32085561497326,37.96791443850268
https://www.tripadvisor.com/Attraction_Review-g304135-d7312819-Reviews-Jaffna_Public_Library-Jaffna_Northern_Province.html,Jaffna Public Library,3.7,216,https://dynamic-media-cdn.tripadvisor.com/media/photo-o/1c/86/bb/04/jaffna-public-library.jpg?w=700&h=400&s=1,Gloria575,"Hobart, Australia",,2,Couples,Visitors only allowed between 4:30 pm and 6 pm and the not actually allowed into any sections to see any books. Hardly public library more like a private members only. Gardens were nice but I would not waste my time,"April 30, 2017",0.0,25.66844919786097,13.903743315508022,2.13903743315508,20.32085561497326,37.96791443850268
https://www.tripadvisor.com/Attraction_Review-g304135-d7312819-Reviews-Jaffna_Public_Library-Jaffna_Northern_Province.html,Jaffna Public Library,3.7,216,https://dynamic-media-cdn.tripadvisor.com/media/photo-o/1c/86/bb/04/jaffna-public-library.jpg?w=700&h=400&s=1,855fabiano855,"Belem, PA",,4,Friends,"I did not entered the library, but it is a beautiful and big building between the fort and the city center. Start your visit of the city by the markets and the kovils of the city center, than go by foot to the fort (the library is in the way) to the sunset!!","April 28, 2017",0.0,25.66844919786097,13.903743315508022,2.13903743315508,20.32085561497326,37.96791443850268
https://www.tripadvisor.com/Attraction_Review-g304135-d7312819-Reviews-Jaffna_Public_Library-Jaffna_Northern_Province.html,Jaffna Public Library,3.7,216,https://dynamic-media-cdn.tripadvisor.com/media/photo-o/1c/86/bb/04/jaffna-public-library.jpg?w=700&h=400&s=1,gerdt_13,124 contributions,,4,Friends,The newest station  having also the newest tracks as recently reopened after the civil war gives you a good welcome and there is no hussle with tuktuks or taxis,"April 27, 2017",0.0,25.66844919786097,13.903743315508022,2.13903743315508,20.32085561497326,37.96791443850268
https://www.tripadvisor.com/Attraction_Review-g304135-d7312819-Reviews-Jaffna_Public_Library-Jaffna_Northern_Province.html,Jaffna Public Library,3.7,216,https://dynamic-media-cdn.tripadvisor.com/media/photo-o/1c/86/bb/04/jaffna-public-library.jpg?w=700&h=400&s=1,Shamil J,"Colombo, Sri Lanka",,5,Missing,Closed on public holidays and Poya days. You'll find the clock tower in front of the the library and the dutch fort is also few meters away from the library.,"April 21, 2017",0.0,25.66844919786097,13.903743315508022,2.13903743315508,20.32085561497326,37.96791443850268
https://www.tripadvisor.com/Attraction_Review-g304135-d7312819-Reviews-Jaffna_Public_Library-Jaffna_Northern_Province.html,Jaffna Public Library,3.7,216,https://dynamic-media-cdn.tripadvisor.com/media/photo-o/1c/86/bb/04/jaffna-public-library.jpg?w=700&h=400&s=1,Jini,"Colombo, Sri Lanka",,4,Missing,good. it is opens only for few hrs. so we missed. bad luck. for us okay. but better to open it at least for foreigners for the whole day,"March 23, 2017",0.0,25.66844919786097,13.903743315508022,2.13903743315508,20.32085561497326,37.96791443850268
https://www.tripadvisor.com/Attraction_Review-g304135-d7312819-Reviews-Jaffna_Public_Library-Jaffna_Northern_Province.html,Jaffna Public Library,3.7,216,https://dynamic-media-cdn.tripadvisor.com/media/photo-o/1c/86/bb/04/jaffna-public-library.jpg?w=700&h=400&s=1,Avi G,"Tel Aviv, Israel",,4,Couples,Very impressive little colonial building that was devastated during the civil war and is now renovated and back in use.,"March 13, 2017",0.0,25.66844919786097,13.903743315508022,2.13903743315508,20.32085561497326,37.96791443850268
https://www.tripadvisor.com/Attraction_Review-g304135-d7312819-Reviews-Jaffna_Public_Library-Jaffna_Northern_Province.html,Jaffna Public Library,3.7,216,https://dynamic-media-cdn.tripadvisor.com/media/photo-o/1c/86/bb/04/jaffna-public-library.jpg?w=700&h=400&s=1,Chummy77,"Malabe, Sri Lanka",,3,Missing,"One of the best kept libraries in this country. A one time ""best library"" of the Asian region. Well that's history. Its prim and kept in a check. One needs to remove his/her shoes to enter. That's a mark of respect and to avoid disturbance. Most of the reading areas are not accessible to visitors, and permits only members. Kind of disappointing for an avid reader though, thus the visit was a shirt spin around for exterior selfies and angle shoots. Its only a landmark for a visitor.","March 12, 2017",0.0,25.66844919786097,13.903743315508022,2.13903743315508,20.32085561497326,37.96791443850268
https://www.tripadvisor.com/Attraction_Review-g304135-d7312819-Reviews-Jaffna_Public_Library-Jaffna_Northern_Province.html,Jaffna Public Library,3.7,216,https://dynamic-media-cdn.tripadvisor.com/media/photo-o/1c/86/bb/04/jaffna-public-library.jpg?w=700&h=400&s=1,Jan W,"Glasgow, United Kingdom",,4,Couples,"The Public Library was burned down in June 1981 and is viewed as in of the defining moment of the Sri Lankan civil war.   More than 90,000 books, documents and ancient palm leaf books were destroyed.  It was viewed as aimed at the Tamil culture. The building has been rebuilt and is beautiful.  Unfortunately, it wasn't open when we visited.  It opens in the evenings only.","March 9, 2017",0.0,25.66844919786097,13.903743315508022,2.13903743315508,20.32085561497326,37.96791443850268
https://www.tripadvisor.com/Attraction_Review-g304135-d7312819-Reviews-Jaffna_Public_Library-Jaffna_Northern_Province.html,Jaffna Public Library,3.7,216,https://dynamic-media-cdn.tripadvisor.com/media/photo-o/1c/86/bb/04/jaffna-public-library.jpg?w=700&h=400&s=1,Andromachos D,"Athens, Greece",,3,Couples,"Before it was burned in the early 80's, Jaffna Library was a treasure of Tamil culture and knowledge. The modern reconstruction is a reminder of this former glory.","February 26, 2017",0.0,25.66844919786097,13.903743315508022,2.13903743315508,20.32085561497326,37.96791443850268
https://www.tripadvisor.com/Attraction_Review-g304135-d7312819-Reviews-Jaffna_Public_Library-Jaffna_Northern_Province.html,Jaffna Public Library,3.7,216,https://dynamic-media-cdn.tripadvisor.com/media/photo-o/1c/86/bb/04/jaffna-public-library.jpg?w=700&h=400&s=1,janon2011,"Jaffna, Sri Lanka",,5,Solo,"Jaffna Public Library , Sri Lanka One of Jaffna's most notable landmarks, it is run by the Jaffna Municipal Council. The library was built in 1933 and burnt in 1981. During the early 1980s, it was one of the biggest libraries in Asia, containing over 97,000 books and manuscripts.In 2001, rehabilitation of the library was completed, with new structure being built and new books received, although its old books and manuscripts were not replaced. It is Sri Lanka's second main public Library only rivaled by the Library in Colombo The building's classical lines and beautiful proportions make it stand out architecturally. It contains lush gardens and has been modernized with new facilities such as free-wifi","February 23, 2017",0.0,25.66844919786097,13.903743315508022,2.13903743315508,20.32085561497326,37.96791443850268
https://www.tripadvisor.com/Attraction_Review-g304135-d7312819-Reviews-Jaffna_Public_Library-Jaffna_Northern_Province.html,Jaffna Public Library,3.7,216,https://dynamic-media-cdn.tripadvisor.com/media/photo-o/1c/86/bb/04/jaffna-public-library.jpg?w=700&h=400&s=1,ACMarcelline,"Colombo, Sri Lanka",,4,Missing,"Visitors time is 4.30-6.30pm, But if you are solo or couple you should be able to visit the reading section and get permission to visit other areas. Please maintain silence and observe the rules. Good selection of books. Nice system. Definitely a place to see a good collection back again","February 7, 2017",0.0,25.66844919786097,13.903743315508022,2.13903743315508,20.32085561497326,37.96791443850268
https://www.tripadvisor.com/Attraction_Review-g304135-d7312819-Reviews-Jaffna_Public_Library-Jaffna_Northern_Province.html,Jaffna Public Library,3.7,216,https://dynamic-media-cdn.tripadvisor.com/media/photo-o/1c/86/bb/04/jaffna-public-library.jpg?w=700&h=400&s=1,DrHema,"Nittambuwa, Sri Lanka",,3,Missing,The library was built in 1933 and burnt in 1981. But now it's almost renovated and only picture and posters remains. I would say there is nothing much to see now. It will be only opens at 4.30pm to 6pm only,"February 3, 2017",0.0,25.66844919786097,13.903743315508022,2.13903743315508,20.32085561497326,37.96791443850268
https://www.tripadvisor.com/Attraction_Review-g304135-d7312819-Reviews-Jaffna_Public_Library-Jaffna_Northern_Province.html,Jaffna Public Library,3.7,216,https://dynamic-media-cdn.tripadvisor.com/media/photo-o/1c/86/bb/04/jaffna-public-library.jpg?w=700&h=400&s=1,ThiLi-DS,"Colombo, Sri Lanka",,5,Friends,A place filled with memories. Once known to be the largest library on the country and later burnt down by the terrorists with a lot of books to be found only in the Jaffna library. Rebuilt and back on its glory..,"January 30, 2017",0.0,25.66844919786097,13.903743315508022,2.13903743315508,20.32085561497326,37.96791443850268
https://www.tripadvisor.com/Attraction_Review-g304135-d7312819-Reviews-Jaffna_Public_Library-Jaffna_Northern_Province.html,Jaffna Public Library,3.7,216,https://dynamic-media-cdn.tripadvisor.com/media/photo-o/1c/86/bb/04/jaffna-public-library.jpg?w=700&h=400&s=1,louierh,"Paris, France",,3,Friends,"The exteriors of this building has been beautifully restored. Inside, you can see some old pictures of how the building looked like before it was damaged before the start of the civil war. It's also interesting to see locals inside the library reading books and newspapers. It's a good place to visit for half an hour.","January 28, 2017",0.0,25.66844919786097,13.903743315508022,2.13903743315508,20.32085561497326,37.96791443850268
https://www.tripadvisor.com/Attraction_Review-g304135-d7312819-Reviews-Jaffna_Public_Library-Jaffna_Northern_Province.html,Jaffna Public Library,3.7,216,https://dynamic-media-cdn.tripadvisor.com/media/photo-o/1c/86/bb/04/jaffna-public-library.jpg?w=700&h=400&s=1,Sigrun R,28 contributions,,5,Solo,"Completele gutted in 1981, it's valuable collection of books and manuscripts redused to cinders, this beautiful building has been restored and lovingly refilled with books in the years following the war. The surrounding gardens are weel-kept and beautiful. It's a quiet oasis for book-lovers, and garden-lovers alike.","January 27, 2017",0.0,25.66844919786097,13.903743315508022,2.13903743315508,20.32085561497326,37.96791443850268
https://www.tripadvisor.com/Attraction_Review-g304135-d7312819-Reviews-Jaffna_Public_Library-Jaffna_Northern_Province.html,Jaffna Public Library,3.7,216,https://dynamic-media-cdn.tripadvisor.com/media/photo-o/1c/86/bb/04/jaffna-public-library.jpg?w=700&h=400&s=1,Sharmini W,42 contributions,,5,Couples,The Jaffna library has been restored to its original architecture after the war.  It is very well looked after with great gardens and excellent view of Jaffna. You are allowed to go inside the library but required to leave your foot wear outside.  The place a great importance of learning so their way of showing respect is to walk without foot wear.  From a practical perspective this reduces the noise levels and the need for regular cleaning of the library.,"January 10, 2017",0.0,25.66844919786097,13.903743315508022,2.13903743315508,20.32085561497326,37.96791443850268
https://www.tripadvisor.com/Attraction_Review-g304135-d7312819-Reviews-Jaffna_Public_Library-Jaffna_Northern_Province.html,Jaffna Public Library,3.7,216,https://dynamic-media-cdn.tripadvisor.com/media/photo-o/1c/86/bb/04/jaffna-public-library.jpg?w=700&h=400&s=1,Sanjay H,"Sydney, Australia",,5,Missing,First of all the gardens seem like a little slice of Eden in the heat of a Jaffna mid morning. Managed to get in before the actual visiting hours which are from 4-6pm. Nice to see that the library has strict rules and study and reading are the first priority. Have to take your shoes off to enter the building. There's a fascinating mix of literature within its walls with most books quite old and providing interesting view points on their subjects. There is a reference room but requires membership to enter. Lovely grounds to stroll through and definitely would recommend a visit while you're in Jaffna,"January 6, 2017",0.0,25.66844919786097,13.903743315508022,2.13903743315508,20.32085561497326,37.96791443850268
https://www.tripadvisor.com/Attraction_Review-g304135-d7312819-Reviews-Jaffna_Public_Library-Jaffna_Northern_Province.html,Jaffna Public Library,3.7,216,https://dynamic-media-cdn.tripadvisor.com/media/photo-o/1c/86/bb/04/jaffna-public-library.jpg?w=700&h=400&s=1,regina_chan,"Penang Island, Malaysia",,4,Solo,"The library only opens after 4:30pm, so please don't go if you want to go inside to have a look. It is close either 6pm or 6:30pm.. can't remember .. It is quite a shame that most sections are not open for visitors. Everyone have to remove their shoes before entering. It is interesting to see that they seperate male and female reading rooms. Male is downstairs and female one is upstairs. No photograph is allow inside, and so can't share any photos.","January 5, 2017",0.0,25.66844919786097,13.903743315508022,2.13903743315508,20.32085561497326,37.96791443850268
https://www.tripadvisor.com/Attraction_Review-g304135-d7312819-Reviews-Jaffna_Public_Library-Jaffna_Northern_Province.html,Jaffna Public Library,3.7,216,https://dynamic-media-cdn.tripadvisor.com/media/photo-o/1c/86/bb/04/jaffna-public-library.jpg?w=700&h=400&s=1,Raaj A,8 contributions,,5,Solo,Wow.. some priceless books also in this library.. and nice place..  This library gave me a good feeling. One of the best library in sri Lanka this is. nothing else to say  anything...,"January 5, 2017",0.0,25.66844919786097,13.903743315508022,2.13903743315508,20.32085561497326,37.96791443850268
https://www.tripadvisor.com/Attraction_Review-g304135-d7312819-Reviews-Jaffna_Public_Library-Jaffna_Northern_Province.html,Jaffna Public Library,3.7,216,https://dynamic-media-cdn.tripadvisor.com/media/photo-o/1c/86/bb/04/jaffna-public-library.jpg?w=700&h=400&s=1,Konrad M,"Melbourne, Australia",,3,Solo,"The library is only open to visitors from 4.30pm to 6.00pm for free each day except public holidays and then you are only permitted to enter the reading room on the ground floor. There is not a lot to see other than a couple of photographs at the library entrance showing the damage after the library contents were burned in 1981, one of the incidents to spark the civil war. However it is a very impressive building with lovely landscaped gardens surrounding it.","January 4, 2017",0.0,25.66844919786097,13.903743315508022,2.13903743315508,20.32085561497326,37.96791443850268
https://www.tripadvisor.com/Attraction_Review-g304135-d7312819-Reviews-Jaffna_Public_Library-Jaffna_Northern_Province.html,Jaffna Public Library,3.7,216,https://dynamic-media-cdn.tripadvisor.com/media/photo-o/1c/86/bb/04/jaffna-public-library.jpg?w=700&h=400&s=1,ilokaw,127 contributions,,3,Missing,The Library is very big. However nothing much for a visitor to see as only a small section is open to public. Understand that public visiting the reading areas would disturb the users however maybe tours should be arranged with a guide when library is closed.,"January 2, 2017",0.0,25.66844919786097,13.903743315508022,2.13903743315508,20.32085561497326,37.96791443850268
https://www.tripadvisor.com/Attraction_Review-g304135-d7312819-Reviews-Jaffna_Public_Library-Jaffna_Northern_Province.html,Jaffna Public Library,3.7,216,https://dynamic-media-cdn.tripadvisor.com/media/photo-o/1c/86/bb/04/jaffna-public-library.jpg?w=700&h=400&s=1,Neville F,"Canterbury, Australia",,3,Couples,"The Jaffna Public Library is advertised as one of the sights to see in Northern Sri Lanka, During the civil war the Library which was even then one of the hallmarks of Jaffna was burnt down and now rebuilt. I had sent some books to Jaffna for the library, so I looked forward to seeing it. I went on a Sunday morning and was told it was closed, so I made an arrangement,  after a conversation with the man at the gate, to come in early the next morning. I arrived at 9am and was told that visitors were allowed only after 4pm. I explained to the only one who could speak in English that I was from Australia, and that I had an interest in seeing the complex. I still had the same reply. In the end they let me through but showed no interest in my appearance there. I did not see all of it to make any comment. I felt that I was being treated as a inconvenience to be tolerated, and so I left. If you advertise something as a tourist attraction the you should make arrangements to make sure your visitors are made welcome. I do not think I will go back there and while I wish them success I will not personally contribute.","December 31, 2016",0.0,25.66844919786097,13.903743315508022,2.13903743315508,20.32085561497326,37.96791443850268
