Destination URL,Destination Title,Destination Score,Total Reviews (Destination),Destination Image,Reviewer Name,Reviewer Location,Review Title,Review Score,Reviewer Category,Review Text,Written Date,Family %,Couples %,Solo %,Business %,Friends %,Missing %
https://www.tripadvisor.com/Attraction_Review-g304135-d7312819-Reviews-Jaffna_Public_Library-Jaffna_Northern_Province.html,Jaffna Public Library,3.7,216,https://dynamic-media-cdn.tripadvisor.com/media/photo-o/1c/86/bb/04/jaffna-public-library.jpg?w=700&h=400&s=1,Charith K,"Plumpton, Australia",,3,Couples,"Short experience as most of the library rooms are off limits for visitors. It's a shame to have had this place destroyed earlier, you can feel the enormous wealth of knowledge and history this place would have stored. Friendly staff and worth a short visit","October 17, 2018",0.0,25.66844919786097,13.903743315508022,2.13903743315508,20.32085561497326,37.96791443850268
https://www.tripadvisor.com/Attraction_Review-g304135-d7312819-Reviews-Jaffna_Public_Library-Jaffna_Northern_Province.html,Jaffna Public Library,3.7,216,https://dynamic-media-cdn.tripadvisor.com/media/photo-o/1c/86/bb/04/jaffna-public-library.jpg?w=700&h=400&s=1,Malki S,"Bentota, Sri Lanka",,1,Missing,If TripAdvisor allowed to give no stars at all this is the place for which I have used it. A complete waste of time. They do not allow you to enter any of the rooms which houses the books.not even to know what kind of books they have. You are only allowed to have a walk through the building. I was really excited to see this place as in terms of books they have this is legendary in Sri Lanka. So when we first went it wasn’t time for visitors which is from 4 p.m. to 6 p.m. So we came again at 4 because I wanted to see this place so much only to know that you are only allowed to appreciate the walls. If it is about a security reason you can keep a place guard to check at the ent of the tour. If you are not allowed to look at books what’s the point of permitting a visit. Never ever going to this place in my life.,"October 6, 2018",0.0,25.66844919786097,13.903743315508022,2.13903743315508,20.32085561497326,37.96791443850268
https://www.tripadvisor.com/Attraction_Review-g304135-d7312819-Reviews-Jaffna_Public_Library-Jaffna_Northern_Province.html,Jaffna Public Library,3.7,216,https://dynamic-media-cdn.tripadvisor.com/media/photo-o/1c/86/bb/04/jaffna-public-library.jpg?w=700&h=400&s=1,lakshansilva,"Nelson, New Zealand",,4,Missing,This is a beautiful white building near the Jaffna fort. Known to be the biggest library in Asia in past. destroyed in 1980/1 due to the civil war. Visitors are not allowed to use books though.,"September 25, 2018",0.0,25.66844919786097,13.903743315508022,2.13903743315508,20.32085561497326,37.96791443850268
https://www.tripadvisor.com/Attraction_Review-g304135-d7312819-Reviews-Jaffna_Public_Library-Jaffna_Northern_Province.html,Jaffna Public Library,3.7,216,https://dynamic-media-cdn.tripadvisor.com/media/photo-o/1c/86/bb/04/jaffna-public-library.jpg?w=700&h=400&s=1,Polina-Maria-Veronika,33 contributions,,5,Missing,"The biggest library in Sri Lanka surrounded by a beautiful garden is located very close to the Jaffna clock tower, the tall white column and the police station on the way to Jaffna Fort. The library looks like a newly renovated building.","September 3, 2018",0.0,25.66844919786097,13.903743315508022,2.13903743315508,20.32085561497326,37.96791443850268
https://www.tripadvisor.com/Attraction_Review-g304135-d7312819-Reviews-Jaffna_Public_Library-Jaffna_Northern_Province.html,Jaffna Public Library,3.7,216,https://dynamic-media-cdn.tripadvisor.com/media/photo-o/1c/86/bb/04/jaffna-public-library.jpg?w=700&h=400&s=1,007vignes,"Kuala Lumpur, Malaysia",,5,Missing,one of the most popular library in Asia. Consider World well known library. Must visit in Sri Lanka. Full of knowledge,"August 19, 2018",0.0,25.66844919786097,13.903743315508022,2.13903743315508,20.32085561497326,37.96791443850268
https://www.tripadvisor.com/Attraction_Review-g304135-d7312819-Reviews-Jaffna_Public_Library-Jaffna_Northern_Province.html,Jaffna Public Library,3.7,216,https://dynamic-media-cdn.tripadvisor.com/media/photo-o/1c/86/bb/04/jaffna-public-library.jpg?w=700&h=400&s=1,the_finchley_lees,"London, United Kingdom",,3,Missing,"Worth a visit to see something of local culture at play. No women in periodical reading room, tourists not allowed anywhere Toilet floors swimming in water abd no taps working 4 security men at entrance Did look nice if allowed in","August 17, 2018",0.0,25.66844919786097,13.903743315508022,2.13903743315508,20.32085561497326,37.96791443850268
https://www.tripadvisor.com/Attraction_Review-g304135-d7312819-Reviews-Jaffna_Public_Library-Jaffna_Northern_Province.html,Jaffna Public Library,3.7,216,https://dynamic-media-cdn.tripadvisor.com/media/photo-o/1c/86/bb/04/jaffna-public-library.jpg?w=700&h=400&s=1,guillermo_calvino,"Paris, France",,2,Solo,"Nice building, well renovated but poor content: you can just walk into a few corridors and cannot enter departments: you will not see much not see many explanations. But important historical place in Jaffna.","August 17, 2018",0.0,25.66844919786097,13.903743315508022,2.13903743315508,20.32085561497326,37.96791443850268
https://www.tripadvisor.com/Attraction_Review-g304135-d7312819-Reviews-Jaffna_Public_Library-Jaffna_Northern_Province.html,Jaffna Public Library,3.7,216,https://dynamic-media-cdn.tripadvisor.com/media/photo-o/1c/86/bb/04/jaffna-public-library.jpg?w=700&h=400&s=1,Ishak Nazim,"Kalutara, Sri Lanka",,5,Business,open from 9am to 17hrs.Entrance is free of charge.we find the all the books.there are two areas.Indian and sri lankan section.photographs not allowed inside the library,"August 10, 2018",0.0,25.66844919786097,13.903743315508022,2.13903743315508,20.32085561497326,37.96791443850268
https://www.tripadvisor.com/Attraction_Review-g304135-d7312819-Reviews-Jaffna_Public_Library-Jaffna_Northern_Province.html,Jaffna Public Library,3.7,216,https://dynamic-media-cdn.tripadvisor.com/media/photo-o/1c/86/bb/04/jaffna-public-library.jpg?w=700&h=400&s=1,Vachintha Piyadasa,"Colombo, Sri Lanka",,5,Friends,"This is one of Jaffna‘s most prominent landmarks. The library was built in 1933 and got destroyed in 1981 during the civil war. This was known to be one of the largest libraries in Asia back in 1980's that had around 100,000 books and other relevant material. After the destruction that took place in the 80's, it was renovated in 2001 and today, it is the second main public library in the island.","August 9, 2018",0.0,25.66844919786097,13.903743315508022,2.13903743315508,20.32085561497326,37.96791443850268
https://www.tripadvisor.com/Attraction_Review-g304135-d7312819-Reviews-Jaffna_Public_Library-Jaffna_Northern_Province.html,Jaffna Public Library,3.7,216,https://dynamic-media-cdn.tripadvisor.com/media/photo-o/1c/86/bb/04/jaffna-public-library.jpg?w=700&h=400&s=1,Akila P,72 contributions,,5,Missing,"It was funtastic experience visiting the library, saw how the micro film reader works, yazh, india corner...must visit place .very quite and people are getting benefitted...","August 7, 2018",0.0,25.66844919786097,13.903743315508022,2.13903743315508,20.32085561497326,37.96791443850268
https://www.tripadvisor.com/Attraction_Review-g304135-d7312819-Reviews-Jaffna_Public_Library-Jaffna_Northern_Province.html,Jaffna Public Library,3.7,216,https://dynamic-media-cdn.tripadvisor.com/media/photo-o/1c/86/bb/04/jaffna-public-library.jpg?w=700&h=400&s=1,Balaji J,"Sharjah, United Arab Emirates",,4,Business,We visited this place since we had time to kill. Did not undertake a tour of the premises but spent the time reading. They have the entire range of local newspapers to read. Also magazines. They are open to public for reading only from 4.30 to 6.30 p.m. This could have been for a longer duration or the whole day. The library is located in a beautiful campus.,"July 19, 2018",0.0,25.66844919786097,13.903743315508022,2.13903743315508,20.32085561497326,37.96791443850268
https://www.tripadvisor.com/Attraction_Review-g304135-d7312819-Reviews-Jaffna_Public_Library-Jaffna_Northern_Province.html,Jaffna Public Library,3.7,216,https://dynamic-media-cdn.tripadvisor.com/media/photo-o/1c/86/bb/04/jaffna-public-library.jpg?w=700&h=400&s=1,Lisa S,"San Francisco, California",,1,Couples,Unfriendly staff. Limited rooms for tourists to visit. Not very public at all. Not worth going inside.,"July 15, 2018",0.0,25.66844919786097,13.903743315508022,2.13903743315508,20.32085561497326,37.96791443850268
https://www.tripadvisor.com/Attraction_Review-g304135-d7312819-Reviews-Jaffna_Public_Library-Jaffna_Northern_Province.html,Jaffna Public Library,3.7,216,https://dynamic-media-cdn.tripadvisor.com/media/photo-o/1c/86/bb/04/jaffna-public-library.jpg?w=700&h=400&s=1,ricshanshibly1986,"Jeddah, Saudi Arabia",,4,Missing,Jaffna public Library is Sri Lanka's prominent and biggest library. Before the war there were many books and once it was south asia's biggest library as well. Public can visit inside. Photos and videos not allowed. Two stories building. must visit place in Jaffna,"July 14, 2018",0.0,25.66844919786097,13.903743315508022,2.13903743315508,20.32085561497326,37.96791443850268
https://www.tripadvisor.com/Attraction_Review-g304135-d7312819-Reviews-Jaffna_Public_Library-Jaffna_Northern_Province.html,Jaffna Public Library,3.7,216,https://dynamic-media-cdn.tripadvisor.com/media/photo-o/1c/86/bb/04/jaffna-public-library.jpg?w=700&h=400&s=1,faarazri,"Colombo, Sri Lanka",,5,Missing,this a public library and visitors only can visit 04.30 pm - 06.30 pm Mondays library is closed and please avoid on Mondays,"July 12, 2018",0.0,25.66844919786097,13.903743315508022,2.13903743315508,20.32085561497326,37.96791443850268
https://www.tripadvisor.com/Attraction_Review-g304135-d7312819-Reviews-Jaffna_Public_Library-Jaffna_Northern_Province.html,Jaffna Public Library,3.7,216,https://dynamic-media-cdn.tripadvisor.com/media/photo-o/1c/86/bb/04/jaffna-public-library.jpg?w=700&h=400&s=1,arinds,"Noida, India",,4,Solo,I was not allowed inside as it was a holiday that day. But from he outside i can make out that it must be a nice place inside too.,"June 9, 2018",0.0,25.66844919786097,13.903743315508022,2.13903743315508,20.32085561497326,37.96791443850268
https://www.tripadvisor.com/Attraction_Review-g304135-d7312819-Reviews-Jaffna_Public_Library-Jaffna_Northern_Province.html,Jaffna Public Library,3.7,216,https://dynamic-media-cdn.tripadvisor.com/media/photo-o/1c/86/bb/04/jaffna-public-library.jpg?w=700&h=400&s=1,AnudeSilva,"Christchurch, New Zealand",,5,Missing,Just went there for taking photos and couldn't visit inside. It is a nice building and must visit if you travel to Jaffna.,"June 4, 2018",0.0,25.66844919786097,13.903743315508022,2.13903743315508,20.32085561497326,37.96791443850268
https://www.tripadvisor.com/Attraction_Review-g304135-d7312819-Reviews-Jaffna_Public_Library-Jaffna_Northern_Province.html,Jaffna Public Library,3.7,216,https://dynamic-media-cdn.tripadvisor.com/media/photo-o/1c/86/bb/04/jaffna-public-library.jpg?w=700&h=400&s=1,Kenneth S,"Mirissa, Sri Lanka",,3,Missing,Mostly famous within Sri Lanka. The place could be easily visited along with the other attractions in Jaffna.,"May 2, 2018",0.0,25.66844919786097,13.903743315508022,2.13903743315508,20.32085561497326,37.96791443850268
https://www.tripadvisor.com/Attraction_Review-g304135-d7312819-Reviews-Jaffna_Public_Library-Jaffna_Northern_Province.html,Jaffna Public Library,3.7,216,https://dynamic-media-cdn.tripadvisor.com/media/photo-o/1c/86/bb/04/jaffna-public-library.jpg?w=700&h=400&s=1,SimonDabbs,"Melksham, United Kingdom",,4,Friends,"We were unable to enter the building, because foreigners may visit only from 4.30pm. But it was a joy to behold from the gate, surrounded, as it is, by beautiful trees and gardens. And of course, in a sense it is a symbol of peace.","April 14, 2018",0.0,25.66844919786097,13.903743315508022,2.13903743315508,20.32085561497326,37.96791443850268
https://www.tripadvisor.com/Attraction_Review-g304135-d7312819-Reviews-Jaffna_Public_Library-Jaffna_Northern_Province.html,Jaffna Public Library,3.7,216,https://dynamic-media-cdn.tripadvisor.com/media/photo-o/1c/86/bb/04/jaffna-public-library.jpg?w=700&h=400&s=1,shamirr_13,"Tel Aviv, Israel",,5,Couples,This place is a must for all those wishing to learn war about the origin and history of the ethnic conflict.,"April 6, 2018",0.0,25.66844919786097,13.903743315508022,2.13903743315508,20.32085561497326,37.96791443850268
https://www.tripadvisor.com/Attraction_Review-g304135-d7312819-Reviews-Jaffna_Public_Library-Jaffna_Northern_Province.html,Jaffna Public Library,3.7,216,https://dynamic-media-cdn.tripadvisor.com/media/photo-o/1c/86/bb/04/jaffna-public-library.jpg?w=700&h=400&s=1,JeffreyB,"London, United Kingdom",,4,Solo,"Re-built in 2002, this is a wonderful white building housing the new library whose books were destroyed","April 6, 2018",0.0,25.66844919786097,13.903743315508022,2.13903743315508,20.32085561497326,37.96791443850268
https://www.tripadvisor.com/Attraction_Review-g304135-d7312819-Reviews-Jaffna_Public_Library-Jaffna_Northern_Province.html,Jaffna Public Library,3.7,216,https://dynamic-media-cdn.tripadvisor.com/media/photo-o/1c/86/bb/04/jaffna-public-library.jpg?w=700&h=400&s=1,tommymacaus,"Melbourne, Australia",,3,Couples,"We tried to visit when we first arrived in Jaffna but discovered it doesn't open to foreign visitors until 4:30pm. We came back a couple of days later and when we went inside discovered that we could only walk through the hallways - all the actual rooms in the library are off limits to foreigners. You can't take photos, there are no information signs or guides - there really isn't much to do. It's a shame as this library plays a big part in Sri Lanka's history and could be a really interesting attraction - perhaps it is still a little early after the war.","March 26, 2018",0.0,25.66844919786097,13.903743315508022,2.13903743315508,20.32085561497326,37.96791443850268
https://www.tripadvisor.com/Attraction_Review-g304135-d7312819-Reviews-Jaffna_Public_Library-Jaffna_Northern_Province.html,Jaffna Public Library,3.7,216,https://dynamic-media-cdn.tripadvisor.com/media/photo-o/1c/86/bb/04/jaffna-public-library.jpg?w=700&h=400&s=1,PUTNEYBIKER,"London, United Kingdom",,3,Solo,Non locals discouraged from entering but I suppose there is a couple of casual photo snaps of you are wandering past. Could be so much better.,"March 24, 2018",0.0,25.66844919786097,13.903743315508022,2.13903743315508,20.32085561497326,37.96791443850268
https://www.tripadvisor.com/Attraction_Review-g304135-d7312819-Reviews-Jaffna_Public_Library-Jaffna_Northern_Province.html,Jaffna Public Library,3.7,216,https://dynamic-media-cdn.tripadvisor.com/media/photo-o/1c/86/bb/04/jaffna-public-library.jpg?w=700&h=400&s=1,BhaarathPhotography,"Chennai (Madras), India",,5,Friends,It's really a most wonderful place in Jaffana (Srilanka). One of the famous library in the world. Very rare and vaulable book you can read here.,"March 18, 2018",0.0,25.66844919786097,13.903743315508022,2.13903743315508,20.32085561497326,37.96791443850268
https://www.tripadvisor.com/Attraction_Review-g304135-d7312819-Reviews-Jaffna_Public_Library-Jaffna_Northern_Province.html,Jaffna Public Library,3.7,216,https://dynamic-media-cdn.tripadvisor.com/media/photo-o/1c/86/bb/04/jaffna-public-library.jpg?w=700&h=400&s=1,Kirtidodiedo,"Telangana, India",,2,Couples,"All the sections are closed to visitors, so you can only admire the building facade, walk the corridors and see closed doors What is interesting is the statue of Goddess Saraswati - the Hindu Goddess of learning at the front Avoidable","March 2, 2018",0.0,25.66844919786097,13.903743315508022,2.13903743315508,20.32085561497326,37.96791443850268
https://www.tripadvisor.com/Attraction_Review-g304135-d7312819-Reviews-Jaffna_Public_Library-Jaffna_Northern_Province.html,Jaffna Public Library,3.7,216,https://dynamic-media-cdn.tripadvisor.com/media/photo-o/1c/86/bb/04/jaffna-public-library.jpg?w=700&h=400&s=1,Asanka F,Qatar,,2,Friends,It only has historical legacy nothing much to see in present days. Make a visit in your half day city tours in Jaffna city. Can cover this max in 30 min upon arrival to library,"February 10, 2018",0.0,25.66844919786097,13.903743315508022,2.13903743315508,20.32085561497326,37.96791443850268
https://www.tripadvisor.com/Attraction_Review-g304135-d7312819-Reviews-Jaffna_Public_Library-Jaffna_Northern_Province.html,Jaffna Public Library,3.7,216,https://dynamic-media-cdn.tripadvisor.com/media/photo-o/1c/86/bb/04/jaffna-public-library.jpg?w=700&h=400&s=1,dogadoga,"Ispra, Italy",,2,Couples,"First we came on a wrong day, then on a right day it was at a wrong hour. Then we came at 15:30 and it turned out that it opens at 16:00. Anyway, we waited and went in. Most of the halls were off-limits and could not be entered by us. There was hardly anything else to see except some corridors and insight into halls, and, of course, some pictures from the terrible fire during war times. I feel sorry to give such a poor remark and I feel sorry for what has happened to this building in the past. But if they responsible people from now want that this building is admired by the general public, they should also open it (more) to the public.","January 11, 2018",0.0,25.66844919786097,13.903743315508022,2.13903743315508,20.32085561497326,37.96791443850268
https://www.tripadvisor.com/Attraction_Review-g304135-d7312819-Reviews-Jaffna_Public_Library-Jaffna_Northern_Province.html,Jaffna Public Library,3.7,216,https://dynamic-media-cdn.tripadvisor.com/media/photo-o/1c/86/bb/04/jaffna-public-library.jpg?w=700&h=400&s=1,Wijay,"England, United Kingdom",,3,Missing,"I visited this library after a long time and it is good to see it is functional again. Not sure the quality of the books though. Please not, you need to remove your foot wear before you enter the building.","January 10, 2018",0.0,25.66844919786097,13.903743315508022,2.13903743315508,20.32085561497326,37.96791443850268
https://www.tripadvisor.com/Attraction_Review-g304135-d7312819-Reviews-Jaffna_Public_Library-Jaffna_Northern_Province.html,Jaffna Public Library,3.7,216,https://dynamic-media-cdn.tripadvisor.com/media/photo-o/1c/86/bb/04/jaffna-public-library.jpg?w=700&h=400&s=1,Eliya Devan,"Gosford, Australia",,3,Missing,Did not get to visit inside since the break time is between 1 to 4 which was a travesty because we went at 330,"January 9, 2018",0.0,25.66844919786097,13.903743315508022,2.13903743315508,20.32085561497326,37.96791443850268
https://www.tripadvisor.com/Attraction_Review-g304135-d7312819-Reviews-Jaffna_Public_Library-Jaffna_Northern_Province.html,Jaffna Public Library,3.7,216,https://dynamic-media-cdn.tripadvisor.com/media/photo-o/1c/86/bb/04/jaffna-public-library.jpg?w=700&h=400&s=1,Robert H,"Sydney, Australia",,3,Couples,You are welcome to call in and look but there are rooms where you cannot enter. One of the better public buildings of Jaffna but not sure why we visited!!,"December 29, 2017",0.0,25.66844919786097,13.903743315508022,2.13903743315508,20.32085561497326,37.96791443850268
https://www.tripadvisor.com/Attraction_Review-g304135-d7312819-Reviews-Jaffna_Public_Library-Jaffna_Northern_Province.html,Jaffna Public Library,3.7,216,https://dynamic-media-cdn.tripadvisor.com/media/photo-o/1c/86/bb/04/jaffna-public-library.jpg?w=700&h=400&s=1,Thanaraj S,"Shah Alam, Malaysia",,4,Missing,Was a break in Jaffna and the library is close to where we stay. It’s an historical structure with lord Saraswathy ( god of knowledge in Hinduism) at the main entrance . worth to see when in Jaffna,"December 15, 2017",0.0,25.66844919786097,13.903743315508022,2.13903743315508,20.32085561497326,37.96791443850268
https://www.tripadvisor.com/Attraction_Review-g304135-d7312819-Reviews-Jaffna_Public_Library-Jaffna_Northern_Province.html,Jaffna Public Library,3.7,216,https://dynamic-media-cdn.tripadvisor.com/media/photo-o/1c/86/bb/04/jaffna-public-library.jpg?w=700&h=400&s=1,Harsha P,"Colombo, Sri Lanka",,3,Friends,The Jaffna library lacks the staff to give guided tours or have handouts regarding it's importance. This is one of the best libraries in the country & none of the local authorities are interested in developing it A visitor is only allowed to view the passages & the reception area.,"November 20, 2017",0.0,25.66844919786097,13.903743315508022,2.13903743315508,20.32085561497326,37.96791443850268
https://www.tripadvisor.com/Attraction_Review-g304135-d7312819-Reviews-Jaffna_Public_Library-Jaffna_Northern_Province.html,Jaffna Public Library,3.7,216,https://dynamic-media-cdn.tripadvisor.com/media/photo-o/1c/86/bb/04/jaffna-public-library.jpg?w=700&h=400&s=1,AviMF,"Brighton and Hove, United Kingdom",,4,Missing,"The Jaffna library built in 1933 was burnt in 1981 and is a horrific reminder of the ethnic tension of the 80s. Over 97000 valuable manuscripts were destroyed (Seneviratne, 2006). It has now risen to being a new, vibrant library with areas for children, youth and is an interesting place. It is a must visit site for all locals to be reminded of the horrors of ethnic biblioclasm and to be challenged to think ""Never Again"" shall such a thing happen in Sri Lanka.","November 4, 2017",0.0,25.66844919786097,13.903743315508022,2.13903743315508,20.32085561497326,37.96791443850268
https://www.tripadvisor.com/Attraction_Review-g304135-d7312819-Reviews-Jaffna_Public_Library-Jaffna_Northern_Province.html,Jaffna Public Library,3.7,216,https://dynamic-media-cdn.tripadvisor.com/media/photo-o/1c/86/bb/04/jaffna-public-library.jpg?w=700&h=400&s=1,Tom T,"Melbourne, Australia",,3,Couples,One of the standout buildings in Jaffna with a sad history.  Unfortunately visitors only have access to the main corridors of the building.  So fifteen minutes will do it.  If you are staying longer than a few days it may be worth joining as apparently the wifi is excellent. The children's park across the road is quiet and cool to stop for a rest.,"October 9, 2017",0.0,25.66844919786097,13.903743315508022,2.13903743315508,20.32085561497326,37.96791443850268
https://www.tripadvisor.com/Attraction_Review-g304135-d7312819-Reviews-Jaffna_Public_Library-Jaffna_Northern_Province.html,Jaffna Public Library,3.7,216,https://dynamic-media-cdn.tripadvisor.com/media/photo-o/1c/86/bb/04/jaffna-public-library.jpg?w=700&h=400&s=1,peterh125,"Rugeley, United Kingdom",,4,Couples,"Photographs in the library show the destruction it suffered during the civil war and it is remarkable that it has been restored Externally the impressive colonial architecture provides Jaffna with a remarkable landmark Internally not quite so impressive with many of the rooms off limits to casual visitors However, the atmosphere harks back to libraries of yesteryear with long shelves lined with books and a reverential hush reinforced by prominent ""Silence"" notices posted throughout the building","October 9, 2017",0.0,25.66844919786097,13.903743315508022,2.13903743315508,20.32085561497326,37.96791443850268
https://www.tripadvisor.com/Attraction_Review-g304135-d7312819-Reviews-Jaffna_Public_Library-Jaffna_Northern_Province.html,Jaffna Public Library,3.7,216,https://dynamic-media-cdn.tripadvisor.com/media/photo-o/1c/86/bb/04/jaffna-public-library.jpg?w=700&h=400&s=1,Ropro,"Kigali, Rwanda",,4,Missing,There is history behind this place and worth the visit. Its is very creditable that it has been rebuilt and slowly getting back to its old glory. Lots of intellectuals have gone through this place and have benefited. It was nice to look around though not allowed to go inside.,"September 11, 2017",0.0,25.66844919786097,13.903743315508022,2.13903743315508,20.32085561497326,37.96791443850268
https://www.tripadvisor.com/Attraction_Review-g304135-d7312819-Reviews-Jaffna_Public_Library-Jaffna_Northern_Province.html,Jaffna Public Library,3.7,216,https://dynamic-media-cdn.tripadvisor.com/media/photo-o/1c/86/bb/04/jaffna-public-library.jpg?w=700&h=400&s=1,fjp4564,645 contributions,,4,Solo,"This Library has been restored to its early glory, and contains a vast collection of valuable books.   It also acts as a centre of learning for the local students.  restricted acces to visitors.","August 11, 2017",0.0,25.66844919786097,13.903743315508022,2.13903743315508,20.32085561497326,37.96791443850268
https://www.tripadvisor.com/Attraction_Review-g304135-d7312819-Reviews-Jaffna_Public_Library-Jaffna_Northern_Province.html,Jaffna Public Library,3.7,216,https://dynamic-media-cdn.tripadvisor.com/media/photo-o/1c/86/bb/04/jaffna-public-library.jpg?w=700&h=400&s=1,hotsikadee,"Rotterdam, The Netherlands",,4,Couples,"It is a nice building, not really special. For me the most interesting was to see how proud they are about this building and how they use it. People are reading newspapers, there are archives, etc..","August 9, 2017",0.0,25.66844919786097,13.903743315508022,2.13903743315508,20.32085561497326,37.96791443850268
