Destination URL,Destination Title,Destination Score,Total Reviews (Destination),Destination Image,Reviewer Name,Reviewer Location,Review Title,Review Score,Reviewer Category,Review Text,Written Date
https://www.tripadvisor.com/Attraction_Review-g2435125-d3510270-Reviews-Mannar_Island-Mannar_Northern_Province.html,Mannar Island,4.0,108,https://dynamic-media-cdn.tripadvisor.com/media/photo-o/12/1f/9b/90/mannar-island-gold-sand.jpg?w=700&h=400&s=1,hélène f,5 contributions,,3,Friends,We stayed in mannar for 2 days but we found that there was not a lot to see. One day is enough to visit the whole island.,"October 10, 2017"
https://www.tripadvisor.com/Attraction_Review-g2435125-d3510270-Reviews-Mannar_Island-Mannar_Northern_Province.html,Mannar Island,4.0,108,https://dynamic-media-cdn.tripadvisor.com/media/photo-o/12/1f/9b/90/mannar-island-gold-sand.jpg?w=700&h=400&s=1,My_Reservations,"Colombo, Sri Lanka",,5,Friends,"The drive to Mannar from the main island of Sri Lanka is amazing! The ocean on both sides and the blue skies above it is almost like a postcard! The first attraction you will spot when you get into Mannar is the dutch fort. Definitely worth a visit! Most of the fort is intact and you can walk around and take some photos of the ocean from up there. Further down the road, you can visit the Baobob tree which is the tree with the largest bark in Sri Lanka. The tree is not native to Sri Lanka so its a mystery as to how it actually got there! Rumor has it that Arabian sailors brought it over ;) From Mannar town, you can drive up to Talaimannar which is home to the naval base and Talaimannar pier. The pier was used to board ships which go to India back in the day. Sadly, the ferry service is no longer active. On the drive to Talaimannar you pass beautiful scenery on both sides of the road. If you get down and walk off the road you will see that the white sand is covered by beautiful little shells! The area is aptly named the Shell coast cos of this. Right along the drive you will see heaps of Donkeys strolling along the sides of the roads which is quite and unusual sight for Sri Lanka :) The island has its own little post office which is the furthest most post office towards the west of the island. We bought some post cards and sent it across to ourselves from there as a fun little souvenir :) When back in town, make sure to visit Choice restaurant which is a small cheap food shop. Amazing fried rice and Biriyani available for Lunch and dinner. 5 of us had food and drinks, and the bill came to only LKR 1,500.00 Mannar island is definitely a must see for all locals and foreigners :) Just make sure to hire or drive your own vehicle since there is a lot of driving around to do :)","September 19, 2017"
https://www.tripadvisor.com/Attraction_Review-g2435125-d3510270-Reviews-Mannar_Island-Mannar_Northern_Province.html,Mannar Island,4.0,108,https://dynamic-media-cdn.tripadvisor.com/media/photo-o/12/1f/9b/90/mannar-island-gold-sand.jpg?w=700&h=400&s=1,Janaka Nagodavithana,"Pannipitiya, Sri Lanka",,5,Couples,"Wonderful. Unbelievable. Mannar is a hidden gem in Sri Lanka. Suggest travellers to read the book ""Discover Mannar"" by Mr.Amrith Gnanam before visiting Mannar. Ideal for birding, photography and relaxing.","August 21, 2017"
https://www.tripadvisor.com/Attraction_Review-g2435125-d3510270-Reviews-Mannar_Island-Mannar_Northern_Province.html,Mannar Island,4.0,108,https://dynamic-media-cdn.tripadvisor.com/media/photo-o/12/1f/9b/90/mannar-island-gold-sand.jpg?w=700&h=400&s=1,FazlyColombo,17 contributions,,3,Solo,"Mannar is an Island off the mainland Sri Lanka. However district of Mannar covers parts the mainland. Key sites you may be interested include 1. Silavaturai, Arippu, Coastal wetlands and archaeological sites 2. Vankalai Bird Sanctuary and beach 3. Silavaturai, Aripput and Vankalai coral reefs, undiscovered live corals 4. Talaimannar Pier, Adam Bridge, several archeological sites and Pesalai fishery harbour 5. Mannar Port and Mantai port 6. Madhu Church, religious sites 7. Vidattaltivu lagoon and extensive coastal habitat with mangroves Climate & Geography Avg Temperature December - Feb 26C April - June  above 29C (Avoid going during this time) Rest of the year - 28C History Talaimannar is 18 miles away from india and during good times was a centre of trade and sea routes. Baobab tress and donkeys are a reminder of this even to this date, that traders from Arabia frequented this place. The fact that dutch chose to build a fort also goes to prove its bygone hub status. Kuweni, as the legend has it is from Thambapanni which is in Mannar district of Wilpattu reserve though not in the island. Adam's bridge or Hanuman's bridge also is there though there are no formal tours. Modi went to Talai Mannar to initiate a train service back in 2015 is still showing its strategic value to be connecting point to the Asian Railway Network. Wild Life Mannar sees migratory birds during seasons, especially flamingoes. Wild donkeys and poneys too can be seen. Coral reafs are also available. Again no formal tours In past, mannar was famous for natural pearls; though it is not commercially done now at large scale. Go to keeri beach Economy Economy is mainly based on fishing and agriculture. Food If you are in mannar, eat sea food. Prawns and cuttle fish are out of the world, but you need to get them fresh and cook. Only one proper resturant imo (Palmyrah). THough small shops also serve tasty curry. I am told cargills has opened in mannar town; please check. If not, take plenty of water bottles. Travel No 95 petrol is available in the island, Last station apparently is in Madu. Use TukTuk but discuss the rates prior to travelling. If difficult get help of a resident. THere are air conditioned buses between mannar and colombo. Leaves Mannar opposite Sri Lanka telecom.","August 18, 2017"
https://www.tripadvisor.com/Attraction_Review-g2435125-d3510270-Reviews-Mannar_Island-Mannar_Northern_Province.html,Mannar Island,4.0,108,https://dynamic-media-cdn.tripadvisor.com/media/photo-o/12/1f/9b/90/mannar-island-gold-sand.jpg?w=700&h=400&s=1,Johanna H,"Bern, Switzerland",,5,Couples,We rented two bycicles to explore the island. There are no real special things to see but its just a wonderful way to get to know mannar and its people. Everyone we met was really nice and helpful. There are also many small shops on the way where you can buy drinks and snacks. Be prepaired for the sun. There are not many shady places. To deive from mannar to the lighthouse it takes something about 3 hours (slowly driving and stops included). Was hot and exhausting but definitely worth it!,"August 1, 2017"
https://www.tripadvisor.com/Attraction_Review-g2435125-d3510270-Reviews-Mannar_Island-Mannar_Northern_Province.html,Mannar Island,4.0,108,https://dynamic-media-cdn.tripadvisor.com/media/photo-o/12/1f/9b/90/mannar-island-gold-sand.jpg?w=700&h=400&s=1,sharmini m,"Colombo, Sri Lanka",,5,,"The sea is gorgeous, not an over crowded town, so peaceful and beautiful. Now there are few hotels.  You can drive to Talaimannar where the sea is also so gorgeous.  Real out of the ordinary place.","June 22, 2017"
https://www.tripadvisor.com/Attraction_Review-g2435125-d3510270-Reviews-Mannar_Island-Mannar_Northern_Province.html,Mannar Island,4.0,108,https://dynamic-media-cdn.tripadvisor.com/media/photo-o/12/1f/9b/90/mannar-island-gold-sand.jpg?w=700&h=400&s=1,GielTammeling,"Amersfoort, The Netherlands",,4,Couples,Lot of birds. Once there was a very to India. You can visit Adam's Bridge. The only place you can find the Baobab Tree in Sri Lanka. A lot of wild donkeys. Old Portuguese/Dutch fort.,"June 18, 2017"
https://www.tripadvisor.com/Attraction_Review-g2435125-d3510270-Reviews-Mannar_Island-Mannar_Northern_Province.html,Mannar Island,4.0,108,https://dynamic-media-cdn.tripadvisor.com/media/photo-o/12/1f/9b/90/mannar-island-gold-sand.jpg?w=700&h=400&s=1,Nilusha Alahakoon,"Colombo, Sri Lanka",,5,Friends,"Even though this listing is say Manna Island, the best place to visit here is Talaimanna Pier. This is a very old pier, earlier used to transport goods from India and other countries to Sri Lanka through ships. Also, earlier time, there were a train service connected to ferry from India to here. You can see all these places if you go here.","June 12, 2017"
https://www.tripadvisor.com/Attraction_Review-g2435125-d3510270-Reviews-Mannar_Island-Mannar_Northern_Province.html,Mannar Island,4.0,108,https://dynamic-media-cdn.tripadvisor.com/media/photo-o/12/1f/9b/90/mannar-island-gold-sand.jpg?w=700&h=400&s=1,Aisling F,46 contributions,,3,,"Mannar is a sand island in the arid north of Sri Lanka. It was badly affected by the war and is only now starting to get back on its feet. It's a different experience to the rest of Sri Lanka and is worth a day or two side tour. You can arrive via bus or train. The journey across the causeway to the island is beautiful at high tide. There are donkeys throughout the island left by Arab traders. The donkeys are small but quite tame. They were the local taxi service for centuries but have been neglected with arrival of motorised vehicles. Bridging Lanka (48 New Moor st) are setting up a donkey education centre just outside town. They will shortly be running tours to try fund caring for these donkeys - contact them if you want to try set up a tour as we got to pat some beautiful well cared for donkeys in our visit. The baobab tree dates from the 1400s and is enormous. The local cathedral is nice. The Dutch fortress Is just at the end of the causeway on the island while it's small and was used during the war, you get great views from the walls.Just across the causeway on the Jaffna road is an ancient Hindu temple (Ketheeswaram) which is spectacular - and not a tourist in sight (remove shoes, men must remove their shirts and women must have shoulders and knees covered). Part of the temple is being restored and you can walk around the building site (!).  The Giants tank is a well known bird watching spot. Baobab guest house can provide tasty lunch for about $5 (if you want curry and rice they need a few hours notice but if you want egg and toast, shanthi can whip that up quickly) or the local ahash hotel was about the same cost. Mannar may not have the highlights of other parts of Sri Lanka but if you want to know what life is like for everyday Sri Lankans then this is a lovely stop over between Anuradhapura and Jaffna.","June 9, 2017"
https://www.tripadvisor.com/Attraction_Review-g2435125-d3510270-Reviews-Mannar_Island-Mannar_Northern_Province.html,Mannar Island,4.0,108,https://dynamic-media-cdn.tripadvisor.com/media/photo-o/12/1f/9b/90/mannar-island-gold-sand.jpg?w=700&h=400&s=1,Kahuna146,16 contributions,,2,,Hot dusty water problems unpleasant poor food choices really I wouldn't go out of my way to see this place,"May 26, 2017"
https://www.tripadvisor.com/Attraction_Review-g2435125-d3510270-Reviews-Mannar_Island-Mannar_Northern_Province.html,Mannar Island,4.0,108,https://dynamic-media-cdn.tripadvisor.com/media/photo-o/12/1f/9b/90/mannar-island-gold-sand.jpg?w=700&h=400&s=1,Lahiru Dulshan,"Colombo, Sri Lanka",,5,,Sri lanka is an island and mannar is an Island that belongs to the main island. despite being an island it has no place to visit except the mannar fort which is very small and abandoned comparing to galle fort or trincomalee fort..,"May 18, 2017"
https://www.tripadvisor.com/Attraction_Review-g2435125-d3510270-Reviews-Mannar_Island-Mannar_Northern_Province.html,Mannar Island,4.0,108,https://dynamic-media-cdn.tripadvisor.com/media/photo-o/12/1f/9b/90/mannar-island-gold-sand.jpg?w=700&h=400&s=1,Nathasha u,"Bangkok, Thailand",,5,Friends,Rhe drive from mannar to thalai mannar is teally beautiful. Can see bird life there as well and saw several photograpgers with massive cameras taking pics of birds. Must visit if you re in mannar.,"May 7, 2017"
https://www.tripadvisor.com/Attraction_Review-g2435125-d3510270-Reviews-Mannar_Island-Mannar_Northern_Province.html,Mannar Island,4.0,108,https://dynamic-media-cdn.tripadvisor.com/media/photo-o/12/1f/9b/90/mannar-island-gold-sand.jpg?w=700&h=400&s=1,perpatetix,"Dubai, United Arab Emirates",,3,Couples,"First the geography. Mannar and the associated tip  of the island,Talaimannar form the bottom claw of the Jaffna pincers extending into the sea. Mannar is slightly inland and Talaimannar is the tip. The two reasons why any visitor would want to visit this place are birds and history. The birds are quite exotic and plentiful in the area. The historical currency of this place is enhanced by the tale of Ramayana, an enduring epic in Sri Lanka and India. Talaimannar forms the Eastern edge of the fabled Adams bridge. On a good day and low tide, you can see the opposite end of these sand bars. That's all there is for the itinerant visitor. The drive from Mannar to Talaimannar is an hour an a half. The roads get progressively worse. Lot of military presence and a naval detachment right at the very tip of Talaimannar is a bit of a dampener. To reach the closest sandbars,called island 1 and 2, the help of local fishermen needs to be requisitioned. From the Indian side,Dhanushkodi,access to the sandbars is better. Reaching Mannar from central Lanka is on the A14. From the North,it is the A14. The roads are black tops for much of the way. Closing Mannar,the roads are not well lit and rough for long stretches. Advise against driving in the night. The arterial roads are patrolled by the police actively. Max speed is 70 kmph. In town limits are 40 to 50 kmph. The approach roads roads unlike much of Sri lanka are straight and don't wind. Food and overnight residence in Mannar are limited and average. It would help to carry food of choice and be prepared to stay in basic lodgings. An overnight stay with food should be no more than 60 usd per person. This is Mannar. Talaimannar has no amenities. Plan all trips by day. Avoid the rainy season. The local food is delicious but fiery. Breakdowns on the roads can ruin your timetable.Four wheel drives are best and a local guide recommended. Hospitality is unflaggingly super. Enjoy the trip !","April 19, 2017"
https://www.tripadvisor.com/Attraction_Review-g2435125-d3510270-Reviews-Mannar_Island-Mannar_Northern_Province.html,Mannar Island,4.0,108,https://dynamic-media-cdn.tripadvisor.com/media/photo-o/12/1f/9b/90/mannar-island-gold-sand.jpg?w=700&h=400&s=1,Shobhana DA,34 contributions,,3,Friends,"An under developed area in the remote north western area of Sri Lanka it offers little or no 'tourist' attraction,  However to all those bird lovers out there - its a great place to be during the winter migration of birds.  The flamingos are the greatest attraction not forgetting many other species of migrant birds","April 17, 2017"
https://www.tripadvisor.com/Attraction_Review-g2435125-d3510270-Reviews-Mannar_Island-Mannar_Northern_Province.html,Mannar Island,4.0,108,https://dynamic-media-cdn.tripadvisor.com/media/photo-o/12/1f/9b/90/mannar-island-gold-sand.jpg?w=700&h=400&s=1,denha,6 contributions,,3,,"Nice place to visit but extremely hot atmosphere. Four Tees inn is recommended for a family stay but make sure you get the new rooms at the back which have a very nice environment, with it's tiny petting zoo with rabbits and ducks. Visit the Pier to grab a ride to Adams Bridge","April 15, 2017"
https://www.tripadvisor.com/Attraction_Review-g2435125-d3510270-Reviews-Mannar_Island-Mannar_Northern_Province.html,Mannar Island,4.0,108,https://dynamic-media-cdn.tripadvisor.com/media/photo-o/12/1f/9b/90/mannar-island-gold-sand.jpg?w=700&h=400&s=1,Mirani123,"Colombo, Sri Lanka",,5,,"Excellent birding during the migrant season.  September to April. Especially  Flamingos , Waders and Ducks. A laid back beautiful part of Sri Lanka","April 14, 2017"
https://www.tripadvisor.com/Attraction_Review-g2435125-d3510270-Reviews-Mannar_Island-Mannar_Northern_Province.html,Mannar Island,4.0,108,https://dynamic-media-cdn.tripadvisor.com/media/photo-o/12/1f/9b/90/mannar-island-gold-sand.jpg?w=700&h=400&s=1,Gayan P,"Colombo, Sri Lanka",,2,Friends,"There is nothing much to do or see here. The migratory bird sightings and habitats are on the mainland beyond the connecting causeway. The ferry and he train to Talaimanar do not operate anymore and there aren't any formal tours to the Adam's Bridge. There are a few lackluster beaches and Navy patrols many of them and do not allow bathing. Tuk tuks do not have meters and their fares are extremely high here. Hard to find regular brands of bottled water, alcohol or supermarket goods. It's a dry, hot laid back experience. You can see a few wild donkeys and birds","March 6, 2017"
https://www.tripadvisor.com/Attraction_Review-g2435125-d3510270-Reviews-Mannar_Island-Mannar_Northern_Province.html,Mannar Island,4.0,108,https://dynamic-media-cdn.tripadvisor.com/media/photo-o/12/1f/9b/90/mannar-island-gold-sand.jpg?w=700&h=400&s=1,WHISKASyKANGOU,"Lima, Peru",,1,Couples,There is nothing of great interest here. I wasted a day coming here to visit. It's a backwater . Dont waste your time.,"January 20, 2017"
https://www.tripadvisor.com/Attraction_Review-g2435125-d3510270-Reviews-Mannar_Island-Mannar_Northern_Province.html,Mannar Island,4.0,108,https://dynamic-media-cdn.tripadvisor.com/media/photo-o/12/1f/9b/90/mannar-island-gold-sand.jpg?w=700&h=400&s=1,Dr. Dharshana Weerakoon,"Gampaha, Sri Lanka",,5,,"This is must visit place and the largest island of Sri Lanka. Mannar Island formerly called Manar Island, is part of Mannar District, Sri Lanka. It is linked to the main island of Sri Lanka by a causeway. It has an area of about 50 square kilometres, mainly covered with vegetation and sand. Ram setu is a chain of limestone shoals, between Pamban Island, also known as Rameswaram Island, off the southeastern coast of Tamil Nadu, India, and Mannar Island, off the northwestern coast of Sri Lanka. Geological evidence suggests that this bridge is a former land connection between India and Sri Lanka. We had a nice and wonderful time.","January 20, 2017"
https://www.tripadvisor.com/Attraction_Review-g2435125-d3510270-Reviews-Mannar_Island-Mannar_Northern_Province.html,Mannar Island,4.0,108,https://dynamic-media-cdn.tripadvisor.com/media/photo-o/12/1f/9b/90/mannar-island-gold-sand.jpg?w=700&h=400&s=1,Madawa Gunaratna,"Colombo, Sri Lanka",,4,,"It was an amazing experience to all of us. The weather too very conducive for the most valuable boat trip to see the islands. Beautiful sceneries around.  A bit of advices are please take ample drinking water, some biscuits & sandwiches as less places to have meals but can manage. It was a one day trip for us and was really worthwhile","December 25, 2016"
https://www.tripadvisor.com/Attraction_Review-g2435125-d3510270-Reviews-Mannar_Island-Mannar_Northern_Province.html,Mannar Island,4.0,108,https://dynamic-media-cdn.tripadvisor.com/media/photo-o/12/1f/9b/90/mannar-island-gold-sand.jpg?w=700&h=400&s=1,Prasad_Siriwardena,"Negombo, Sri Lanka",,4,Friends,"Mannar island can be treated as one of the best place to visit. This place can be treated as best place to see wetland birds and some of the ruins,","December 21, 2016"
https://www.tripadvisor.com/Attraction_Review-g2435125-d3510270-Reviews-Mannar_Island-Mannar_Northern_Province.html,Mannar Island,4.0,108,https://dynamic-media-cdn.tripadvisor.com/media/photo-o/12/1f/9b/90/mannar-island-gold-sand.jpg?w=700&h=400&s=1,Kumar W,"Colombo, Sri Lanka",,3,Friends,"The weather is fair in the later and early parts of the year. Mid year is very hot and dry. October to early February is good for bird watching, since most of the migratory birds can bee see there","December 7, 2016"
https://www.tripadvisor.com/Attraction_Review-g2435125-d3510270-Reviews-Mannar_Island-Mannar_Northern_Province.html,Mannar Island,4.0,108,https://dynamic-media-cdn.tripadvisor.com/media/photo-o/12/1f/9b/90/mannar-island-gold-sand.jpg?w=700&h=400&s=1,Seevali D,"Colombo, Sri Lanka",,5,Friends,"We visited Mannar on hearing that migratory flamingos had arrived there.  We were not disappointed and saw two large groups of flamingos numbering over 700 in each group.  They were a little too far for close up shots with my 400 mm lens.  I now feel sorry that we did not visit them early morning for better photographic shots!  If you move close they move away!! We also saw the big baobab tree with a girth of 19.5 m said to be planted by Arabian sailors around 1475. The Doric house was another historic attraction.  The then British governer of Ceylon, Sir Fredrick North, had occupied this building around 1800 to personally supervise the thriving and extremly lucrative pearl fishery in and around Mannar.  The building is in ruins and could be better managed by the authorities.  We also visited the light house and the Dutch Fort.  There are many other interesting places to be visited around Mannar as we spent most of our time looking at the Flamingos.  We certainly shall visit Mannar again to see the other interesting locations.","December 5, 2016"
https://www.tripadvisor.com/Attraction_Review-g2435125-d3510270-Reviews-Mannar_Island-Mannar_Northern_Province.html,Mannar Island,4.0,108,https://dynamic-media-cdn.tripadvisor.com/media/photo-o/12/1f/9b/90/mannar-island-gold-sand.jpg?w=700&h=400&s=1,Ram K,"Jaffna, Sri Lanka",,4,Friends,its about 120km from jaffna town.. we had a nice bike ride to mannar with friends.. there are some tourist places like thalai mannar adams bridge its around 30km straight road from mannar town.. we can see the bridge and beach and some fishing places... keeri beach also wonderful beach to take bath and a dutch fort and baobab tree and good food stalls to taste traditional food are there.. hot climate is irritating otherwise everything fine...,"November 29, 2016"
https://www.tripadvisor.com/Attraction_Review-g2435125-d3510270-Reviews-Mannar_Island-Mannar_Northern_Province.html,Mannar Island,4.0,108,https://dynamic-media-cdn.tripadvisor.com/media/photo-o/12/1f/9b/90/mannar-island-gold-sand.jpg?w=700&h=400&s=1,akhila r,23 contributions,,5,Friends,"This is an amazing place. One of the drawbacks I noticed is not having many places to eat well. Other than that the beach is awesome, people seem nice as well. There are so many things around to watch. If you come by a vehicle I suggest you to go and visit the Kanchukulam Hanging Bridge.","November 20, 2016"
https://www.tripadvisor.com/Attraction_Review-g2435125-d3510270-Reviews-Mannar_Island-Mannar_Northern_Province.html,Mannar Island,4.0,108,https://dynamic-media-cdn.tripadvisor.com/media/photo-o/12/1f/9b/90/mannar-island-gold-sand.jpg?w=700&h=400&s=1,Langkapura,"Winterswijk Henxel, The Netherlands",,4,Couples,"Mannar is well known for it's birds. But there is more to see, like an old Dutch fort, the mansion of the English govenor and the famous Baobab trees which you will only find in Africa.","September 26, 2016"
https://www.tripadvisor.com/Attraction_Review-g2435125-d3510270-Reviews-Mannar_Island-Mannar_Northern_Province.html,Mannar Island,4.0,108,https://dynamic-media-cdn.tripadvisor.com/media/photo-o/12/1f/9b/90/mannar-island-gold-sand.jpg?w=700&h=400&s=1,HanimA A,"Colombo, Sri Lanka",,4,Couples,Mannar gives travellers a very different experience to the rest of the Island. You'll  see donkeys roam freely on the streets. Vast landscapes and a very diverse culture.,"September 20, 2016"
https://www.tripadvisor.com/Attraction_Review-g2435125-d3510270-Reviews-Mannar_Island-Mannar_Northern_Province.html,Mannar Island,4.0,108,https://dynamic-media-cdn.tripadvisor.com/media/photo-o/12/1f/9b/90/mannar-island-gold-sand.jpg?w=700&h=400&s=1,Mahinda W,"Colombo, Sri Lanka",,3,Solo,"Mannar Island is accessible by both train, bus or car with excellent roadways for both modes of travel. It is a coastal town. #Hotel #Agape is one of the places which is very good. The #Portugese Fort, the #Baobab Tree, #Church of Our #LadyOf Madhu, Talai Mannar pier are must visits. Even the Northern capital Jaffna is accessible over an excellent short cut road within 2 hours.","September 7, 2016"
https://www.tripadvisor.com/Attraction_Review-g2435125-d3510270-Reviews-Mannar_Island-Mannar_Northern_Province.html,Mannar Island,4.0,108,https://dynamic-media-cdn.tripadvisor.com/media/photo-o/12/1f/9b/90/mannar-island-gold-sand.jpg?w=700&h=400&s=1,Udarahema,"Colombo, Sri Lanka",,3,Friends,"Hot, windy and clear sky all round the island. This island combine to main island in a small bridge. Families living here doing fishing, one Naval base with Police station in there.","August 31, 2016"
https://www.tripadvisor.com/Attraction_Review-g2435125-d3510270-Reviews-Mannar_Island-Mannar_Northern_Province.html,Mannar Island,4.0,108,https://dynamic-media-cdn.tripadvisor.com/media/photo-o/12/1f/9b/90/mannar-island-gold-sand.jpg?w=700&h=400&s=1,Jorne V,17 contributions,,4,Couples,"Not much to see or do, except some small sites. Nontheless Mannar is a nice place to visit. Definitly if you like to see wild ... donkeys!! They are all over town Things to do include seeing/visiting Adam's bridge, old and very big Bilbao tree in the centre and ....","August 29, 2016"
https://www.tripadvisor.com/Attraction_Review-g2435125-d3510270-Reviews-Mannar_Island-Mannar_Northern_Province.html,Mannar Island,4.0,108,https://dynamic-media-cdn.tripadvisor.com/media/photo-o/12/1f/9b/90/mannar-island-gold-sand.jpg?w=700&h=400&s=1,Deshani  F,"Panadura, Sri Lanka",,4,Friends,Different climate than the other sides of Sri Lanka. Windy and hot.specialy the Adams bridge.some sandy islands with small plants.soo many birds were there. Unfortunately no flemingoes were seen.,"May 26, 2016"
