Destination URL,Destination Title,Destination Score,Total Reviews (Destination),Destination Image,Reviewer Name,Reviewer Location,Review Title,Review Score,Reviewer Category,Review Text,Written Date
https://www.tripadvisor.com/Attraction_Review-g2435125-d3510270-Reviews-Mannar_Island-Mannar_Northern_Province.html,Mannar Island,4.0,108,https://dynamic-media-cdn.tripadvisor.com/media/photo-o/12/1f/9b/90/mannar-island-gold-sand.jpg?w=700&h=400&s=1,Ravi K,"Colombo, Sri Lanka",,4,,"This place is nice and different. I like mannar than Jaffna. The city is still developing so u will not find many things here. Saw a food city., sathosa, but the only reliable and good food place is choice reataurent. Located at Centre bazaar rd in the city.","April 30, 2016"
https://www.tripadvisor.com/Attraction_Review-g2435125-d3510270-Reviews-Mannar_Island-Mannar_Northern_Province.html,Mannar Island,4.0,108,https://dynamic-media-cdn.tripadvisor.com/media/photo-o/12/1f/9b/90/mannar-island-gold-sand.jpg?w=700&h=400&s=1,peushan,"Colombo, Sri Lanka",,5,,Mannar island is a place where we could visit many places which are important historically. Moreover lots of fantastic senses are also available.,"April 14, 2016"
https://www.tripadvisor.com/Attraction_Review-g2435125-d3510270-Reviews-Mannar_Island-Mannar_Northern_Province.html,Mannar Island,4.0,108,https://dynamic-media-cdn.tripadvisor.com/media/photo-o/12/1f/9b/90/mannar-island-gold-sand.jpg?w=700&h=400&s=1,Meriyn,"Penarth, United Kingdom",,3,Solo,"The town of Mannar is pretty scruffy with few amenities. It is a very mixed community that appear to live in harmony. There is a beach about 6 kms away and one at the end of the railway line, but they have quite a lot of rubbish. One would be a brave woman to swim in a swimsuit I was subject to a fair amount of sexual harassment and I'm 65! The newly constructed railway line is very pristine but I'm not certain if any trains actually traverse the length of the island. The old ferry pier which was used to link Sri Lanka with India is very dilapidated and the only talk now is of a bridge.","April 4, 2016"
https://www.tripadvisor.com/Attraction_Review-g2435125-d3510270-Reviews-Mannar_Island-Mannar_Northern_Province.html,Mannar Island,4.0,108,https://dynamic-media-cdn.tripadvisor.com/media/photo-o/12/1f/9b/90/mannar-island-gold-sand.jpg?w=700&h=400&s=1,peterh125,"Rugeley, United Kingdom",,4,Friends,After the war great endeavours have been made to restore road and rail links that are both now excellent. The route into Mannar is long and straight and passes some stunning waterside landscapes - very similar to the journey into Jaffna. The main shopping area is the Grand Bazaar. Apart from the ruined Dutch Fort the only other building on a grand scale is the impressive cathedral/church (again similar in design to the one in Jaffna) We found that there was little choice of places to eat and there is an absence of any quality tourist accommodation at the current time,"March 25, 2016"
https://www.tripadvisor.com/Attraction_Review-g2435125-d3510270-Reviews-Mannar_Island-Mannar_Northern_Province.html,Mannar Island,4.0,108,https://dynamic-media-cdn.tripadvisor.com/media/photo-o/12/1f/9b/90/mannar-island-gold-sand.jpg?w=700&h=400&s=1,Traveltubbies,"Colombo, Sri Lanka",,3,,"The drive into the island on the causeway was beautiful. The fort was not much but accorded a nice view of the surroundings. The island itself was charming, only place you could see wild donkeys. A good pit stop enroute Colombo to Jaffna though will not come here specifically for a visit as there's not much to see.","February 26, 2016"
https://www.tripadvisor.com/Attraction_Review-g2435125-d3510270-Reviews-Mannar_Island-Mannar_Northern_Province.html,Mannar Island,4.0,108,https://dynamic-media-cdn.tripadvisor.com/media/photo-o/12/1f/9b/90/mannar-island-gold-sand.jpg?w=700&h=400&s=1,PRABHU60,"Colombo, Sri Lanka",,5,Couples,"Mannar is one place in Sri Lanka where you can find a variety of exotic birds including the Flamingos. That seems to be the only reason one would ever go to Mannar. Ruff, Grebe, Open Bill painted woolly necked and adjutant storks, Pintail, Garganey, Spot billed duck, Teals gulls and terns Grey Francolin, Peafowl ..... The varieties are a lot.. Great place for birders to be","February 22, 2016"
https://www.tripadvisor.com/Attraction_Review-g2435125-d3510270-Reviews-Mannar_Island-Mannar_Northern_Province.html,Mannar Island,4.0,108,https://dynamic-media-cdn.tripadvisor.com/media/photo-o/12/1f/9b/90/mannar-island-gold-sand.jpg?w=700&h=400&s=1,JOHN C,"Milton Keynes, United Kingdom",,4,,"I visited and stayed here for a night as part of a Sri Lankan coastline cycle tour and then a year later as a self drive, it is a little conservative, and not touristy, many police and checkpoint controls. The new bridge leads into town, the old blown up bridge still visible to the right, there is a central town roundabout roads lead off, shops and a bustling market surround, impressive religious buildings to see, a fuel station and many banks with cashpoints and donkeys everywhere.","February 3, 2016"
https://www.tripadvisor.com/Attraction_Review-g2435125-d3510270-Reviews-Mannar_Island-Mannar_Northern_Province.html,Mannar Island,4.0,108,https://dynamic-media-cdn.tripadvisor.com/media/photo-o/12/1f/9b/90/mannar-island-gold-sand.jpg?w=700&h=400&s=1,Ine F,211 contributions,,5,Couples,"in wonderful weather we visited Mannar during 3 days. That was enough to explore and we loved the sight seeing, even after the floodings that took place 14 days before. Lots of birds to spot, friendly people. Unfortunately a great part of the road is in horrible condition but this Island has a real potential to be visited by tourists.","January 25, 2016"
https://www.tripadvisor.com/Attraction_Review-g2435125-d3510270-Reviews-Mannar_Island-Mannar_Northern_Province.html,Mannar Island,4.0,108,https://dynamic-media-cdn.tripadvisor.com/media/photo-o/12/1f/9b/90/mannar-island-gold-sand.jpg?w=700&h=400&s=1,Shivantha R,"Colombo, Sri Lanka",,3,,"Mannar Island & the close by area of the main land possesses a very unique socio-cultural and geographic profile  in comparison to the other parts of Sri Lank. This is the largest Island belongs to Sri Lanka ( nearly 40 km in length and average 3 km in width. connected to the main land by a 3 km long road and a bridge at the entrance to the island. The sea which is on the both side of the road is just 2 feet deep in the high tide and becomes a massive dessert of white sand during law tide. Main attractions - Mannar Fort can be seen on your left when you enter the island. This was originally built by the Portuguese and further fortified by the Dutch and British and is still in a pretty good condition, and now are under preservation project of the Archaeological Department.  No tickets needed. There are few Dutch Tombs in the premises. - Adams Bridge at Thalei Mannar- Located around 35 km away from the Mannar town, Can be reached by Mannar - Thalai Mannar main road by Bus and Train. Public transportation goes only up to the Talai Mannar small town. The Adam's Bridge is the narrow belt of sand reefs and atolls runs from Thalai Mannar to Danushkodi at Pamban Island of India. Approximately 30 km in length  200 m in average width and 2 ft in average elevation , controlled by Sri Lanka Navy. During the day time between 7 am to 4 pm visitors can go there on private boats that can be arranged talking to any of the fishermen living there. In October 2015 it was 2500 rupees for a pack of 6 people for a 2 hrs visit. The boater should provide slandered life jackets to all the passengers and passengers must be wearing it all the time they are on board. if not sometimes the Navy even will send you all the way back to the shore cancelling your trip. after 4 pm you can not stay there under any circumstances. hope this will change in the near future to a level that you can camp in the night with special permission. Extremely warm and dry, better keep hydrating yourself through out the journey. - Fort Arippu - A small fort located on the road to Puththalama via Silavathurai. You can see the ruins of a small fortification originally done by the Portuguese and occupied by the Dutch and the British latter. - Doric Mansion - Located on the shore on the same road passing the Fort Arippu. One of the mansions of the 1st British Governor of Sri Lanka (then Ceylon). The mansion is in ruin but still you can see the great brick walls and arches. Kudhiramale Cliffs point in the shore of Vipattu forest, Thiruketheeshvaram Hindhu Temple, The Giant Tank, The Catholic Shrine of Madu, St. Lucia church, Baiobab trees, Sandy jungle beaches and couple of sanctuaries are located in the Mannar island and the adjoining main land. I first visited Mannar in 2010 and have gone there more than 20 times. Nothing much in terms of entertainment. but if you are interested in just observing a unique social set up, some of the oldest catholic customs in the south Asia, and colonial History, Mannar is awesome.  Not very developed in comparison to the other parts of the  country. Around 20 Hotels are found in the area. one of the hottest and driest climate in the country.","October 12, 2015"
https://www.tripadvisor.com/Attraction_Review-g2435125-d3510270-Reviews-Mannar_Island-Mannar_Northern_Province.html,Mannar Island,4.0,108,https://dynamic-media-cdn.tripadvisor.com/media/photo-o/12/1f/9b/90/mannar-island-gold-sand.jpg?w=700&h=400&s=1,Angela W,"Brisbane, Australia",,4,Couples,A quiet place by the sea full of wonderful people. Go to experience authentic village life. Stay a while and volunteer at an NGO. Help look after the Bridging Lanka donkeys. Visit the sites but stay and meet the people you won't be disappointed. The town is full of wildlife and domestic animals. The bird life here and in the Mannar Province is abundant. Visit Keeri Beach and help clean it up for the future. Take long bicycle rides around the town and the villages.  Take a three wheeler to the mainland and visit the sacred Hindu lake and temple. You can now catch a train directly to Mannar from Colombo or anywhere along the line. Its great to visit in July and August because the winds are up and it cools you down.  The mornings and evening are very pleasant and the breezes are wonderful.,"August 5, 2015"
https://www.tripadvisor.com/Attraction_Review-g2435125-d3510270-Reviews-Mannar_Island-Mannar_Northern_Province.html,Mannar Island,4.0,108,https://dynamic-media-cdn.tripadvisor.com/media/photo-o/12/1f/9b/90/mannar-island-gold-sand.jpg?w=700&h=400&s=1,Sam M,"Colombo, Sri Lanka",,4,Friends,We stayed at Palmyrah house which is on the Island.  The island is quite hot and dry with lots of donkeys.  You can visit the Talaimannar pier from here.  Fun fact: From the pier it is closer to travel to India than to Mannar town!!,"July 25, 2015"
https://www.tripadvisor.com/Attraction_Review-g2435125-d3510270-Reviews-Mannar_Island-Mannar_Northern_Province.html,Mannar Island,4.0,108,https://dynamic-media-cdn.tripadvisor.com/media/photo-o/12/1f/9b/90/mannar-island-gold-sand.jpg?w=700&h=400&s=1,Prasad V,"Matara, Sri Lanka",,4,,"Visited with family and its a nice place to visit. mannar fort , Bio bab tree ,lagoon , Iron / steel light house in Urumalei, beach and shopping in Mannar town are interesting. Brought good dry fish and they are reasonably cheap. Do not forget to see the sand banks of Adams bridge. carry extra water bottles, a good binocular , shades and caps. Area is dry and hot . Cotton/ linen  is the most  suitable attire. There are lot of things to preserve in Mannar ford and its a very interesting place.","May 15, 2015"
https://www.tripadvisor.com/Attraction_Review-g2435125-d3510270-Reviews-Mannar_Island-Mannar_Northern_Province.html,Mannar Island,4.0,108,https://dynamic-media-cdn.tripadvisor.com/media/photo-o/12/1f/9b/90/mannar-island-gold-sand.jpg?w=700&h=400&s=1,Nimal D,"Peradeniya, Sri Lanka",,4,Couples,"We never feel that we have such a beautiful landscape in this country until we go out for a holiday. Mannar is a separate island connected by a beautiful causeway to the mainland. It is a fishing island, covered with palmyrah trees on typical white sand. People are back to their normal life after ending the war but war damaged buildings can be seen here and there. The life of people are very simple, genuine and they are not that corrupted like in the city people in many other parts. I was amazing to see the selling price of dried fish as Rs. 200.00 /kg ($1.5/kg). We were unable to watch birds as it was not the birds season. Finding a good restaurant is the most difficult and some people speak only Tamil.","May 2, 2015"
https://www.tripadvisor.com/Attraction_Review-g2435125-d3510270-Reviews-Mannar_Island-Mannar_Northern_Province.html,Mannar Island,4.0,108,https://dynamic-media-cdn.tripadvisor.com/media/photo-o/12/1f/9b/90/mannar-island-gold-sand.jpg?w=700&h=400&s=1,giriColombo_SriLanka,273 contributions,,4,,The causeway connecting the island with the mainland is once again passable. This is the ideal time to watch Flamingoes in Mannar. Thousands of birds could be watched in the salterns. Wild Donkeys are straying all over.,"May 1, 2015"
https://www.tripadvisor.com/Attraction_Review-g2435125-d3510270-Reviews-Mannar_Island-Mannar_Northern_Province.html,Mannar Island,4.0,108,https://dynamic-media-cdn.tripadvisor.com/media/photo-o/12/1f/9b/90/mannar-island-gold-sand.jpg?w=700&h=400&s=1,Fahadh Nazir,"Panadura, Sri Lanka",,4,,"I am not sure whether it is closer to India that Mannar Island has a very close similarity to South Indian villages. Avoid going during the warm seasons (April - June) as the climate is naturally hot. On the way you travel, expect herds of cows alongside the main road. Mannar is one of the only places where you can spectate donkeys aside the road. Go to the seashore and have a conversation with the local fishermen. They have interesting stories to share.","March 23, 2015"
https://www.tripadvisor.com/Attraction_Review-g2435125-d3510270-Reviews-Mannar_Island-Mannar_Northern_Province.html,Mannar Island,4.0,108,https://dynamic-media-cdn.tripadvisor.com/media/photo-o/12/1f/9b/90/mannar-island-gold-sand.jpg?w=700&h=400&s=1,Ayanthi S,"Colombo, Sri Lanka",,5,Friends,I do hope they protect the island and educate the locals about how precious their land is for all the resident and migrant birds.,"March 7, 2015"
https://www.tripadvisor.com/Attraction_Review-g2435125-d3510270-Reviews-Mannar_Island-Mannar_Northern_Province.html,Mannar Island,4.0,108,https://dynamic-media-cdn.tripadvisor.com/media/photo-o/12/1f/9b/90/mannar-island-gold-sand.jpg?w=700&h=400&s=1,Mukesh S,"Kathmandu, Nepal",,4,Business,"An island, connected with manmade road/bridge over the ocean/laggon. Developing gradually and becoming a attractive place. Famous adams bridge connects from here i.e Talai Mannar. Some good beaches around - and mostly low laying areas. You may find difficult to get a good food though unless pre-organized. Though fried rice/curry commonly available.","December 4, 2014"
https://www.tripadvisor.com/Attraction_Review-g2435125-d3510270-Reviews-Mannar_Island-Mannar_Northern_Province.html,Mannar Island,4.0,108,https://dynamic-media-cdn.tripadvisor.com/media/photo-o/12/1f/9b/90/mannar-island-gold-sand.jpg?w=700&h=400&s=1,Margaret G,23 contributions,,3,Friends,"but a must see! we travel all over the other parts of the world without seeing our own Island , so much to appreciate.","October 22, 2014"
https://www.tripadvisor.com/Attraction_Review-g2435125-d3510270-Reviews-Mannar_Island-Mannar_Northern_Province.html,Mannar Island,4.0,108,https://dynamic-media-cdn.tripadvisor.com/media/photo-o/12/1f/9b/90/mannar-island-gold-sand.jpg?w=700&h=400&s=1,TravelistaMelB,"Melbourne, Australia",,3,,"We stayed at Palmyrah House which was a nice place with great meals & a pool. Mannar is a very different side of Sri Lanka than we have seen so far. It's a very poor area recovering from the conflict. It's also a dry zone so fewer trees and no hills here. Very few tourists here. Local people friendly & many speak English. The bird life here is amazing as well saw cows, goats, donkeys, frogs, huge fish, wild horses and of course dogs!","October 4, 2014"
https://www.tripadvisor.com/Attraction_Review-g2435125-d3510270-Reviews-Mannar_Island-Mannar_Northern_Province.html,Mannar Island,4.0,108,https://dynamic-media-cdn.tripadvisor.com/media/photo-o/12/1f/9b/90/mannar-island-gold-sand.jpg?w=700&h=400&s=1,Namith G,"Colombo, Sri Lanka",,4,Couples,"It was a very lovely experience at mannar. The island has a beautiful environment although it's hot and has few attractions such as the longest brigde in SL, Dutch fort and the tree which has the biggest trunk (Baobab). But the road in Mannar town is horrible. People are very nice.","April 28, 2014"
https://www.tripadvisor.com/Attraction_Review-g2435125-d3510270-Reviews-Mannar_Island-Mannar_Northern_Province.html,Mannar Island,4.0,108,https://dynamic-media-cdn.tripadvisor.com/media/photo-o/12/1f/9b/90/mannar-island-gold-sand.jpg?w=700&h=400&s=1,Sergey D,"Negombo, Sri Lanka",,4,Solo,"Practically all of the time I was the solely foreigner around - a strange sort of sensation, with people calling and waiving from all directions, smiling and striking out casual conversations. Some people here call the area a dump, still for me it was a valuable insight in the region recovering from the war. It is the people whom I found most surprising - extremely opened and friendly for a region with a recent history like that.","March 16, 2014"
https://www.tripadvisor.com/Attraction_Review-g2435125-d3510270-Reviews-Mannar_Island-Mannar_Northern_Province.html,Mannar Island,4.0,108,https://dynamic-media-cdn.tripadvisor.com/media/photo-o/12/1f/9b/90/mannar-island-gold-sand.jpg?w=700&h=400&s=1,Dhanishka D,"Colombo, Sri Lanka",,5,Friends,"Its definitely a place with its own beauty and scenarios and offers a unique experience. If you are the total explorer open to new experiences and ready to taste the true flavors of the places you visit its indeed a pleasurable trip. But if you are fussy about food and accommodation Mannar may not really be your place. You do not have much choice of food restaurants or accommodation but the food definitely has a flavor of its own. Its probably the only city where you get Goats, Donkeys, Cattle and Humans living in harmony. The donkeys are adorable and harmless. If you are looking to get away from your city life and wanting a break with a totally different experience its your place for sure","January 14, 2014"
https://www.tripadvisor.com/Attraction_Review-g2435125-d3510270-Reviews-Mannar_Island-Mannar_Northern_Province.html,Mannar Island,4.0,108,https://dynamic-media-cdn.tripadvisor.com/media/photo-o/12/1f/9b/90/mannar-island-gold-sand.jpg?w=700&h=400&s=1,Bakelei,21 contributions,,1,Couples,Except the old Fort lots of birds and the funny Baobab tree (looks like wider than tall)in town and mangy wild donkeys there is absolutely nothing of interest here! Beaches could be nice but you can see and feel the closeness to India because all of tthem look like a plastic dump - absolutely horrible!,"January 8, 2014"
https://www.tripadvisor.com/Attraction_Review-g2435125-d3510270-Reviews-Mannar_Island-Mannar_Northern_Province.html,Mannar Island,4.0,108,https://dynamic-media-cdn.tripadvisor.com/media/photo-o/12/1f/9b/90/mannar-island-gold-sand.jpg?w=700&h=400&s=1,Aakhi85,"Galle, Sri Lanka",,5,,mannar island is totally amazing. The best time to go is during december as the weather is good. Good for bird watching,"December 31, 2013"
https://www.tripadvisor.com/Attraction_Review-g2435125-d3510270-Reviews-Mannar_Island-Mannar_Northern_Province.html,Mannar Island,4.0,108,https://dynamic-media-cdn.tripadvisor.com/media/photo-o/12/1f/9b/90/mannar-island-gold-sand.jpg?w=700&h=400&s=1,Hastwokitties,"Galle, Sri Lanka",,3,Friends,"There is little on the island itself that would interest the casual tourist. However, if you know any local folks, then Mannar is a wonderful relaxing place to visit. Interestingly, the place is loaded with donkeys, which were introduced by the Portuguese. But this in itself isn't enough to make a special trip. Mannar town itself is a sleepy little place, and there isn't anything of interest for the casual tourist. If you are going to visit the shrine at Madhu, then I would suggest spending the night in Mannar; it's fairly close, and has the best accommodations in the District. I would also suggest one night in Mannar if you are driving the coastal road to Jaffna in order to break the trip up.","December 30, 2013"
https://www.tripadvisor.com/Attraction_Review-g2435125-d3510270-Reviews-Mannar_Island-Mannar_Northern_Province.html,Mannar Island,4.0,108,https://dynamic-media-cdn.tripadvisor.com/media/photo-o/12/1f/9b/90/mannar-island-gold-sand.jpg?w=700&h=400&s=1,AD2010,"Melbourne, Australia",,4,,"Mannar is a beautiful place. There aren’t many places in Sri Lanka that you get to see donkeys freely roaming around like cattle in the rest of the island.  Perfect place to spot birds. We stopped at the bird sanctuary just at the entrance to the island and spotted variety of birds.  In season, I am sure Mannar must be a bird watches paradise. The place is rapidly changing after many years of civil conflict. The blown up bridge alongside the new bridge is reminder of the dark history of the island. The place is now very safe and the people are very helpful. The beaches are beautiful and plenty of shells that are not commonly found elsewhere. The place has basic facilities but there are no super markets. Recommend carrying adequate water and a full tank of fuel. Power shortages are common so recommend carrying a torch and staying in a hotel with a generator.","September 10, 2013"
https://www.tripadvisor.com/Attraction_Review-g2435125-d3510270-Reviews-Mannar_Island-Mannar_Northern_Province.html,Mannar Island,4.0,108,https://dynamic-media-cdn.tripadvisor.com/media/photo-o/12/1f/9b/90/mannar-island-gold-sand.jpg?w=700&h=400&s=1,Aadhes,"Colombo, Sri Lanka",,3,,"I visited this place after 40 years, lots of changes. This island is connected by road with the main island, there is enough transport to Colombo and other major cities, I saw the railway road is under construction and I am told it will be completed within few months. (most parts of the road is completed) This city (island is famous among Hindus and Catholic because of Madhu St. Marys chursh and Thiruketheeswaram (a very ancient popular Sivan Temple). both are not in the city but little away with good public transport connection. In the city there is a huge tree which you MUST see this is the largest tree in Asia (huge trunk). Aprt from this you can go to Thalai Mannar pier which is about 45 minutes drive this is a historical place which was the landing port from (South India) Rameswaram. Old train road and the pier still there.(Please check with Navy who is in the town whether you can visit because some days it is closed by them) Mannar is getting busy these days, another city in SriLanka. You do see lots of wild Donkeys in this area be careful, they can kick and harm you (not always but there are several incidents) It is fun to watch them, some times they stand still all of a sudden they run or scream, real fun. There are few places to stay Sorry, I did not stay there so no comment. In short it is a dry but charming place.","September 4, 2013"
https://www.tripadvisor.com/Attraction_Review-g2435125-d3510270-Reviews-Mannar_Island-Mannar_Northern_Province.html,Mannar Island,4.0,108,https://dynamic-media-cdn.tripadvisor.com/media/photo-o/12/1f/9b/90/mannar-island-gold-sand.jpg?w=700&h=400&s=1,Sanka W,"Colombo, Sri Lanka",,4,Couples,"This is one of the best cities I have ever visited in Sri Lanka. However accommodation options were less, unless you're fine with guesthouses. There're so many things to see in this lovely city. We set out from Colombo & took a short cut via the Oyamaduwa road which bypassed Medawachchiya & saved us about 45 minutes drive time. First we visited the Kunchikulam Suspension Bridge en route to Mannar. This was one of the hidden gems which is still standing strong. However the road leading upto the bridge was a bit damaged. Afterwards we proceeded to Thiruketishwaram Kovil & Madhu Church. Both very beautiful sites. Spent the night in a nice clean guesthouse which was well worth the money we paid. The next day morning we visited Talaimannar & took a boat trip to Adam's Bridge. This is another breathtaking experience. The Sri Lankan Navy operates this & if the Ocean is rough, they will not operate. Luckily it was a good day. In the afternoon we visited Arippu Fort which was a Dutch built Fort to which Robert Knox fled while escaping from the Kandyan King during ancient times. Close to the fort is the Dorric House which was the bungalow of the 1st British Governor of Sri Lanka - Fredrick North. Better hurry since this site is at the edge of a cliff & parts of it is being washed to the Ocean. After several years, the entire site will be gone. The road to Arripu from Mannar was a bit bumpy. Spent the night at our cozy guesthouse. Next day morning visited the Vankalai Bird Sanctuary which was a major success for us. I'm not that much into birds, but still I enjoyed seeing so many different birds at that time of the day. In the afternoon we visited the Mannar fort & proceeded back to Colombo.","June 18, 2013"
