Destination URL,Destination Title,Destination Score,Total Reviews (Destination),Destination Image,Reviewer Name,Reviewer Location,Review Title,Review Score,Reviewer Category,Review Text,Written Date
https://www.tripadvisor.com/Attraction_Review-g2435125-d3510270-Reviews-Mannar_Island-Mannar_Northern_Province.html,Mannar Island,4.0,108,https://dynamic-media-cdn.tripadvisor.com/media/photo-o/12/1f/9b/90/mannar-island-gold-sand.jpg?w=700&h=400&s=1,SEs,"London, United Kingdom",Birds,4,Friends,This is a popular location for bird watchers. There lots of migratory birds during the season including flamingos. Beaches also.,"June 22, 2022"
https://www.tripadvisor.com/Attraction_Review-g2435125-d3510270-Reviews-Mannar_Island-Mannar_Northern_Province.html,Mannar Island,4.0,108,https://dynamic-media-cdn.tripadvisor.com/media/photo-o/12/1f/9b/90/mannar-island-gold-sand.jpg?w=700&h=400&s=1,CatherineGrove,"Berlin, Germany",historic,4,,A very historic place and is said to be the closest place to India. The place seems to be modernising too soon and could harm the flamingos that normally migrate here with seasonal changes.,"September 15, 2021"
https://www.tripadvisor.com/Attraction_Review-g2435125-d3510270-Reviews-Mannar_Island-Mannar_Northern_Province.html,Mannar Island,4.0,108,https://dynamic-media-cdn.tripadvisor.com/media/photo-o/12/1f/9b/90/mannar-island-gold-sand.jpg?w=700&h=400&s=1,Imesh,"Colombo, Sri Lanka",Peaceful place,5,,It has very peaceful environment. Also this place does miracles. You can enjoy the nature there with a lot of space trees birds etc,"January 20, 2021"
https://www.tripadvisor.com/Attraction_Review-g2435125-d3510270-Reviews-Mannar_Island-Mannar_Northern_Province.html,Mannar Island,4.0,108,https://dynamic-media-cdn.tripadvisor.com/media/photo-o/12/1f/9b/90/mannar-island-gold-sand.jpg?w=700&h=400&s=1,Albia-Newton,"Evanton, United Kingdom",Rapidly getting spoiled and developed,3,Couples,The tranquility of this place is being spoiled by major road development and the placement of up to eighty wind turbines.  The salt flats where flamingo migrate to are next to a set of road works and now the only way to see flamingo is to get up at 0500 before the traffic starts The beaches are mostly in use for fishing so are not nice or clean enough to relax and enjoy The area also has a major problem with drug trafficking and drug taking. We found a nice beach area only to be joined by a group of locals doing cocaine On the positive side we enjoyed a couple of walks beside the salterns and saw lots of painted storks and pelicans,"February 12, 2020"
https://www.tripadvisor.com/Attraction_Review-g2435125-d3510270-Reviews-Mannar_Island-Mannar_Northern_Province.html,Mannar Island,4.0,108,https://dynamic-media-cdn.tripadvisor.com/media/photo-o/12/1f/9b/90/mannar-island-gold-sand.jpg?w=700&h=400&s=1,Dharini d,"Colombo, Sri Lanka",Lots of history,4,,"There is a lot of history and interesting places to visit, the Doric, where the world acclaimed fresh water pearls were found. Fort at Arippu nearby and a larger Fort at Mannar","January 15, 2020"
https://www.tripadvisor.com/Attraction_Review-g2435125-d3510270-Reviews-Mannar_Island-Mannar_Northern_Province.html,Mannar Island,4.0,108,https://dynamic-media-cdn.tripadvisor.com/media/photo-o/12/1f/9b/90/mannar-island-gold-sand.jpg?w=700&h=400&s=1,The Travel Couple - Chathu & Ishanka,"Kalutara, Sri Lanka","Not a popular tourist spot, but there’s plenty to see",5,Friends,"You have many places to visit at Mannar island although many simply ignore this place due to the extreme hot weather and less facilities. But it’s a must visit at least once. Mannar is famous for flamingoes in the migratory season. You can see them beside the road connecting Mannar and main island. Some of the major attractions are Mannar fort, thaleimannar pier and light house, thaleimannar beach, adam’s bridge, Keeri beach. The Adam’s bridge is a must visit from all of this. Specially visit in evenings, the sunset view would be amazing. If you can get navy permission they’ll take you on a boat ride towards the first island of town he adams bridge. On the way to Mannar you can visit Doric bungalow, arippu fort, Madhu church and thanthrimale temple.","November 28, 2019"
https://www.tripadvisor.com/Attraction_Review-g2435125-d3510270-Reviews-Mannar_Island-Mannar_Northern_Province.html,Mannar Island,4.0,108,https://dynamic-media-cdn.tripadvisor.com/media/photo-o/12/1f/9b/90/mannar-island-gold-sand.jpg?w=700&h=400&s=1,ManojDK,"Colombo, Sri Lanka","Mannar, a Place Like No Other in Sri Lanka!",5,,"It's like stepping back to the Eighties! No fast food, just one supermarket, no traffic lights and NO TRAFFIC, but you enter a land where donkeys roam freely, Baobob trees grow amidst the thorny shrub, desolate white sandy landscape stretches for miles. Near empty roads, lush Palmyra trees and birds, hundreds and hundreds of them everywhere.  If you go off the beaten track, there's a stretch of beach which is completely isolated in parts except for a tiny fishing village or two. The silence only punctuated by bird calls is therapeutic, to say the least. I am of couse referring to Mannar Island, rather than Mannar on mainland. The only tiny disappointment was the Mannar Fort but the huge Baobob tree, supposedly over 800years old and, 22.8 metres in circumference, made up for it. The drive to Talaimannar Pier is absolutely beautiful,  hardly a single vehicle passes by. As if all this is not enough, a Donkey Clinic!!, over 30 donkeys live there and one can feed and pet them. We're definitely going back for the birding season, which is from November to around March I believe.","August 17, 2019"
https://www.tripadvisor.com/Attraction_Review-g2435125-d3510270-Reviews-Mannar_Island-Mannar_Northern_Province.html,Mannar Island,4.0,108,https://dynamic-media-cdn.tripadvisor.com/media/photo-o/12/1f/9b/90/mannar-island-gold-sand.jpg?w=700&h=400&s=1,Rukshan K,14 contributions,An interesting island offering new experiences and discovering more to explore...,4,,"beyond the dry arid landscape Mannar Island has more and more to offer. From observing the migratory flamingoes that escape the harsh winter to Kite surfing at Ayu, to an exploration of the old dutch fort Mannar is still raw and untouched and unspoiled by mass tourism.","August 9, 2019"
https://www.tripadvisor.com/Attraction_Review-g2435125-d3510270-Reviews-Mannar_Island-Mannar_Northern_Province.html,Mannar Island,4.0,108,https://dynamic-media-cdn.tripadvisor.com/media/photo-o/12/1f/9b/90/mannar-island-gold-sand.jpg?w=700&h=400&s=1,Anton O Fernando,"Nuwara Eliya, Sri Lanka",Very historical place,5,,A good place and a admiring place with see more sea side view with more old port and near railway station too,"May 5, 2019"
https://www.tripadvisor.com/Attraction_Review-g2435125-d3510270-Reviews-Mannar_Island-Mannar_Northern_Province.html,Mannar Island,4.0,108,https://dynamic-media-cdn.tripadvisor.com/media/photo-o/12/1f/9b/90/mannar-island-gold-sand.jpg?w=700&h=400&s=1,Dushyantha P,71 contributions,Evening visit,3,,"Went there as it was the only town in Sri Lanka that I had not visited. Not a great deal to see. However, there are some superb sea bathing spots close to Thallaimannar pier. Ask the Naval personnel on duty and they will guide you. The sea was the warmest it has ever been (in my memory) and the sun set is a photographers dream.","April 16, 2019"
https://www.tripadvisor.com/Attraction_Review-g2435125-d3510270-Reviews-Mannar_Island-Mannar_Northern_Province.html,Mannar Island,4.0,108,https://dynamic-media-cdn.tripadvisor.com/media/photo-o/12/1f/9b/90/mannar-island-gold-sand.jpg?w=700&h=400&s=1,Gill P,"Shrewsbury, United Kingdom",,5,Couples,This is an unfeveloped region of Sri Lanka but really worth going there if you're interested in birds. Nov-Mar is the best time to see resident birds but also many migrants. There are also quite a lot of wild donkeys - the only area where see these lovely animals - which were apparently introduced by Arab traders but not used by the locals now.,"March 21, 2019"
https://www.tripadvisor.com/Attraction_Review-g2435125-d3510270-Reviews-Mannar_Island-Mannar_Northern_Province.html,Mannar Island,4.0,108,https://dynamic-media-cdn.tripadvisor.com/media/photo-o/12/1f/9b/90/mannar-island-gold-sand.jpg?w=700&h=400&s=1,Mishka Fernando,"Colombo, Sri Lanka",,5,,"Mannar has a manner, mythology and meaning, all its own. Located in the North West of Sri Lanka, the island is now connected to the mainland by way of causeways, creating easy access to this strange little place, full of donkeys, people and peculiar mannerisms. Mannar incidentally is the closest point to India and on a clear day, when the tide is low you can almost see our neighbours above us. Mythic tales tell of an invisible bride binding the 2 nations together, woven by jewels left like a Hansel and Gretel narrative by Sita when she was taken by King Ravana to Lanka. But this is 21st century Mannar and mythology has become a modern thing; multiple faiths and ethnicities reside here – as do multiple species of animals. You might find stray dogs meandering the streets elsewhere in Sri Lanka, but in Mannar, donkeys rule the streets. Old, abandoned houses named in honour of women with English names sit on lonely streets where two wheelers and four-legged ones occupy rush hour and colonial forts sit abandoned on the edge of little towns. Check out a travelzine called The Fowler for more interesting insights about the North!","March 14, 2019"
https://www.tripadvisor.com/Attraction_Review-g2435125-d3510270-Reviews-Mannar_Island-Mannar_Northern_Province.html,Mannar Island,4.0,108,https://dynamic-media-cdn.tripadvisor.com/media/photo-o/12/1f/9b/90/mannar-island-gold-sand.jpg?w=700&h=400&s=1,Cyril-Mundy,"Colombo, Sri Lanka",,4,,Enough to fill a couple of days starting from the Fort and working out to Talaimannar.  Baobab old tree is fascinating if a bit grotesque.  The pier at Ta.. is a sad story considering how important it was many years ago.  We even came from India though here with our Land Rover many years back.,"February 26, 2019"
https://www.tripadvisor.com/Attraction_Review-g2435125-d3510270-Reviews-Mannar_Island-Mannar_Northern_Province.html,Mannar Island,4.0,108,https://dynamic-media-cdn.tripadvisor.com/media/photo-o/12/1f/9b/90/mannar-island-gold-sand.jpg?w=700&h=400&s=1,Anna C,"Thames Ditton, United Kingdom",,5,Couples,Lovely place to spend the day with lots of bird watching. We loved the natural beauty of the place and not too many tourists.,"February 25, 2019"
https://www.tripadvisor.com/Attraction_Review-g2435125-d3510270-Reviews-Mannar_Island-Mannar_Northern_Province.html,Mannar Island,4.0,108,https://dynamic-media-cdn.tripadvisor.com/media/photo-o/12/1f/9b/90/mannar-island-gold-sand.jpg?w=700&h=400&s=1,Mahlon A,"Colombo, Sri Lanka",,4,,The road could be better. We did not mind it as we were eager to explore Mannar. We were not disappointed. Loved It.,"February 7, 2019"
https://www.tripadvisor.com/Attraction_Review-g2435125-d3510270-Reviews-Mannar_Island-Mannar_Northern_Province.html,Mannar Island,4.0,108,https://dynamic-media-cdn.tripadvisor.com/media/photo-o/12/1f/9b/90/mannar-island-gold-sand.jpg?w=700&h=400&s=1,Dammika D,"Nugegoda, Sri Lanka",,5,Friends,"This island connected to the Mannar mainland by a causeway is actually Thalaimannar. It's 30 km long and a few kilometres wide - in some places more than 10 km. It's part of the hot Northern province of Sri Lanka more than 300km away from the capital city of Colombo. It's human settlements have a colonial origin comprising Dutch Fort, numerous churches. The island is populated by Tamil Christians and Muslims using Tamil as the widely spoken language. The main source of income for the people here is fishing. However, tourism is beginning to play a major role, too. There's a saltern on the western side of the city. The city is dead on Sundays with most businesses closed to the public. Only a few convenience stores and restaurants are open on Sundays including the much talked about Choice restaurant. The island doesn’t still have many places for tourists to stay. There are only a couple of luxury accommodations in the island. There are a few comfortable budget accommodations, in addition. The main attraction of the island is as a birding site. During the migratory season November to March. Around 1000 Flamingos visit the island to feed on the crustaceans found in abundance in the saltern and other areas with shallow salty water pools. In January to early February beautiful pink color developing in primary feathers of Flamingos is a treat to the eyes of the birders - both local and foreign. Large amounts of Copper in the Crustaceans they feed on are responsible for this color. You must watch them flying to appreciate the true beauty! But, please don't try to chase them so that they fly for you to see this magical display. If you wait long enough at a safe distance away they will eventually fly above you, especially if you are lucky! If they do you should certainly try your luck in whatever way you like for the day!  In addition to the Flamingos there are numerous other birds to watch, especially several species of Ducks, Glossy ibis, Western reef heron etc. You got to be in field before the sunrise to witness the birds in their true glory. You must make it a point to visit Thalaimannar area as well for the scintillating ride and the sights including the old pier, fishing harbour with an abundance of terns and gulls in addition to egrets and birds of prey fighting for fish thrown away by the fishermen. The other attractions of the island include the giant Baobab tree near the city,  the Dutch Fort,  Adam's bridge etc. Wankalai sanctuary is only a few kilometres from the island on the main land which is home to a large population of migratory water birds. Driving on your own in this sparsely populated island is a delight. You can make the best use of your stay if you can spare at least three days here. You can reach the island by car, bus or train. Train and bus rides can be harder during hotter months as air conditioning is not commonplace in public transport to this part of the country. If you have a genuine 4 WD vehicle it's possible to take a memorable drive to Mannar from Puttalam, through the Wilpattu jungle during certain times of the year when the gravel road is not flooded.","January 21, 2019"
https://www.tripadvisor.com/Attraction_Review-g2435125-d3510270-Reviews-Mannar_Island-Mannar_Northern_Province.html,Mannar Island,4.0,108,https://dynamic-media-cdn.tripadvisor.com/media/photo-o/12/1f/9b/90/mannar-island-gold-sand.jpg?w=700&h=400&s=1,Seevali D,"Colombo, Sri Lanka",,4,Couples,"My wife and I visited Mannar on 25th and 26th December 2018 and again on 12th & 13th January 2019, with the main objective of watching the migratory Flamingos.  We were unfortunate during our first visit as the Flamingos kept far out in the sea near the causeway.  We were lucky during the second visit!! They were there in their hundreds at the Mannar Salterns.  They arrived early morning around 0600 and kept feeding in the semi-saline waters while making their typical clucking noise.  It was a beautiful sight to see them coming on to land with the sun shining on them against the blue sky.  There were quite a crowd gathered there to witness this scene that happens only during the migratory season from about December to February each year.  We were advised to wear dull coloured clothing and not move too close to the group of birds to avoid scaring them away.  There were bird-watchers with binoculars and photographers with long-lens cameras feasting their eyes on the flock of beautiful pinkish birds. In addition to the Flamingos we also visited the Pesalai, a fishing beach where there were many birds such as gulls, terns, and brahimini kites.  We also visited Thiruketheeswaran temple and the famed Baobab tree.  In the evenings we went around looking for other migratory birds.  There are many places of interest around this little islet, Mannar, that we had visited in our previous annual visits. The main road from Mannar to Talaimannar is not in very good state rutted with potholes.  There were not many tourists too other than those who came to see the birds.  It is not a very busy place.  The seafood in many a local eating houses were spicy and tasty. We will go there again next year!!","January 18, 2019"
https://www.tripadvisor.com/Attraction_Review-g2435125-d3510270-Reviews-Mannar_Island-Mannar_Northern_Province.html,Mannar Island,4.0,108,https://dynamic-media-cdn.tripadvisor.com/media/photo-o/12/1f/9b/90/mannar-island-gold-sand.jpg?w=700&h=400&s=1,Phil R,"Hamilton, New Zealand",,4,,The island has a long and varied history which would be nice to fully understand.  The island is not set up for tourists and you have to work for information.  Overall the 'not touristy' way of this place suited us.,"January 14, 2019"
https://www.tripadvisor.com/Attraction_Review-g2435125-d3510270-Reviews-Mannar_Island-Mannar_Northern_Province.html,Mannar Island,4.0,108,https://dynamic-media-cdn.tripadvisor.com/media/photo-o/12/1f/9b/90/mannar-island-gold-sand.jpg?w=700&h=400&s=1,RD4th,"Colombo, Sri Lanka",,4,Solo,This is a good place for a silent getaway. However better to book a reputed place for meals and accommodation because I did not see many eateries/lodgings except the one I stayed. I spent the time in Talaiannar (Vayu resort). They provide bicycles free and you can bird watch too. Also yo may kite surf (paid activity) which is really exciting.,"January 4, 2019"
https://www.tripadvisor.com/Attraction_Review-g2435125-d3510270-Reviews-Mannar_Island-Mannar_Northern_Province.html,Mannar Island,4.0,108,https://dynamic-media-cdn.tripadvisor.com/media/photo-o/12/1f/9b/90/mannar-island-gold-sand.jpg?w=700&h=400&s=1,Pablo S,21 contributions,,4,Solo,"Because this island was excellent for natural pearls many people came to trade with, greeks, roman, arabs and also was the shorter way to cruise india. But now is a lazy town and island with some beaches of blue water in the season and projects of big resorts.","December 14, 2018"
https://www.tripadvisor.com/Attraction_Review-g2435125-d3510270-Reviews-Mannar_Island-Mannar_Northern_Province.html,Mannar Island,4.0,108,https://dynamic-media-cdn.tripadvisor.com/media/photo-o/12/1f/9b/90/mannar-island-gold-sand.jpg?w=700&h=400&s=1,Attanayake P,"Kandy, Sri Lanka",,5,Friends,"One of the best place in sri lanka for bird watching specially during migratory bird season (December - January). Lot of birds can be seen by the sides of south cost road, Punarin road and thaleimannar road.","December 10, 2018"
https://www.tripadvisor.com/Attraction_Review-g2435125-d3510270-Reviews-Mannar_Island-Mannar_Northern_Province.html,Mannar Island,4.0,108,https://dynamic-media-cdn.tripadvisor.com/media/photo-o/12/1f/9b/90/mannar-island-gold-sand.jpg?w=700&h=400&s=1,Nilmini P,Sri Lanka,,5,Friends,"There are many places to visitt Mannar Island.Mannar fort, Biobab tree, Arippu fort, Doric bunglow, Vankalai sanctuary ,Widatalthivu Sanctuary ,Mathota Temple ,Thiruketheeswaram kovil, Talaimannar pier ,Adam's bridge,Light house, Giant's tank,Suspension bridge ,Giant's tank sanctuary and many more.","November 7, 2018"
https://www.tripadvisor.com/Attraction_Review-g2435125-d3510270-Reviews-Mannar_Island-Mannar_Northern_Province.html,Mannar Island,4.0,108,https://dynamic-media-cdn.tripadvisor.com/media/photo-o/12/1f/9b/90/mannar-island-gold-sand.jpg?w=700&h=400&s=1,SEs,"London, United Kingdom",,4,Friends,This is good to spend a day.The accommodation is limited so have to early .The  old fort  Babok tree and the beach main attraction. The sea food is excellent.,"October 29, 2018"
https://www.tripadvisor.com/Attraction_Review-g2435125-d3510270-Reviews-Mannar_Island-Mannar_Northern_Province.html,Mannar Island,4.0,108,https://dynamic-media-cdn.tripadvisor.com/media/photo-o/12/1f/9b/90/mannar-island-gold-sand.jpg?w=700&h=400&s=1,ypsivakumar,"Colombo, Sri Lanka",,3,Friends,"Though nothing much to see in Mannar it was a good drive from Colombo since the roads are good. Madu Church, Thirukkeswaram Load Shiva Temple, Mannar Dutch fort, Biobab tree, and Thalimannar Pier are few attactions around Mannar. Plenty on donkeys on the road. They said it’s a place to see Flamingos but we couldn’t see since it was not the season. Maximum one day is ok.","September 27, 2018"
https://www.tripadvisor.com/Attraction_Review-g2435125-d3510270-Reviews-Mannar_Island-Mannar_Northern_Province.html,Mannar Island,4.0,108,https://dynamic-media-cdn.tripadvisor.com/media/photo-o/12/1f/9b/90/mannar-island-gold-sand.jpg?w=700&h=400&s=1,007vignes,"Kuala Lumpur, Malaysia",,5,,Beat clean view . Nice view and relaxing environment. Place to visit and relaxing walk along the sea,"August 27, 2018"
https://www.tripadvisor.com/Attraction_Review-g2435125-d3510270-Reviews-Mannar_Island-Mannar_Northern_Province.html,Mannar Island,4.0,108,https://dynamic-media-cdn.tripadvisor.com/media/photo-o/12/1f/9b/90/mannar-island-gold-sand.jpg?w=700&h=400&s=1,Wezza,"Melbourne, Australia",,4,,"We drove from Jaffna,  the journey out and the entry into Mannar is pretty . Mannar town itself is featureless. For the tourist lacks even the bare necessities - food, toilets etc . Development upside is when trading  and travel to/from India recommences. In the interim better bang for spend in Jaffna and surrounds . Probably there are experiences if you want to find a hamlet and pretend that you are a villager for a period off the grid!","August 18, 2018"
https://www.tripadvisor.com/Attraction_Review-g2435125-d3510270-Reviews-Mannar_Island-Mannar_Northern_Province.html,Mannar Island,4.0,108,https://dynamic-media-cdn.tripadvisor.com/media/photo-o/12/1f/9b/90/mannar-island-gold-sand.jpg?w=700&h=400&s=1,lakshansilva,"Nelson, New Zealand",,4,,You need to visit to this peer which is in Mannar Island. The peer now very damaged & not allowed to go beyond this point.,"August 17, 2018"
https://www.tripadvisor.com/Attraction_Review-g2435125-d3510270-Reviews-Mannar_Island-Mannar_Northern_Province.html,Mannar Island,4.0,108,https://dynamic-media-cdn.tripadvisor.com/media/photo-o/12/1f/9b/90/mannar-island-gold-sand.jpg?w=700&h=400&s=1,Axel B,56 contributions,,4,Friends,"The island can be travelled by bicycle or by scooter. We went all the way to Talaimannar to see the lighthouse and afterwards we watched the sunset at Keeri beach (bit disappointed by the garbage there). A lot of donkeys on this island, hence the nickname of the citizens. Not a lot of tourists so a totally different vibe.","July 22, 2018"
https://www.tripadvisor.com/Attraction_Review-g2435125-d3510270-Reviews-Mannar_Island-Mannar_Northern_Province.html,Mannar Island,4.0,108,https://dynamic-media-cdn.tripadvisor.com/media/photo-o/12/1f/9b/90/mannar-island-gold-sand.jpg?w=700&h=400&s=1,Zsuzsa Smidtne,"Kandy, Sri Lanka",,5,,"Mannar - no words. Simple, calm, peace, ... and lot of donkeys :) Fishermen's cottages, Indian ocean, shells. Only few accomodation, but enough.","June 20, 2018"
https://www.tripadvisor.com/Attraction_Review-g2435125-d3510270-Reviews-Mannar_Island-Mannar_Northern_Province.html,Mannar Island,4.0,108,https://dynamic-media-cdn.tripadvisor.com/media/photo-o/12/1f/9b/90/mannar-island-gold-sand.jpg?w=700&h=400&s=1,Roshane R,"Colombo, Sri Lanka",,5,Couples,Please visit this place late evening as the sun is very strong until late evening.  The light house looks so magnificent and you can look out to the sea when you stand next to it.,"April 23, 2018"
https://www.tripadvisor.com/Attraction_Review-g2435125-d3510270-Reviews-Mannar_Island-Mannar_Northern_Province.html,Mannar Island,4.0,108,https://dynamic-media-cdn.tripadvisor.com/media/photo-o/12/1f/9b/90/mannar-island-gold-sand.jpg?w=700&h=400&s=1,anneelizabeth16,"Westerham, United Kingdom",,3,,"I am sure that a visit to Mannar in sunny weather would be a very different experience.  However we travelled out of season, the skies were gray with occasional rain, and generally it was a bit miserable.  There didn't seem to be very much to do but perhaps a bit more research would have brought better results.  But if you have to choose then I would say Jaffna every time.","March 22, 2018"
https://www.tripadvisor.com/Attraction_Review-g2435125-d3510270-Reviews-Mannar_Island-Mannar_Northern_Province.html,Mannar Island,4.0,108,https://dynamic-media-cdn.tripadvisor.com/media/photo-o/12/1f/9b/90/mannar-island-gold-sand.jpg?w=700&h=400&s=1,Andrea  J,"Bali, Indonesia",,3,Couples,The Mannar area is mainly aimed at bird watching. If you arrive at your accommodation early then take a drive out to the lighthouse and see the jetty at Adams Bridge which is the closest part of the coast to India. Its nothing special but most people do this.,"March 5, 2018"
https://www.tripadvisor.com/Attraction_Review-g2435125-d3510270-Reviews-Mannar_Island-Mannar_Northern_Province.html,Mannar Island,4.0,108,https://dynamic-media-cdn.tripadvisor.com/media/photo-o/12/1f/9b/90/mannar-island-gold-sand.jpg?w=700&h=400&s=1,Dale Steyn,"New York City, New York",,5,,"Amazing place nice people here in Shri Lanka. When you see this palace you can check India is too close. without any glass instrument, you can check  India.","February 20, 2018"
https://www.tripadvisor.com/Attraction_Review-g2435125-d3510270-Reviews-Mannar_Island-Mannar_Northern_Province.html,Mannar Island,4.0,108,https://dynamic-media-cdn.tripadvisor.com/media/photo-o/12/1f/9b/90/mannar-island-gold-sand.jpg?w=700&h=400&s=1,Kanishka M,"Kandy, Sri Lanka",,4,,History of Sri Lanka and India where the Ramasetu bridge is. there are lot of islets supposed to have been remanants of a bridge built by Rama king of India when he came to rescue his wife Seeta. Good for seafood and very few places where you have comfortable accommodation therefore you need to book in advance,"December 28, 2017"
